tez_no,yazar,yıl,title,üniversite,tez_türü,konu,tez_detay
694960,EMİNE HAZAL AKTAŞ,2021,"Behçet hastalarında optik koherens tomografi ve optik koherens anjiografi ile santral retina ve koroid kalınlıkları, maküler vaskuler dansite ve foveal avaskuler zon değişikliklerinin değerlendirilmesi<br><span style='font-style: italic';>Evaluation of central retinal and choroidal thicknesses, macular vascular density and foveal vascular zone changes by optical coherence tomography and optical coherence angiography in behçet\'s patients",Akdeniz Üniversitesi,Tıpta Uzmanlık,Göz Hastalıkları = Eye Diseases," onclick=tezDetay('yXgGVd-I2j39vZkNGvr19A','OCC8kwj5kuzvMNHXlVrOkw')"
38185,ATAYLA GENÇOĞLU,1994,Bronşiyal astım ve kronik bronşit\'li hastalarda mağara tedavisi: Speleoterapi<br><span style='font-style: italic';> ,Akdeniz Üniversitesi,Tıpta Uzmanlık,Göğüs Hastalıkları = Chest Diseases," onclick=tezDetay('tOYxk7xpalnU1i-wZysUOQ','tOYxk7xpalnU1i-wZysUOQ')"
360403,POLAT BİÇİCİ,2014,Rat inferior epigastrik deri flebinde farklı geciktirme ve iskemik koşullama metodlarının iskemi/reperfüzyon sonrası flep sağkalımına etkilerinin karşılaştırılması<br><span style='font-style: italic';>Comparison between various conditioning methods and delay methods of prevention to ischemia/reperfusion injury in rat inferior epigastric skin flaps,Akdeniz Üniversitesi,Tıpta Uzmanlık,Plastik ve Rekonstrüktif Cerrahi = Plastic and Reconstructive Surgery," onclick=tezDetay('HJ1dpCQPovos1Clr0ydrWQ','L0CilL2a7ytDxNcaW6m13g')"
360397,NUSRET YILMAZ,2014,"Renal transplant hastalarında, farklı immünsupresif ilaçların inkretinler üzerine etkileri<br><span style='font-style: italic';>Effects of different immunosuppressive drugs on incretins in renal transplant patients",Akdeniz Üniversitesi,Tıpta Uzmanlık,Endokrinoloji ve Metabolizma Hastalıkları = Endocrinology and Metabolic Diseases," onclick=tezDetay('b4Kxc_tJbSkaCsWv_26JtA','6UDjs90XI1Je8RQdDk0NFw')"
340647,EVRİM SÜRER BUDAK,2013,68ga-dotatate ve 68ga-dotanoc\'un fizyolojik biyodistribüsyonunun semikantitatif değerlendirilmesi<br><span style='font-style: italic';>Semiquantitative analysis of physiological biodistribution of 68GA-dotatate and 68GA-dotanoc,Akdeniz Üniversitesi,Tıpta Uzmanlık,Radyoloji ve Nükleer Tıp = Radiology and Nuclear Medicine," onclick=tezDetay('Nf0OsDabbMVp8w581maSdQ','Bmu_c_07ASj0PdrE3mhz7g')"
3570,ERSİN NUZUMLALI,1985,Doğmalık kalça çıkıklarında pavlik bandajı uygulaması<br><span style='font-style: italic';>,Akdeniz Üniversitesi,Tıpta Uzmanlık,Ortopedi ve Travmatoloji = Orthopedics and Traumatology," onclick=tezDetay('7KHp1XLqF2WPK358DpNE7w','7KHp1XLqF2WPK358DpNE7w')"
541189,ALİ TÜRKCAN,2019,Benign paroksismal pozisyonel vertigo (BPPV) hastalarında repozisyon manevraları öncesi ve sonrasındaki video head impulse test (VHIT) bulgularının değerlendirilmesi<br><span style='font-style: italic';>Evaluation of video head impulse test (VHİT) findings before and after repositioning maneuvers in benign paroxysmal positional vertigo (BPPV) patients,Akdeniz Üniversitesi,Tıpta Uzmanlık,Kulak Burun ve Boğaz = Otorhinolaryngology (Ear-Nose-Throat)," onclick=tezDetay('17Iup4MhywS5D4LsLc-GZA','4W0KxvU0kr1ngBfY5jzyZg')"
419752,DUYGU DAĞLAR,2007,"İdrar örneklerinden izole edilen genişlemiş spektrumlu beta-laktamaz (GSBL) pozitif Escherichia coli suşlarındaki GSBL enzim tiplerinin İzoelektrik odaklama ve PCR yöntemleri ile araştırılması<br><span style='font-style: italic';>Determination of extended-spectrum beta-lactamase (ESBL) enzyme types in ESBL positive E. coli strains which were isolated from urine samples, by using Isoelectric focusing method and Polymerase chain reaction",Akdeniz Üniversitesi,Tıpta Uzmanlık,Mikrobiyoloji = Microbiology," onclick=tezDetay('yz-To3fxkQFffDfXQ3oVmw','Xh3dRaPQZpuT0dM_ZL7TBQ')"
433225,ÇAĞIN OZANKAYA,2016,"Malign hemisferik inmelerde dekompresif kraniektominin prognoz, yaşamsal disabilite ve yaşam kalitesi üzerindeki etkisi<br><span style='font-style: italic';>Effect of decompressive craniectomy on prognosis, disability and quality of life at patients with malignant hemisferic infarction",Akdeniz Üniversitesi,Tıpta Uzmanlık,Nöroşirürji = Neurosurgery," onclick=tezDetay('WrnjQhe3Iaky1R543gTSOg','_8D6Hb-p6GiHnZQRokPjfA')"
22277,SERDAR TÜZÜNER,1992,Antalya ve yöresindeki moped motosiklet kazaları ile ilgili bir araştırma<br><span style='font-style: italic';> ,Akdeniz Üniversitesi,Tıpta Uzmanlık,Ortopedi ve Travmatoloji = Orthopedics and Traumatology," onclick=tezDetay('WbkvA9d4ABA2X-HwaTf8QQ','WbkvA9d4ABA2X-HwaTf8QQ')"
388476,AYBEGÜM YÖRÜMEZ DURSUN,2014,"Akdeniz Üniversitesi Tıp Fakültesi Hastanesi aile hekimliği üreme sağlığı / aile planlaması polikliniğine başvuran hastaların değerlendirilmesi<br><span style='font-style: italic';>The evaluation of female patients admitted to Akdeniz University Faculty of Medicine, family medicine department reproductive health / family planning (RH / FP) clinic",Akdeniz Üniversitesi,Tıpta Uzmanlık,Aile Hekimliği = Family Medicine," onclick=tezDetay('rfMNwawarFG0QvuW-pKQMQ','77f13ILHkcSopYUv2cH9nQ')"
22278,İHSAN KARADOĞAN,1992,Transplantasyon sonrası gelişen hipertansiyonda enalapril ve verapamilin renal hemodinamik üzerine olan etkileri<br><span style='font-style: italic';>,Akdeniz Üniversitesi,Tıpta Uzmanlık,Kardiyoloji = Cardiology," onclick=tezDetay('NGSSbZF_HqxDRtFJzckDQw','NGSSbZF_HqxDRtFJzckDQw')"
688446,TAYGUN YİĞİT,2021,COVID-19 Pandemisi\'nde Akdeniz Üniversitesi Aile Hekimliği ve Spor Hekimliği polikliniklerine başvuran hastaların sunulan sağlık hizmetinden memnuniyet düzeyleri<br><span style='font-style: italic';>The satisfaction levels of the health service provided by the patients applying to the Akdeniz University Family Medicine and sports medicine polyclinics in the COVID-19 pandemic,Akdeniz Üniversitesi,Tıpta Uzmanlık,Aile Hekimliği = Family Medicine," onclick=tezDetay('siYBdRSuTjYAvy3-0Zscdg','jTMjQEZOglADmz7D0I8RYw')"
496759,İLKER GÖK,2018,Sentetik esrar (bonzai) kullanımı ile acil servise başvuran hastaların analizi<br><span style='font-style: italic';>Analysis of the patients admitted to emergency department with synthetic cannabinoid (bonsai) abuse,Akdeniz Üniversitesi,Tıpta Uzmanlık,İlk ve Acil Yardım = Emergency and First Aid," onclick=tezDetay('0cCwG4mzDmm6nyfuqlEy_g','ZqOQa4wtND4IBDsrfpC8pg')"
667208,ERSİN KARA,2021,Akdeniz Üniversitesi Hastanesinde çalışan araştırma görevlilerinin covid-19 pandemisinde tükenmişlik düzeylerinin değerlendirilmesi<br><span style='font-style: italic';>Evaluation of burnout levels of research assistants working at Akdeniz University Hospital in the covid-19 pandemic,Akdeniz Üniversitesi,Tıpta Uzmanlık,Aile Hekimliği = Family Medicine," onclick=tezDetay('DAZnLP_KV0S47QIaFQd72g','dak7TPRpPyolfyaaLfkc9w')"
682835,SELAHATTİN DEMİRBAŞ,2021,Multiple skleroz olgularında korpus kallozum morfolojisinin endeksler ve yapay zeka ile değerlendirilmesi<br><span style='font-style: italic';>,Akdeniz Üniversitesi,Tıpta Uzmanlık,Radyoloji ve Nükleer Tıp = Radiology and Nuclear Medicine," onclick=tezDetay('oj7MJxtRoPLF8GS6m6hojg','AWa9PCb9CCc0juVQi7yPNg')"
535985,CİHAN YEŞİL,2019,"Çoklu ilaca dirençli acinetobacter baumannii suşunun neden olduğu infeksiyonun tedavisinde kolistin ve kolistinin rifampisin, trimetoprim sulfametoksazol, teikoplanin ile birlikte kullanımının etkinliği<br><span style='font-style: italic';>Efficacy of colistin and colistin combined with rifampicin, trimethoprim sulfamethoxazole, teicoplanin for treatment of infection caused by acinetobacter baumannii strains",Akdeniz Üniversitesi,Tıpta Uzmanlık,Klinik Bakteriyoloji ve Enfeksiyon Hastalıkları = Clinical Microbiology and Infectious Diseases," onclick=tezDetay('s8iAMzUGIQYil5hYwhi-BQ','70E6P5v70L-OGfsy0Mq7vA')"
329825,NESRİN ŞEN,2012,Ankilozan spondilit ve romatoid artrit hastalarında anti-MCV antikor seviyeleri<br><span style='font-style: italic';>The level of anti-MCV antibody in patients with ankylosing spondylitis and rheumatoid arthritis,Akdeniz Üniversitesi,Tıpta Uzmanlık,Romatoloji = Rheumatology," onclick=tezDetay('-fj-YNq5x_rMGnlFD6aipg','MihfaNHlDaFj5syvOhbfrA')"
626289,ASENA UZDU,2020,Depresyon ya da obsesif-kompulsif bozukluk tanısıyla tekrarlayıcı transkraniyal manyetik uyarım (TTMU) tedavisi alan hastalarda bu yöntemin sigara içme davranışı üzerinde etkisi: Retrospektif bir çalışma<br><span style='font-style: italic';>The effect of repetitive transcranial magnetic stimulation (RTMS) therapy on the smoking behaviors of patients with depression or ocd: A retrospective study,Akdeniz Üniversitesi,Tıpta Uzmanlık,Psikiyatri = Psychiatry," onclick=tezDetay('_1uSH9Gf5SFp9E_kSdbVEQ','O-2so8gTm7FWbP_fHospdg')"
602225,HACER BERNA ÖZTÜRK,2007,"Sıçanlarda gibberellik asitin TNF-α, IL-4 ve IL-10 düzeylerine etkisi<br><span style='font-style: italic';>Effect of gibberellic acid on the levels of tumor necrosis factor-α, interleukin-4 and interleukin-10 in rats",Akdeniz Üniversitesi,Tıpta Uzmanlık,Endokrinoloji ve Metabolizma Hastalıkları = Endocrinology and Metabolic Diseases," onclick=tezDetay('dlh4iLUPb7I6C4lRCiWq2w','uAPEjScqdtDBD_GCg-IErg')"
625867,ASLI AKAN,2020,"Febril konvülziyon ile başvuran hastalarda ve IL-1β (-511) ve IL-10 (-1082) gen polimorfizmi saptananlarda rekürrens ile uzun vadede epilepsiye dönme prevalans, risk faktörleri ve prognozun araştırılması<br><span style='font-style: italic';>Study of Recurrence and in the Long-Term Epilepsy Development, Prevalence, Risk Factors and Prognosis in Patients Presenting with Febrile Convulsion and IL-1β (-511) and IL-10 (-1082) Gene Polymorphism İdentifed",Akdeniz Üniversitesi,Tıpta Uzmanlık,Çocuk Sağlığı ve Hastalıkları = Child Health and Diseases," onclick=tezDetay('4ykBAeSSNlmNq3t8YGfl2Q','btuz0T5iYCw1FbmMbgCj4g')"
433201,HALİL MUTLU,2015,Acil servisten yatış yapılan hastaların ileriye dönük değerlendirilmesi<br><span style='font-style: italic';>Prospective evaluation of patients hospitalized from the emergency department,Akdeniz Üniversitesi,Tıpta Uzmanlık,İlk ve Acil Yardım = Emergency and First Aid," onclick=tezDetay('fCWjlgVeldTsLyjZHiu5tQ','xyYY1vz4_cyYQZMh5XfT4Q')"
22279,HÜLYA ÖZTÜRK,1992,Birinci trimester spontan abortuslarda histokimyasal ve immünohistokimyasal yöntemlerle etyopatogenezin araştırılması<br><span style='font-style: italic';>,Akdeniz Üniversitesi,Tıpta Uzmanlık,Kadın Hastalıkları ve Doğum = Obstetrics and Gynecology," onclick=tezDetay('nWxiICV4sSM7Hz50sdB3cw','nWxiICV4sSM7Hz50sdB3cw')"
408045,FİLİZ GÜNDÜZ,2000,Egzersiz proteinürisi oluşumunda oksidan stresin rolü<br><span style='font-style: italic';>,Akdeniz Üniversitesi,Tıpta Uzmanlık,Fizyoloji = Physiology," onclick=tezDetay('7kT0zPbim38wHDmkW_C8DQ','sURN1wopObgQJjAZLPUSGg')"
607440,CENNET OĞUL,2019,Bipolar bozukluk ve borderline kişilik bozukluğu tanılı hastalarda proinflamatuvar sitokinler<br><span style='font-style: italic';>Proinflammatory cytokines in patients with bipolar disorder and borderline personality disorder,Akdeniz Üniversitesi,Tıpta Uzmanlık,Psikiyatri = Psychiatry," onclick=tezDetay('NTo2I9BiD4Sbb55FTQZ2EA','r1XmTdcMKwVdwFm4Ht_OEQ')"
407922,H. BÜLENT ÇELİK,1999,"Sol ventriküler anevrizmektomi sonrası, ventrikül performansının istirahat anında ve dobutamin efor testi sonrası değerlendirilmesi<br><span style='font-style: italic';>",Akdeniz Üniversitesi,Tıpta Uzmanlık,Göğüs Kalp ve Damar Cerrahisi = Thoracic and Cardiovascular Surgery ; Kardiyoloji = Cardiology," onclick=tezDetay('30x2fz2xdjVR3UVPwOK4gA','RrxoW2wD00qZVGASXJPWVQ')"
407923,NURTEN BOSTANOĞLU KAYACAN,1999,Kombine spinal epudural anastezi uygulamasında bupivakain ile bupivakain + fentanil ve bupivakain + ketaminin peroperatif ve postoperatif etkilerinin karşılaştırılması<br><span style='font-style: italic';>,Akdeniz Üniversitesi,Tıpta Uzmanlık,Anestezi ve Reanimasyon = Anesthesiology and Reanimation," onclick=tezDetay('VwkIJtFPQ_rCyYcANNQ2Yw','UwZO2NGOvNj8y4x2l_3V3g')"
408049,ÖZCAN RAHAT,1999,Sylvian sistrn ve orta serebral arter mikrocerrahi anatomisi<br><span style='font-style: italic';>,Akdeniz Üniversitesi,Tıpta Uzmanlık,Nöroşirürji = Neurosurgery," onclick=tezDetay('H4no3XuT4uuYqD3LFM7Ytg','UdbPWnDuPBdu6-RmRfeM5A')"
378180,SEMRA DİNMEZEL,2003,"Antalya ili merkezi\'nde bronş astması, allerjik rinit atopi prevalansı<br><span style='font-style: italic';>",Akdeniz Üniversitesi,Tıpta Uzmanlık,Göğüs Hastalıkları = Chest Diseases," onclick=tezDetay('hCqxUb6qpwxX9nhlVyCmQg','kn183gaTpkuBErMLBMwsXg')"
22280,ÜMİT KEMAL ŞENTÜRK,1992,Mangan\'ın öğrenmeye etkisi<br><span style='font-style: italic';>The Effect of manganese on learning ability,Akdeniz Üniversitesi,Tıpta Uzmanlık,Nöroloji = Neurology," onclick=tezDetay('Eznye_6IDlbN9d3hBBJcTw','Eznye_6IDlbN9d3hBBJcTw')"
22281,İNCİ SÜLEYMANLAR,1992,Ortotopik karaciğer transplantasyonu (OKCTx) yapılan hastalarda prognastik indeks olarak renal disfonksiyonun değeri<br><span style='font-style: italic';>,Akdeniz Üniversitesi,Tıpta Uzmanlık,Üroloji = Urology," onclick=tezDetay('W47KNGm7q7vfTEtLyFowDA','W47KNGm7q7vfTEtLyFowDA')"
17516,SEVGÜL ŞAHİN,1991,Plasenta retansiyonunda intraumblikal venden oksitosin enfüzyonunun etkisi<br><span style='font-style: italic';> ,Akdeniz Üniversitesi,Tıpta Uzmanlık,Kadın Hastalıkları ve Doğum = Obstetrics and Gynecology," onclick=tezDetay('psagTIpk1IQssXQ_7VVv5A','psagTIpk1IQssXQ_7VVv5A')"
17517,HALİL AKMAN,1991,Süt çocukluğu döneminde fetal hemoglobin düşüşünün saptanması<br><span style='font-style: italic';> ,Akdeniz Üniversitesi,Tıpta Uzmanlık,Çocuk Sağlığı ve Hastalıkları = Child Health and Diseases," onclick=tezDetay('CkmHs1Wy02IEj5tu2kbXKw','CkmHs1Wy02IEj5tu2kbXKw')"
17518,GÜNER ÖĞÜNÇ,1991,Siklosporin-A\'nın mide mukoza bariyeri üzerine etkisi<br><span style='font-style: italic';> ,Akdeniz Üniversitesi,Tıpta Uzmanlık,Gastroenteroloji = Gastroenterology," onclick=tezDetay('85YMNzjHRXcBJwWSY_iNhA','85YMNzjHRXcBJwWSY_iNhA')"
349531,FUNDA ERBASAN,2009,Romatoid artritde plazma sTRAIL düzeyi ve hastalık aktivitesi ile ilişkisi<br><span style='font-style: italic';>Plasma soluble TRAIL levels in rheumatoid arthritis and their relationship with disease activity,Akdeniz Üniversitesi,Tıpta Uzmanlık,Romatoloji = Rheumatology," onclick=tezDetay('GikaHeUrlaMVkUnbKWeqUw','MckK6tzuwyQVBvhfJYTBRg')"
349541,MEHMET MERİÇ,2002,Irritabl barsak sendromlu hastalarda selektif serotonin reuptake inhibitörlerinin kullanımının visseral algılama üzerine etkileri ve bu hastalarda anorektal manometri bulguları<br><span style='font-style: italic';>,Akdeniz Üniversitesi,Tıpta Uzmanlık,Gastroenteroloji = Gastroenterology," onclick=tezDetay('Z809saVsArKobMuxS7Z3pA','GS9_--tYugWLrd-btVaKbw')"
138123,MUHAMMET YENER AKPINAR,2011,Evre-3 ve evre-4 kronik böbrek hastalarında selüler ve humoral inflamatuar yanıtların değerlendirilmesi<br><span style='font-style: italic';>Assesment of cellular and humoral inflammatory responses in stage-3 and stage-4 chronic kidney disease,Akdeniz Üniversitesi,Tıpta Uzmanlık,Nefroloji = Nephrology," onclick=tezDetay('v2BFwiqT2GBLIG-CZlUBfA','F-Y0ZBQHMWRiUbQ-2xI8cg')"
408128,EMİNE FİLİZ ÜNLÜ,2004,Antalya merkez bölgesi 17 no\'lu sağlık ocağı\'na bağlı 1-5 yaş arası çocuklarda haemophilus influenzae tip B doğal bağışıklığının araştırılması<br><span style='font-style: italic';>,Akdeniz Üniversitesi,Tıpta Uzmanlık,Mikrobiyoloji = Microbiology," onclick=tezDetay('fUA27_aU6ZVNNsRGIUBLcQ','WMJJ7bOt_wnrwAwyuEuu_w')"
408130,ENDER SEMİZ,1994,Akut miyokard infarktüsünde elektif perkütanöz transluminal koroner anjiyoplasti<br><span style='font-style: italic';>,Akdeniz Üniversitesi,Tıpta Uzmanlık,Kardiyoloji = Cardiology," onclick=tezDetay('COwmeJKOsralgggGqpUGNw','1FSzSx2nHIlUUJI2KXx2AA')"
408042,ERCAN AKBULUT,2000,Protez kapak replasmanı sonrası hemolizde pentoksifilin etkinliğinin değerlendirilmesi<br><span style='font-style: italic';>,Akdeniz Üniversitesi,Tıpta Uzmanlık,Göğüs Kalp ve Damar Cerrahisi = Thoracic and Cardiovascular Surgery," onclick=tezDetay('pis3gmggw6g63aiWGn6tPQ','lrh0Hgi9suRoFwcCGU0Iwg')"
379078,ERCAN MIHÇI,2006,22q11.2 delesyon sendromu fenotipinin oluşmasında TBX1 mutasyonunun rolü<br><span style='font-style: italic';>,Akdeniz Üniversitesi,Tıpta Uzmanlık,Çocuk Sağlığı ve Hastalıkları = Child Health and Diseases," onclick=tezDetay('ATytuqWhs_iI-PaOKn-8qw','mgBwr9py3J3it6wyp58wRw')"
408082,ERCAN MIHÇI,2000,Febril konvülziyonlu hastalarda interlökin-1beta tümör nekrozis faktör-alfa düzeyleri<br><span style='font-style: italic';>,Akdeniz Üniversitesi,Tıpta Uzmanlık,Çocuk Sağlığı ve Hastalıkları = Child Health and Diseases," onclick=tezDetay('cLH_bTog7ETZyDYiQDzNnw','VSK0UKQCVppKKpOUtvJ76w')"
407903,ERDAL GİLGİL,2002,Ankilozon spondilitli hastalarda IGF-I ve IGFBP-3 düzeylerinin hastalık aktivitesiyle ilişkisi<br><span style='font-style: italic';>,Akdeniz Üniversitesi,Tıpta Uzmanlık,Fiziksel Tıp ve Rehabilitasyon = Physical Medicine and Rehabilitation," onclick=tezDetay('yLenk9PPgPb519tgFap25Q','Wvxsqzb_k5wJYpyqf4ykcw')"
408001,ERDAL KURTOĞLU,2000,Hematolojik malignitelerde plazma thrombospondin düzeyleri<br><span style='font-style: italic';>,Akdeniz Üniversitesi,Tıpta Uzmanlık,Hematoloji = Hematology," onclick=tezDetay('X1NwsVFgALiQiUl1sX3ZVw','08EXtir1h9CIRtldRstfEQ')"
379075,ERHAN ARI,2005,Renal transplantasyon ile eş zamanlı yapılan nativ nefrektominin operatif ve postoperatif morbiditeye etkisi<br><span style='font-style: italic';>,Akdeniz Üniversitesi,Tıpta Uzmanlık,Genel Cerrahi = General Surgery ; Nefroloji = Nephrology," onclick=tezDetay('id2WZDsZMvYPTOe6OT8sdA','UBESwu1YCiHC_yXwH9H6SQ')"
407977,ERKAN ALPSOY,1993,Behçet hastalığında interferon  alfa 2a tedavisi<br><span style='font-style: italic';>,Akdeniz Üniversitesi,Tıpta Uzmanlık,Dermatoloji = Dermatology," onclick=tezDetay('94dH_W_GeSS_x1U52u_h-A','qNQEFjx6OsrGBhswFZjWIA')"
407975,ERKAN ÇOBAN,1997,Sürekli ayaktan periton diyaliz peritonitli hastalarda intraperitoneal immunglobulin kullanımının tedavideki etkinliği<br><span style='font-style: italic';>,Akdeniz Üniversitesi,Tıpta Uzmanlık,Nefroloji = Nephrology," onclick=tezDetay('sD13Vy5T2Ih8YrVtx6Gc2A','WXxSDwBsXKoSlcM6a6XTeg')"
379082,ERKAN MAHSERECİ,2004,Sürekli ayaktan periton diyalizi ve hemodiyaliz hastaları ile böbrek nakli yapılmış hastalarda mononükleer hücrelerde sitozolik serbest magnezyumun değerlendirilmesi<br><span style='font-style: italic';>,Akdeniz Üniversitesi,Tıpta Uzmanlık,Nefroloji = Nephrology," onclick=tezDetay('XAQwCB_RJuLNu6BSEYNidw','kq9-5VMr1nJB0YNqKlnwLw')"
408013,EROL ÇETİNKAYA,1998,Parsiyel vertikal larenjektomi sonrası rekonstrüksiyon için uyguladığımız açık pencere tekniği<br><span style='font-style: italic';>,Akdeniz Üniversitesi,Tıpta Uzmanlık,Kulak Burun ve Boğaz = Otorhinolaryngology (Ear-Nose-Throat)," onclick=tezDetay('gyjFGslOficoi6cU-0VG0A','MzTUeGmWEdrofSRSeIuWbA')"
407966,ERSAL DEMİRTAŞ,2000,Retinal ven tıkanıklarında klinik özellikler ve oküler hemodinami<br><span style='font-style: italic';>,Akdeniz Üniversitesi,Tıpta Uzmanlık,Göz Hastalıkları = Eye Diseases," onclick=tezDetay('vskQetU8eZxNNdhzD7ozYw','O7Vs2rGJ6uWg1FZYErvdcA')"
408024,ERSİN ARIĞOĞLU,2000,Endojen epidermal growth faktörün deneysel bir kısa barsak modelinde intestinal adaptasyon üzerine etkisi<br><span style='font-style: italic';>,Akdeniz Üniversitesi,Tıpta Uzmanlık,Çocuk Cerrahisi = Pediatric Surgery," onclick=tezDetay('VGA09gpE04PLeqcS-E6waA','Ksz_-zQ_DWOcDohPdp-Mjw')"
408093,ESİN ÖZEL,2004,"Over karsinomlarında siklooksijenaz-2 (CO-2) ve i-NOS ekspresyonu :Klinikopatolojik faktörler, prognoz ile ilişkisi, kemoterapiye cevaba etkisi<br><span style='font-style: italic';>",Akdeniz Üniversitesi,Tıpta Uzmanlık,Onkoloji = Oncology ; Patoloji = Pathology," onclick=tezDetay('VweKEM5F-qKDzAAZSwIOWw','mOF4YtZh7VivlieaYZdOug')"
378219,TEOMAN ERDOĞAN,2005,Menenjitin tanısı ve prognozun tahmininde beyin omurilik sıvısının laktatının rolü<br><span style='font-style: italic';>,Akdeniz Üniversitesi,Tıpta Uzmanlık,Nöroşirürji = Neurosurgery," onclick=tezDetay('USvA7y71SMj_xtbBSq2a1g','Mthj7wBj4-YjvHWFoOCLWg')"
408084,TEOMAN ÖZDEMİR,1998,Anterior üçüncü ventrikülün mikrocerrahi anatomisi<br><span style='font-style: italic';>,Akdeniz Üniversitesi,Tıpta Uzmanlık,Nöroşirürji = Neurosurgery," onclick=tezDetay('7XUryBbZVtKl7XlC6gP2pw','1-IBfKNYdFPuD-Be9Zykrg')"
408022,TİMUR SİNDEL,1995,"Normal, romatoid artrit, diabetes mellitus ve kronik renal yetmezlik olgularında metakarpal radyogrammetri uygulaması<br><span style='font-style: italic';>",Akdeniz Üniversitesi,Tıpta Uzmanlık,Radyoloji ve Nükleer Tıp = Radiology and Nuclear Medicine," onclick=tezDetay('SEpNSbwBLVwOdbCm1eZmTQ','yfSOr14tgLny4-p5aaFuSw')"
411704,TÜLİN AYDOĞDU,1988,Böbrek fonksiyonları normal olgularda ethrane\'nın böbrek fonksiyon testleri üzerine etkisi<br><span style='font-style: italic';>,Akdeniz Üniversitesi,Tıpta Uzmanlık,Anestezi ve Reanimasyon = Anesthesiology and Reanimation," onclick=tezDetay('D1EPZSP2YTmVLFb6PoJ3vQ','EPC82YAg5fwsUPsFZ6zawg')"
378215,UĞUR GÜRSES,2005,Akciğer rezeksiyonları sonrasında ampiyem gelişiminde neden sonuç ilişkisi ve tedavi yöntemleri<br><span style='font-style: italic';>,Akdeniz Üniversitesi,Tıpta Uzmanlık,Göz Hastalıkları = Eye Diseases," onclick=tezDetay('27lkKg0nCDJg-CBVA5l6GA','4z5ZSvOVzgGzsE3X5wUHQQ')"
408028,UĞUR KAHVECİOĞLU,1997,Serebral yaşlanmada piracetam ve seleğiline\'nin etkisinin klinik ve nörofizyolojik değerlendirilmesi<br><span style='font-style: italic';>,Akdeniz Üniversitesi,Tıpta Uzmanlık,Nöroloji = Neurology," onclick=tezDetay('ULVLBxinKRuTyfhhpia2aQ','6otGgOlAzkL11gaL5CSUAA')"
378221,ÜMİT DÜNDAR,2004,Talasemi majorlü hastalarda kemik mineral yoğunluğu ve etkileyen faktörler<br><span style='font-style: italic';>,Akdeniz Üniversitesi,Tıpta Uzmanlık,Fiziksel Tıp ve Rehabilitasyon = Physical Medicine and Rehabilitation," onclick=tezDetay('dBJuRZn44mqhh6QuORZNrQ','seuBDCdBZyW-xVrMJO7Ohg')"
454068,FLORİJE MEŞELİ,2016,Altmışbeş yaş ve üzeri bireylerin üriner inkontinans durumlarının değerlendirilmesi<br><span style='font-style: italic';>Evaluation of urinary incontinence among individiuals aged 65 and over,Akdeniz Üniversitesi,Tıpta Uzmanlık,Aile Hekimliği = Family Medicine," onclick=tezDetay('rL92DaZ1Hr9HPpoiLj_P7Q','tq9VdhfEOHulzro_6Tu01A')"
691130,SİNEM ÇİLİNGİR,2021,"Sıçanlarda adipoz kaynaklı kök hücre, stromal vasküler fraksiyon, yağ grefti ve doku kokteylinin dondurma işlemi sonrasında sağkalımlarının ve yağ dokusuna katkılarının karşılaştırılması<br><span style='font-style: italic';>Comparison of survival and effectivity of cryopreserved adiposed derived stem cell, stromal vascular fraction, fat graft and tissue cocktail in rats",Akdeniz Üniversitesi,Tıpta Uzmanlık,Plastik ve Rekonstrüktif Cerrahi = Plastic and Reconstructive Surgery," onclick=tezDetay('JjI5QnEXZ1doj_c3IOoOyA','oZ-eOTBozRmDAxzT5oAKGg')"
330035,TUĞBA ÖZEL,2013,İskemik inme proflaksisinde asetil salisilik asit (ASA) kullanan hastada ek olarak proton pompa inhibitörü (PPI) verilmesi tedavi etkisini azaltır mı?<br><span style='font-style: italic';>Do proton pump inhibitors (PPI) use with acetyl salicylic acid (ASA) reduce the effect in stroke patients proflaksi ?,Akdeniz Üniversitesi,Tıpta Uzmanlık,Nöroloji = Neurology," onclick=tezDetay('01NdiVgTFQgz_utANTZo0A','D2Ij4zrwTHsoU3yyKQCOiQ')"
510360,SELDA ÖZKAVAK,2018,Febril acil servis hastalarında triaj \'quick SOFA skoru\'nun  prognostik değeri; Kesitsel bir çalışma<br><span style='font-style: italic';>Prognostic value of triage quick SOFA score on emergency service patient who have fever; An observational study,Akdeniz Üniversitesi,Tıpta Uzmanlık,İlk ve Acil Yardım = Emergency and First Aid," onclick=tezDetay('adBui58mS9OHiQY1lwBZEQ','-etTuzTqFSa--hJ9c7866w')"
411748,ÜNAL ÜZÜNLÜ,1981,Lumbosakral bölgeyi tutan kronik ağrıların tedavisinde intaketal morfin uygulaması<br><span style='font-style: italic';>,Akdeniz Üniversitesi,Tıpta Uzmanlık,Anestezi ve Reanimasyon = Anesthesiology and Reanimation," onclick=tezDetay('TlC9Q_BAvnqxxxoOPQpcWA','jTz-wPxXL0dIFM86HaPYFg')"
378222,VEDAT UYGUN,2005,Glikojen depo hastalığı TİP 3 olgularının klinik laboratuvar bulguları ve dal kırıcı enzim aktivite düzeyleri<br><span style='font-style: italic';>,Akdeniz Üniversitesi,Tıpta Uzmanlık,Çocuk Sağlığı ve Hastalıkları = Child Health and Diseases," onclick=tezDetay('yJ0lk3V9hkI9AVdQODz-Zw','iBfIgS8XjrXS2huGCOQkjQ')"
407942,VİLDAN ULUSAN,1999,Artroskopik diz cerrahisinden sonra intraartiküler uygulanan bupivakain ve klonidinin postoperatif analjezi üzerine etkileri<br><span style='font-style: italic';>,Akdeniz Üniversitesi,Tıpta Uzmanlık,Anestezi ve Reanimasyon = Anesthesiology and Reanimation," onclick=tezDetay('nlEhDCB_2_HSc7Mgk92WEw','MBQivLuWWijKgAz4k918xw')"
411760,VURAL KÜÇÜKATAY,1997,Diabet\'in merkezi sinir sistemi komplikasyonlarına kükürtdioksit\'in (SO2) etkisi<br><span style='font-style: italic';>,Akdeniz Üniversitesi,Tıpta Uzmanlık,Fizyoloji = Physiology," onclick=tezDetay('J8uWCAc1tnSHxWzlWSZOtA','kx7-lI9PQ2zqKMsbxbGkKg')"
