tez_no,yazar,yıl,title,üniversite,tez_türü,konu,tez_detay
422002,ÖMER SERTKAYA,2012,Rat aşil tendon onarım modelinde fosfolipid kompleksi ve hyaluronik asitin iyileşme ve yapışıklık üzerine etkilerinin karşılaştırılması<br><span style='font-style: italic';>Comparission of effects of hyaluronic acid and phospholipid complex over healing process and adhesions at rat achilles tendon repairement model,Akdeniz Üniversitesi,Tıpta Uzmanlık,Ortopedi ve Travmatoloji = Orthopedics and Traumatology," onclick=tezDetay('FncyRxKhMzNHCIGL5G6C4Q','a1gXS8MSG74kyiIebtBXfw')"
340640,GONCA MERSİN,2013,Renal transplantasyon yapılan hastaların diyaliz yöntemlerinin intraoperatif parametrelere göre değerlendirilmesi<br><span style='font-style: italic';>Assessment of the dialysis methods according to operative parameters for the patients with renal transplantation,Akdeniz Üniversitesi,Tıpta Uzmanlık,Anestezi ve Reanimasyon = Anesthesiology and Reanimation," onclick=tezDetay('rFoTB7_ymsLWPaJTCbyV9A','CLY_iQNcf1LNlhivEmaapg')"
422003,SALİH İNCEOĞLU,2006,Botox kullanımının tendon iyileşmesi üzerindeki biyomekanik etkilerinin deneysel hayvan modelinde araştırılması<br><span style='font-style: italic';>,Akdeniz Üniversitesi,Tıpta Uzmanlık,Ortopedi ve Travmatoloji = Orthopedics and Traumatology," onclick=tezDetay('ITd63jUWuwWKUeeocbWMQw','nSELSXUgE1N5ixLFI-AhIw')"
340654,İHSAN KARA,2013,"Overian rezervi belirlemede FSH, TSH, prolaktin,ANTi-müllerian hormon, antral folikül sayısı ve tiroid oto-antikorlarının prediktif değeri<br><span style='font-style: italic';>Predictive value of FSH, TSH, prolactin, ANTİ -müllerian hormone, number of antral follicles and thyroid auto-antibodies in determining the ovarian reserve",Akdeniz Üniversitesi,Tıpta Uzmanlık,Kadın Hastalıkları ve Doğum = Obstetrics and Gynecology," onclick=tezDetay('PSbpJdxfs4YC3copYbRX-A','E2zdJrfTbMxuMbxzk9oQGw')"
625835,İSMAİL ATEŞ,1999,Koroner arter hastalığında egzersiz testi bulguları ile koroneranjiyografiye göre belirlenen tedavi seçeneklerinin ilişkileri<br><span style='font-style: italic';>,Akdeniz Üniversitesi,Tıpta Uzmanlık,Kardiyoloji = Cardiology," onclick=tezDetay('FuXemYqTlzrTtdGZC0n8YA','ANjlDa3qBKkH3xkIQt965w')"
618303,MUSA KÜÇÜKKAPDAN,2020,Antalya ili kamu hastaneleri acil servis başvurularının değerlendirilmesi<br><span style='font-style: italic';>Evaluation of Emergency Department Visitsto Governmental Hospitalsin,Akdeniz Üniversitesi,Tıpta Uzmanlık,İlk ve Acil Yardım = Emergency and First Aid," onclick=tezDetay('SG8LSWR2tsmviE6v30xtyw','i77679yW_ZRhIDtzafqHdg')"
44227,NURSEL ŞAHİN,1995,Koroner bypass olgularında uyanıklığın ve explicit/implicit belleğin isoflurane inhalasyon anestezisi ve propofol-TIVA yönünden karşılaştırılması<br><span style='font-style: italic';> ,Akdeniz Üniversitesi,Tıpta Uzmanlık,Anestezi ve Reanimasyon = Anesthesiology and Reanimation," onclick=tezDetay('sHAIfNaqSGnFPGpp6Rg5DA','sHAIfNaqSGnFPGpp6Rg5DA')"
681343,KEIVAN HANIFI,2021,"Hastanemizde lokal anestezi ve sedasyon ile TAVI yapılan hastalarda komorbid hastalıkların komplikasyonlar, hastanede kalma süresi, operasyon süresi üzerine etkilerinin retrospektif değerlendirilmesi<br><span style='font-style: italic';>Retrospective analysis effects of comorbid diseases over the complications, length of hospital stay, duration of procedure in patients that are undergo transcatheter aortic valve implantation with local anesthesia and sedation in Akdeniz University Hospital",Akdeniz Üniversitesi,Tıpta Uzmanlık,Anestezi ve Reanimasyon = Anesthesiology and Reanimation," onclick=tezDetay('VSQ6vFeNqv89T-hjdhqCWQ','ehPeFRY_HDuGLYNL2_4G8A')"
454050,TOLGAHAN AKCA,2016,Karaciğer sirozunda malnütrisyon ve böbrek fonksiyonlarının değerlendirilmesi; klasik ve yeni kuşak yöntemlerin karşılaştırmalı analizi<br><span style='font-style: italic';>Evaluation of malnutrition and renal function in hepatic cirrhosis; comparison of classic and new methods,Akdeniz Üniversitesi,Tıpta Uzmanlık,Gastroenteroloji = Gastroenterology," onclick=tezDetay('UEin9lyhlXTr_7dd7iopYQ','1zxDfYtBxVdpGVu89NOwOg')"
484696,AYŞEGÜL ERAT,2017,Pemfigus dışı otoimmün büllü hastalıklarda immünofloresan mozaik tabanlı biyoçip yönteminin değeri<br><span style='font-style: italic';>The value of immunofluorescence mosaic based biochip method in autoimmune bullous diseases out of pemphigus,Akdeniz Üniversitesi,Tıpta Uzmanlık,Dermatoloji = Dermatology," onclick=tezDetay('XLowo6bng54-4_bSPpNgcA','rKGyXVnyRpoMi-pboyxeYA')"
687762,AYBİKE ERDEM,2021,Çocukluk ve ergenlik çağında dikkat eksikliği ve hiperaktivite bozukluğu tanısı almış erişkinlerin güncel sosyodemografik ve tıbbi durumunun değerlendirilmesi<br><span style='font-style: italic';>Evaluation of the current sociodemographic and medical status of adults with attention deficit and hyperactivity disorder in childhood and adolescence,Akdeniz Üniversitesi,Tıpta Uzmanlık,Psikiyatri = Psychiatry," onclick=tezDetay('wqOMoeCiWFqQKbCyofu9Jw','khga35lqLdMSpFWjK1gyug')"
601916,GÖKÇE ALTIN,2019,Parotis tümörlerinde intraoperatif histopatolojik değerlendirme (frozen incelemesi) ve postoperatif  histopatoloji sonuçlarının karşılaştırılması<br><span style='font-style: italic';>Comparison of intraoperative histopathological evaluation (frozen examination) and postoperative histopatology results in parotis tumors,Akdeniz Üniversitesi,Tıpta Uzmanlık,Kulak Burun ve Boğaz = Otorhinolaryngology (Ear-Nose-Throat)," onclick=tezDetay('V2ukGpjQ8kv14AZ8mlLClA','JClBt_quf9ZTe5E2KZkFXw')"
514341,FATİH OLUŞ,2018,Genel cerrahi hastalarında postoperatif deliryum erken tanısı<br><span style='font-style: italic';>Early diagnosis of postoperative delirium in general surgery patients,Akdeniz Üniversitesi,Tıpta Uzmanlık,Anestezi ve Reanimasyon = Anesthesiology and Reanimation," onclick=tezDetay('cMpAMqZRFlJ5pMxUv3zbhw','il_n7rOJ78r9q-L_2zI4bQ')"
388481,BERNA ALTINOK,2015,Alopesi areata hastalarında difenilsiklopropenon (DCP) ile  kontakt immünoterapi ve bu tedavinin ıl-17 protein düzeylerine etkisi<br><span style='font-style: italic';>Contact immunotherapy with diphenylcyclopropenone (DCP) in alopecia areata patients and effect of treatment on İL-17 protein levels,Akdeniz Üniversitesi,Tıpta Uzmanlık,Dermatoloji = Dermatology," onclick=tezDetay('lz5i7utRjqNGPRjWm_Jggw','0N8HR3nq2UXfKzqY7DoIow')"
634212,İBRAHİM KAMEL,2020,Yeni tanı almış idiyopatik pulmoner fıbrozis hastalarında yaşam kalitesi<br><span style='font-style: italic';>Quality of life in newly di̇agnosed pati̇ents wi̇th idiopatic pulmonary fibrosis,Akdeniz Üniversitesi,Tıpta Uzmanlık,Göğüs Hastalıkları = Chest Diseases," onclick=tezDetay('VCNcsG8k9MB_Vvvj8WXIMw','S_tZznPLha070BYazfcoDw')"
330030,AYLA UZUN,2013,Cinsel istismar mağduru ergenlerin repertuar grid tekniği ile değerlendirilmesi<br><span style='font-style: italic';>Adolescent victims of sexual abuse evaluation with repertory grid technique,Akdeniz Üniversitesi,Tıpta Uzmanlık,Psikiyatri = Psychiatry," onclick=tezDetay('wKWrmlq_A_mPTTM5o5S1UA','qK68vciG2b1xEwUTiHBn1A')"
484675,VOLGA BAŞTAN,2017,Akut renal kolik tedavisinde intravenöz morfin ve parasetamol kombinasyonunun intravenöz morfin ve deksketoprofen kombinasyonuna üstünlüğü: Acil servis\'te optimum tedavi yaklaşımı<br><span style='font-style: italic';>Combination of intravenous morphine and paracetamol or intravenous morphine and dexketoprofen in treatment of acute renal colic: An optimum treatment approach in the emergency department,Akdeniz Üniversitesi,Tıpta Uzmanlık,İlk ve Acil Yardım = Emergency and First Aid," onclick=tezDetay('K-mUSyFtZ9DjKe_LUdrsrg','1Mi7vxNXykJF334KycW85A')"
433241,ALPER ARI,2016,65 yaş ve üstü bireylerin karşılanmamış sağlık sorunları ve konsültasyon nedenlerinin değerlendirilmesi<br><span style='font-style: italic';>Assessment of unmet health problems and consultation causes of individuals aged 65 and over,Akdeniz Üniversitesi,Tıpta Uzmanlık,Aile Hekimliği = Family Medicine," onclick=tezDetay('7POMZsAgoheIMec72MW1Sw','cG692I5lSVZStJZriVVrhw')"
329805,MUSTAFA SARAÇOĞLU,2012,Obstrüktif kolorektal kanserlere yaklaşım ve tedavi sonuçlarımız<br><span style='font-style: italic';>Approach to obstructive colorectal cancers and our treatment results,Akdeniz Üniversitesi,Tıpta Uzmanlık,Genel Cerrahi = General Surgery," onclick=tezDetay('oHzlpnCXNxq9YuWXx2M1dw','hpg2JJJtva5sOdUb3YIZeA')"
329806,ESİN GÜLEN,2012,"Ratlarda demir yüklemesinin hematopoietik sistem, kemik iliği ve ilişkili genler üzerindeki etkisi<br><span style='font-style: italic';>The effect of iron overload on hematopoietic system, bone marow and related genes in rats",Akdeniz Üniversitesi,Tıpta Uzmanlık,Hematoloji = Hematology," onclick=tezDetay('k-SHDCYwj8EKEw_Pc2hwjA','DA5V_PyLM-JX_Ap8UvKS0A')"
359658,MUSTAFA SERKAN ALEMDAR,2014,Hipotiroidili hastalarda inkretin düzeyleri ve tedaviyle inkretin düzeylerinin değişiminin incelenmesi<br><span style='font-style: italic';>Incretin levels in patients with hypothyrody and the evaluation of incretin level alterations with treatment,Akdeniz Üniversitesi,Tıpta Uzmanlık,Endokrinoloji ve Metabolizma Hastalıkları = Endocrinology and Metabolic Diseases," onclick=tezDetay('yW-9h6yiZahe9YnPdKlTpQ','6ax-5V0iVSOP6v5Y1Sf6BA')"
454044,YUSUF AYAZ,2016,Santral seröz korioretinopati\'de takip ve tedavi sonuçlarımız<br><span style='font-style: italic';>Follow up and treatment results of central serous chorioretinopathy,Akdeniz Üniversitesi,Tıpta Uzmanlık,Göz Hastalıkları = Eye Diseases," onclick=tezDetay('50Y663G6G5Qos5EskbAIsw','E360w7_zfApp1-tWmj6G4g')"
339012,YEŞİM ÜNÜVAR TEMEL,2005,Ağır kafa travmalı hastalarda cerrahi dekompressif kraniyektomi ve intraventriküler drenajın prognoza etkisi<br><span style='font-style: italic';>,Akdeniz Üniversitesi,Tıpta Uzmanlık,Anestezi ve Reanimasyon = Anesthesiology and Reanimation," onclick=tezDetay('M8GPQbmNNBSHS6K52MdCfQ','ls5t8O2faza-VPV3zXp7_Q')"
484670,MURAT ALP ÖZTEK,2017,İkinci trimestr obstetrik ultrasonografide kardiyak morfolojik parametrelerin nomogramları<br><span style='font-style: italic';>Nomograms of cardiac morphologic parameters in second trimester obstetric ultrasonography,Akdeniz Üniversitesi,Tıpta Uzmanlık,Radyoloji ve Nükleer Tıp = Radiology and Nuclear Medicine," onclick=tezDetay('EHBhNgW0cpXCduDrwD70BA','qFP0QW8_HnVBgJysFkakEw')"
388484,FİKRİYE TÜTER YILMAZ,2015,Parkinson hastalığında hafif kognitif bozukluk tanısında  işitsel P300 testinin klinik tanıya katkısı<br><span style='font-style: italic';>Contribution of auditory P300 test in the diagnosis of mild cognitive impairment in parkinson\'s disease,Akdeniz Üniversitesi,Tıpta Uzmanlık,Nöroloji = Neurology," onclick=tezDetay('B1k-r8-ixWER_v4d8oXKbA','xc4vNXeiWUYWtAv2P9zwgg')"
433240,İBRAHİM OĞUZ ÖZKAVAK,2016,Torakolomber / lomber adölesan idiyopatik skolyozun posteriordan pedikül vidaları ile tedavisinin fonksiyonel ve radyolojik sonuçları<br><span style='font-style: italic';>Thoracolumbar/lumbar adolescent idiopathic scoliosis functional and radiological results of treatment with posterior pedicle screws,Akdeniz Üniversitesi,Tıpta Uzmanlık,Ortopedi ve Travmatoloji = Orthopedics and Traumatology," onclick=tezDetay('xT-qPFEwEyzpoAecL0vqmQ','24EWHGZNhhoZmTGIpJrauA')"
551890,FATMA CEREN GÜNER,2019,"GnRH antagonist protokol uygulanan hastalarda ovulasyon tetiğinde hCG kullanımı ile hCG ve GnRH agonisti uygulamasının IVF sonuçlarına (toplanan oosit sayısı, mıı oosit sayısı, fertilizasyon oranı, implantasyon oranı, canlı doğum oranı) etkisi<br><span style='font-style: italic';>Reproductive outcomes after human chorionic gonadotropin compared with human chorionic gonadotropin with gonadotropin-releasing hormone agonist for the induction of final oocyte maturation in gnrh antagonist cycles",Akdeniz Üniversitesi,Tıpta Uzmanlık,Kadın Hastalıkları ve Doğum = Obstetrics and Gynecology," onclick=tezDetay('ONvJoIuI91Kq3xGeBH66tw','7MIP1HugKbtSX1MREbURtQ')"
423634,YILMAZ ÖNDER,2016,Femur üst uç kırıklarında kullanılan modüler aksiyel fiksatör\'ün biyomekanik olarak değerlendirilmesi<br><span style='font-style: italic';>The biomechanical evaluation of moduler axial fixator used in proximal femoral fractures,Akdeniz Üniversitesi,Tıpta Uzmanlık,Ortopedi ve Travmatoloji = Orthopedics and Traumatology," onclick=tezDetay('9HfsOQ_HsLmPL6ose3UChg','agXS7CVG_R8VpusJRr5FQQ')"
516041,ÜLKÜ İNCE,2018,"Obstrüktif uyku apne sendromlu hastaların preoperatif değerlendirilmesi, anestezinin ve cerrahinin inflamatuar ve stres parametreleri üzerine etkisi<br><span style='font-style: italic';>Preoperative evaluation of patients with obstructive sleep apnea syndrome, effects of anesthesia and surgery on inflammatory and stress parameters",Akdeniz Üniversitesi,Tıpta Uzmanlık,Anestezi ve Reanimasyon = Anesthesiology and Reanimation," onclick=tezDetay('bp5M0dAbPzbKSnutTt1Opw','lgRxGdLtmr21pqqF0VsHTQ')"
338995,SUZAN KÜÇÜKYORGANCI,2011,2007-2010 yılları arasında Akdeniz Üniversitesi Tıp Fakültesi Anestezi Yoğun Bakım Bilim Dalında takip ve tedavi edilen kritik onkolojik olguların değerlendirilmesi<br><span style='font-style: italic';>,Akdeniz Üniversitesi,Tıpta Uzmanlık,Anestezi ve Reanimasyon = Anesthesiology and Reanimation," onclick=tezDetay('1RWWn5MW-syZQXgLQelt2w','5oI2QuZMQysiV66zOJkc5g')"
339000,ŞEREF ŞİMŞEK,2010,Cinsel istismara uğramış çocuklarda ve ebeveynlerinde travma sonrası stres bozukluğu<br><span style='font-style: italic';>Symptoms of posttraumatic stress disorder in child sexual abuse victims and their parents,Akdeniz Üniversitesi,Tıpta Uzmanlık,Psikiyatri = Psychiatry ; Çocuk Sağlığı ve Hastalıkları = Child Health and Diseases," onclick=tezDetay('LwdQbj6FCtoEaCRPfagSRQ','XR2jWWHFMuWt-rl214nWbw')"
484705,ÖZTAN YILDIZ,2017,Diz osteoartritli hastalarda nöropatik ağrı sıklığı ve klinik parametrelerle ilişkisi<br><span style='font-style: italic';>Prevalence of neuropathic pain in patients with knee osteoarthritis and its relevance with clinical parameters,Akdeniz Üniversitesi,Tıpta Uzmanlık,Fiziksel Tıp ve Rehabilitasyon = Physical Medicine and Rehabilitation," onclick=tezDetay('IeW-hyT7-Nua39Bc5LCdug','-CCqPfoIN5W3JCUM5Bo__w')"
433228,HASAN KAYA,2016,Akut apandisitte lökosit CE C- reaktif proteinin tanısal değeri<br><span style='font-style: italic';>The diagnostic value of leucocytes and C- reactive protein in acute appendisitis,Akdeniz Üniversitesi,Tıpta Uzmanlık,İlk ve Acil Yardım = Emergency and First Aid," onclick=tezDetay('jeDuitYtn7dIHHYPv-TpyA','RdozL2uQbR_gT_-VO0Yutw')"
484697,GİZEM MÜJDECİOĞLU DEMİR,2017,Kendine zarar verme davranışı ve/veya intihar girişimi olan ergenlerde çocukluk çağı travmaları ve bağlanma stillerinin değerlendirilmesi<br><span style='font-style: italic';>Evaluation of childhood trauma and attechment styles in adolescent who have self harm behaviour and/or suicide attempts,Akdeniz Üniversitesi,Tıpta Uzmanlık,Psikiyatri = Psychiatry," onclick=tezDetay('ZJDj8azBuFC_42RjhVT--Q','zGCpKiDBpM4l_XTdAMI_Kg')"
329819,OKAN ARSLAN,2012,İkinci ve üçüncü trimester preeklamsi ve intrauterin gelişme kısıtlılığı olan fetüslerde sonografik umbilikal kord morfolojisinin perinatal sonuçlarla ilişkisi<br><span style='font-style: italic';>Sonographic umbilical cord morphology and perinatal outcome in fetuses with preclampsia and intrauterine growth restriction in second and third trimester,Akdeniz Üniversitesi,Tıpta Uzmanlık,Kadın Hastalıkları ve Doğum = Obstetrics and Gynecology," onclick=tezDetay('WEGloXvbcmoSJU0ndJ4L-A','h5a2Nq05Bb0yX2f38AA7Tw')"
361435,ÖZGÜL ÖZDİLMEN,2014,Akdeniz Üniversitesi Tıp fakültesi hastanesi psikiyatri servisi\'nde 2006-2013 yılları arasında yatarak tedavi alan olguların retrospektif olarak sosyodemografik ve klinik özelliklerinin değerlendirilmesi<br><span style='font-style: italic';>Assessment of the sociodemographical and clinical characteristics of the subjects who are hospitalised in the psychiatry clinic of Akdeniz university hospital between the 1st of january 2006 and 31st of august 2013: A retrospective study,Akdeniz Üniversitesi,Tıpta Uzmanlık,Psikiyatri = Psychiatry," onclick=tezDetay('uy6RMt0XqT3qzAbKY8sHoA','6102Op5fgx5UDlhZeLCemQ')"
625973,KEVSER UZ,2019,Antalya\'da bir mantar fabrikasının çalışanlarında kadına yönelik şiddet algısının saptanması ve eğitim müdahalesinin etkileri<br><span style='font-style: italic';>Determination of perception of violence against women in a mushroom factory employees in Antalya and effects of education intervention,Akdeniz Üniversitesi,Tıpta Uzmanlık,Halk Sağlığı = Public Health," onclick=tezDetay('W_wv7nPMttUyBVyfYb1sRg','IzctY7z-XF0Y34L8B76AhA')"
349558,VELİ YAZISIZ,2009,Romatoid artritte düzenleyici T lenfositlerin rolü ve hastalık aktivitesi ile ilişkisi<br><span style='font-style: italic';>The role of treg cells in rheumatoid arthritis and their relation with disease activity,Akdeniz Üniversitesi,Tıpta Uzmanlık,Romatoloji = Rheumatology," onclick=tezDetay('hNDxSCn9AoIqL3xMF13r8A','vErDSdJPsXtfrBhZu-6f9w')"
349559,VELİ YAZISIZ,2004,Propiltiyourasil (PTU) tedavisi ile antinötrofil sitoplazmik antikor (ANCA) ilişkisi<br><span style='font-style: italic';>,Akdeniz Üniversitesi,Tıpta Uzmanlık,Endokrinoloji ve Metabolizma Hastalıkları = Endocrinology and Metabolic Diseases," onclick=tezDetay('to5Q1ksUHrJJ-bQAXlMoTA','pqJVBKj5c_Kqra8ADXZVhA')"
349561,YAŞAR TUNA,2007,"Organ bekleme listesinde bulunan son evre karaciğer hastalarında MELD-Child-Turcotte-Pugh skorlarının ve diğer prognostik önemi olan faktörlerin değerlendirilmesi<br><span style='font-style: italic';>Evaluation of model for end-stage liver disease (MELD), Child-Turcotte-Pugh scores and other factors with prognostic significiance in patients with end stage liver disease at the liver transplantation waiting list",Akdeniz Üniversitesi,Tıpta Uzmanlık,Gastroenteroloji = Gastroenterology," onclick=tezDetay('DVovByFxl4hLUgtHwlFH-g','JLZE6K-Ior-qP7Sev2JOWQ')"
349562,YAŞAR TUNA,2003,Akut koroner sendromlu hastalarda oksidatif stres belirteçleri<br><span style='font-style: italic';>,Akdeniz Üniversitesi,Tıpta Uzmanlık,Kardiyoloji = Cardiology," onclick=tezDetay('TucZoh_W9daBj2ma4tzjJQ','WaAdNZwy_pAqYCxZSGFlZg')"
408373,ASLI YALÇINKAYA,2015,Juvenil idiopatik artritli hastalarda D vitamini metabolizmasının klinik bulgu ve etyopatogeneze etkisi<br><span style='font-style: italic';>Effects of vitamin D metabolism on clinical findings and etiopathogenesis in patients with juvenile idiopathic arthritis,Akdeniz Üniversitesi,Tıpta Uzmanlık,Çocuk Sağlığı ve Hastalıkları = Child Health and Diseases," onclick=tezDetay('tISTlgEjy6xeZym0N4HwwQ','Z9pOHNHWCeKyPMBoPfca3A')"
613294,ASLI ALTAŞ,2020,İnek sütü alerjisi olan hastalarda spesifik IgE ve epidermal prick testlerinin değerlendirilmesi<br><span style='font-style: italic';>Evaluation of epidermal prick test and specific IgE test in patients with cow\'s milk allergy,Akdeniz Üniversitesi,Tıpta Uzmanlık,Çocuk Sağlığı ve Hastalıkları = Child Health and Diseases," onclick=tezDetay('31P0-ByyfozLO5hX1TT1fw','whp-fPxFfUdPQnMpDIDTeA')"
665458,İBRAHİM DEMİR,2021,2010-2019 yılları arasında Akdeniz Üniversitesi Tıp Fakültesi adli tıp anabilim dalı\'nda rapor düzenlenen yanık olgularının incelenmesi<br><span style='font-style: italic';>Review of burn cases reported in the department of forensic medicine of Akdeniz University Aculty of Medicine between 2010-2019,Akdeniz Üniversitesi,Tıpta Uzmanlık,Adli Tıp = Forensic Medicine," onclick=tezDetay('joXvpeVRvRm-b8EPvP4bPQ','qNOPg_-6QJqqkyDLXumnLg')"
704645,HAYRANİ KAYA,2021,PET/BT incelemede kolonda tesadüfen tespit edilen poliplerin SUVmax değeri ile histolojik tipi ve displazi derecesi arasındaki ilişki<br><span style='font-style: italic';>The association  between SUVmax values and histological types and dysplasia grades of incidentally detected colon polyps in PET/CT examination,Akdeniz Üniversitesi,Tıpta Uzmanlık,Gastroenteroloji = Gastroenterology ; Radyoloji ve Nükleer Tıp = Radiology and Nuclear Medicine," onclick=tezDetay('QzjhiNopyrMyRijEViwFkg','tdDP6ELEblfo1Z8a8qK9zg')"
704590,HATİCE BENGÜ BÜYÜKOĞLAN,2021,COVİD-19 pandemisinin koruyucu sağlık hizmetlerinin kullanımına etkisinin değerlendirilmesi<br><span style='font-style: italic';>Evaluation of the impact of the COVİD-19 pandemic on the USE of preventive HEALTH services,Akdeniz Üniversitesi,Tıpta Uzmanlık,Aile Hekimliği = Family Medicine," onclick=tezDetay('XXoz_oncut7exOFqz8jCgw','nlG0jaLF8mj2zdA2l-mCVg')"
522630,DÜRİYE BETÜL YILMAZ,2018,Yassı epitel hücreli akciğer karsinomlarında immünohistokimya ve floresan insitu hibridizasyon (FİSH)yöntemleriyle FGFR1\'in değerlendirilmesi<br><span style='font-style: italic';>Evaluation of fgfr1 by immunohistochemistry and fluorescence in situ hybridization (FİSH) in squamous cell lung carcinomas,Akdeniz Üniversitesi,Tıpta Uzmanlık,Patoloji = Pathology," onclick=tezDetay('boy1KausxH1AGuOPryQlZg','b1gIuP-I_7EazTLR18rbQw')"
351304,NAZAN ŞİMŞEK ERDEM,2013,Amyotrofik lateral skleroz hastalarında solunum ve yutma fonksiyon bozukluklarının ilişkisi<br><span style='font-style: italic';>Swallowıng and respıratıon relatıonshıp ın amyotrophıc lateral sclerosıs,Akdeniz Üniversitesi,Tıpta Uzmanlık,Nöroloji = Neurology," onclick=tezDetay('6vA7zeFmjT9r1WqSLJuC9w','7YiBGU3DGIL2X-yEKhK6xA')"
307835,BİLGE GÖKTAŞ,2002,Hastanemiz ameliyathanesinde iş akışı<br><span style='font-style: italic';>The work-flow of the operating room in our hospital,Akdeniz Üniversitesi,Tıpta Uzmanlık,Anestezi ve Reanimasyon = Anesthesiology and Reanimation," onclick=tezDetay('Ds_oIo7OhShKg9DyN7enAA','5A8ygmzDBXD3L0mZVhE2JA')"
307914,SEÇGİN SÖYÜNCÜ,2002,Künt karın travmasına bağlı gelişen karın içi kanamaların tanısında acil tıp hekimi tarafından yapılan ultrasonografinin etkinliği<br><span style='font-style: italic';>,Akdeniz Üniversitesi,Tıpta Uzmanlık,İlk ve Acil Yardım = Emergency and First Aid," onclick=tezDetay('Ah10YZqe4uDuRsfWivurqw','0SYBI-WWUZ-ApTSUMjC7ew')"
307915,SELİM DEMİREZEN,2011,Parsiyelhepatektomi yapılan sıçanlarda kimyasal sempatektominin karaciğer rejenerasyonu üzerine etkileri<br><span style='font-style: italic';>The effects of chemical sympathectomy on liver regeneration in rats undergoing partial hepatectomy,Akdeniz Üniversitesi,Tıpta Uzmanlık,Çocuk Cerrahisi = Pediatric Surgery," onclick=tezDetay('5czMfmmoMwFr9k02xDLTcg','EdtywSzvbM6IqfvndsTC1g')"
341898,ÜLKÜ GÜRBÜZ UÇAR,2009,"Postmenopozal vertebral osteoporozda egzersizin sırt ekstansör kas gücü, spinal mobilite, akciğer kapasitesi, endürans ve yaşam kalitesi üzerine etkileri<br><span style='font-style: italic';>Effects of exercise on back extensor muscle strength, spinal mobility, lung capacity, endurance and quality of life in postmenopousal  vertebral steoporosis",Akdeniz Üniversitesi,Tıpta Uzmanlık,Fiziksel Tıp ve Rehabilitasyon = Physical Medicine and Rehabilitation," onclick=tezDetay('tp1Vyrk1ddYhDSWh4YG3bA','Fj9YeGO-6mcNQBRcLUZQtg')"
520599,ECE ULUKAL KARANCI,2018,Kronik karaciğer hastalarında vitamin d düzeyinin hastalık etyolojisi ve hastalık derecesi ile ilişkisi<br><span style='font-style: italic';>The relationship between vitamin d levels and disease etiology and disease degree in chronic liver disease,Akdeniz Üniversitesi,Tıpta Uzmanlık,Endokrinoloji ve Metabolizma Hastalıkları = Endocrinology and Metabolic Diseases ; Gastroenteroloji = Gastroenterology," onclick=tezDetay('sLEFPRZ8upnhnhGhAn9bmA','fhv_hmbW8gau1JK_hVXaOQ')"
550870,MİHRİBAN ÜNAY,2019,"Karaciğer nakli bekleyen ve nakil sonrası dönemde olan çocuk ve ergen hastalarda yaşam kalitesi, psikopatoloji ve travma sonrası stres bozukluğunun değerlendirilmesi<br><span style='font-style: italic';>Evaluation of quality of life, psychopathology and stress disorders in children and adolescent patients that wait for liver transplantation",Akdeniz Üniversitesi,Tıpta Uzmanlık,Psikiyatri = Psychiatry," onclick=tezDetay('X7rx_7RUP1inn32MfDha2g','mw6XNtHrsFXCpb2DRP1QRA')"
577065,HATİCE UĞUR OKUDAN,2019,Pediatrik karaciğer nakillerinde 21 yıllık deneyimimiz ve önerilerimiz<br><span style='font-style: italic';>21 years experience and recommendations in pediatric liver transplantation,Akdeniz Üniversitesi,Tıpta Uzmanlık,Anestezi ve Reanimasyon = Anesthesiology and Reanimation," onclick=tezDetay('r1l3HkWxvwnYyYiNDE_q7w','Z9wB3emvJUoRLutolRxM9g')"
508556,ZÜMRÜT ARSLAN,2015,Antalya ili Muratpaşa ilçesi ilk ve ortaöğretim çağındaki çocuklarda ortostatik proteinüri sıklığının araştırılması<br><span style='font-style: italic';>The prevalence of orthostatic proteinuria among schoolchildren in Muratpaşa district in Antalya,Akdeniz Üniversitesi,Tıpta Uzmanlık,Çocuk Sağlığı ve Hastalıkları = Child Health and Diseases," onclick=tezDetay('EXe7mMbDycZhsolyisDWHQ','0EGS3MQYNalPerqjJlCQyw')"
