tez_no,yazar,yıl,title,üniversite,tez_türü,konu,tez_detay
411668,GÜNSEL SÜNBÜLOĞLU,1999,Osteoporoz osteoartrit ilişkisi<br><span style='font-style: italic';>,Akdeniz Üniversitesi,Tıpta Uzmanlık,Fiziksel Tıp ve Rehabilitasyon = Physical Medicine and Rehabilitation," onclick=tezDetay('LksFd9RS9RQTDOYM3FQz1Q','Hzs3dhZFLz-cpOYlRNdCpA')"
408136,GÜRHAN GÜNAY,1999,Alkol dışı karaciğer yağlanması olan hastalarda homa testi ile insülin resistansının araştırılması<br><span style='font-style: italic';>,Akdeniz Üniversitesi,Tıpta Uzmanlık,Gastroenteroloji = Gastroenterology," onclick=tezDetay('tZLlp9ifvAk3SHNx_8IZxg','591dLTjfx1ImOZ-_YbJNvQ')"
407952,H. GÜL ERGÜNEN,1996,Capd peritoniti olgularında etkenlerin belirlenmesi<br><span style='font-style: italic';>,Akdeniz Üniversitesi,Tıpta Uzmanlık,Mikrobiyoloji = Microbiology," onclick=tezDetay('jfCf-1lxhmW48G3Dsho5ig','4oBq_7PXVU62M0UENxwGew')"
378052,H. NEVGÜN SERPİN ÖZEN,2005,Ferbil nötropenik hastalarda invazif aspergilloz tanısında galaktomannan antijeninin saptanmasında enzim immünassay ve lateks aglütinasyon yöntemlerinin kullanılması<br><span style='font-style: italic';>,Akdeniz Üniversitesi,Tıpta Uzmanlık,Mikrobiyoloji = Microbiology," onclick=tezDetay('DCLlKo1A-Saox5H16c8LOg','dxQI1gOhlksS68CltRuqkg')"
407901,H. SEÇKİN OKŞAR,1999,Nikotin etkisi altındaki ratlarda delay fenomeninin tram flep üzerindeki etkilerinin araştırılması<br><span style='font-style: italic';>,Akdeniz Üniversitesi,Tıpta Uzmanlık,Plastik ve Rekonstrüktif Cerrahi = Plastic and Reconstructive Surgery," onclick=tezDetay('d0FuQ3pAh81Vv1dSAu3R_w','ckdjFuICHbxoa60papgrCw')"
378053,HABİB ÇİL,2005,Karotis intima-media kalınlığı ve nabız dalga hızının koroner arter hastalığını öngörmedeki değeri<br><span style='font-style: italic';>,Akdeniz Üniversitesi,Tıpta Uzmanlık,Kardiyoloji = Cardiology," onclick=tezDetay('8Sr42Uv_-yFcFwyS20uWMQ','utk0DmixhrzkHshie7sImw')"
407935,HAFİZE ÖKSÜZ,1999,Multi travmalı hastalarda prognozu etkileyen faktörler<br><span style='font-style: italic';>,Akdeniz Üniversitesi,Tıpta Uzmanlık,Anestezi ve Reanimasyon = Anesthesiology and Reanimation," onclick=tezDetay('VzOuCiOge8MFY7tK_9bfPg','wDdNAJc8XncyrL6_4aq0tA')"
408034,HAKAN GENİŞ,2000,Sensorinöral tip işitme kayıplarında pürton odyometriyel alternatif bir teknik: Dpoae (Distortion product Otoacoustic Emissions)<br><span style='font-style: italic';>,Akdeniz Üniversitesi,Tıpta Uzmanlık,Kulak Burun ve Boğaz = Otorhinolaryngology (Ear-Nose-Throat)," onclick=tezDetay('LQF2iEI0oIwsubq4z1j44Q','XMYl-xU7CJsF5HtKLQlYrg')"
408116,HAKAN KAYA,2001,Endometriyal patolojilerin erken tanısında endometriyal sitolojinin yeri<br><span style='font-style: italic';>,Akdeniz Üniversitesi,Tıpta Uzmanlık,Kadın Hastalıkları ve Doğum = Obstetrics and Gynecology," onclick=tezDetay('r84BmXKEZMdH-nyPi8FNuw','70GUHCTMY8mwfs3vAt3uzg')"
407949,HAKAN ŞAT BOZCUK,1999,Küçük hücreli dışı akciğer kanserlerinde tedaviye kadar oan sürenin sağ kalım üzerine etkisi. Tek merkezli retrospektif bir çalışma<br><span style='font-style: italic';>,Akdeniz Üniversitesi,Tıpta Uzmanlık,Onkoloji = Oncology," onclick=tezDetay('CT3dwFmyYjdrRNS6-h68qg','pFDHgRbNB1mL9nsVyGvk7w')"
407911,HAKAN ŞAT BOZCUK,1999,Sürekli ayaktan periton diyalizi hastalarında intraperitoneal otolog kriyopresipitat uygulanımının diyalizat fagosit fonksiyonları üzerine etkisi<br><span style='font-style: italic';>,Akdeniz Üniversitesi,Tıpta Uzmanlık,Nefroloji = Nephrology," onclick=tezDetay('KA4Je1gaAgP8fDGPrwPJVA','uGnMjmCIUhhl3kp2qbKffA')"
526334,GÜNDÜZALP SAYDAM,2018,Ekokardiyografi ile sistolik pulmoner arter basınç hesaplanmasında sağ atriyal basınç tahmininde koroner sinüs çapı ve kollapsının kullanımı<br><span style='font-style: italic';>Using coronary sinus diameter and collapse index to estimate right atrial pressure for echocardiographic systolic pulmonary arterial pressure measurement,Akdeniz Üniversitesi,Tıpta Uzmanlık,Kardiyoloji = Cardiology," onclick=tezDetay('EJeF3Q4zEZZdZTExXLhZBQ','1zkaqa9eycT-G_qjh2lMOA')"
32947,A. GÖKHAN ARSLAN,1994,Vaskülojenik empotansın değerlendirilmesinde renkli doppler ultrasonografi<br><span style='font-style: italic';>,Akdeniz Üniversitesi,Tıpta Uzmanlık,Radyoloji ve Nükleer Tıp = Radiology and Nuclear Medicine," onclick=tezDetay('EtTNMIQP3bPmGtmqI5yeuw','EtTNMIQP3bPmGtmqI5yeuw')"
346875,ZEKİ SALAR,2005,Servikovajinal fibronektin ve servikal uzunluk ölçümünün erken doğum eylemi prognozuna etkileri<br><span style='font-style: italic';>,Akdeniz Üniversitesi,Tıpta Uzmanlık,Kadın Hastalıkları ve Doğum = Obstetrics and Gynecology," onclick=tezDetay('iSxlwK5Zp19C2BzPxRqFUA','_Yej2TaRNAG1ev9dH5hvRw')"
433213,LEYLA SÜRMELİ,2015,Kontrast verilen hastalarda kontrast nefropatisi gelişimi ve risk faktörleri<br><span style='font-style: italic';>Determination of risk factors associated with contrast induced nephropathy,Akdeniz Üniversitesi,Tıpta Uzmanlık,İlk ve Acil Yardım = Emergency and First Aid," onclick=tezDetay('EA4sxvOhqJabMm6f7durAg','JdgU9lSPf85EvSdJEXAHEA')"
710125,DOĞANCAN KOZAK,2021,Acil serviste COVID-19 pnömonisi ön tanısı ile toraks BT görüntülemesi yapılan hastalarda acil tıp hekiminin radyolojik yorumunun tanısal değeri<br><span style='font-style: italic';>The diagnostic value of emergency medicine physicians radiological interpretation in patients who had thoracic CT imaging with the prediagnosise of COVID-19 pneumonia at emergency department,Akdeniz Üniversitesi,Tıpta Uzmanlık,Göğüs Hastalıkları = Chest Diseases," onclick=tezDetay('iYeXIeakYZjfj12UO0RN0g','vFN-7jEVxux3MD8pz0GOpQ')"
545815,KAZIM TAŞAR,2018,Yaralanmış sindesmozun dinamik tespitinde ideal sütür-buton yönelimi \'Sonlu Eleman Analizi Çalışması\'<br><span style='font-style: italic';>Optimal suture-button orientation in dynamic fixation of injured syndesmosis \' Finite Element Analiysis Study\',Akdeniz Üniversitesi,Tıpta Uzmanlık,Ortopedi ve Travmatoloji = Orthopedics and Traumatology," onclick=tezDetay('LNJiTy9BqzTf7xasZbS4-w','SMF4ALi3kI24F6sf58nsVw')"
547617,SELİM ÇATAL,2019,Romatoid artritli kadınlarda sarkopeni sıklığı ve ilişkili faktörler<br><span style='font-style: italic';>Prevalence and associated factors of sarcopenia in women with rheumatoid arthritis,Akdeniz Üniversitesi,Tıpta Uzmanlık,Fiziksel Tıp ve Rehabilitasyon = Physical Medicine and Rehabilitation," onclick=tezDetay('pc9ft32hAPpLXrQeYiE6Dw','qzmUG_aDe4ZuX1FaFmYrlw')"
666859,SEMİH ÇETİN,2021,Üçüncü basamak bir üniversite hastanesi acil servisine başvuran travma hastalarının özellikleri: Bir yıllık kesitsel analiz<br><span style='font-style: italic';>Characteristics of trauma patients admitting to A tertiary medical center university hospital emergency service: One-year cross-sectional analysis,Akdeniz Üniversitesi,Tıpta Uzmanlık,İlk ve Acil Yardım = Emergency and First Aid," onclick=tezDetay('0D6ApWrsufEEM4oroezG5g','y2GFNWE_RZ8moSiK81MfDg')"
579286,HÜSEYİN KARA,2019,Opiyat kullanım bozukluğu olan hastalarda serum leptin ve ghrelin seviyeleri ile yoksunluk ve aşerme arasındaki ilişki<br><span style='font-style: italic';>The relationship of serum leptin and ghrelin levels wi̇th withdrawal and craving in patients with opioid use disorder,Akdeniz Üniversitesi,Tıpta Uzmanlık,Psikiyatri = Psychiatry," onclick=tezDetay('kq-d4OtT2afUKNemGfJQdA','AyWTiobxfFLXsVKi-SU9TQ')"
388492,MURAT YILDIZ,2015,Acil serviste akut böbrek yetmezliği tanısı alan hastalarda  asidozla ilgili parametreler<br><span style='font-style: italic';>Acidosis related parameters in the acute renal failure patients diagnosed in the emergency department,Akdeniz Üniversitesi,Tıpta Uzmanlık,İlk ve Acil Yardım = Emergency and First Aid," onclick=tezDetay('Tazd6HvtYeJj49lxQ23LzA','aFkU1g9xCXJXgxKyjnh4AA')"
13989,NÜKHET YILMAZ,1991,Malin ve inflamatuvar olgular arasında serum seruloplazmin oksidaz aktivitesi tayininin biyokimyasal tanı değeri<br><span style='font-style: italic';> ,Akdeniz Üniversitesi,Tıpta Uzmanlık,Biyokimya = Biochemistry," onclick=tezDetay('X1FUggB01t35G3ygpXKNJg','X1FUggB01t35G3ygpXKNJg')"
13990,ENDER SEMİZ,1991,Esansiyel hipertansiyonda sol ventrikül diyastolik fonksiyonlarının doppler ekokardiyografi ile değerlendirilmesi<br><span style='font-style: italic';> ,Akdeniz Üniversitesi,Tıpta Uzmanlık,Kardiyoloji = Cardiology," onclick=tezDetay('MB7-Gf1Udk963VDYY9nGsw','MB7-Gf1Udk963VDYY9nGsw')"
13991,AHMET DANIŞMAN,1991,Böbrek taşlarında ESWL tedavisinin erken dönem yan etkilerinin değerlendirilmesi<br><span style='font-style: italic';> ,Akdeniz Üniversitesi,Tıpta Uzmanlık,Üroloji = Urology," onclick=tezDetay('a4jQ9rgiB3zcLGJYiwoJCQ','a4jQ9rgiB3zcLGJYiwoJCQ')"
408078,İRFAN KAPUTLU,1993,İzole tavşan aortunda pentoksifilin\'in vazodilatör etkisinde endotel kaynaklı gevşetici faktör\'ün ve fosfodiesteraz inhibitörü etkinliğinin olası rolü<br><span style='font-style: italic';>,Akdeniz Üniversitesi,Tıpta Uzmanlık,Eczacılık ve Farmakoloji = Pharmacy and Pharmacology," onclick=tezDetay('DaeafWmycHOeyARUpzh2YA','y1gseVkXOKH103aTzCFfpw')"
408020,CANDAN ÖĞÜŞ,1996,Toraks lezyonlarında transtorasik ince iğne aspirasyon biyopsisi<br><span style='font-style: italic';>,Akdeniz Üniversitesi,Tıpta Uzmanlık,Göğüs Hastalıkları = Chest Diseases," onclick=tezDetay('2rRp-gvFAcEsSqrbvQQaIw','qlHPbcKOYIzzL6nVqK_iKg')"
408117,MEHTAP ÇAKIR,2003,Obez ve nonobez sağlıklı beyinlerde insülin rezistansının hesaplanmasında kullanılan indekslerin kıyaslanması<br><span style='font-style: italic';>,Akdeniz Üniversitesi,Tıpta Uzmanlık,Endokrinoloji ve Metabolizma Hastalıkları = Endocrinology and Metabolic Diseases," onclick=tezDetay('25blKO3x8ubSqZVFdsZNkw','XSFuDPuIO8iv-wooRMfrjg')"
341888,ERHAN KOCALAR,2013,Hastane su ve hava sisteminde Aspergillus spp tayini ve aynı dönemde invaziv pulmoner aspergilloz olguları<br><span style='font-style: italic';>Determination of water and air system hospital Aspergillus spp and invazive pulmonary aspergillosis cases the same period,Akdeniz Üniversitesi,Tıpta Uzmanlık,Klinik Bakteriyoloji ve Enfeksiyon Hastalıkları = Clinical Microbiology and Infectious Diseases," onclick=tezDetay('A6VDHI7bEB9k4S6ZRjTD9g','BWXZdYMwuMmeTunrzSTweA')"
454046,İLKNUR SÜLEMİŞ,2016,"Antalya ili merkez Konyaaltı ilçesi\'nde tip 2 diyabet ve hipertansiyon prevalansının araştırılması ve erken tanı ve tarama programlarının etkinliğinin değerlendirilmesi<br><span style='font-style: italic';>Evaluation of type 2 diabetes and hypertension prevalance and effectiveness of early detection and screening programme in Konyaalti district, Antalya",Akdeniz Üniversitesi,Tıpta Uzmanlık,Halk Sağlığı = Public Health," onclick=tezDetay('qFV5Qrs_woK2KiX-Vmls3Q','6e9HrceauZ5Xc9ocjwZcKA')"
32948,S. METİN ÇUBUK,1994,Serebral lezyonların değerlendirilmesinde helikal ve konvansiyonel bilgisayarlı tomografinin karşılaştırılması<br><span style='font-style: italic';>,Akdeniz Üniversitesi,Tıpta Uzmanlık,Radyoloji ve Nükleer Tıp = Radiology and Nuclear Medicine," onclick=tezDetay('e8m5DHsuEXtjP-nei5RqAA','e8m5DHsuEXtjP-nei5RqAA')"
703612,ÖNDER DOĞAN,2021,"Akdeniz Üniveristesi  Hastanesi Erişkin Acil Servisi\'ne başvuran ve COVID-19 enfeksiyonu tanısı alan hastalarda nötrofil, lenfosit, monosit ve eozinofil sayılarının incelenmesi \'<br><span style='font-style: italic';>Mediterranean University Hospital Adult Emergency Service and Diagnosed with COVID-19 infection investigation of neutrophil, lymphocyte, monocyte and eosinophil counts in patients",Akdeniz Üniversitesi,Tıpta Uzmanlık,Klinik Bakteriyoloji ve Enfeksiyon Hastalıkları = Clinical Microbiology and Infectious Diseases," onclick=tezDetay('rmjFXWyDiZcH8Y4HiQELyg','onyLkJnvgDtmud-TL0nsbg')"
668337,ELA ATMACA KAPLAN,2021,Lomber cerrahi uygulanan hipertansif hastalarda genel anestezinin serebral perfüzyona etkisinin noninvaziv yöntemlerle değerlendirilmesi<br><span style='font-style: italic';>Evaluation of the effect of general anesthesia on cerebral perfusion by noninvasive methods in hypertensive patients undergoing lumbar surgery,Akdeniz Üniversitesi,Tıpta Uzmanlık,Anestezi ve Reanimasyon = Anesthesiology and Reanimation," onclick=tezDetay('n1-qM-scUZosb9nUPxyUUw','gnxCypusYYdCLSPm7gtTUQ')"
652370,CEREN MEMİŞ İRİCAN,2020,Frontal fibrozan alopesi hastalarında tetikleyici çevresel faktörler ve hastalığın yaşam kalitesine etkisinin değerlendirilmesi<br><span style='font-style: italic';>Evaluation of trigger environmental factors and the effect of the disease on the quality of life in patients with frontal fibrosing alopeci̇a,Akdeniz Üniversitesi,Tıpta Uzmanlık,Dermatoloji = Dermatology," onclick=tezDetay('jTMADP6_k-55Mds6YX5x5A','HRMNT0Ah1TywGR6cciTsMA')"
539125,ÖMER UĞUR,2018,Robotik yardımlı radikal prostatektomi vakalarında anestezi uygulamalarının retrospektif incelenmesi<br><span style='font-style: italic';>Reteospecti̇f analysing of anesthesia management in robotic assisted radical prostatectomy cases,Akdeniz Üniversitesi,Tıpta Uzmanlık,Anestezi ve Reanimasyon = Anesthesiology and Reanimation," onclick=tezDetay('yQ444PzkRyUpoCH0Mc5VLQ','u6-wvwxh2To4Kzftu_QLUA')"
346866,MESUT KÜÇÜKOSMANOĞLU,2004,Serum unkonjuge serbest estriol\'ün preterm doğum tanısındaki etkinliği<br><span style='font-style: italic';>,Akdeniz Üniversitesi,Tıpta Uzmanlık,Kadın Hastalıkları ve Doğum = Obstetrics and Gynecology," onclick=tezDetay('zJbpQ3iszItTbnCjPbdn2w','TAbVnRrneo5Hg3vL8J-OUw')"
680547,ASLI KIZILKAYA,2021,Antalya ili birinci basamak sağlık hizmetlerine başvuran ve 0-6 aylık bebeği olan annelerin bebekleri için gıda takviyesi kullanım durumları ve bu konudaki tutumlarının incelenmesi<br><span style='font-style: italic';>Antalya provincial use of food supplements for their babies and investigation of the attitudes of the mothers with 0-6 months baby who refer to primary health services,Akdeniz Üniversitesi,Tıpta Uzmanlık,Aile Hekimliği = Family Medicine," onclick=tezDetay('ywBzzqsHkievqIiqU-xH7Q','uMleZ7f580sXVkpW8CWKSw')"
408376,YAŞAR BEHMEN ERTEKİN,2015,Hafif ve şiddetli erkek infertilitesi ile açıklanamayan infertilitenin IVF sonuçları açısından değerlendirilmesi<br><span style='font-style: italic';>Evaluation of IVF results between mild and severe male factor infertility and unexplained infertility,Akdeniz Üniversitesi,Tıpta Uzmanlık,Kadın Hastalıkları ve Doğum = Obstetrics and Gynecology," onclick=tezDetay('jxuJx-BHsQGRPh9oLuzEow','dMwpwqNq34HYQAkC0jnkDA')"
484708,ONUR YAZDAN BALÇIK,2017,"Kronik böbrek hastalarında monosit, lenfosit ve doğal öldürücü  hücrelerdeki vitamin D reseptör miktarının ölçülmesi<br><span style='font-style: italic';>Measuring of vitamin D receptor quantity in monocytes, lymphocytes and natural killer cells in chronic kidney disease",Akdeniz Üniversitesi,Tıpta Uzmanlık,Nefroloji = Nephrology," onclick=tezDetay('W6PXVpS2a_VyRB3u4U4IWQ','jXbg-C6qB1WhhARmCFUfIQ')"
11287,BİRGÜL GÜR,1990,Renal transplantasyonlu hastalarda steroid tedavisinden sonra gözde görülen yan etkiler<br><span style='font-style: italic';>,Akdeniz Üniversitesi,Tıpta Uzmanlık,Göz Hastalıkları = Eye Diseases," onclick=tezDetay('UHMUOvoG395-NZy6k5hRaQ','UHMUOvoG395-NZy6k5hRaQ')"
584827,BEYZA ŞİRİN ÖZDEMİR,2010,Küçük hücreli akciğer kanserinin 3 boyutlu konformal radyoterapi uygulamalarında adaptif radyoterapinin rolü<br><span style='font-style: italic';>Role of adaptive radiotherapy during the application of three-dimensional conformal radiation therapy for small cell lung cancer,Akdeniz Üniversitesi,Tıpta Uzmanlık,Onkoloji = Oncology," onclick=tezDetay('uCHPeZ9aMxq-G8fld-GOSg','qwPKXdt4nl6GVMJfarX4bQ')"
454077,ÇİĞDEM ÇİÇEK KOLAK,2016,"Akdeniz Üniversitesi Tıp Fakültesi Hastanesinde izlenen yetişkin hastalarda kandidemi olgularının epidemiyolojisi, risk faktörleri, antifungal duyarlılıkları ve mortalite açısından farklılıklarının saptanması<br><span style='font-style: italic';>Evaluation of epidemiology, risk factors, antifungal susceptibilities and mortality of candidaemia in adult patients admitted to Akdeniz University Medical School Hospital",Akdeniz Üniversitesi,Tıpta Uzmanlık,Klinik Bakteriyoloji ve Enfeksiyon Hastalıkları = Clinical Microbiology and Infectious Diseases," onclick=tezDetay('Cqn7m3AcBuNpeuRfJJ5nww','n3cOlqCHyVJBWIfff2rhTA')"
666306,MÜMÜNE MERVE FİDAN,2021,"18 yaş üstü bireylerin internetten sağlık bilgisi arama davranışı, e- sağlık okuryazarlığı ve siberkondri durumlarının değerlendirilmesi<br><span style='font-style: italic';>Evaluation of online health i̇nformation seeking behavior, e-health literacy and cyberchondria status of i̇ndividuals over the age of 18",Akdeniz Üniversitesi,Tıpta Uzmanlık,Aile Hekimliği = Family Medicine ; Psikiyatri = Psychiatry ; Psikoloji = Psychology," onclick=tezDetay('JjoXVBpqlp3bVC7rJl2ixA','5T_RefcCeV1s0ZpHimLqiA')"
601121,EVRİM DUMAN,2011,Kötü prognostik faktörlere sahip lokal ileri evre veya metastatik  küçük hücreli dışı akciğer kanserinde (khdak) palyasyonun sağlanmasında 10 x 3 gy  radyoterapi şemasında tümör volüm değişikliklerinin retrospektif olarak değerlendirilmesi<br><span style='font-style: italic';>Retrospectively analysis of tumor volume changes with 10x3 gy radiotherapy schema in providing palliation of patients with poor prognostic factors in locally advanced stage or metastatic nsclc,Akdeniz Üniversitesi,Tıpta Uzmanlık,Onkoloji = Oncology," onclick=tezDetay('GenSbTIVYixab40knSlU9A','9C6tgv1PllmODO9HHDogBQ')"
11288,ORHAN HOŞGÖR,1990,İnfertilitede over faktörü ve izleminde ultrasonografinin yeri<br><span style='font-style: italic';>,Akdeniz Üniversitesi,Tıpta Uzmanlık,Kadın Hastalıkları ve Doğum = Obstetrics and Gynecology," onclick=tezDetay('PWgxWHWVvk2tJkPLGW2rwA','PWgxWHWVvk2tJkPLGW2rwA')"
11289,F. FEYYAZ AKYILDIZ,1990,Akut ve kronik anterior krusiat ligament lezyonlarının cerrahi sağaltım ve sonuçları<br><span style='font-style: italic';>,Akdeniz Üniversitesi,Tıpta Uzmanlık,Ortopedi ve Travmatoloji = Orthopedics and Traumatology," onclick=tezDetay('tcnUbp1UO5V6XVIVTYm25g','tcnUbp1UO5V6XVIVTYm25g')"
11290,TAHA KARAMAN,1990,Psikosomatik hastalarda aile algısı ve ruhsal yapılanma<br><span style='font-style: italic';>,Akdeniz Üniversitesi,Tıpta Uzmanlık,Psikiyatri = Psychiatry," onclick=tezDetay('SuecmU1UnsvOxKp2CqL8mQ','SuecmU1UnsvOxKp2CqL8mQ')"
160741,İCLAL YÜCEL,1984,Arteriosklerotik retinopatide serum lipidleri ve HDL kolestrolü düzeyleri<br><span style='font-style: italic';> ,Akdeniz Üniversitesi,Tıpta Uzmanlık,Göz Hastalıkları = Eye Diseases," onclick=tezDetay('K5W9k_W5Ov76tX38QOXPFQ','NuKcOJcv5ZJa_zsCpGycMw')"
307832,BAŞAK ÖZDEMİR,2013,Akdeniz Üniversitesi Tıp Fakültesi Hastanesi anestezi kliniğinde acil sezaryen olgularında anestezi yönetiminin değerlendirilmesi<br><span style='font-style: italic';>The evaluation of anesthetic management among patients who underwent emergency cesarean section at the anesthesia clinic of Akdeniz University Faculty of Medicine,Akdeniz Üniversitesi,Tıpta Uzmanlık,Anestezi ve Reanimasyon = Anesthesiology and Reanimation," onclick=tezDetay('GMEJfRZZt1Mpxg-P2JaXrg','8i-wi16n1G8zFppkyXa-xw')"
508822,MERVE ÇETİNKAYA,2018,Perioperatif havayolu değerlendirilmesinde antropometrik ölçümler ve zor laringoskopi insidansı araştırılması<br><span style='font-style: italic';>Anthropometric measurements and research of difficult airway incidance during perioperative airway evoluation,Akdeniz Üniversitesi,Tıpta Uzmanlık,Anestezi ve Reanimasyon = Anesthesiology and Reanimation," onclick=tezDetay('7bOVb6yXiECEJNsc1ryIOA','I2dIFhm68mv1QHwB261KWg')"
423630,ÜMİT ARSLAN,2010,Hba1c seviyelerine göre kontrol altında olan ve olmayan diyabet hastalarında koroner arter bypass cerrahisi sonrası gelişen morbidite ve mortalitenin retrospektif değerlendirilmesi<br><span style='font-style: italic';>The retrospective evaluation of the morbidity and mortality after coronary artery bypass grafting in patients with controlled and uncontrolled diabetes according to hba1c levels,Akdeniz Üniversitesi,Tıpta Uzmanlık,Göğüs Kalp ve Damar Cerrahisi = Thoracic and Cardiovascular Surgery," onclick=tezDetay('7STMFKjMOpFgBpPdB3zvbA','y4Ef7gGyI9gSCrtdTM8_ug')"
548990,SERHAT BAY,2019,Bölgemizdeki fenilketonüri hastalığının ve tedavisinin ailelerin ve fenilketonürili çocukların yaşam kaliteleri üzerine olan etkisinin araştırılması<br><span style='font-style: italic';>Investigation of the effect of phenylketonuria disease and treatment on quality of the parent\'s and patient\'s life in our region,Akdeniz Üniversitesi,Tıpta Uzmanlık,Çocuk Sağlığı ve Hastalıkları = Child Health and Diseases," onclick=tezDetay('qHxpciGpDSrT9Dehqa2UmA','vhEskFrqCE96KRKjQAvELQ')"
681625,VELİ BURAK TAÇKIN,2021,Sol ventrikül destek cihazı implante edilmiş hastalarda oluşan hemolizin değerlendirilmesi<br><span style='font-style: italic';>Evaluation of hemolysis occurred in patients with left ventricle support device implanted,Akdeniz Üniversitesi,Tıpta Uzmanlık,Göğüs Kalp ve Damar Cerrahisi = Thoracic and Cardiovascular Surgery," onclick=tezDetay('l6oTR20oP8u_HTx_NzXo3Q','EKCynHt72oEdYhYdGHme3w')"
539465,HASAN TUNA TÜRKMEN,2019,Alt ekstremite yumuşak doku defektlerinin rekonstrüksiyonunda kullanılan serbest fasyokutan  çapraz bacak flebi ile serbest fasyokutan konvansiyonel fleplerin nörosensöriyel ve klinik karşılaştırılması<br><span style='font-style: italic';>Neurosensorial and clinical comparison of the free fasciocutaneous cross-leg flaps and free conventional fasciocutaneous flaps used in the reconstruction of soft tissue defects of the lower extremity,Akdeniz Üniversitesi,Tıpta Uzmanlık,Plastik ve Rekonstrüktif Cerrahi = Plastic and Reconstructive Surgery," onclick=tezDetay('C077mob6dRKsALYgN4RHbA','JWFxOxKlrJJrD9XsVqcYrg')"
523140,CEM CELAL ASLAN,2018,Posterior kordotomi ve parsiyel aritenoidektomi uygulanan hastalarda ameliyat öncesi ve sonrası ses kalitesinin değerlendirilmesi<br><span style='font-style: italic';>Evaluation the quality of voice between preoperation and postoperation in the patients with posterior cordotomy and partial aritenoidectomy,Akdeniz Üniversitesi,Tıpta Uzmanlık,Kulak Burun ve Boğaz = Otorhinolaryngology (Ear-Nose-Throat)," onclick=tezDetay('1vNAyihK6t9ZfKEbnpcbzQ','DocKViwkr7PNsAY3P6jp2Q')"
11291,E.NEJAT DEMİRTAŞ,1990,Çocukluk çağı epilepsilerinde klinik özelliklerin retrospektif değerlendirilmesi<br><span style='font-style: italic';>,Akdeniz Üniversitesi,Tıpta Uzmanlık,Çocuk Sağlığı ve Hastalıkları = Child Health and Diseases," onclick=tezDetay('4Xe_UhwhaAZ3PGn_BrZXNQ','4Xe_UhwhaAZ3PGn_BrZXNQ')"
11292,ŞAFAK YALÇIN,1990,Human herpesvirus-6(HHV-6) moleküler biyoloji çalışmalarında transformasyon standardizasyonu<br><span style='font-style: italic';>,Akdeniz Üniversitesi,Tıpta Uzmanlık,Mikrobiyoloji = Microbiology," onclick=tezDetay('NuN5cdKXGPaMUrvtlmbdpg','NuN5cdKXGPaMUrvtlmbdpg')"
359647,CAHİDE KAHRAMAN,2014,Karaciğer nakli \'10 yıllık deneyimimiz\'<br><span style='font-style: italic';>Liver transplantation \'our clinical 10 years experience\',Akdeniz Üniversitesi,Tıpta Uzmanlık,Anestezi ve Reanimasyon = Anesthesiology and Reanimation," onclick=tezDetay('-lYWvdQ-EzJ209OAG_Y07Q','yV0WytOF66mggYwYZkOy9Q')"
329811,HÜSEYİN GÜVEN,2012,Rektum kanserlerinde lenf nodlarında mikrometastaz varlığının klinik önemi<br><span style='font-style: italic';>The clinical significance of the existence of lymph node micrometastases i?n rectum cancers,Akdeniz Üniversitesi,Tıpta Uzmanlık,Genel Cerrahi = General Surgery ; Onkoloji = Oncology," onclick=tezDetay('2C8IddK2dSrZ02uN-GK0KQ','ArQDhb_Fgl6B_9IlEKKFGA')"
408369,ZAKİR KOÇ,2015,Esansiyel tremor hastalarında P300 ve CNV değişikliklerinin değerlendirilmesi<br><span style='font-style: italic';>Evaluation of P300 and CNV changes in patients with essential tremor,Akdeniz Üniversitesi,Tıpta Uzmanlık,Nöroloji = Neurology," onclick=tezDetay('hvXqctQDeXoudXxgNIe5Ug','r9tPGRCaA6EuhEeflTRCaA')"
484666,MUSTAFA SAĞLAM,2016,Gebelikte ortalama trombosit hacminin subklinik  intraamniyotik  enfeksiyon tanısında ve erken membran rüptürünün takibindeki yeri ve önemi<br><span style='font-style: italic';>The importance of the mean platalet volum in subcli̇ni̇cal intraamniotic infecti̇on diognosi̇s and follow up of the premature preterm rupture of membranes,Akdeniz Üniversitesi,Tıpta Uzmanlık,Kadın Hastalıkları ve Doğum = Obstetrics and Gynecology," onclick=tezDetay('WOJXSYSuAvWMFweKmpfHTg','GbIJOjbzB4QSltUbFFrQWg')"
420738,METİN KABA,2007,Subklinik hipotiroidin gebelik seyri ve fetüs üzerine etkisi<br><span style='font-style: italic';>The effect of subclinic hypothroidism on  the fetus and the progress of pregnancy,Akdeniz Üniversitesi,Tıpta Uzmanlık,Kadın Hastalıkları ve Doğum = Obstetrics and Gynecology," onclick=tezDetay('JEk8gQI907JxO6F78RJXQw','Tk5ejL9U54QvVzZuU7Vakw')"
11267,M.TEKİNALP GELEN,1989,Akciğer tümörlerinin histokimyasal ve immünohistokimyasal (immünperoksidaz) yöntemlerle yeniden değerlendirilmesi<br><span style='font-style: italic';>,Akdeniz Üniversitesi,Tıpta Uzmanlık,Onkoloji = Oncology," onclick=tezDetay('UP_2uSLtAx5LCH_v80tHIQ','UP_2uSLtAx5LCH_v80tHIQ')"
11268,SUMRU ELAL,1989,Bir dopamin antagonistinin vizüel uyarılmış potansiyellere etkisi<br><span style='font-style: italic';>,Akdeniz Üniversitesi,Tıpta Uzmanlık,Nöroloji = Neurology," onclick=tezDetay('MEqzvxc7lwCl5NoWMryYBQ','MEqzvxc7lwCl5NoWMryYBQ')"
