tez_no,yazar,yıl,title,üniversite,tez_türü,konu,tez_detay
426531,MUKADDER ÇOLAK,2015,Hepatosteatozun saptanmasında BT dansitometrisinin etkinliği<br><span style='font-style: italic';>The effectiveness of CT densitometry in detecting the hepatosteatosis,Gaziantep Üniversitesi,Tıpta Uzmanlık,Radyoloji ve Nükleer Tıp = Radiology and Nuclear Medicine," onclick=tezDetay('1jR1Wm5VFzXo8YzZj8SEtw','jrCCZP4UqXzDz13j9rjznw')"
193655,HAKAN BÜYÜKHATİPOĞLU,2007,Ürotensin II peptidinin raynaud fenomeni ve sistemik lupus eritematozus hastalığındaki rolü<br><span style='font-style: italic';>The role of urotensin II peptide in patients with systemic lupus erythematosus and raynaud phenomenon,Gaziantep Üniversitesi,Tıpta Uzmanlık,Biyokimya = Biochemistry ; Romatoloji = Rheumatology," onclick=tezDetay('pD-q1oSCtD49Y3eMrE6C9A','MpvLJ0dGP3ka--G0Rv3oEA')"
331564,SENA HAS ÜNVERDİ,2013,Radyolojik yöntemlerle saptanan ve histopatolojik olarak tanılandırılan meme kitlelerinde elastografi bulgularının ayırıcı tanıya katkısı<br><span style='font-style: italic';>The contribution of elastography to differential diagnosis of  breast lesions that have been determined by radiological methods and identified histopatologically,Gaziantep Üniversitesi,Tıpta Uzmanlık,Radyoloji ve Nükleer Tıp = Radiology and Nuclear Medicine," onclick=tezDetay('trSrb2HhMMoDIrhHGiRNyg','vaBlH90dmdqKOojw3-0BJA')"
699011,TUNCAY ÖNAL,2021,Beta talasemi major hastalarında demir yüküne bağlı ekzokrin pankreas yetmezliğinin değerlendirilmesi<br><span style='font-style: italic';>Evaluation of exocrine pancreas insufficiency in patients with iron-loaded beta thalassemia major,Gaziantep Üniversitesi,Tıpta Uzmanlık,Hematoloji = Hematology," onclick=tezDetay('sglkgCbbtTymhbiO0Ko0sQ','GwBvS3xbsnF5aJq6jLw6ug')"
340631,MEHMET BOZOK,2013,Şizofrenide anti-müllerian hormon düzeyleri ve cinsiyet hormonları ile ilişkisi<br><span style='font-style: italic';>Anti-müllerian hormone and sex hormone levels in schizophrenia,Gaziantep Üniversitesi,Tıpta Uzmanlık,Biyokimya = Biochemistry," onclick=tezDetay('sl6cxHBblWQl34-cc9sM3Q','VjvCegoYkFCJON1sD-Btxg')"
301325,YILMAZ KÖR,2012,Büyüme hormonu eksikliği olgularında tanı ve tedaviye yanıtın değerlendirilmesi<br><span style='font-style: italic';>Evaluatıon of the dıagnosıs and assessment of response to treatment ın patıents wıth growth hormone defıcıency,Gaziantep Üniversitesi,Tıpta Uzmanlık,Endokrinoloji ve Metabolizma Hastalıkları = Endocrinology and Metabolic Diseases ; Çocuk Sağlığı ve Hastalıkları = Child Health and Diseases," onclick=tezDetay('xEp0jk7GZFjRsOkrNnk3rQ','g2cYlFblZy51dRRxVOJ3Bw')"
195275,MEHMET ERKAN ALTUNCU,2007,Obez çocuklarda kalp hızı değişkenliği ve metabolik sendrom<br><span style='font-style: italic';>Heart rate variability in childhood obesity and the metabolic syndrom,Gaziantep Üniversitesi,Tıpta Uzmanlık,Çocuk Sağlığı ve Hastalıkları = Child Health and Diseases," onclick=tezDetay('cCX25quNsRiwOTexNFIf0A','eCuwcm4XL8JJt3ZiUd2AZw')"
604909,CELAL BİRLİK,2019,Altı ay altı yaş arası çocuklarda iştahsızlık sıklığı ve etkileyen faktörlerin belirlenmesi<br><span style='font-style: italic';>The frequency of appetite loss and determination of affecting factors in children aged between six months and six years,Gaziantep Üniversitesi,Tıpta Uzmanlık,Çocuk Sağlığı ve Hastalıkları = Child Health and Diseases," onclick=tezDetay('5qUb1jUksz8ru3hU4K2Svw','X8nOT81oGi_wySptC3pIoQ')"
236629,BURCU ÖZBALA GÜNSOY,2009,Romatizmal mitral darlık hastalarında EKG\'de QRS fragmantasyonu varlığı<br><span style='font-style: italic';>Relationship between fragmented QRS and rheumatic mitral stenosis,Gaziantep Üniversitesi,Tıpta Uzmanlık,Kardiyoloji = Cardiology," onclick=tezDetay('UhhTWfFmpi0__m_x63h95Q','od9Pj3Z7FJjzfzG7CyFDcA')"
230172,BEKİR YAVUZ ÇAKIR,2009,Alt ekstremite venöz yetmezliğin renkli Doppler ultrasonografi ile değerlendirilmesinde değişik pozisyonda yapılan incelemelerin karşılaştırılması<br><span style='font-style: italic';>Comparison of different examinatıon positions at colored Doppler sonography of lower extremity venous insufficiency,Gaziantep Üniversitesi,Tıpta Uzmanlık,Radyoloji ve Nükleer Tıp = Radiology and Nuclear Medicine," onclick=tezDetay('BcRVr8Tn9JqGS-UK36jq4Q','-t9LhM_J1vqV7qX_rGsluw')"
281238,ÖZLEM KARAOĞLU,2011,"Gaziantep ilindeki çocukluk çağı immün trombositopenik purpura hastalarında klinik seyir, labaratuar bulguları ve tedavi cevaplarının değerlendirilmesi<br><span style='font-style: italic';>Evaluation of clinical course, laboratory findings and treatment response in childhood immune thrombocytopenic purpura in Gaziantep",Gaziantep Üniversitesi,Tıpta Uzmanlık,Çocuk Sağlığı ve Hastalıkları = Child Health and Diseases," onclick=tezDetay('DQGd1b9oMK5Tis89wC-ATg','oJYl67dh6xVtkltIqJlRvw')"
324118,RAMAZAN YAYUSPAYI,2013,Gaziantep il merkezinde düşük sosyoekonomik düzeye sahip ilköğretim çağı öğrencilerin göz patolojileri ve demografik özellikleri<br><span style='font-style: italic';>The prevalence of visual impairment and demographic characteristics school age children of low socio-economic status in gaziantep,Gaziantep Üniversitesi,Tıpta Uzmanlık,Göz Hastalıkları = Eye Diseases," onclick=tezDetay('ivlQjr8rJCoxOtWeGbok2g','UsPrt9Q2M9RIWtXQS7Owmw')"
329095,ERAY MANDOLLU,2013,Elektif  sezaryen\'de lateral pozisyonda düşük doz lokal anestezikle spinal ve düşük konsantrasyonda lokal anestezik solüsyonla epidural anestezi kombinasyonunun kullanımının hipotansiyona etkisi<br><span style='font-style: italic';>Effects of  combinational usage  of spinal anesthesia with a low dose of a local anesthetic and epidural anesthesia with a low concentration of local anesthetic solution on hypotension in elective cesarean-section  with lateral position,Gaziantep Üniversitesi,Tıpta Uzmanlık,Anestezi ve Reanimasyon = Anesthesiology and Reanimation," onclick=tezDetay('hl8UhDlHdPKoXtGmCWq11w','j7DZee5ogK9r2LTAj9STkg')"
69978,MUSTAFA DEMİRCİ,1998,İmpotansın penil renkli doppler ultrasonografi ve kavernözografi ile değerlendirilmesi<br><span style='font-style: italic';>Evaluation of impotance penile color doppler ultrasonography and cavernosography,Gaziantep Üniversitesi,Tıpta Uzmanlık,Radyoloji ve Nükleer Tıp = Radiology and Nuclear Medicine," onclick=tezDetay('KXJFGSD2bDYTHDgAqM060Q','KXJFGSD2bDYTHDgAqM060Q')"
359198,MEHMET ALİ ELÇİ,2014,İdiyopatik parkinson hastalığı\'nda klinik ağırlık ile olfaktor bulbus hacim ilişkisi<br><span style='font-style: italic';>The relationship between clinical severity and olfactory bulb volume in idiopathic parkinson\'s disease,Gaziantep Üniversitesi,Tıpta Uzmanlık,Nöroloji = Neurology," onclick=tezDetay('mc0YOZEfI4sIyl_QHFPZRg','AkPPA5Tojf2p5l3cZTr8jg')"
195059,ALPER SEVİNÇ,2007,Gastrointestinal stromal tümörlerde siklooksijenaz-2 ekspresyonu<br><span style='font-style: italic';>Cyclooxygenase-2 expression in gastrointestinal stromal tumours,Gaziantep Üniversitesi,Tıpta Uzmanlık,Onkoloji = Oncology ; Patoloji = Pathology," onclick=tezDetay('s2GycuxxRA3kd5iIDoYFag','pi5qvfQgi9HrhaN8fS9xYg')"
602786,DİLA TUĞÇE KOPAN,2019,Epilepsi hastalığı olan çocuklarda oksidatif ve nitrosatif stres ile antioksidan kapasitenin değerlendirılmesi<br><span style='font-style: italic';>Evaluation of oxidative and nitrosative stress and antioxidant capacity in chi̇ldren with epilepsy,Gaziantep Üniversitesi,Tıpta Uzmanlık,Çocuk Sağlığı ve Hastalıkları = Child Health and Diseases," onclick=tezDetay('8L19q8ZGXd53GliehjheYg','SriDdWBkmlHIc7coR_Aa7g')"
289230,MURAT UĞUR,2012,Kranioservikal bileşke instabilitesi olan hastalarda rijit oksipitoservikal fiksasyon\'un etkinliğinin araştırılması<br><span style='font-style: italic';>Investigation of the effectiveness of rigid occipitocervical fixation in patients with craniocervical junction instability,Gaziantep Üniversitesi,Tıpta Uzmanlık,Nöroşirürji = Neurosurgery," onclick=tezDetay('bk1XUZDuZWypNxD4taA7uw','WpKr-ZV0wB2SYAlt4L6OZQ')"
619832,HACER KOCAOĞLAN,2020,Ankilozan spondilit hastalarında TNF- α geninde olası varyantların analizi ve klinik parametrelerle olan ilişkisi<br><span style='font-style: italic';>Analysis of potential variant in the TNF-α gene in ankylosing spondylitis patients and its relationship with clinical parameters,Gaziantep Üniversitesi,Tıpta Uzmanlık,Fiziksel Tıp ve Rehabilitasyon = Physical Medicine and Rehabilitation," onclick=tezDetay('Y4cgkXEWSjID4dDlZgO6WQ','idFxtEVuOPvgWMlkYqW8rQ')"
478200,TUĞBA ÖZTÜRK,2017,"Paratiroid adenomu tanılı hastalarda klinik, laboratuar ve görüntüleme bulgularının birbiriyle ilişkisi<br><span style='font-style: italic';>Relationships of clinical, laboratory and imaging findings in patients with parathyroid adenoma",Gaziantep Üniversitesi,Tıpta Uzmanlık,Endokrinoloji ve Metabolizma Hastalıkları = Endocrinology and Metabolic Diseases," onclick=tezDetay('c_x8ypvUSfeEC57iIU9VEA','dlREHfocomIJscsctLyJ8A')"
398996,MURAT ŞAN,2013,GÜTF Çocuk Yoğun Bakım Ünitesinde takip edilen ventilatöre bağlı hastaların endotrakel aspirasyonları sırasında meydana gelen serebral oksijenizasyon değişikliklerinin near ınfrared spektroskopi cihazı ile değerlendirilmesi<br><span style='font-style: italic';>The evaluation of cerebral oxygenation changes with near infrared spectroscopy during open endotracheal suctioning  on the patients who are conventionally mechanically ventilated in Gaziantep University pediatric intensive care Unit,Gaziantep Üniversitesi,Tıpta Uzmanlık,Çocuk Sağlığı ve Hastalıkları = Child Health and Diseases," onclick=tezDetay('utczIagHVhbN3wbCSFSJwg','JUMIpo_E1FEHYnHJD_Zq1g')"
319217,AYŞEGÜL ÇÖMEZ,2012,"Açık glob yaralanmalı olgularda epidemiyolojik ve klinik özellikler, tedavi sonuçları ile prognostik faktörlerin incelenmesi<br><span style='font-style: italic';>The analysis of the epidemiological and clinical features, treatment results, prognostic factors in the cases with open globe injuries",Gaziantep Üniversitesi,Tıpta Uzmanlık,Göz Hastalıkları = Eye Diseases," onclick=tezDetay('F-ZIUSPVpzRsKAeZ4YdMlw','JJzSyvXumMuEj6QjZDjzow')"
632466,ALİ DEMİR,2020,Acil tıp stajının intern doktorlara mesleki bilgi ve beceri açısından katkısının değerlendirilmesi<br><span style='font-style: italic';>Evaluation of the emergency department medical internship\'s contribution to intern doctors in occupati̇onal knowledge and skills,Gaziantep Üniversitesi,Tıpta Uzmanlık,İlk ve Acil Yardım = Emergency and First Aid," onclick=tezDetay('6qx_rtSOgu6FS8UpKKnx1g','O7w4mIuGHG4wqwOKXe1IWQ')"
503111,ESRA SAYDAM KARABIYIK,2018,Aile hekimlerinin geriatrik hastaya yaklaşımı<br><span style='font-style: italic';>Approach to geriatric patients of family pyhsicians,Gaziantep Üniversitesi,Tıpta Uzmanlık,Geriatri = Geriatrics," onclick=tezDetay('b_g7UMBF3ybGuS6DzbSmhA','XNtCxejRoIQWuCftgekdyA')"
69979,HANİFİ AYHAN ÖZKUR,1998,Normal gebelerin takibinde renkli doppler ultrasonografinin kullanımı ve yeri<br><span style='font-style: italic';>The Place and usage of color doppler ultrasonography in the fallow up of pregnant women,Gaziantep Üniversitesi,Tıpta Uzmanlık,Radyoloji ve Nükleer Tıp = Radiology and Nuclear Medicine," onclick=tezDetay('PqCPKaZiKfNFvxv-5pG0iQ','PqCPKaZiKfNFvxv-5pG0iQ')"
429191,ŞENER CİNDORUK,2016,Derin ven trombozu tanısında acil hekimi tarafından yapılan renkli doppler ultrasonografi ve infrared kamera ölçümlerinin karşılaştırılması<br><span style='font-style: italic';>Comparison of infrared camera measurement and color doppler ultrasonography performed by emergency physicians in diagnosis of deep venous thrombosis,Gaziantep Üniversitesi,Tıpta Uzmanlık,İlk ve Acil Yardım = Emergency and First Aid," onclick=tezDetay('_4l4RdbX3J3OCZTOtvRobA','TnnJ9y6XP11lv1oWWz7ZLQ')"
329194,HİDAYET KILIÇ,2013,"Gaziantep Üniversitesi Tıp Fakültesi hematoloji bilim dalında takip edilen güneydoğu anadolu bölgesindeki idyopatik trombositopenik purpuralı (ıtp) olguların retrospektif analizi; 10 yıllık deneyim<br><span style='font-style: italic';>Retrospective analysis of idiopathic thrombocytopenia purpura (itp) cases in southeastern anatolia, followed in hematology department of  Gaziantep Medical Faculty; 10 years\' experience",Gaziantep Üniversitesi,Tıpta Uzmanlık,Hematoloji = Hematology," onclick=tezDetay('1QtxsGmcn68TAi5fQ9-ivQ','e_gLV6PoQM0OOAAgHEDyrQ')"
230163,MELİH AKŞAMOĞLU,2009,Kohlear implant adaylarının implant öncesinde yapılmış olan bilgisayarlı tomografi ve manyetik rezonans görüntülemelerinin değerlendirilmesi<br><span style='font-style: italic';>Assessment of preoperative computed tomography and magnetic resonance imagings in cochlear implant candidates,Gaziantep Üniversitesi,Tıpta Uzmanlık,Radyoloji ve Nükleer Tıp = Radiology and Nuclear Medicine," onclick=tezDetay('Hd8emfngzTOuY53UJcQRWw','byKigJZj_uZ9HTg-IOygDQ')"
230162,TÜRKAN HARUNLAR,2009,Romatoid artritli hastalarda anti TNF ve DMARD tedavi sonuçlarının hastalık aktivite ve iyileşme kriterlerine göre karşılaştırılması<br><span style='font-style: italic';>Comparison of treatment results of rheumatoid arthritis with DMARDS and anti TNF drugs based on the disease activity and remission criteria,Gaziantep Üniversitesi,Tıpta Uzmanlık,Fiziksel Tıp ve Rehabilitasyon = Physical Medicine and Rehabilitation," onclick=tezDetay('y4YOJVKH5jt86kssmoprgg','OI8nVRsxWyaGjiLrMwbu2g')"
301259,SİNAN GENÇ,2012,Hipovolemik hastalarda yatakbaşı ultrasonografi ile vena kava inferior ve sağ ventrikül çapı ölçümlerinin tanı ve takip parametresi olarak kullanılması<br><span style='font-style: italic';>Measurements of inferior vena cava and right ventricular diameter with bedside ultrasonography as a diagnostic and follow-up parameter in hypovolemic patients,Gaziantep Üniversitesi,Tıpta Uzmanlık,İlk ve Acil Yardım = Emergency and First Aid," onclick=tezDetay('6f8KjzTEZUpFD-Sqljsucw','Ad9LENcfSTCjgqm7Df1gNQ')"
247866,İRFAN KOCA,2010,Karpal tünel sendromulu hastalarda masaj tedavisinin etkinliği<br><span style='font-style: italic';>Effectiveness of massage therapy on patients with carpal tunnel syndrome effectiveness of massage therapy on patients with carpal tunnel syndrome,Gaziantep Üniversitesi,Tıpta Uzmanlık,Fiziksel Tıp ve Rehabilitasyon = Physical Medicine and Rehabilitation," onclick=tezDetay('6omkUCsh6McTTuACUQKZJg','C5yv409_-J5vG502kQI_wg')"
406627,OSMAN HAKAN DEMİR,2015,İyi diferansiye tiroid kanserlerinde nötrofil lenfosit oranının ilişkisi<br><span style='font-style: italic';>Importance of neutrophi̇l / lymphcoyte ratio in well differentiated thyroid cancer,Gaziantep Üniversitesi,Tıpta Uzmanlık,Endokrinoloji ve Metabolizma Hastalıkları = Endocrinology and Metabolic Diseases," onclick=tezDetay('P-E5EWwktWs3DMyorKClJA','oGSfm_6ExolTZfdKLGUQog')"
664632,ÖZGE MUTLU KAYA,2021,"Acil servise başvuran covıd-19 hastalarının klinik, laboratuvar ve radyolojik analizi<br><span style='font-style: italic';>Covid-19 applies to emergency servicepatients clinical, laboratory andradiological analysis",Gaziantep Üniversitesi,Tıpta Uzmanlık,İlk ve Acil Yardım = Emergency and First Aid," onclick=tezDetay('r20O8vu50XbE1Gf0riEkyQ','IvgRqvZ0tVinfb1chy3_HQ')"
503958,ZEKERİYA TATAROĞLU,2018,İntihar girişiminde bulunmuş vakalarla SKA 2 (rs7208505) ve SAT1 (rs6526342) gen polimorfizmleri arasındaki ilişkinin araştırılması<br><span style='font-style: italic';>Examinationof the relationship between SKA 2 (rs7208505) and SAT1 (rs6526342) gen polymorphism in cases attempted suicide,Gaziantep Üniversitesi,Tıpta Uzmanlık,Adli Tıp = Forensic Medicine," onclick=tezDetay('aOGA7TEmfxDroQMjS6wYNQ','GisF8wyj_bg-VzRursRZ3w')"
712907,MEHMET KILIÇ,2022,Suça sürüklenen çocuklarda suça eğilim ile triptofan hidroksilaz 2 ve SLC6A4 genleri arasındaki ilişkinin araştırılması<br><span style='font-style: italic';>Investigation of the relationship between triptophan hydroxylase 2 and SLC6A4 genes and juveni̇le deli̇nquents,Gaziantep Üniversitesi,Tıpta Uzmanlık,Adli Tıp = Forensic Medicine," onclick=tezDetay('XC593fbsxS-35FmNB05iYA','u0bhg_KDjFjs-57hAhvhNw')"
547060,MEHMET GÜNGÖR,2019,Koroner arter hastalığı tanısı olup acil servise göğüs ağrısı şikayeti ile başvuran hastalara \'hastane anksiyete ve depresyon ölçeği\' uygulaması<br><span style='font-style: italic';>Application of \'hospital anxiety and depression scale\' in patients with coronary artery diseases who presented to the  emergency department,Gaziantep Üniversitesi,Tıpta Uzmanlık,Kardiyoloji = Cardiology ; İlk ve Acil Yardım = Emergency and First Aid," onclick=tezDetay('L7J0lI3cQX99pIetEnWAvg','I7EuCbC8VZ0GcohmWg9_6g')"
260633,ABDURAHMAN KUZHAN,2010,Ağrılı kemik metastazlarının palyatif tedavisinde PET Florodeoksiglukoz tutulumu ile ağrının radyoterapiye cevabı arasındaki ilişki<br><span style='font-style: italic';>Association between Positron Emission Tomography (18F) Fluorodeoxyglucose Uptake and Pain Response to Palliative Radiotherapy in Patients with Bone Metastasis.,Gaziantep Üniversitesi,Tıpta Uzmanlık,Onkoloji = Oncology ; Radyoloji ve Nükleer Tıp = Radiology and Nuclear Medicine," onclick=tezDetay('nqqMBUNpU2jLFcs-wvk3aA','MNawqDMlaEjsqsEpq64s0A')"
319308,İBRAHİM HALİL ÖZCAN,2012,Spinal anestezi uygulanan hastalarda gelişen postspinal baş ağrısı insidansı ve predispozan faktörlerin araştırılması<br><span style='font-style: italic';>Spinal anesthesia in patients undergoing developing postspinal headache incidence and predisposing factors,Gaziantep Üniversitesi,Tıpta Uzmanlık,Anestezi ve Reanimasyon = Anesthesiology and Reanimation," onclick=tezDetay('xh4NWdCeprSjiY7rQ-kuJw','u7njjx6J_bsD0xFVm5Pt2w')"
225046,SEFA YAPICI,2008,Deneysel kimyasal özofagus yanık modelinde dekspantenol ve bir RHO-kinaz enzim inhibitörü olan Y-27632 ile tedavinin yara iyileşmesi üzerindeki etkileri<br><span style='font-style: italic';>The role of dexpanthenol and a RHO-kinase inhibitor Y-27632 treatment in wound healing in an experimental chemical esophageal burn model,Gaziantep Üniversitesi,Tıpta Uzmanlık,Çocuk Cerrahisi = Pediatric Surgery," onclick=tezDetay('o55qKx_cEMRtb7L2ENAURA','SQLpnMUa5zd6xcZvcA-QfQ')"
225054,ALPER KARAGÖZ,2008,Cinnamon (Tarçın)\'un kolesterol profili ve endotel fonksiyonları üzerine etkisi<br><span style='font-style: italic';>The effect of cinnamon against cholesterol profile and endothelial functions,Gaziantep Üniversitesi,Tıpta Uzmanlık,Biyokimya = Biochemistry ; Kardiyoloji = Cardiology," onclick=tezDetay('7pvBdM-H7NR3_pOQtoADdA','8pD3z8OtQo04Q7RXGNi1Pg')"
377073,FUAT BAŞANALAN,2015,Vasovagal senkoplu hastalarda sol atriyal mekanik fonksiyonların elektrokardiyografik ve ekokardiyografik olarak değerlendirilmesi<br><span style='font-style: italic';>Electrocardiographic and echocardiographic evaluation of left atrial mechanical functions in vasovagal syncope patients,Gaziantep Üniversitesi,Tıpta Uzmanlık,Kardiyoloji = Cardiology," onclick=tezDetay('3mzIdLIgdRtD4WJ_-FX_kw','A60xplqZLU8vbOACWgl3ag')"
224304,EMİNE AL,2008,"Brakiyal pleksus bloğu (Aksiller kateter ile) uygulanan operasyonlarda bupivakain ile levobupivakainin etkilerinin preoperatif, peroperatif ve postoperatif analjezik açıdan karşılaştırılması<br><span style='font-style: italic';>Comparison of bupivacaine and levobupivacaine efficacy at the operations which the brachial plexus block applicated (with axillary catheter) for preoperative, peroperative, postoperative analgesia",Gaziantep Üniversitesi,Tıpta Uzmanlık,Anestezi ve Reanimasyon = Anesthesiology and Reanimation," onclick=tezDetay('FoFwKP5O0mUcLh4UvV1d4Q','wz3FANsJ1bojYpu96nn00w')"
282036,EVRİM ÖĞÜT,2011,Fibromiyalji sendromlu hastalarda sitokinlerin monosit ekspresyon düzeyleri<br><span style='font-style: italic';>Monocyte expression levels of cytokines in patients with fibromyalgia syndrome,Gaziantep Üniversitesi,Tıpta Uzmanlık,Fiziksel Tıp ve Rehabilitasyon = Physical Medicine and Rehabilitation," onclick=tezDetay('ws4GvwasR9cHvHrI8xXQJA','SZaq97g_kpysL1oN_Vrnkw')"
365073,İLKER ÜNLÜ,2014,Lateral ventrikül kitlelerine cerrahi yaklaşım ve sonuçları<br><span style='font-style: italic';>Surgi̇cal approach to the lateral ventri̇cle masses and results,Gaziantep Üniversitesi,Tıpta Uzmanlık,Nöroşirürji = Neurosurgery," onclick=tezDetay('eK9SHVpFe7FomzP64t2UVw','MZVTa-MhdpiaNUBO2137tQ')"
236588,EMRE KUŞ,2009,Ekokardiyografi rehberliğinde yapılan perikardiyosentez: Vaka deneyimlerimiz<br><span style='font-style: italic';>Echocardiography-Guided pericardiocentesis: Case experiences,Gaziantep Üniversitesi,Tıpta Uzmanlık,Kardiyoloji = Cardiology," onclick=tezDetay('qRLYU95Y1c_0KrTxvRqgvw','sWhWVkKFVZNtU65DsF6lQg')"
196190,YASEMİN KİBAR,2008,Larinks karsinomlarında D2-40 immünoreaktivitesinin klinikopatolojik parametrelerle karşılaştırılması<br><span style='font-style: italic';>The comparision of D2-40 immünoreactivity with clinicopathologic parameters in laryngeal carcinoma,Gaziantep Üniversitesi,Tıpta Uzmanlık,Patoloji = Pathology," onclick=tezDetay('wpX8kNExNptdh8naJN6G1A','MKBrPztS-W4kYfuE-KCrTg')"
224912,NURDAN ÖZLÜ CEYLAN,2008,İkiuçlu bozukluk olan hastalarda serum nitrik oksit düzeyi ve arginaz aktivitesi<br><span style='font-style: italic';>Serum nitric oxcide levels and arginase activities in patients with bipolar affective disorder,Gaziantep Üniversitesi,Tıpta Uzmanlık,Biyokimya = Biochemistry ; Psikiyatri = Psychiatry," onclick=tezDetay('az4uhTiChuj6-y0omEUhyA','DqI7Zk4V1MgWnCAT_hnv0Q')"
550057,ABDULLAH SALMAN,2019,Acil servislerde meydana gelen tekrarlayan başvuruların araştırılması<br><span style='font-style: italic';>Investigation of recurrent applications to emergency departments,Gaziantep Üniversitesi,Tıpta Uzmanlık,İlk ve Acil Yardım = Emergency and First Aid," onclick=tezDetay('Gz5PkV3C1Cmz99dQ004WEg','vdO93jJwKaMwEquO9UrL8g')"
195720,İSMAİL TOĞUN,2008,Acil serviste hasta memnuniyeti<br><span style='font-style: italic';>Patient satisfaction in emergency medicine,Gaziantep Üniversitesi,Tıpta Uzmanlık,İlk ve Acil Yardım = Emergency and First Aid," onclick=tezDetay('hwqRwcbAb02MqvoMZ8TzIg','Vah2CpZclkIcihB4wftbDA')"
520697,OSMAN KOPAN,2018,"Hodgkin lenfoma ve diffüz büyük b hücreli lenfoma tanılı hastalarda, tanı anındaki nötrofil/lenfosit oranının klinik parametreler, prognoz ve sağ kalımla ilişkisinin değerlendirilmesi<br><span style='font-style: italic';>Evaluation of the relationship between the neutrophil/lymphocyte ratio with clinical parameters, prognosis and survival of hodgkin lymphoma and diffuse large b cell lymphoma",Gaziantep Üniversitesi,Tıpta Uzmanlık,Hematoloji = Hematology," onclick=tezDetay('xuCZXd-3ufwPGIVu4fVeLQ','TjW9mL-BL5I-CPEVw1apRw')"
359199,EMİNE CENGİZ,2014,Multipl skleroz hastalarında optik koherens tomografi (OKT) ve görsel uyarılmış potansiyeller (GUP) bulguları<br><span style='font-style: italic';>Optıcal coherence tomography (OCT) and vısual evoked potentıals (VEP) fındıngs on multıple sclerosıs patıents,Gaziantep Üniversitesi,Tıpta Uzmanlık,Nöroloji = Neurology," onclick=tezDetay('NMjs5S82GY9qTjF6PsM3cw','-xoNbYJkmZeNSqlkJt7Qzw')"
478161,AHMET MERT,2017,Kliniğimizde takip ve tedavi edilen asetabulum kırıklı hastaların klinik ve radyolojik sonuçları<br><span style='font-style: italic';>Clinical and radiological outcomes of followed and treated acetabular fractures in our cli̇ni̇c,Gaziantep Üniversitesi,Tıpta Uzmanlık,Ortopedi ve Travmatoloji = Orthopedics and Traumatology," onclick=tezDetay('bKLIhxgwAYX9kP1-YAmG4A','leDZ5WJs5UeTpoDFCg30wA')"
294178,YASEMİN BALKAN,2012,Kronik hepatit b enfeksiyonu olan hastalarda serum kantitatif HBsAg düzeyi ile karaciğer histopatolojisi ve viral yük arasındaki ilişkinin araştırılması<br><span style='font-style: italic';>Examination of relationship between serum quantitative HBsAg level and hepatic histopathology and viral load in patients with chronic hepatitis b infection,Gaziantep Üniversitesi,Tıpta Uzmanlık,Klinik Bakteriyoloji ve Enfeksiyon Hastalıkları = Clinical Microbiology and Infectious Diseases," onclick=tezDetay('UGrP7m9_fNqSwPksAxtGsg','nSoy9YHeEB3VDly6BT0TdA')"
490007,MAZLUM SERDAR AKALTUN,2018,Ankilozan spondilit hastalarında cd74 düzeyi ve mif gen polimorfizminin klinik özellikler ile ilişkisinin araştırılması<br><span style='font-style: italic';>Investigation of relationship between serum cd74 levels and mif gene polymorphism with clinical features in patients with ankylosing spondylitis,Gaziantep Üniversitesi,Tıpta Uzmanlık,Fiziksel Tıp ve Rehabilitasyon = Physical Medicine and Rehabilitation ; Romatoloji = Rheumatology," onclick=tezDetay('PChxAN0GwHMdFvYFTdpCaA','vT-EXFFzihClTW-R0iC9Rg')"
629480,BAYRAM BURULDAY,2020,Hirschsprung hastalığı tanısıyla transanal endorektal pull through ameliyatı yapılan olguların uzun dönem sonuçlarının değerlendirilmesi<br><span style='font-style: italic';>Evaluation of long term results of patients who underwent transanal endorectal pull through surgery for hirschsprung disease,Gaziantep Üniversitesi,Tıpta Uzmanlık,Çocuk Cerrahisi = Pediatric Surgery," onclick=tezDetay('ToR1TkD2-orpUgLmslH_oA','P6sA1iXxnx4RRuZXJTzS2w')"
