tez_no,yazar,yıl,title,üniversite,tez_türü,konu,tez_detay
675206,İRFAN AÇIKGÖZ,2021,Humerus cismi kaynamama tedavisinde çözüm çift plak ile yapılan tespit midir? Karşılaştırmalı sonuçlar<br><span style='font-style: italic';>Is double plate fixation A remedy for thetreatment of humeral shaft nonunions? Comparative presentations,Gaziantep Üniversitesi,Tıpta Uzmanlık,Ortopedi ve Travmatoloji = Orthopedics and Traumatology," onclick=tezDetay('I9SAVTDJPivOEiuK41ajMw','J1iAjnmR3BgqYE0teVUw3g')"
515076,ESRA ÇELİK,2018,İntrauterin gelişme geriliği ile komplike olmuş gebeliklerde maternal serumda oksidatif stres ve Ürotensin 2 seviyeleri<br><span style='font-style: italic';>Oksidative Stress and Urotensine 2 Levels in maternal serum in pregnancies complicated by  Intrauterine Growth Restriction,Gaziantep Üniversitesi,Tıpta Uzmanlık,Biyokimya = Biochemistry," onclick=tezDetay('XOtafQPMwDTnxMN6bAzG4g','45ovolAD1iz1Rrj2_UvDAQ')"
225055,MUSTAFA ÇELİK,2008,Prelingual koklear implant olgularında preoperatif odyolojik ve radyolojik bulguların postoperatif işitme sonuçlarıyla karşılaştırılması<br><span style='font-style: italic';>Comparing preoperative audiological and radiological findings with postoperative auditory outcomes prelingually in cochlear implant cases,Gaziantep Üniversitesi,Tıpta Uzmanlık,Kulak Burun ve Boğaz = Otorhinolaryngology (Ear-Nose-Throat)," onclick=tezDetay('EbqOmj_nO4Asx6vE-RtIIw','Z1OiYnlsnsVLVZQiERur0g')"
478172,MUSTAFA SABAK,2017,Kardiyopulmoner arrest hastalarında spontan dolaşımın geri dönmesi üzerine epinefrin uygulamasının etkisi<br><span style='font-style: italic';>Effect of epinephrine administration on return of spontaneous circulation in cardiopulmonary arrest patients randomized prospective clinical trial,Gaziantep Üniversitesi,Tıpta Uzmanlık,İlk ve Acil Yardım = Emergency and First Aid," onclick=tezDetay('kR4R7HetxWAFwUQWFZ8qow','B2Vb8n2RgLKOjm5Ba_KhIg')"
489998,ERDOĞAN KOCA,2017,Preeklamptik gebelerde sfms like tirozin kinaz -1 ve biyokimyasal parametre düzeylerinin plazmaferez öncesi ve sonrası prognoza etkisinin değerlendirilmesi<br><span style='font-style: italic';>Evaluation of prognostic effect of sfms like tyrosine kinase-1 and biochemical parameters before and after plasmapheresis in preeclamptic pregnancies,Gaziantep Üniversitesi,Tıpta Uzmanlık,Kadın Hastalıkları ve Doğum = Obstetrics and Gynecology," onclick=tezDetay('xK2qZwxV-crwXG46PUysQA','IEeNB4hTdoaqRq9bjEsdHA')"
661689,İRFAN MEHMET,2021,Jinekolojik onkolojik cerrahinin anestezi yönetiminde genel anestezi ile genel anesteziye  ilave edilen  epidural anestezinin etkilerinin karşılaştırılması: Retrospektif kontrollü çalışma<br><span style='font-style: italic';>Comparison of the effects of general anesthesia and epidural anesthesia added to general anesthesia in the anesthetic management of gynecological oncological surgery,Gaziantep Üniversitesi,Tıpta Uzmanlık,Anestezi ve Reanimasyon = Anesthesiology and Reanimation," onclick=tezDetay('2oq_ello3mSFaN7BwQB8rg','4BF5R1HCoY3e0KCUX8lJ1Q')"
406639,PELİN ÇELEMLER,2015,Behçet hastalığına bağlı posterior üveit tedavisinde intravitreal deksametazon implantının etkinliği ve güvenilirliği<br><span style='font-style: italic';>Safety and efficacy of intravitreal dexamethasone implant for treatment behçet posterior uveitis,Gaziantep Üniversitesi,Tıpta Uzmanlık,Göz Hastalıkları = Eye Diseases," onclick=tezDetay('DBHB6vxYBB8zDFzY1ilnKw','E0I-bXqcTqgNuNiSNp-6OQ')"
498070,NURCAN ÖZDEMİR,2017,Tipik gögüs ağrısı ile acil servise başvuran hastalardapatolojik elektrokardiyogram bulguları<br><span style='font-style: italic';>Pathological electrocardiographic findings of patient with typical chest pai̇n that appli̇es to emergency service,Gaziantep Üniversitesi,Tıpta Uzmanlık,İlk ve Acil Yardım = Emergency and First Aid," onclick=tezDetay('HfL_suraCj1KAIpU8fBz0Q','krU1K8SfIMph1cMXKSnFsw')"
230175,AKIN SARIMEHMETOĞLU,2008,Göğüs cerrahisinde ameliyat öncesi ve sonrası hormon düzeylerinin morbidite ve mortalite üzerindeki etkisi<br><span style='font-style: italic';>The effect of hormone levels on pre and postoperative morbidity and mortality in thoracic surgery,Gaziantep Üniversitesi,Tıpta Uzmanlık,Göğüs Kalp ve Damar Cerrahisi = Thoracic and Cardiovascular Surgery," onclick=tezDetay('8dx5Hs1qMOb8w6M-ByYWqQ','amfc-ld0ARBCIYv3bHXoag')"
274569,HACI HALİL ŞAŞMAZ,2011,Gelişimsel kalça displazisi tanısında sonografik tarama tekniklerinin karşılaştırılması<br><span style='font-style: italic';>Comparison of ultrasonographic methods in the evaluation of developmental dysplasia of the hip,Gaziantep Üniversitesi,Tıpta Uzmanlık,Radyoloji ve Nükleer Tıp = Radiology and Nuclear Medicine," onclick=tezDetay('NUnpoWWhUWrPlWo9ICYosA','paGQWtON34vTCJnFTlDHDA')"
644284,MELDA MELİK KURT,2020,Alerjen spesifik immunoterapi alan hastaların klinik ve laboratuvar olarak değerlendirilmesi<br><span style='font-style: italic';>Evaluation of patients with allergen specific immunotherapy as clinical and laboratory,Gaziantep Üniversitesi,Tıpta Uzmanlık,Çocuk Sağlığı ve Hastalıkları = Child Health and Diseases," onclick=tezDetay('49IMW-rADZYbjwK9VXPMow','pm1mYAK67OkSbzeGspfwAA')"
509068,YUSUF TÜYLÜ,2016,TRP kanalı gen ekspresyonları ve pterjiumla ilişkisinin araştırılması<br><span style='font-style: italic';>Investıgatıon of the relatıonshıp between TRP channel gene expressıons and pterygıum,Gaziantep Üniversitesi,Tıpta Uzmanlık,Göz Hastalıkları = Eye Diseases," onclick=tezDetay('ZBoDM4UL7Du9maQc0xboFA','GMAUXQmgxWaFH4SVSNGwEQ')"
306212,NURİYE KAYIRAN,2012,Plak tip psöriazis hastalarında obezite ve sigara kullanımının hastalık şiddeti üzerine etkisi<br><span style='font-style: italic';>Impact of obesity and smoking on disease severity in patients with plaque type psoriasis,Gaziantep Üniversitesi,Tıpta Uzmanlık,Dermatoloji = Dermatology," onclick=tezDetay('Hrm0CWRoVADJdrnTFZXAGQ','iRZclIITCVvNeyynlrItQQ')"
289138,MEHRİ TÜRKOĞLU CENGİZ,2011,Bupivakain ve levobupivakainin izole insan umbilikal arterinde ve veninde vazokonstriktör etki mekanizmasının araştırılması<br><span style='font-style: italic';>Investigation of the vasoconstrictor influence mechanism of bupivacaine and levobupivacaine on the isolated human umbilical artery and vein,Gaziantep Üniversitesi,Tıpta Uzmanlık,Anestezi ve Reanimasyon = Anesthesiology and Reanimation," onclick=tezDetay('c4sQXN7Qlfkd1POALHN0IQ','iKg1pgMimfAe-vtBQh_5wQ')"
247914,HÜSEYİN AĞTAŞ,2010,Elektif abdominal cerrahi girişim uygulanan olgularda abdomendeki yapışıklıkların önlenmesinde %4 icodextrin ile hyaluronic asitin etkinlik ve maliyet yönünden karşılaştırılması (Deneysel çalışma)<br><span style='font-style: italic';>The comparison of icodextrin %4 and hyaluronic acid by efficacy and cost-effectivity preventing postoperative abdominal adhesions in the elective abdominal surgery cases,Gaziantep Üniversitesi,Tıpta Uzmanlık,Genel Cerrahi = General Surgery," onclick=tezDetay('72BhExAg0birCwvMJWxelQ','uA5Zcbp3OdYnbNzrZg7DMQ')"
632142,EMRAH TERZİOĞLU,2020,Arkus aorta dallanma paterni varyasyonlarının ve vertebral arter dominansi-hipoplazi sıklığının çok kesitli bilgisayarlı tomografi ile değerlendirilmesi<br><span style='font-style: italic';>Multidedector computerized tomography evaluation of arcus aorta branchi̇ng pattern variations and vertebral artery dominance-hypoplasia frequency,Gaziantep Üniversitesi,Tıpta Uzmanlık,Radyoloji ve Nükleer Tıp = Radiology and Nuclear Medicine," onclick=tezDetay('3MxSyoxiab_TcCl9vVEhFw','X26OLYAIbI9CaCULSRoE4Q')"
194707,ŞÜKRÜ GÜÇBEY,2007,Postmenapozal osteoporozlu hastalarda serumda total oksidatif ve antioksidatif kapasite ölçümü<br><span style='font-style: italic';>Measurement of serum total oxidative and antioksidative status in patiend with postmenopausal osteoporosis,Gaziantep Üniversitesi,Tıpta Uzmanlık,Biyokimya = Biochemistry ; Fiziksel Tıp ve Rehabilitasyon = Physical Medicine and Rehabilitation," onclick=tezDetay('qfVOA8qwpiaactABwjmSLw','DWRoangRxC6Q-jbsZVsRpg')"
340633,TURGAY ABAY,2013,Karotis ve vertebrobaziler sistemde  arter darlığı veya plak tespit edilmiş olan hastalarda oksidan-antioksidan durumlarının araştırılması<br><span style='font-style: italic';>Oxıdant-antıoxıdant status ın patıents that have carotıs and vertebrobasıller artery stenosıs or plaque ın doppler USG,Gaziantep Üniversitesi,Tıpta Uzmanlık,Sağlık Eğitimi = Health Education," onclick=tezDetay('1jgXzJrNasa46-hrY0O4JA','xVhkOwy6D3IWa9jv_dKhiA')"
426548,MEHMET TÜRKER,2015,Castleman hastalarında BRAF gen mutasyon sıklığının saptanması<br><span style='font-style: italic';>BRAF gene mutations in Castleman disease,Gaziantep Üniversitesi,Tıpta Uzmanlık,Hematoloji = Hematology," onclick=tezDetay('za-TdzeOS1AU5PH2nCi3oQ','X9VLxlbO-Wlvzd8KyP4MmQ')"
478159,SERCAN ÇIKRIKCI,2017,Genişletilmiş parsiyel larenjektomili hastalarda postoperatif bulgular ve yaşam kalitesi üzerine etkisi<br><span style='font-style: italic';>Extended partial larenjectomy diseases\' postoperative results and effects on quality of life,Gaziantep Üniversitesi,Tıpta Uzmanlık,Kulak Burun ve Boğaz = Otorhinolaryngology (Ear-Nose-Throat)," onclick=tezDetay('aXHyvHKGBitNHp0Pmk78-Q','0hGLU6cMRmqRq5TffXAyrQ')"
301186,ÖNDER ÖZEN,2011,Laparoskopik kolesistektomilerde düşük ve yüksek akımlı anestezinin postoperatif bulantı-kusma ve titreme üzerine olan etkilerinin karşılaştırılması<br><span style='font-style: italic';>Comparison of the effects of the low and high flow anesthesia on nausea-vomiting and shivering in laparoscopic cholecystectomy,Gaziantep Üniversitesi,Tıpta Uzmanlık,Anestezi ve Reanimasyon = Anesthesiology and Reanimation," onclick=tezDetay('23vZXK3jMLyNEc_uz9UPbw','cKNDaQNClJc-380IR279Vg')"
224906,HATİCE SEZEN,2008,Behçet hastalarında serum visfatin düzeyleri<br><span style='font-style: italic';>Serum levels of visfatin of the Behçet\'s patients,Gaziantep Üniversitesi,Tıpta Uzmanlık,Biyokimya = Biochemistry ; Dermatoloji = Dermatology ; Romatoloji = Rheumatology," onclick=tezDetay('kcbvPq0CP5arG8ADRpdZIA','F_TVHTQUtT89tioniMabZQ')"
426520,DİDEM YILMAZ,2015,"Çocuklarda ventilasyon-entübasyon zorluk derecesini belirlemede, Mallampati ve Cormeck-Lehane, diş yapısı ve antropometrik ölçümlerin değerlendirilmesi<br><span style='font-style: italic';>Evaluation of Mallampati and Cormeck-Lehane, tooth morphology and anthropometric measurements, to determine ventilation-entubation difficulty in children",Gaziantep Üniversitesi,Tıpta Uzmanlık,Anestezi ve Reanimasyon = Anesthesiology and Reanimation," onclick=tezDetay('tx0U-kgRR75XSplPsLHNbw','WamyhV_pHCBNCXnY8rRIKQ')"
359179,GÜL ÖZDEMİR,2014,Hematopoietik kök hücre transplantasyonu yapılan erişkin hastalarda erken dönemde saptanan sitokin düzeyleri ile hastalığın klinik seyri arasındaki ilişkinin araştırılması<br><span style='font-style: italic';>Investigation of relationship between early cytokine levels and clinical course of disease in adult patients after hematopoietic stem cell transplantation,Gaziantep Üniversitesi,Tıpta Uzmanlık,Mikrobiyoloji = Microbiology," onclick=tezDetay('vwBXxzgndsxBWChqJLWl9w','mUEtO863c2Xh-3q9wBWhLw')"
632140,ÇAĞRI BURCU AÇIKGÖZ,2020,"Geleneksel ve tamamlayıcı tıp polikliniğine kupa tedavisi için başvuran hastalarda, tedavinin kronik ağrı ve yaşam kalitesi üzerine olan etkisinin, fiziksel tıp ve rehabilitasyon polikliniğine benzer şikayetlerle başvuran hastalarla karşılaştırılması<br><span style='font-style: italic';>Comparison of cupping therapy and physical rehabilitation on the treatment of chronic pain and quality of life",Gaziantep Üniversitesi,Tıpta Uzmanlık,Halk Sağlığı = Public Health," onclick=tezDetay('eUdVP0cWWJAZPjKpr5myEw','QExOyzHOTO8QxUO8IkiExg')"
523343,DOĞAN ÖNCÜ,2018,Çocukluk çağı dirençli epilepsilerinde risk faktörlerinin belirlenmesi<br><span style='font-style: italic';>Determination of the risk factors in children\'s drug resistant epilepsy,Gaziantep Üniversitesi,Tıpta Uzmanlık,Çocuk Sağlığı ve Hastalıkları = Child Health and Diseases," onclick=tezDetay('am3HgkLBbeTBMOho7C8zBQ','MriUicV_Rc3RWXgONbiMhw')"
377081,FATMA İŞIKER,2015,Atriyal septal defekt tanısında triküspit ve pulmoner akım hızlarındaki artışın öneminin değerlendirilmesi<br><span style='font-style: italic';>Evaluation of the importance of increase in tricuspid and pulmonary flow velocities in diagnosis of atrial septal defect,Gaziantep Üniversitesi,Tıpta Uzmanlık,Çocuk Sağlığı ve Hastalıkları = Child Health and Diseases," onclick=tezDetay('9ffsOXi42aa_Y6e2PjFUQA','LMPF39JqgQHo6oo9WemxaQ')"
478179,ZEHRA ALTUNBAŞ,2017,Yoğun bakım ünitelerinde yatan hastalarda rektal sürüntü ile karbapenemaz üreten enterobacteriaceae (CPE) kolonizasyonunun ve kolonizasyonu etkileyen risk faktörlerinin belirlenmesi<br><span style='font-style: italic';>Determination of carbapenemase-producing enterobacteriaceae colonization by rectal swabs and causative  risk factors  in patient hospitalized in intensive care units,Gaziantep Üniversitesi,Tıpta Uzmanlık,Klinik Bakteriyoloji ve Enfeksiyon Hastalıkları = Clinical Microbiology and Infectious Diseases," onclick=tezDetay('rpv15VNXJgh7ett_CwVBNA','kXa3JdBtVjaqRUAbUoDwPg')"
671000,BURAK ERBAĞCI,2021,Ağır COVİD-19 pnömonisi tanısı alan hastalarda sitokin adsorbsiyon kolonu uygulamasının klinik ve biyokimyasal parametreler üzerine etkisi<br><span style='font-style: italic';>Effect of adsorption column application on clinical and biochemical parameters in patients diagnosed with severe COVID-19 pneumonia,Gaziantep Üniversitesi,Tıpta Uzmanlık,İç Hastalıkları = Internal diseases," onclick=tezDetay('pKAmADcYVghQqs0hqjBLPw','JEgbVW1jArLAPiIx_w19nw')"
508806,HAKAN YÜCEL,2018,Hashimoto tiroiditli hastalarda serum fetuin-a ve osteoprotegerin düzeyi ile ateroskleroz arasındaki ilişki<br><span style='font-style: italic';>The relationship between serum fetuin-a and osteoprotegerine levels and atherosclerosis in patient with hashimoto thyroiditis,Gaziantep Üniversitesi,Tıpta Uzmanlık,Endokrinoloji ve Metabolizma Hastalıkları = Endocrinology and Metabolic Diseases," onclick=tezDetay('xxTvhsEID9xda59sgGFMTg','dXwCZ4kzEe92xbLeWVi6xA')"
643122,ELİF SİNANOĞLU DOĞAN,2020,2012-2019 yılları arasında ülkemizde acil servis çalışanları hakkında ve acil servis çalışanları tarafından açılmış ve yargıtay tarafından karara bağlanmış davalar ve sonuçlarının incelenmesi<br><span style='font-style: italic';>Examination of the results of the lawsuits filed against and filed by the emergency department workers in our country between the years of 2012-2019,Gaziantep Üniversitesi,Tıpta Uzmanlık,Adli Tıp = Forensic Medicine ; İlk ve Acil Yardım = Emergency and First Aid," onclick=tezDetay('QFz47WOYVVFryZR9cLnnlw','fXzbObZwAZNkXFgCFEyx-Q')"
632364,KORAY TOKLU,2020,Kolorektal kanserlerde kodlanmayan LNC-RNA crnde\'nin gen ifade düzeylerinin analizi<br><span style='font-style: italic';>Analysis LNC-RNA crnde gene expression levels in colorectal cancer,Gaziantep Üniversitesi,Tıpta Uzmanlık,Genel Cerrahi = General Surgery ; Genetik = Genetics," onclick=tezDetay('ItjzeJbOxlmPHIaHfVZ6Gw','g9gq_9Y8pnavWD6wlUXCHQ')"
236602,ÖZLEM AYBASTI,2009,Tek uçlu depresyon tanısıyla Elektrokonvulzif Terapi almış hastalarda Oksidatif Metabolizma<br><span style='font-style: italic';>oxidative metabolism in Unipolar depressive patients treated with Electroconvulsive Therapy,Gaziantep Üniversitesi,Tıpta Uzmanlık,Psikiyatri = Psychiatry," onclick=tezDetay('ztvPnOxg8oBs6s_YXciLQA','bKMYg2-HY9LTPxC1pyBpQA')"
478198,ELİF MELİS BALOĞLU AKYOL,2017,"Kemik iliği nakli yapılan hastalarda sitomegalovirus (CMV) enfeksiyonu, reaktivasyonu ve tedavi protokolleri ile ilişkisi<br><span style='font-style: italic';>Relationship between cytomegalovirus (CMV) infection, reactivation and treatment protocols in bone marrow transplant patients",Gaziantep Üniversitesi,Tıpta Uzmanlık,Hematoloji = Hematology," onclick=tezDetay('1RqphE61VmirpjUoQIPA_w','RsR1Rm3sR-0vMNwSplH26A')"
665262,GÖKÇE YETKİN ÖZKEÇECİ,2021,Kutanöz leishmaniasis lezyonlarında dermoskopik bulgular<br><span style='font-style: italic';>Dermoscopic findings of cutaneous leishmaniasis,Gaziantep Üniversitesi,Tıpta Uzmanlık,Dermatoloji = Dermatology," onclick=tezDetay('x2UHZNL4Qmxn2HxzuJIe5A','9H4JNvddDxV9JV0k3wXZTA')"
224909,YURDANUR GÜRÇAY AÇILMIŞ,2008,"Maternal ve fetal serum homosistein, folik asit, vitamin B12 ve plasental doku homosistein düzeylerinin preeklampsi şiddeti ile ilişkisi<br><span style='font-style: italic';>Relationship between homocysteine, folic acid, vitamin B12 levels in maternal and fetal serum and homocysteine levels in placental tissue and severity of preeclampsia",Gaziantep Üniversitesi,Tıpta Uzmanlık,Kadın Hastalıkları ve Doğum = Obstetrics and Gynecology," onclick=tezDetay('Ebpy8_QNDvAyOQ5Hl9FkWg','3FB4H0SOOtM45RnXtU8ucA')"
490000,MEHMET DEMİR,2017,Çok dedektörlü bilgisayarlı tomografi ile pulmoner ven varyasyonlarının değerlendirilmesi<br><span style='font-style: italic';>Evaluation of pulmonary vein variations with multidetector computed tomography,Gaziantep Üniversitesi,Tıpta Uzmanlık,Radyoloji ve Nükleer Tıp = Radiology and Nuclear Medicine," onclick=tezDetay('zI5RGxbhXR_zA6E16b2QWg','zhM7WnAnEhHjhcvDVBhqFQ')"
362127,İBRAHİM EGE,2004,Gaziantep yöresindeki geleneksel kalaylama işçilerinde mesleki akciğer hastalıkları araştırması<br><span style='font-style: italic';>,Gaziantep Üniversitesi,Tıpta Uzmanlık,Göğüs Hastalıkları = Chest Diseases," onclick=tezDetay('3bcr1kEjOQJDgbg06sQpiw','zBN6un4aXwCA-X7m1LOP2g')"
648867,NESRİN TÜRK,2020,Trikotillomani tanılı çocuk ve ergenlerde klinik özellikler ve eşlik eden psikiyatrik bozukluklar<br><span style='font-style: italic';>Clinical characteristics and accompanying psychiatric disorders in children and adolescents with trichotillomania,Gaziantep Üniversitesi,Tıpta Uzmanlık,Psikiyatri = Psychiatry," onclick=tezDetay('q92ddxGMmEcnsW9MFO0M6g','lYiFST2Y2j6xgeIldUVZlQ')"
669310,AYŞE SEVDE SARP,2021,"Bipolar bozukluk ve major depresif bozukluk tanılı ebeveynlerin ve eşleştirilmiş sağlıklı kontrollerin çocuklarının emosyon regülasyonu, irritabilite düzeyleri ve genel psikopatoloji yaygınlığı açısından karşılaştırılması<br><span style='font-style: italic';>Comparison of the children of parents diagnosed with bipolar disorder and major depressive disorder and matched healthy controls in terms of emotion regulation, irritability levels and general psychopathology prevalence",Gaziantep Üniversitesi,Tıpta Uzmanlık,Psikiyatri = Psychiatry," onclick=tezDetay('XPOlJ_Zzem3uJ1BSQkuzkQ','IC6Lgqw2FzZDX3TrsRybrQ')"
655268,NURLANA AHMADZADA,2021,"Yoğun bakım ünitesinde yatan hastalarda paracetemol, metamizol ve soğuk uygulamanın ateş düşürme üzerine etkilerinin karşılaştırlması<br><span style='font-style: italic';>Comparison of the effects of paracetamol, metamizol and external cooling on the fever reduction in intensive care unit patients",Gaziantep Üniversitesi,Tıpta Uzmanlık,Anestezi ve Reanimasyon = Anesthesiology and Reanimation," onclick=tezDetay('Q1bjQW3gvPGwV76IqRmuuA','Jh7dF7TDL0ZxARSTkT8-yQ')"
665736,ÖZNUR BİLİR,2021,Uterin sarkom tanılı hastaların klinik ve patolojik özelliklerinin retrospektif değerlendirilmesi<br><span style='font-style: italic';>Retrospective evaluation of the clinical and pathological features of patients with uterin sarcoma,Gaziantep Üniversitesi,Tıpta Uzmanlık,Onkoloji = Oncology," onclick=tezDetay('kYUpj59_0Fm8MKeBDM_z6g','ptX5iYW3XY00POryuHcZFA')"
608302,HİKMET CİLLİ,2020,Büyüme gelişme geriliği veya anemi ile febril konvülziyon arasındaki ilişkinin değerlendirilmesi<br><span style='font-style: italic';>Evaluation of the relationship between failure to thrive or anemia and febrile convulsions,Gaziantep Üniversitesi,Tıpta Uzmanlık,Çocuk Sağlığı ve Hastalıkları = Child Health and Diseases," onclick=tezDetay('-VYYJAxrYvYAVjoMzpqmWw','YXi61_9d8C9FHnORmN09Ag')"
634252,YAKUP KADRİ KAPUDERE,2020,Canlı vericili karaciğer nakillerinde total kaval klempaj tekniğinin uzun dönemli sonuçları<br><span style='font-style: italic';>Long term results of total caval clamping time in living donor liver transplantations,Gaziantep Üniversitesi,Tıpta Uzmanlık,Genel Cerrahi = General Surgery," onclick=tezDetay('qe3hYBzRSlZ4uz6iBSYdzA','aVlbGVGZlhyJZOcTnlhGTA')"
554947,BARIŞ AĞAR,2019,Endometriom tanılı hastalarda soluble programmed DEATH-1 ve soluble programmed death ligand-1 serum seviyelerinin araştırılması<br><span style='font-style: italic';>Investigation of soluble programmed death-1(SPD-1) and soluble programmed death ligand-1 (SPD-L1)serum levels in patients with endometrioma,Gaziantep Üniversitesi,Tıpta Uzmanlık,Kadın Hastalıkları ve Doğum = Obstetrics and Gynecology," onclick=tezDetay('Qkdu3IuIsiCasAWFl2r8jQ','1icfZb6AKrVuziJqwFzGqw')"
478173,METE NAİL ÇİMEN,2017,Domuz gribi tanısı almış hastalarda nötrofil lenfosit oranının tanıya katkısı<br><span style='font-style: italic';>H1n1 diagnostic contribution of neutrophil lymphocyte in diagnosed patients,Gaziantep Üniversitesi,Tıpta Uzmanlık,İlk ve Acil Yardım = Emergency and First Aid," onclick=tezDetay('a5klpAVcuQ3aBBDig6C91Q','fEQxshYKtftB_7AwY4h7WQ')"
326281,ŞAHİN KARTAL,2013,Karbonmonoksit zehirlenmesi hastalarında oksidan/antioksidan ve oksidatif stres indeks seviyelerinin değerlendirilmesi<br><span style='font-style: italic';>Oxidant/antioxidant and oxidative stress index levels in patients with carbon monoxide poisoning,Gaziantep Üniversitesi,Tıpta Uzmanlık,İlk ve Acil Yardım = Emergency and First Aid," onclick=tezDetay('_8B9Z6CBciUEc4yNFuqLiQ','Zy5XU2gjoSpVut43L3stxw')"
340635,SEVGÜL KARA,2013,"Papiller renal hücreli karsinomlarda ve kromofob renal hücreli karsinomlarda gremlin 1 ve COL15A1 immunreaktivitesi ile gremlin1 ile mikrovasküler dansite arasındaki ilişkinin araştırılması<br><span style='font-style: italic';>Investigation of gremlin 1, COL15A1 immunoreactivity and the relationship between microvessel density and gremlin 1 in papillary renal cell carcinoma and chromophobe renal cell carcinoma",Gaziantep Üniversitesi,Tıpta Uzmanlık,Patoloji = Pathology," onclick=tezDetay('7ARiBNzyn5HP9nHIEuoiqA','q-81GCz0pkgYt-gByTrVvw')"
236559,SEDAT SIMSIK,2009,Çocuklarda over patolojileri<br><span style='font-style: italic';>Ovarian pathologies in childhood,Gaziantep Üniversitesi,Tıpta Uzmanlık,Çocuk Cerrahisi = Pediatric Surgery," onclick=tezDetay('jjXitBLa56mdvJY3MXEAqA','uHddNj-Uxuzc8JF9kMlwxA')"
674421,EDA KENT,2021,Atriyal septal defekti olan çocuk hastalarda baş ağrısı ve migren sıklığı<br><span style='font-style: italic';>Frequency of headache and migraine in child patients with atrial septal defect,Gaziantep Üniversitesi,Tıpta Uzmanlık,Çocuk Sağlığı ve Hastalıkları = Child Health and Diseases," onclick=tezDetay('kU6EvgMOrhkyWtDhA3UBIQ','4Hi0aOB8K9kz2S5rBih-1w')"
435712,MEHMET ERTEN,2016,Deneysel miyokard infarktüsü oluşturulmuş ratlarda visfatinin kardiyak belirteçlerle ilişkisi<br><span style='font-style: italic';>The relationship between visfatin and cardiac markers on induced myocardial infarction in rats,Gaziantep Üniversitesi,Tıpta Uzmanlık,Biyokimya = Biochemistry," onclick=tezDetay('yAznM7xzBCiIH9PRwrDslw','ymSP16sRMKomEaGnrRzNfw')"
426546,SEDA ÜNSAL,2015,Kronik HBV ve HCV hastalarının metabolik sendrom ile ilişkisi<br><span style='font-style: italic';>Association of patients with chronic HBV and HCV with metabolic syndrome,Gaziantep Üniversitesi,Tıpta Uzmanlık,Gastroenteroloji = Gastroenterology," onclick=tezDetay('q5d-4HmD8YxirgzuGheyUw','fgXlopGRPsZvEGyiQ3GD-g')"
308087,MUSTAFA ARAZ,2012,Tip 2 diyabetik popülasyonda metabolik sendrom prevalansı ve diyabetik nefropati ile ilişkisi<br><span style='font-style: italic';>The prevalence of metabolic syndrome in type 2 diabetic patients and its relation with diabetic nephropathy,Gaziantep Üniversitesi,Tıpta Uzmanlık,Endokrinoloji ve Metabolizma Hastalıkları = Endocrinology and Metabolic Diseases," onclick=tezDetay('yCRq_TkL6umnguVE7omw4g','i0PbwrDOOWjBcRnN8JvqDg')"
648829,FURKAN ÇETİN,2020,Ektopik gebeliklerde ardışık metotreksat tedavisinin başarı oranının belirlenmesi ve tedavinin over rezervine etkilerinin anti müllerian hormon seviyeleri ile değerlendirilmesi<br><span style='font-style: italic';>Determining the success rate of sequential methotrexate therapy in ectopic pregnancy and evaluating the effects of the treatment on ovarian reserve with anti mullerian hormone levels,Gaziantep Üniversitesi,Tıpta Uzmanlık,Kadın Hastalıkları ve Doğum = Obstetrics and Gynecology," onclick=tezDetay('ui4nH2pFqbD5YP28yfZKow','A4IhPMTjINCFiqTb0y-dGg')"
196189,ABDULLAH DEMİRHAN,2008,Toraks cerrahisinde postoperatif uygulanan intravenöz tramadolün ve tramadole deksmedetomidin ilavesinin analjezi ve solunum parametreleri üzerine etkileri<br><span style='font-style: italic';>The effects on analgesia and respiratory parameters of intravenous tramadol and dexmedetomidine added to tramadol using postoperatively in the thoracic surgery,Gaziantep Üniversitesi,Tıpta Uzmanlık,Anestezi ve Reanimasyon = Anesthesiology and Reanimation," onclick=tezDetay('umkFFZgtLT5psHoQW7M_7Q','M-cyAQ5CgsY6KaQ34N4okg')"
