tez_no,yazar,yıl,title,üniversite,tez_türü,konu,tez_detay
301187,PINAR ERDALOĞLU,2012,Jinekolojik abdominal cerrahilerde peroperatif deksmedetomidin verilmesi ile yara yerine levobupivakain infüzyonunun ağrıya etkilerinin karşılaştırılması.<br><span style='font-style: italic';>Comparison of the effects of perioperative dexmedetomidine and levobupivacaine infusion at wound on pain in abdominal gynecologic surgery.,Gaziantep Üniversitesi,Tıpta Uzmanlık,Anestezi ve Reanimasyon = Anesthesiology and Reanimation," onclick=tezDetay('M52Z37tkRl9PQAq-KJA2JA','Eax__ISoZ85czWa7xT9E0Q')"
365091,ALPER DOĞAN,2014,Gaziantep ili ve çevresinde ailevi akdeniz ateşi hastalığı olan çocukların retrospektif değerlendirilmesi<br><span style='font-style: italic';>A retrospective evaluation of children with familial mediterranean fever in the province of Gaziantep and the surrounding area,Gaziantep Üniversitesi,Tıpta Uzmanlık,Çocuk Sağlığı ve Hastalıkları = Child Health and Diseases," onclick=tezDetay('5W0l1Mxiq6-0Ohr8BY8vDQ','F_E_jXAckxV6q8q2gxDqXg')"
301182,AYŞE BİLGE ÖZTÜRK,2012,Dizel egzoz partiküllerinin insan nazal epitelhücrelerinin inflamatuar parametrelerine etkisi<br><span style='font-style: italic';>Effects of dıesel exhaust partıcles on ınflammatory parameters of human nasal epıthelıal cells,Gaziantep Üniversitesi,Tıpta Uzmanlık,Allerji ve İmmünoloji = Allergy and Immunology," onclick=tezDetay('gGkMVjyFVs3ewHwuECWQ_Q','oC_wwn_Eh2npXUXPL2O1bg')"
581219,SERHAT HASÜS,2019,Tekrarlayan gebelik kaybı hastalarında serum 25-hı̇droksı̇ vı̇tamı̇n D ve 8-hı̇droksı̇-2-deoksı̇guanosı̇n sevı̇yelerı̇nı̇n araştırılması<br><span style='font-style: italic';>Investigation of serum 25-hydroxy vitamin D and 8- hydroxy-2-deoxyguanosine levels in recurrent pregnancy loss patients,Gaziantep Üniversitesi,Tıpta Uzmanlık,Kadın Hastalıkları ve Doğum = Obstetrics and Gynecology," onclick=tezDetay('4HM8CBxbfVrgbJEEuXzaGA','Fw-1ed0B-NMgWTDD4h8vYQ')"
339952,ZÜLKÜF EKŞİ,1995,Alt ekstremite venöz patolojilerinin tanımlanmasında renkli doppler ultrasonografinin yeri<br><span style='font-style: italic';>,Gaziantep Üniversitesi,Tıpta Uzmanlık,Anatomi = Anatomy," onclick=tezDetay('Z9cFxC2rWctwTlY3f7dmDg','p6ofL4MyLiSmP5TmWuBw7g')"
362125,HÜSEYİN GÜNEYİSİ,1995,Koroner arter hastalığında pseudoxanthoma elasticumun risk faktörü olarak yeri ve önemi<br><span style='font-style: italic';>,Gaziantep Üniversitesi,Tıpta Uzmanlık,Kardiyoloji = Cardiology," onclick=tezDetay('NWeKCTA4TJa5vPkncRaXfA','lDqb5GreFW0WVji5nyo7tA')"
362170,MUSTAFA NAMIDURU,1995,Nozokomiyal üriner sistem enfeksiyonları ve enfeksiyon etkenlerinin antibiyotik duyarlıkları<br><span style='font-style: italic';>,Gaziantep Üniversitesi,Tıpta Uzmanlık,Klinik Bakteriyoloji ve Enfeksiyon Hastalıkları = Clinical Microbiology and Infectious Diseases," onclick=tezDetay('hU16QZG3P2cN5VAgf1Kn_A','bqI1aNyeXxCMmBxKbFbQnQ')"
362161,MESİH TÜRKER,1995,Brucella enfeksiyonlarının tanısında kullanılan serolojik testlerin tanı değerleri<br><span style='font-style: italic';>,Gaziantep Üniversitesi,Tıpta Uzmanlık,Klinik Bakteriyoloji ve Enfeksiyon Hastalıkları = Clinical Microbiology and Infectious Diseases," onclick=tezDetay('hZ7eyYQmMIwTFuD61H1XSw','7PcaKuFJXT3ZnzU8szvcOw')"
362126,İBRAHİM ÇAVUŞOĞLU,1996,Postmenapozal dönemdeki kadınlarda peropal değişik dozda konjuge estrojen replasman tedavisinin kemik dansitesi üzerine etkilerinin değerlendirilmesi<br><span style='font-style: italic';>,Gaziantep Üniversitesi,Tıpta Uzmanlık,Kadın Hastalıkları ve Doğum = Obstetrics and Gynecology," onclick=tezDetay('xC2TLWHRx4PNdwB78JoS1A','VkQvLnIROJZKeZt84D0vYg')"
362046,MUSA İNAL,1996,Ekstrahepatik safra yolları cerrahisinde operatif kolanjiografi basınç ve akım hızı ölçümlerinin yeri<br><span style='font-style: italic';>,Gaziantep Üniversitesi,Tıpta Uzmanlık,Genel Cerrahi = General Surgery," onclick=tezDetay('rWHH2n_fOll8BKBPXUtAOg','VlOGh1h8EeqsqGu8puUg2g')"
339950,MAHMUT KALENDER,1996,Acromıal eğim varyasyonlarının yaş ve cinsiyete dağılım analizi impingement sendromu ile ilişkisi<br><span style='font-style: italic';>,Gaziantep Üniversitesi,Tıpta Uzmanlık,Ortopedi ve Travmatoloji = Orthopedics and Traumatology," onclick=tezDetay('LalyAnvNxyvjdpm5ZrAItw','bAsqk8qHJvFPSZXR2ku2Ew')"
362174,NECMETTİN KIRTAK,1996,Kutanöz leishmaniasis tedavisinde kriyoterapi<br><span style='font-style: italic';>,Gaziantep Üniversitesi,Tıpta Uzmanlık,Dermatoloji = Dermatology," onclick=tezDetay('LqeWFLG12l-0lTN1Bbmfkg','qFk8bPYfHNsIl3nbAevxoA')"
362119,HASAN URCU,1996,Alt ekstremite tıkayıcı arter hastalıklarında renkli doppler us: DSA ile karşılaştırımalı değerlendirilme<br><span style='font-style: italic';>,Gaziantep Üniversitesi,Tıpta Uzmanlık,Radyoloji ve Nükleer Tıp = Radiology and Nuclear Medicine," onclick=tezDetay('miwD_ndYihvKSjQKcJglQQ','6V97hi9chkwzZtTi_7hARg')"
362149,GÖZEN YILMAZ,1997,Epilepsilerin değerlendirilmesinde bilgisayarlı tomografi ile manyetik rezonans görüntülemenin yeri ve önemi<br><span style='font-style: italic';>,Gaziantep Üniversitesi,Tıpta Uzmanlık,Radyoloji ve Nükleer Tıp = Radiology and Nuclear Medicine," onclick=tezDetay('ujaYaPqnNK1GFCBW9xMqSg','Jx6JfkXEvIdLSJePopd7RQ')"
362064,MUSTAFA ŞAHİN KILINÇER,1999,"Gaziantep il merkezinde gebe kadınların plazma A,C vitaminleri ve b-karoten düzeyleri<br><span style='font-style: italic';>",Gaziantep Üniversitesi,Tıpta Uzmanlık,Biyokimya = Biochemistry," onclick=tezDetay('tvp9R7AbHbGHMGbG6G4C3g','cpByA1fgfMDVtWmoOBklTQ')"
362091,CANAN KORKMAZ,1999,Akciğer kanserlerinde anjiogenezisin prognostik değeri<br><span style='font-style: italic';>,Gaziantep Üniversitesi,Tıpta Uzmanlık,Patoloji = Pathology," onclick=tezDetay('MWtOEvud7fjf13VIs_gsSQ','zQeOHjo8yJsg-LDUfY6TcQ')"
362118,HASAN Ş. MİCOZKADIOĞLU,1999,İnsüline bağımlı olmayan diabetes mellitus olgularında pulmoner mikrovasküler pataloji ile diğer diyabetik mikrovasküler komplikasyonların ilişkisi<br><span style='font-style: italic';>,Gaziantep Üniversitesi,Tıpta Uzmanlık,Endokrinoloji ve Metabolizma Hastalıkları = Endocrinology and Metabolic Diseases ; Kardiyoloji = Cardiology," onclick=tezDetay('FrufG3OirCy4I-EDg76Bxw','8BS5v6kWNY4pRxFsd3giEg')"
429187,HASAN BAYAR,2016,Dikkat eksikliği ve hiperaktivite bozukluğu olan çocuklarda metilfenidat tedavisi öncesi ve sonrası oksidatif metabolizmanın değerlendirilmesi<br><span style='font-style: italic';>Evaluation of oxidative metabolism in children with adhd before and after  methylphenidate treatment,Gaziantep Üniversitesi,Tıpta Uzmanlık,Psikiyatri = Psychiatry," onclick=tezDetay('vAyDSgKzCh2Eq_KpAYVlyg','OtWyi_FoYEg491jPjoqntg')"
225063,BURÇİN BÜYÜKÇELİK,2009,Orta ve şiddetli plak tip psoriazis hastalarında metabolik sendromun klinik ve laboratuvar bulugularının araştırılması<br><span style='font-style: italic';>Detection of clınıcal and laboratory parameters of metabolıc syndrome ın patıents wıth moderate and severe plaque type of psorıasıs,Gaziantep Üniversitesi,Tıpta Uzmanlık,Dermatoloji = Dermatology," onclick=tezDetay('ByWdLqQvGT2E0ZpoSltUKw','JJLLbiOyyV6zZt0oMesLVQ')"
362077,AHMET SEZER,1999,"Kilis ili merkezinde erişkin nüfusta diabet, hiperlipidemi prevalansı ve koroner risk faktörleri sıklığı<br><span style='font-style: italic';>",Gaziantep Üniversitesi,Tıpta Uzmanlık,Kardiyoloji = Cardiology," onclick=tezDetay('8wdLrl5-SibRzK1pGAU_pQ','vBgdZH4CzG1Rn39bIPe_KA')"
362184,PELİN ATMACA,2000,Pterygium cerrahisinde farklı tekniklerin karşılaştırılması<br><span style='font-style: italic';>,Gaziantep Üniversitesi,Tıpta Uzmanlık,Göz Hastalıkları = Eye Diseases," onclick=tezDetay('qjvN5W-z95sf3vV5o8FmEg','wGS7YZes8zmcrDnmOt1SRA')"
362084,AYSUN BARANSEL,2000,Dna parmak izi yöntemi ile kişi farklılıklarının gösterilmesi<br><span style='font-style: italic';>,Gaziantep Üniversitesi,Tıpta Uzmanlık,Adli Tıp = Forensic Medicine," onclick=tezDetay('hygNF1gYopBPLbGsvA8ndA','Zvbw9tTzANwZU7or6AmqfQ')"
281558,NEŞE BÜLBÜL,2011,Ülseratif kolitte NADPH oksidaz alt ünitesi P22phox gen ekspresyonu<br><span style='font-style: italic';>Nicotinamide adenine dinucleotide phosphate (NADPH) oxidase subunit P22phox gene expression in ulcerative colitis,Gaziantep Üniversitesi,Tıpta Uzmanlık,Gastroenteroloji = Gastroenterology ; Genetik = Genetics," onclick=tezDetay('6IBa2N8cZqNyeeIYQzTZPA','kFXF-FrhSgbXe8lC9zOs-A')"
88528,KAYA ÖZÇIRPICI,1999,"Helicobacter pylori intestinal metaplazi; displazi; gastrik kanser ilişkisi<br><span style='font-style: italic';>The Relationship between helicobacter pylori and intestinal metaplasia, displasia and gastric cancer",Gaziantep Üniversitesi,Tıpta Uzmanlık,Gastroenteroloji = Gastroenterology," onclick=tezDetay('koxWn95-K4CTc-E33a64sw','koxWn95-K4CTc-E33a64sw')"
692305,MURAT MERCANLI,2021,"Derin Anterior Lameller keratoplasti (DALK) anatomik ve fonksiyonel sonuçları<br><span style='font-style: italic';>Murat Mercanlı, Deep Anterior Lamellar Keratoplasty (DALK) anatomical and functional results",Gaziantep Üniversitesi,Tıpta Uzmanlık,Göz Hastalıkları = Eye Diseases," onclick=tezDetay('JScqA_X5K1hCOt40qF9tOw','mqK_9YfWJwMekkoga2V8tg')"
689144,SERKAN HOSRAFOĞLU,2021,Over kanserinde klinik ve laboratuvar parametrelerin sağkalım ileilişkisi<br><span style='font-style: italic';>The relationship of clinical and laboratory parameters and survival in ovarian cancer,Gaziantep Üniversitesi,Tıpta Uzmanlık,Onkoloji = Oncology," onclick=tezDetay('Z4YX5OhR9vh_7peQDDa-tw','69WMjvIqIwCp5vCgcLHppQ')"
319327,RECEP DOKUYUCU,2012,"Sıçanlarda renal iskemi sonrası biyokimyasal parametreler ve demir metabolizmasından sorumlu hepsidin ve hepsidin bağımlı genlerin (BMP6, GDF-15, HJV) incelenmesi<br><span style='font-style: italic';>Investigation of biochemical parameters in rats after renal ischemia and hepcidin linked genes (BMP6, GDF-15, HJV)) which are responsible for the iron metabolism",Gaziantep Üniversitesi,Tıpta Uzmanlık,Fizyoloji = Physiology ; Genetik = Genetics," onclick=tezDetay('sfX-DpA6onsolgn4cXxKHA','QL0lPg4O_YC9jMElUg8Glw')"
236609,MEHMET HALİT DEMİR,2009,Aksiller brakial pleksus bloğunda 0.3 ve 0.5 mA\' lik eşik akımların blok üzerine olan etkileri<br><span style='font-style: italic';>The Effects of The 0.3 mA and 0.5 mA of threshold currents on the axillary brachial plexus blockade,Gaziantep Üniversitesi,Tıpta Uzmanlık,Anestezi ve Reanimasyon = Anesthesiology and Reanimation," onclick=tezDetay('7AE84519ZFR0cETOFqD1Ww','6rUTo6a54k98uAGIKDcq9Q')"
489996,HASAN GÜMÜŞBOĞA,2017,"Kardiyopulmoner arrest hastalarda ekokardiyografi, doppler ultrason ve el ile nabız kontrolünün karşılaştırması<br><span style='font-style: italic';>Comparison of echocardiyography, doppler ultrasonography and manual methods to control pulse in cardiopulmonary arrest patients",Gaziantep Üniversitesi,Tıpta Uzmanlık,İlk ve Acil Yardım = Emergency and First Aid," onclick=tezDetay('E2VM0LCVb6I45RHHHjSTCQ','aGXBmjsyljX6jVSuIEmJUQ')"
192818,AYSUN TAŞDEMİR ARI,2006,Farklı glokom olgularında santral kornea kalınlığı ve aksiyel uzunluk değerlerinin göz içi basıncı üzerine etkilerinin araştırılması<br><span style='font-style: italic';>İnvestigations of the effects of central corneal thickness and axial length on intraocular pressure in different glaucoma subgroups,Gaziantep Üniversitesi,Tıpta Uzmanlık,Göz Hastalıkları = Eye Diseases," onclick=tezDetay('eE8nLcygH0CQBuZI8yQKDA','LvnClhyoIjzKx3YYpAxoVA')"
281021,SERDAR DÜNDAR,2010,Akut kolesistit cerrahi tedavisinde açık ve laparoskopik yöntemlerin karşılaştırılması<br><span style='font-style: italic';>The comparesion of laparascopic versus open technique for acute cholesistitis treatment as mortality comorbidity and surgical compact,Gaziantep Üniversitesi,Tıpta Uzmanlık,Genel Cerrahi = General Surgery," onclick=tezDetay('93lPsuQqoUbo8bFXj5bsIQ','heBQp3waRKyEGztxNyRMWw')"
680845,ZÜBEYİR TURAN,2021,Tiroid tümörlerinin histopatolojik özelliklerinin prognozla ilişkisi ve Anneksin A1 ve TROP2\'nin tanısal yararlılığı<br><span style='font-style: italic';>The relationship of histopathological characteristics of thyroid tumors with prognosis and diagnostic utility of Annexin A1 and TROP2,Gaziantep Üniversitesi,Tıpta Uzmanlık,Patoloji = Pathology," onclick=tezDetay('zk5TXLcqBPDR7oVh6r4b4A','0yUSpLiUsnSk98kMIWulkA')"
342041,ERDAL KAYDU,2013,İlerleyici keratokonus olgularında riboflavin/UV-A ile korneal çapraz bağlama tedavisinin sonuçları<br><span style='font-style: italic';>The results of cross-linking with riboflavin/UV-A in patients with progressive keratoconus,Gaziantep Üniversitesi,Tıpta Uzmanlık,Göz Hastalıkları = Eye Diseases," onclick=tezDetay('2bTN4xGf3D9SGE1DH65AAw','6ItlhaBO53A95tHbrU5RaA')"
236525,MUSTAFA ÜNAL,2009,Biliyer sistem anatomisi ve varyasyonlarının manyetik rezonans kolanjiopankreatografi ile değerlendirilmesi<br><span style='font-style: italic';>The evaluation of anatomy and variations of biliary system by using magnetic resonance cholangiopancreatography,Gaziantep Üniversitesi,Tıpta Uzmanlık,Radyoloji ve Nükleer Tıp = Radiology and Nuclear Medicine," onclick=tezDetay('F3fZg1USel-t-IuBChA5eA','ZPvdvSpdvqtBIId9U_nKsg')"
329092,SİNAN TEKE,2013,"Hiperemezis gravidarum etyopatogenezinde total oksidan seviye, total antioksidan seviye ve oksidatif stres indeksinin değerlendirilmesi: Prospektif  klinik çalışma<br><span style='font-style: italic';>Evaluation of total oxidant, antioksidant status level and oxidative stress index in hyperemezis gravidarum etiopathogenesis; prospective clinical study",Gaziantep Üniversitesi,Tıpta Uzmanlık,Kadın Hastalıkları ve Doğum = Obstetrics and Gynecology," onclick=tezDetay('oAdtkjmxz3-LARMe_O-ryg','f-NSmdYJJsRw4AKHJBvj1Q')"
225064,ŞENOL AYDIN,2009,"Yüksek doz atorvastatin\'in kırık iyileşmesi üzerine etkisinin radyolojik, histopatolojik ve biyomekanik yönden araştırılması (Ratlarda deneysel çalışma)<br><span style='font-style: italic';>Radiological, histopathological and biomechanical research of effect of high dose atorvastatin on fracture healing (An experimental study with rats)",Gaziantep Üniversitesi,Tıpta Uzmanlık,Ortopedi ve Travmatoloji = Orthopedics and Traumatology," onclick=tezDetay('qxA-CIOIOKcq-cAX5lcdhg','auYD78BhRjyiNJ2dmbvn8g')"
596156,GALİYE AYLİN SEYRAN,2019,İntihar düşüncesi olan hastaların intihar olasılıklarına göre kranial 18-FDG PET/BT ile bölgesel beyin glukoz metabolizmasının incelenmesi<br><span style='font-style: italic';>Investigation of regional brain glucose metabolism via 18- FDG PET/CT in patients with suicidal toughts according to thei̇r suicide probability,Gaziantep Üniversitesi,Tıpta Uzmanlık,Psikiyatri = Psychiatry," onclick=tezDetay('zCWzCK6Ur5tbvE5vryanTg','IMusPq39H6GfAY3sXrBdcw')"
550588,DİDEM CEYLAN YOĞURTÇUOĞLU,2019,Kronik bel ağrısı olan hastalarda pulse magnetik alan tedavisinin etkinlik ve güvenirliği<br><span style='font-style: italic';>Efficacy and safety pulse magnetic field therapy in patients with chronic lower back pain,Gaziantep Üniversitesi,Tıpta Uzmanlık,Fizyoterapi ve Rehabilitasyon = Physiotherapy and Rehabilitation," onclick=tezDetay('zRFQGeLqbyBVX4QuU6hqsQ','Kpmn9BKPQXEfhhLIB3tHFQ')"
236630,SEMA YAVUZ,2009,Sol ventrikül disfonksiyonunda koroner sinüsün anatomik değişimi ve NYHA fonksiyonel durum ile ilişkisi<br><span style='font-style: italic';>Anatomik alteration of coronary sinus in left ventricular systolic disfunction and relationship with NYHA functional status,Gaziantep Üniversitesi,Tıpta Uzmanlık,Kardiyoloji = Cardiology," onclick=tezDetay('RcrDVFcwYV6t_v5vbqgnWQ','EQtglfyQHmMPcnB5L0wrhg')"
203808,RAMAZAN GEYİK,2008,Multipl myelomda hepsidin\'in anemi potogenezindeki rolü ve klinik takipteli değeri<br><span style='font-style: italic';>The role of hepcidin in the pathogenesis of multiple myeloma related anemia and the value of hepcidin in clinical follow-up,Gaziantep Üniversitesi,Tıpta Uzmanlık,Hematoloji = Hematology," onclick=tezDetay('brLiaDBLsWTQPqxsJN6m7A','fq5bf6DyRf4UCvw0CYUttw')"
406626,MÜZEYYEN GÜNAY ÖRKMEZ,2015,Romatoid artritli hastalarda anti-TNF tedavilerinin serum prohepsidin düzeyine etkisi<br><span style='font-style: italic';>The effect of anti-TNF therapies on serum prohepcidin level in the patients with rheumatoid arthritis,Gaziantep Üniversitesi,Tıpta Uzmanlık,Biyokimya = Biochemistry ; Romatoloji = Rheumatology," onclick=tezDetay('PyWZRh9iPqIG72lMhJw-zA','GSqOB1OTJmMHIGLr4WFp2w')"
359191,MUSTAFA POLAT,2014,Lenf nodu metastazı olan baş boyun yassı epitel hücreli karsinomlarında selektif boyun diseksiyonlarının yeri<br><span style='font-style: italic';>The role of selective neck dissection in squamous epithelial cell carcinoma of the head and neck with lymph node involvement,Gaziantep Üniversitesi,Tıpta Uzmanlık,Kulak Burun ve Boğaz = Otorhinolaryngology (Ear-Nose-Throat)," onclick=tezDetay('aVh3kts5SQ8ti1kSSv_kSQ','h386Zswp4XjMcPvoha5PeA')"
359186,MELDA DOĞAN,2014,Laparatomi sonrası transdermal fentanil ile IV hasta kontrollü fentanilin analjezik etkilerinin karşılaştırılması<br><span style='font-style: italic';>After laparatomy transdermal fentanyl and IV. patient controlled fentanyl comparison analgesic effect,Gaziantep Üniversitesi,Tıpta Uzmanlık,Anestezi ve Reanimasyon = Anesthesiology and Reanimation," onclick=tezDetay('st0j4ennU-2GNT9SIJxu3w','TD2wDLPQDBSS_fEszoicBw')"
377095,İSMAİL AYTAÇ,2014,Tinnitus hastalarında maskeleme tedavisi uygulanması ve tinnitus parametreleri üzerine etkisinin araştırılması<br><span style='font-style: italic';>Masking treatment and its effect on tinnitus parameters,Gaziantep Üniversitesi,Tıpta Uzmanlık,Kulak Burun ve Boğaz = Otorhinolaryngology (Ear-Nose-Throat)," onclick=tezDetay('uVF_VNIC03-8YwHqQ8Xa8g','as4TIfykhETyPaG8QMt7MA')"
365072,EMİNE AYLA GÖKÇE,2014,Alt ekstremite defektlerinin kapatımında klinik deneyimlerimiz<br><span style='font-style: italic';>Our clinical experience with lower extremity defect closure,Gaziantep Üniversitesi,Tıpta Uzmanlık,Plastik ve Rekonstrüktif Cerrahi = Plastic and Reconstructive Surgery," onclick=tezDetay('bp53NhbXirlnE6YaJtg9Mg','TNsFwGAt-RjGJDM9YELv2Q')"
301185,MESUT BULUT,2012,Obstruktif uyku apne sendromu (OUAS) olan hastalarda oksidan antioksidan durumlarının araştırılması<br><span style='font-style: italic';>Obstructive Sleep Apnea Syndrome in patients are investigated of oxidant- antioxidant status,Gaziantep Üniversitesi,Tıpta Uzmanlık,Nöroloji = Neurology," onclick=tezDetay('QOP3pBbnG0xtP8GV9JU7Xg','dF3PbDd3ELx_U5W_4q6UsA')"
267980,MEHMET AKSOY,2011,Çocuklarda izole ventriküler septal defekt ile ROCK2 (RHO/RHO-kinaz) gen polimorfizmi arasındaki ilişkinin araştırılması<br><span style='font-style: italic';>Research of the relatıon between ROCK2 (RHO/RHO--kınase) gene polımorfısm and the ızole ventrıcular septal defects on the chıldhood,Gaziantep Üniversitesi,Tıpta Uzmanlık,Çocuk Sağlığı ve Hastalıkları = Child Health and Diseases," onclick=tezDetay('EQGtX4sOabohw4Q_pwqVQA','Vpl_YaFRyBFkWf2u2ZpHBw')"
339738,FIRAT TİRYAKİ,2013,Gelişimsel kalça çıkığının salter innominate osteotomisi ile cerrahi tedavisinde; femoral kısaltma osteotomisi yapılan hastalar ile preoperatif iskelet traksiyonu yapılan hastaların sonuçlarının karşılaştırılması<br><span style='font-style: italic';>Comparison of results of patients who underwent femoral shortening osteotomy and patients who underwent preoperative skeletal traction for surgical treatment of developmental hip dislocation with salter innominate osteotomy,Gaziantep Üniversitesi,Tıpta Uzmanlık,Ortopedi ve Travmatoloji = Orthopedics and Traumatology," onclick=tezDetay('MEOnHPKalU1UTKLt9xeRvA','8WTOZ231g16CFPifdnaidA')"
281560,FATMA ESİN KARÇİN,2011,Preeklampsili gebelerde serum Paraoksonaz ve Arilesteraz aktivitelerinin değerlendirilmesi<br><span style='font-style: italic';>Assesment of serum Paraoxonase and Arylesterase activity in preeclampsia,Gaziantep Üniversitesi,Tıpta Uzmanlık,Kadın Hastalıkları ve Doğum = Obstetrics and Gynecology," onclick=tezDetay('6lSRstOH0RL0gPfLJGLpsw','YYXYIBkobQw7BSwGd3Gwgg')"
581883,FEZA DEMİR,2019,Gaziantep Üniversitesi Tıp Fakültesi Çocuk Hematoloji Polikliniğine başvuran hastalarda yaşam kalitesinin değerlendirilmesi<br><span style='font-style: italic';>Evaluation of quality of life in patients who applied to Gaziantep University Children Hematology Policlinary,Gaziantep Üniversitesi,Tıpta Uzmanlık,Çocuk Sağlığı ve Hastalıkları = Child Health and Diseases," onclick=tezDetay('5EneFHCorG9RaEqPz85rIQ','1fSkpBOE_ypdDeG0az9Ccw')"
329086,MEHMET ÖZ,2013,Kronik hepatit B hastalığının evreleri ile serum ürotensin-II arasındaki ilişki<br><span style='font-style: italic';>Stages of chronic hepatitis b disease and the relationship between urotensin-II,Gaziantep Üniversitesi,Tıpta Uzmanlık,Gastroenteroloji = Gastroenterology," onclick=tezDetay('9puYvfIYG6ObiCMwGaCctg','H8ljb-gJ9TJ23rqPd_SqTg')"
274562,EDA İÇBAY,2011,"Gaziantep il merkezindeki kadın kuaförlerinin fiziksel koşullarının, çalışanlarının sağlıkla ilgili yakınmalarının ve bulaşıcı hastalıklarla ilgili bilgi ve uygulamalarının değerlendirilmesi<br><span style='font-style: italic';>The evaluation of physical conditions of the hairdressing salons in the Gaziantep city center and their worker?s health complaints, knowledge and practices about the infectious diseases",Gaziantep Üniversitesi,Tıpta Uzmanlık,Halk Sağlığı = Public Health," onclick=tezDetay('mCOygGBj1FBGKpp-t-l22A','5kGk8x4BeoqgZ4VMJZkHlw')"
629208,DENİZ GÖZCÜ,2020,Menisküs onarımı yapılan hastalarda menisküs yırtık tipine göre klinik sonuçların değerlendirilmesi<br><span style='font-style: italic';>Evaluation of clinical results according to the type of meniscus tears in patients undergoing meniscus repair,Gaziantep Üniversitesi,Tıpta Uzmanlık,Ortopedi ve Travmatoloji = Orthopedics and Traumatology," onclick=tezDetay('Gs9-TvbN4AfhfUW1qU-M2Q','_lgkbmQa9F2VXGUzYT-M5Q')"
230174,ŞERİF ÇÖLOĞLU,2009,Asemptomatik hipervolemisi bulunan diyaliz hastalarında subklinik kardiyovasküler anormalliklerin göstergesi olarak yeni kardiyovasküler hastalık belirleyicilerinin yararlılığı ve önemi<br><span style='font-style: italic';>The utılıty and importance of new cardiovascular disease determıners as an ındıcator of subclıcal cardıovascular abnormalıtıes in dialysıs patıents wıth symptomatıc hypervolemıa,Gaziantep Üniversitesi,Tıpta Uzmanlık,Nefroloji = Nephrology," onclick=tezDetay('7Faz_T8D34TAe6KVJQKzSw','trsZnNcibjT2-fsrEhSXUA')"
236569,MURAT ÇAVDAR,2009,Kalorifer yakan apartman görevlilerinde kronik karbon monoksit maruziyetinin etkileri<br><span style='font-style: italic';>The effect of chronic carbon monoxide exposure on thecoal-burning heating system workers,Gaziantep Üniversitesi,Tıpta Uzmanlık,İlk ve Acil Yardım = Emergency and First Aid," onclick=tezDetay('7qz8PW4ency7ba1VhnoE6w','lihSNFlmDpRGr8m5dfAjzg')"
340630,HAŞİM ERDİNÇ YETER,2013,Tiroid fonksiyon bozukluğu olan hastalarda serum prokalsitonin düzeyi ve tedavi ile değişimi<br><span style='font-style: italic';>Serum procalcitonine levels in patients with thyroid function disorder and changes with treatment,Gaziantep Üniversitesi,Tıpta Uzmanlık,Endokrinoloji ve Metabolizma Hastalıkları = Endocrinology and Metabolic Diseases," onclick=tezDetay('aPxv0QoOUDN9pQ5eOJ3u4w','5gznoupwpYnfX5xSAFXKLQ')"
478184,VOLKAN GÜÇYETMEZ,2017,Erişkin dikkat eksikliği ve hiperaktivite bozukluğunda proenflamatuar ve antienflamatuar sitokin düzeyleri<br><span style='font-style: italic';>Pro-inflammatory and anti-inflammatory cytokine levels in adult attention deficit and hyperactivity disorder,Gaziantep Üniversitesi,Tıpta Uzmanlık,Psikiyatri = Psychiatry," onclick=tezDetay('W3oEJ9b8V0SY2FsSzRjmIg','MgBi0c4fQWuLfUF_erKleg')"
576212,BUKET ÇAM,2019,"Opere Fallot tetralojili hastalarda dört boyutlu ekokardiyografi, solunum fonksiyon testi ve kan BNP düzeyi ile sağ ventrikül fonksiyonu değerlendirilmesi<br><span style='font-style: italic';>Right ventricle function evaluation of patients with repaired tetralogy of Fallot via four dimensional echocardiography, spirometry and  BNP level examination",Gaziantep Üniversitesi,Tıpta Uzmanlık,Çocuk Sağlığı ve Hastalıkları = Child Health and Diseases," onclick=tezDetay('mbpWc-yL-Y4LomYDySNXAw','F-d4ahqCQN-L0zvxxAnMFw')"
365082,METİN KILINÇ,2014,Ultrason eşliğinde fasya iliaka kompartman bloğunda farklı lokal anestezik volümlerin karşılaştırılması<br><span style='font-style: italic';>Ultrasound gui̇ded the comparison of different volumes of local anaesthetics in fascia iliaca compartment block,Gaziantep Üniversitesi,Tıpta Uzmanlık,Anestezi ve Reanimasyon = Anesthesiology and Reanimation," onclick=tezDetay('zvna4fhcpPWZqNodbl2GSQ','CIi4xZBzipdGBAIRsR7Lnw')"
359187,AZİZ YARBİL,2014,Trans üretral prostat ve mesane rezeksiyonunda remifentanil\'in farklı dozlarının karşılaştırılması<br><span style='font-style: italic';>Comparison of different doses of remifentanil in trans  urethral resection of the prostate and bladder,Gaziantep Üniversitesi,Tıpta Uzmanlık,Anestezi ve Reanimasyon = Anesthesiology and Reanimation," onclick=tezDetay('lXok5vIwKXPYTXHPYjiuzQ','pxi40aV4H8PNgk2hl51naw')"
