tez_no,yazar,yıl,title,üniversite,tez_türü,konu,tez_detay
656690,OMER YOUSEF KUDSİ,2003,Management of emergency cases in heart diseases<br><span style='font-style: italic';>,Halep Üniversitesi,Tıpta Uzmanlık,Acil Tıp = Emergency Medicine," onclick=tezDetay('BZvViE9xfl1vM6SDXL4bhA','yrSceprLFiev24D-Vg7zNg')"
622912,GOLSHAN ROUHANİ,1996,در پیشگیری از بروز سل فعال در بیماران بستری در بیمارستان والسته به دانشگاه علوم‌پزشکی شهید بهشتی در سالهای ۱۳۷۳-۱۳۷۵BCGبررسی میزان اثر بخشی واکسیناسیون<br><span style='font-style: italic';>Shahid Beheshhti Tıp Bilimleri Üniversitesi Hastanelerinde 1994-1996 yılları arasında yatırılarak takip edilen hastalardan BCG aşısını aktif tüberküloza karşı etkinliğinin değerlendirilmesi,Shahid Beheshti University,Tıpta Uzmanlık,Göğüs Hastalıkları = Chest Diseases," onclick=tezDetay('J9HM3TgQOWHZct5rwGgvNQ','QC-G5PFz1jKXnGeRGekVmQ')"
706567,MUSTAFA ALTINTAŞ,2002,Hipertrofik tonsil ve rekürren/kronik tonsillitli çocuklarda atopi prevalansı<br><span style='font-style: italic';>Atopy prevalence in children with hypertrophic tonsil and recurrent/chronic tonsillitis,Azerbaycan Milli Elmler Akademiyası,Tıpta Uzmanlık,Kulak Burun ve Boğaz = Otorhinolaryngology (Ear-Nose-Throat)," onclick=tezDetay('mtRrS1VG3B_SpDjP1SZdCw','5Jk0HGnHJW_Tv3UkM3M7gw')"
738749,ÖMER YILDIZ,2002,QT-Dispersion bei Patienten mit schwerer chronischer Herzinsuffizienz: Vergleich mit etablierten Risikoprädiktoren<br><span style='font-style: italic';>Kronik ileri evre kalp yetmezliği olan hastalarda QT dispersiyonu: Yerleşik risk prediktörleri ile karşılaştırma,Ruprecht-Karls-Universität-Heidelberg,Tıpta Uzmanlık,Kardiyoloji = Cardiology," onclick=tezDetay('4zVyeL_f_-DUnJlkqmS51g','iVio0ZEnkHdEPBNRmE4jtA')"
772645,ŞEYMA OSMANLIOĞLU COŞKUN,2015,Steroid-responsive Enzephalopathie bei Autoimmunthyreoiditis alsDifferentialdiagnose der Creutzfeldt-Jakob-Krankheit<br><span style='font-style: italic';>Creutzfeldt-Jakob hastalığının ayırıcı tanısı olarak otoimmün tiroiditte steroid yanıtlı ensefalopati,Georg-August-Universität Göttingen,Tıpta Uzmanlık,Kadın Hastalıkları ve Doğum = Obstetrics and Gynecology ; Nöroloji = Neurology," onclick=tezDetay('z3WXpb28_RTILWq-yyNZ0g','Jj0UsRjawrYw6clH-JGHaw')"
761489,SUZAN AKPULAT,2022,"Adipositas-Einfluß von niedrig- kohlenhydrat Diät und normal kohlenhydrat Diät auf metabolische Parameter, Grundumsatz und Insulinsensitivität<br><span style='font-style: italic';>Düşük karbonhidratlı diyetlerde ve normal karbonhidratlı diyetlerde adipositasın metabolik parametrelere, bazal metabolizma hızına ve insülin duyarlılığına etkisi",Charité–Universitätsmedizin Berlin,Tıpta Uzmanlık,Kardiyoloji = Cardiology," onclick=tezDetay('7IhvqfcbzXAXFHbwcBk-cA','BZjxhz0fogSM_hmvrnOb1Q')"
401270,NOURAN A. SABIR,1992,Measurement of normal lumbar spinal canal<br><span style='font-style: italic';>,Jami\'at Baghdad,Tıpta Uzmanlık,Radyoloji ve Nükleer Tıp = Radiology and Nuclear Medicine," onclick=tezDetay('l4jF-utIU5awwF5Sadw7wQ','Co6rtY_WgANlZdDm1r0bwg')"
400256,MEHMET KEMAL ARIKAN,1992,Electrophysiological aspects of depression<br><span style='font-style: italic';>,New York Medical College ,Tıpta Uzmanlık,Radyoloji ve Nükleer Tıp = Radiology and Nuclear Medicine," onclick=tezDetay('rhS7LUhVuAHsvkN4H4o2VQ','uDR_p20q2UsM8RHXX9VOow')"
825868,HATİCE GÜNGÖR,2005,Roles of different igg subclasses on graft rejection<br><span style='font-style: italic';>Farklı ıgg alt sınıflarının greft reddi üzerindeki rolleri,Imperial College London,Tıpta Uzmanlık,İç Hastalıkları = Internal diseases," onclick=tezDetay('WjvwhAmHqUt6RYbO5IBcfA','DROZGya3np_aswoBeDB85w')"
