tez_no,yazar,yıl,title,üniversite,tez_türü,konu,tez_detay
647516,HÜRREM SULTAN ATAÇ ŞENTÜRK,2020,Trombosit profilinin gestasyonel diyabet öngörüsündeki rolü<br><span style='font-style: italic';>The role of the thrombocytes profile in the prediction of gestational diabetes,Amasya Üniversitesi,Tıpta Uzmanlık,Kadın Hastalıkları ve Doğum = Obstetrics and Gynecology," onclick=tezDetay('NcAKWHG2wM6I1oL8HQbcBQ','OYGrbAHcBO5f9quvxktEVg')"
799156,CAHİDENUR SELVEROĞLU,2023,Adölesan polikistik over sendromlu hastalarda obezite ile oksidatif stres ilişkisinin değerlendirilmesi<br><span style='font-style: italic';>Evaluation of the relationship between obesity and oxidative stress in patients with adolescent polycystic ovary syndrome,Amasya Üniversitesi,Tıpta Uzmanlık,Kadın Hastalıkları ve Doğum = Obstetrics and Gynecology," onclick=tezDetay('hTHaW8qJmmlvXGJehBk02A','zLGiVPa57QGMW-XYq_WThw')"
848690,ZEHRA DİLARA ÜYÜK,2024,Enflamatuar markerların hiperemezis gravidarum ile ilişkisinin değerlendirilmesi<br><span style='font-style: italic';>Evaluation of inflammatory markers in pregnancieswith hyperemesis gravidarum,Amasya Üniversitesi,Tıpta Uzmanlık,Kadın Hastalıkları ve Doğum = Obstetrics and Gynecology," onclick=tezDetay('wLORhofrBVORcHsFodJyeA','O27uqdd-r1M_yJXyVdnUuw')"
903572,UFUK ÖZKAN,2024,Konservatif takip edilen pediatrik ön kol çift kırıklarında açılanma ve aşırı büyüme ulnar varyansı etkiler mi?<br><span style='font-style: italic';>The effect of angulation and overgrowth on ulnar variance in conservatively managed pediatric both bone forearm fractures,Amasya Üniversitesi,Tıpta Uzmanlık,Ortopedi ve Travmatoloji = Orthopedics and Traumatology," onclick=tezDetay('fwYPybqD_JkP3E4BKjTyjw','b8IXB4hF6akommM0xPUAwQ')"
737013,ERHAN UZUN,2022,"Septorinoplasti operasyonunda kullanılan, enjekte edilebilir trombositten zengin fibrinin postoperatif ödem ve ekimoz üzerine olan etkisi<br><span style='font-style: italic';>Effect of injectable platelet rich fibrin used in septorinoplasty operation on postoperative edema and ecchymosis",Amasya Üniversitesi,Tıpta Uzmanlık,Kulak Burun ve Boğaz = Otorhinolaryngology (Ear-Nose-Throat)," onclick=tezDetay('b84pex-CIvjVBtVRmd5CRA','-YS8Zdx9qReUDmHCqDlvhg')"
737014,ELİF HANOĞLU,2022,Burun aksı ile kulak morfolojisi arasındaki ilişkinin değerlendirilmesi<br><span style='font-style: italic';>Evaluation of the relationship between nose axis and ear morphology,Amasya Üniversitesi,Tıpta Uzmanlık,Kulak Burun ve Boğaz = Otorhinolaryngology (Ear-Nose-Throat)," onclick=tezDetay('3vEwCPnBGo4J7Qrq3ax93Q','qyi3KWNBUONsR87_GMZpLQ')"
700298,SAKİNE MERVE AYDIN,2021,"Abortus imminens olan gebelerde serum prokalsitonin, nötrofil-lenfosit ve trombosit-lenfosit oranlarının değerlendirilmesi<br><span style='font-style: italic';>Abortus imminens olan gebelerde serum prokalsitonin, nötrofil-lenfosit ve trombosit-lenfosit oranlarinin değerlendirilmesi",Amasya Üniversitesi,Tıpta Uzmanlık,Kadın Hastalıkları ve Doğum = Obstetrics and Gynecology," onclick=tezDetay('EQETS7lY8GXCBuZjvYCinw','s7mz2hTlkOGwEBPNAaVzcg')"
666324,ESRA GÜNER,2021,Polikistik over sendromlu hastalarda serum visfatin seviyelerinin obezite ile ilişkisi<br><span style='font-style: italic';>The relationship between obesity and serum visfatin levels inpatients with polycystic ovary syndrome,Amasya Üniversitesi,Tıpta Uzmanlık,Kadın Hastalıkları ve Doğum = Obstetrics and Gynecology," onclick=tezDetay('mre_f6eKucYkJWXcu1vkww','nA2am-AhjT53lPDspfJcEA')"
