tez_no,yazar,yıl,title,üniversite,tez_türü,konu,tez_detay
165504,ZAHİDE YALAKİ,2005,"Ankara Üniversitesi Tıp Fakültesi Çocuk Sağlığı ve Hastalıkları Genel Polikliniğine başvuran aşılanmamaış 5-16 yaş grubundaki çacuklarda hepatit B antijen pozitifliğin araştırılması<br><span style='font-style: italic';>Investigation of hepatitis B antigen psitivity in unvaccinated patients between 5-16 age who were admitted to the general polyclinic of Ankara University, falculty of medicine deparment of pediatrics",Ankara Üniversitesi,Tıpta Uzmanlık,Çocuk Sağlığı ve Hastalıkları = Child Health and Diseases," onclick=tezDetay('b_UD5amefOlcqil6RDHf6A','E7ttwZkQb6XMLyBZt-EyvA')"
175414,İLKE MUNGAN AKIN,2011,Yenidoğan yoğun bakım ünitesinde yatan çok düşük doğum ağırlıklı bebeklerin sepsis ve nek gelişimini engellemeye yönelik oral laktoferrin profilaksisi ve t-regulatuar hücreler üzerine etkisi<br><span style='font-style: italic';>Oral lactoferrin prophylaxis to prevent sepsis and necrotising enterocolitis of very low birth weight neonates in neonatal ıntensive care unit and effect on t-regulatory cells,Ankara Üniversitesi,Tıpta Uzmanlık,Çocuk Sağlığı ve Hastalıkları = Child Health and Diseases," onclick=tezDetay('TSJ_xF8AH0ELKDnQWTLJkA','0kPIj0uzW3An5oksfxQsAg')"
271695,MEHMET ÇAKICI,2010,"Ciddi aort darlığı olan hastalarda, aort kapak replasmanı sonrası sol ventrikül geometrisindeki değişiklikler (Prospektif randomize çalışma)<br><span style='font-style: italic';>Left ventricular geometrical changes following aortic valve replacement in patients with severe aortic stenosis (Prospective randomised study)",Ankara Üniversitesi,Tıpta Uzmanlık,Göğüs Kalp ve Damar Cerrahisi = Thoracic and Cardiovascular Surgery," onclick=tezDetay('3vjsllpBeHCXpiLwHNgYlA','rEGEgbMaYou8C1LnI2tJMw')"
165489,NURAY ALPTEKİN,2005,İnmeli hastalarda KAT 2000 ile denge eğitiminin motor gelişim ve denge üzerine etkileri<br><span style='font-style: italic';>The effects of KAT 2000 balance training in the motor recovery and balance in the hemiplegic stroke patients,Ankara Üniversitesi,Tıpta Uzmanlık,Fiziksel Tıp ve Rehabilitasyon = Physical Medicine and Rehabilitation," onclick=tezDetay('UzAJtPsVK1IlHVaMIneknA','Z9IwmGNLbdNFPazdkg5aqg')"
165505,SONAY İNCESOY ÖZDEMİR,2005,Erken çocukluk döneminde gelişimsel sorunları olan çocukların özel eğitim ve rehabilitasyon hizmetlerine ulaşmalarını etkileyen etmenlerin ve ulaştıkları hizmetlerin niteliğinin değerlendirilmesi<br><span style='font-style: italic';>Determining the barriers and facilitators to receiving early intervention services and whether the services received are familyt versus child focused for children identified with developmental delay and referred to the early intervention services,Ankara Üniversitesi,Tıpta Uzmanlık,Çocuk Sağlığı ve Hastalıkları = Child Health and Diseases," onclick=tezDetay('J2LB8M0kPBhyEFft7zN7sA','PbV2GLGnBeCU0lhfJ1j_Mw')"
298782,YASEMİN YUYUCU KARABULUT,2011,BCR-ABL (PH kromozomu) negatif kronik myeloproliferatif neoplazilerdeki kemik iliği mikroçevresi özelliklerinin bu hastalıkların ayırıcı tanısındaki önemi<br><span style='font-style: italic';>The signature of bone marrow microenvironment for differantial diagnosis of bcr-abl negative myeloproliferative neoplasms,Ankara Üniversitesi,Tıpta Uzmanlık,Patoloji = Pathology," onclick=tezDetay('p3I63L4zyiGejTxFTVlt8A','hrTNm3cvRnRW0fSRyPq9pA')"
225979,MESUT KAYA,2008,Obstrüktif uyku apnesi sendromunda lateral farengoplastinin etkinliğinin değerlendirilmesi<br><span style='font-style: italic';>Efficiacy of lateral pharyngoplasty in obstructive sleep apnea syndrome,Ankara Üniversitesi,Tıpta Uzmanlık,Kulak Burun ve Boğaz = Otorhinolaryngology (Ear-Nose-Throat)," onclick=tezDetay('A4gw-0dD18h4vGb6IxWqMA','yNqcOApx5XMgl8CVBYCgFQ')"
260337,GÖKHAN BERKTUĞ BAHADIR,2009,"Tek taraflı testis torsiyonu deneysel modelinde IGF-I, GH VE FGF gibi büyüme faktörlerinin uygulanmasının fertilite ve fekundite üzerine etkileri (Sıçanlarda deneysel çalışma)<br><span style='font-style: italic';>The effects of IGF-I, FGF AND GH treatment, on fertility in experimental unilateral testicular torsion model",Ankara Üniversitesi,Tıpta Uzmanlık,Çocuk Cerrahisi = Pediatric Surgery," onclick=tezDetay('HAIs0V252mAxy_4FQ5nW9g','cFS1DwBRQdwAFoinYJr6aA')"
298745,BURCU CİRİT KOÇER,2011,Parapnömonik plevral efüzyon tanısında plevral sıvı prokalsitonin düzeyinin rolü<br><span style='font-style: italic';>The role of pleural fluid procalcitonin levels ın the diagnosis of parapneumonic pleural effusion,Ankara Üniversitesi,Tıpta Uzmanlık,Göğüs Hastalıkları = Chest Diseases," onclick=tezDetay('PwvaZUyifD-1UYRCom8R2w','ZaMMVcuk_vGmm54UC7gSqQ')"
298727,GÜLSÜM KADIOĞLU ŞİMŞEK,2011,"Gonadotoksik kemoterapi almış ve kür sağlanmış çocukluk çağı kanser hastalarında puberte sekonder seks karakterleri ve inhibin B ilişkisi<br><span style='font-style: italic';>The relationship between ınhibin b, puberty and secondary sex characteristics in childhood cancer patients after gonadotoxic treatment and have provided cure",Ankara Üniversitesi,Tıpta Uzmanlık,Çocuk Sağlığı ve Hastalıkları = Child Health and Diseases," onclick=tezDetay('eocK_3v9G3pdt2ZMtCyVCg','I9mNMRD19l87Jeek3BVcZA')"
165490,ARMIN MOSHTAGH GOHARI,2005,Yüz kontak dermatitli hastalarda patch test sonuçları<br><span style='font-style: italic';>Patch test result in patients with contact dermatitis,Ankara Üniversitesi,Tıpta Uzmanlık,Dermatoloji = Dermatology," onclick=tezDetay('IGHpGTHI-6LHLlnypckhbA','knluX3EouXPhcC2IedbiGQ')"
165506,MELTEM GÜNEŞ,2005,Retinoblastomlu olgularda serum fas ve solubl fas ligand düzeyleri<br><span style='font-style: italic';>Serum fas and solubl fas ligand levels in retinoblastoma patiets,Ankara Üniversitesi,Tıpta Uzmanlık,Çocuk Sağlığı ve Hastalıkları = Child Health and Diseases," onclick=tezDetay('eWAOvIJ-nzlmwLUd34RSng','-cBNkdz07i1spmR-MO1sXA')"
229990,RABİA MİHRİBAN (GÜNER) KILINÇ,2008,Çocuk hastalarda üriner sistemin değerlendirilmesinde MR ürografi<br><span style='font-style: italic';>Evaluation of urinary tract in chidren with MR urography,Ankara Üniversitesi,Tıpta Uzmanlık,Radyoloji ve Nükleer Tıp = Radiology and Nuclear Medicine," onclick=tezDetay('FCsuQfa3skXSX7ZlSgTgCg','ZgItHr8a9kgBr8QyY_VpCw')"
298757,BERNA İMGE AYDOĞAN,2011,Yaşlı populasyonda 25-OH-vitamin D3 düzeyi ile arteryal sertlik ve mortalite riski arasındaki ilişki<br><span style='font-style: italic';>The Association of 25-OH-vitamin D3 with Arterial Stiffness and Mortality in a Elderly Population,Ankara Üniversitesi,Tıpta Uzmanlık,Geriatri = Geriatrics ; Nefroloji = Nephrology," onclick=tezDetay('gPqwdA-xkhN30zybbO_HSA','vCBQA_-_eo15IyZGgkdV-w')"
165491,MUSTAFA ARGUN,2005,Akut pyelonefritte böbrek hasarının gösterilmesinde soluble CD27\'nin yeri ve DMSA sintigrafisi<br><span style='font-style: italic';>The role of sCD27 and its relation to dimercaptosuccinic acid scintigram in renal damage in acute pyelonephritis,Ankara Üniversitesi,Tıpta Uzmanlık,Çocuk Sağlığı ve Hastalıkları = Child Health and Diseases," onclick=tezDetay('54WW3Gjmr6yQKYYZgEGNYQ','7NE_185AwQ0N1Cqs7hgOwA')"
165507,KAMİL GÜLPINAR,2005,Major hepatekomi sonrası portal venöz kan akımındaki artışın hemodinamik değişiklikler üzerine etkisi<br><span style='font-style: italic';>The effect of increased portal venous blood flow on haemodynamical after major hepatectomy,Ankara Üniversitesi,Tıpta Uzmanlık,Genel Cerrahi = General Surgery," onclick=tezDetay('gDnasXpM8_VAoTKx0IIKPQ','_G-qN1Y-m0J0N4Jk7snVkw')"
298754,NAZİYET KÖSE,2011,Tiroid dışı bir nedenle çekilen 18-F-FDG PET/BT\'de saptanan tiroid tutulumlarının klinik öneminin değerlendirilmesi<br><span style='font-style: italic';>Evaluation of the clinical significance of the thyroid uptake identified by 18-F-fluoro-deoxy glucose positron emission tomography/ computed tomography for non-thyroidal illness,Ankara Üniversitesi,Tıpta Uzmanlık,Endokrinoloji ve Metabolizma Hastalıkları = Endocrinology and Metabolic Diseases," onclick=tezDetay('5G0ZHw0SDIopXF_XJ1Y0bA','YoBZz2sHjfLWhu7P1_clBw')"
298755,ERDEN ATİLLA,2011,Hemoglobin içeriğine dayalı transfüzyon ile standart eritrosit süspansiyonu transfüzyon etkinliğinin karşılaştırılması<br><span style='font-style: italic';>A randomized comparison of hemoglobin content-based versus standard (Unit-based) rbc transfusion policiy efficiencies,Ankara Üniversitesi,Tıpta Uzmanlık,Hematoloji = Hematology," onclick=tezDetay('G6-_ufcsP_MiNF0dilrNkw','bLGLxkbGxpb8XIWq7vzM1A')"
165492,BENGÜ NİSA AKAY,2005,Bazal hücreli karsinoma ve seboreik keratozda dermoskopik bulguların değerlendirilmesi<br><span style='font-style: italic';>The evaluation of dermoscopic findings in basal cell carcinoma and seborrheic keratosis,Ankara Üniversitesi,Tıpta Uzmanlık,Dermatoloji = Dermatology," onclick=tezDetay('f-rR6omArTGZukgvWyH-uQ','UIncZTrviZdrVa0-gvP6Eg')"
165508,EMİNE GÜLLÜ,2005,Kronik obstrüktif akciğer hastalığında kortiosteroid kullanımının osteoporoz gelişimi üzerine etkisi<br><span style='font-style: italic';>The effect of cordicosteroids on osteoposis development in COPD,Ankara Üniversitesi,Tıpta Uzmanlık,Göğüs Hastalıkları = Chest Diseases," onclick=tezDetay('qfDDt2nHlHQm3nWhq6XSUg','ENuHzDXQpp3zFhwNWbqrTg')"
165509,FİLİZ AVŞİN ÖZDEMİR,2005,"Psödoeksfolyasyonlu hastalarda santral kornea kalınlığı, aköz hümör homosistein düzeyi ve serum lipid düzeyi<br><span style='font-style: italic';>Central corneal thickness, homocysteine levels in asueous humor and lipid levels in plasma of patients with pseudoexfoliation",Ankara Üniversitesi,Tıpta Uzmanlık,Göz Hastalıkları = Eye Diseases," onclick=tezDetay('duBfKvU6TWPNBae710kzew','EbRVfj6S1-hlo5U1CRjfRQ')"
260316,DİDEM YASEMİN SÖNMEZ,2009,Rektum kanserli hastalarda manyetik rezonans görüntüleme ile preoperatif lokal evreleme<br><span style='font-style: italic';>Preoperative local staging with magnetic resonance imaging in patients with rectal cancer,Ankara Üniversitesi,Tıpta Uzmanlık,Radyoloji ve Nükleer Tıp = Radiology and Nuclear Medicine," onclick=tezDetay('hX81iTIu4GrgqcR3KTqJQQ','ZvrJ-aqaTbpqazjPJCO2Ng')"
298777,ZERİN ÖZAYDIN AKSUN,2011,Epilepsi hastalarının yakınlarının nöbet sırasındaki davranışları ve bunun epilepsi hakkındaki bilgileri ile ilişkisi<br><span style='font-style: italic';>The attitudes of care givers of epileptic patients during seizure and relations with their knowledge about epilepsy,Ankara Üniversitesi,Tıpta Uzmanlık,Nöroloji = Neurology," onclick=tezDetay('T5QYy7uWOHsHn9dom2MX7A','KbXVgRmr9Mw30DvdytVsnw')"
260318,HAKAN GENCE,2009,Nikotine maruz bırakılan sıçanlarda ?resveratrol? ve ?silostazol?ün flep yaşayabilirliği üzerine etkilerinin araştırılması (Deneysel çalışma)<br><span style='font-style: italic';>Study of the effect of resveratrol and cilostazol on flap viability in rats exposed to nicotine,Ankara Üniversitesi,Tıpta Uzmanlık,Plastik ve Rekonstrüktif Cerrahi = Plastic and Reconstructive Surgery," onclick=tezDetay('uIADDZu3Bizb6Mu4kITkEg','r-XC54Idlbs3EUUOiM0ZtA')"
266819,ONUR KESKİN,2010,Sistemik lupus eritematozus hastalarında klinik bulgularla serum interlökin-17 ve interlökin-23 düzeylerinin incelenmesi<br><span style='font-style: italic';>Serum interleukin-17 and interleukin-23 levels of systemic lupus erythematosus patients and the relation with clinical findings,Ankara Üniversitesi,Tıpta Uzmanlık,Allerji ve İmmünoloji = Allergy and Immunology," onclick=tezDetay('CMpTPhbsfnOScN3UWmWo0w','Qli64NMldTA02DhNFcID_Q')"
306318,DEVRİM TANIL KURT,2011,Koroner arter cerrahisi geçiren hastalarda anestezi indüksiyonunda ve sternotomi sırasında uygulanan Esmolol\'ün QT ve QTC süresine ve stres hormonları üzerine etkileri<br><span style='font-style: italic';>The effects of Esmolol on the QTand QTC interval and stress hormones applied during induction of anesthesia and sternotomy in patients undergoing coronary artery bypass graft surgery,Ankara Üniversitesi,Tıpta Uzmanlık,Anestezi ve Reanimasyon = Anesthesiology and Reanimation," onclick=tezDetay('NhTj8y2z0e7-jJhbt1olGw','6p6GteKOHvBtCpdiKPIILw')"
266829,GÜLŞAH AYNAOĞLU,2010,Uzun protokol IVF-ET uygulamalarında standart luteal faz desteğine gnrh agonisti eklenmesinin yeri<br><span style='font-style: italic';>The signification of addition GnRH agonist to standart luteal phase support in long protocol IVF-ET cycles,Ankara Üniversitesi,Tıpta Uzmanlık,Kadın Hastalıkları ve Doğum = Obstetrics and Gynecology," onclick=tezDetay('NC7iFB0fYf2hNDHB26ZVuA','1zErHb7ojlriyO0z2aiaDw')"
306347,İNSU YILMAZ,2011,Mevsimsel ve yıl boyu allerjik riniti olan olgularda bronşial remodelling\'in indükte balgamda vascular endothelial growth factor ve endostatin ölçümü ile değerlendirilmesi ve bunun bronş aşırı duyarlığı ile ilişkisi<br><span style='font-style: italic';>Evaluation of bronchial remodelling via measurment of vascular endothelial growth factor and endostatin levels in induced sputum and their relationship to bronchial hyperrectivity in patients with seasonal allergic rhinitis and perennial allergic rhinitis,Ankara Üniversitesi,Tıpta Uzmanlık,Allerji ve İmmünoloji = Allergy and Immunology," onclick=tezDetay('4qyLONEWyKz6U1aUgWF3lQ','Biaqftzttlu7AN151auhWA')"
306311,MEFTUNE SAV AYDINLI,2011,Kolorektal kanser tanısı alan hastaların koruyucu hekimlik açısından durumları ve tanı sürecinin değerlendirilmesi<br><span style='font-style: italic';>Situation of patients with colorectal cancer in terms of preventive medicine and evaluation of diagnostic process,Ankara Üniversitesi,Tıpta Uzmanlık,Aile Hekimliği = Family Medicine ; Gastroenteroloji = Gastroenterology ; Onkoloji = Oncology," onclick=tezDetay('awFoZpbL39AfK-2AXQqVjg','AW2MoMKlZX-WXQG3GA45sg')"
298785,YUSUF ALPER AKIN,2011,Multipl sklerozda uyku bozukluğu nedenlerinin araştırılması<br><span style='font-style: italic';>Multipl sklerozda uyku bozukluğu nedenlerinin araştırılması,Ankara Üniversitesi,Tıpta Uzmanlık,Nöroloji = Neurology," onclick=tezDetay('vWWaXwHLnuoKfm-KszTtkg','-VrESGMn1kGD4LjdLcnrow')"
230446,YETİŞ UÇAR,2008,Astımlı çocuklarda solubl endotelyal protein c reseptörü (sEPCR) düzeyleri<br><span style='font-style: italic';>Plasma sEPCR levels in asthmatic children,Ankara Üniversitesi,Tıpta Uzmanlık,Çocuk Sağlığı ve Hastalıkları = Child Health and Diseases," onclick=tezDetay('5uLz890abAKAqLuQw5Jq5w','XbLVFJA6Yzkf2F0Eth7XRA')"
230451,BERKAN REŞORLU,2008,"Lokal ileri evre (Evre pT3, T4a) ve/veya lenf nodu metastazı saptanan mesane tümörlü hastalarda adjuvan kemoterapi tedavisinin etkinliği<br><span style='font-style: italic';>The role of adjuvant chemotherapy in patients with bladder cancer who had local advanced stage (pT3, pT4a) and/or lymph node metastasis",Ankara Üniversitesi,Tıpta Uzmanlık,Üroloji = Urology," onclick=tezDetay('ifqdMF3mPnWqun_hGm_hNQ','vcgswM-i9HgOPxPTrCiUcw')"
306340,ÖMER FARUK BÜK,2011,GSTT-1 ve GSTM-1 gen delesyonlarının mide adenokarsinomu gelişimi riski üzerine etkisi<br><span style='font-style: italic';>The effect of GSTT-1 and GSTM-1 gene deletions on the risk of gastric adenocarcinoma development,Ankara Üniversitesi,Tıpta Uzmanlık,Genel Cerrahi = General Surgery ; Genetik = Genetics," onclick=tezDetay('0Zg3jZi-e25pBkoahUQVEw','2aAG5O1z4R0AQc42eovXaA')"
306356,ŞİYAR ERDOĞMUŞ,2011,Renal transplant alıcılarında idrar anjiotensinojen düzeyi ile ilişkili parametreler<br><span style='font-style: italic';>Association between urinary levels of angiotensinogen and clinical parameters in renal transplant recipients,Ankara Üniversitesi,Tıpta Uzmanlık,Nefroloji = Nephrology," onclick=tezDetay('LlCQ2ulQwdvrdDb3qNpsUw','JzsUXO1CgbJHOpB2kLE5XA')"
260367,EVREN SÜER,2010,Perirenal yağ invazyonu olan renal hücreli kanser hastalarında tümör boyutunun prognostik önemi var mı?<br><span style='font-style: italic';>Does tumor size have any prognostic significance in RCC patients with perinephric fat invasion ?,Ankara Üniversitesi,Tıpta Uzmanlık,Üroloji = Urology," onclick=tezDetay('3FRilLwqPo4eObgr76L2cA','QCW8F6uNfed4DNVTITRVTg')"
266812,EVRİM AKSU,2010,Behçet hastaları ve sağlıklı bireylerde üroepitel hücrelerin Streptococcus Pyogenes ve E. Coli\'ye karşı bakterisidal etkisinin araştırılması<br><span style='font-style: italic';>Investigation of bactericidal effects of uroepithelial cells against Streptococcus pyogenes and Eshherichia coli in Behcet\'s disease and healty controls,Ankara Üniversitesi,Tıpta Uzmanlık,Mikrobiyoloji = Microbiology," onclick=tezDetay('0QBDqLKYO0lcct7jN4T-LQ','cdUSbwEtah6H0teyzRUc6Q')"
298761,KEMAL AĞBAHT,2010,"Tirotoksikozda adrenokortikal rezerv ve bu rezerv ile ilişkili parametreler<br><span style='font-style: italic';>Adrenocortical reserve in thyrotoxicosis, and parameters associated with this reserve",Ankara Üniversitesi,Tıpta Uzmanlık,Endokrinoloji ve Metabolizma Hastalıkları = Endocrinology and Metabolic Diseases," onclick=tezDetay('BbyrDUcOP70PLxi4zn0qgw','xWpaUE_lzMMpNmLZyeMXHw')"
307934,GÜNAY ŞAHİN DALGIÇ,2011,Sistemik sklerozda ACPA (Anti Citrullinated Protein Antibody)\'nın prognostik değeri<br><span style='font-style: italic';>Prognostic value of ACPA in systemic sclerosis,Ankara Üniversitesi,Tıpta Uzmanlık,Romatoloji = Rheumatology," onclick=tezDetay('ak22Lma7J6HMm9OkfubnBw','_qN40SALS19kJYInS-V0Gg')"
192163,BANU ORHAN,2006,Nitrofen ile konjenital diafragma hemisi oluşturulan ratlarda N-asetil sistein\'in akciğer gelişimine etkisi<br><span style='font-style: italic';>The effect of N-acetylcystein on the lung growth in rats with nitrofen induced congenital diaphragmatic hemia,Ankara Üniversitesi,Tıpta Uzmanlık,Çocuk Cerrahisi = Pediatric Surgery," onclick=tezDetay('3Vbjh_E5h2_iILOhdZ5D7A','2jXdovFFBPp_nMNocdGcEw')"
298750,HANDE İLKAY,2011,Diyabetes mellitus ve hipertansiyonlu hastaların by-pass cerrahisinde kullanılacak damarlarında ( V. Safena magna ve A .Torasika interna ) gözlenen değişikliklerin ışık mikroskobu düzeyinde incelenmesi<br><span style='font-style: italic';>Light microscobic analysis of vascular wall changes (V. Saphena magna and A. Thoracica interna) prepared for by-pass surgery in patients with diyabetes mellitus and hypertension,Ankara Üniversitesi,Tıpta Uzmanlık,Göğüs Kalp ve Damar Cerrahisi = Thoracic and Cardiovascular Surgery ; Histoloji ve Embriyoloji = Histology and Embryology," onclick=tezDetay('Eeh0CEMyYHgS3ODntAecwg','8-4r75xoy0-2iJN9aFPBYA')"
271633,FERDA TOPAL,2010,"Ovaryum dokusunun, vitrifikasyon ve yavaş soğutma teknikleriyle korunurluğunun histopatolojik yönden karşılaştırılması<br><span style='font-style: italic';>Compare preservation of vitrified and slow freezed ovarium tissue",Ankara Üniversitesi,Tıpta Uzmanlık,Histoloji ve Embriyoloji = Histology and Embryology," onclick=tezDetay('jQ18uD2QJD5wkiHgwzNkDA','5q11kjn7MTJZoFtl3EB9bQ')"
266844,İLKNUR SABAN,2010,Postmenopozal kadınlarda osteoporoz ve kırık riskinin belirlenmesinde COL1A1 gen polimorfizminin rolü<br><span style='font-style: italic';>Role of COL1A1 gene polymorphism in prediction of osteoporosis and fracture risk in postmenopausal women,Ankara Üniversitesi,Tıpta Uzmanlık,Fiziksel Tıp ve Rehabilitasyon = Physical Medicine and Rehabilitation," onclick=tezDetay('tsJHlUU_5wfqY4rdlAm4Aw','evasMmRWhQRfF5u70cX5ww')"
306348,ALİ ÇELİK,2011,Özofagus kanserinde cerrahi tedavi ve sonuçlarımız<br><span style='font-style: italic';>Surgery in esophageal carcinoma and our results,Ankara Üniversitesi,Tıpta Uzmanlık,Göğüs Kalp ve Damar Cerrahisi = Thoracic and Cardiovascular Surgery," onclick=tezDetay('fjiL85zVrLd1y5EhdUMT2Q','oamXOwbQ3WH3Sa_QKueiPg')"
230456,CEMİL GÜLÜCÜ,2008,Geriatrik hastalarda intravenöz ve epidural morfin ile hasta kontrollü analjezi uygulamasının kognitif fonksiyonlar üzerine etkisi<br><span style='font-style: italic';>The effect of patient controlled analgesia methods with intravenous and epidural morphine on cognitive functions in geriatric patients,Ankara Üniversitesi,Tıpta Uzmanlık,Anestezi ve Reanimasyon = Anesthesiology and Reanimation," onclick=tezDetay('p0zJQ3yhZvtUlCqxFD6Quw','53E3K53PzpbVV9pcaN1hMg')"
306324,ŞENAY SAVAŞ ERDEVE,2011,Erkene kaymış puberteli kız olguların klinik özellikleri ve gnrha tedavisinin kemik yaşına göre boya etkisi: 2 yıllık izlem<br><span style='font-style: italic';>Clinical characteristics of girls with early puberty and effect of gnrha treatment on height depending on the bone age: a-two-year follow-up,Ankara Üniversitesi,Tıpta Uzmanlık,Endokrinoloji ve Metabolizma Hastalıkları = Endocrinology and Metabolic Diseases ; Çocuk Sağlığı ve Hastalıkları = Child Health and Diseases," onclick=tezDetay('yHjc_yCYLUtnZ1tCgGbfaQ','Y5axjeKPOVX099UDLKTSsw')"
661586,SEMİHA URVAY,2008,"Renal transplantasyon ve kronik hemodiyaliz hastalarında dolaşımda thrombomodulin, endotelyal protein c reseptör ve tümör nekrozis faktör düzeyleri.<br><span style='font-style: italic';>Plasma levels of soluble endothelial cell protein c receptor, solublethrombomodulin and tumor necrosis factor in renal transplantrecipients and hemodialysis patients",Ankara Üniversitesi,Tıpta Uzmanlık,Nefroloji = Nephrology," onclick=tezDetay('C6yRmg63ukbVne9AI9_DFg','URovsyO3V2LmyT9IhdR-Mw')"
306342,ELVAN ONUR KIRIMKER,2011,Sıçan modelinde yorucu egzersizin karaciğer rejenerasyonuna etkisi<br><span style='font-style: italic';>Effect of exhaustive exercise on liver regeneration in rat model,Ankara Üniversitesi,Tıpta Uzmanlık,Genel Cerrahi = General Surgery," onclick=tezDetay('hggbiAuir6v3ftwkiUIUgQ','2V6QzsfgnkZ6s6iuh4vAtw')"
307939,VEHAP TOPÇU,2011,"46,xy kromozom kuruluşlu cinsel gelişim bozukluğu gösteren bireylerde androjen reseptör gen değişikliklerinin araştırılması<br><span style='font-style: italic';>Detection of androgen receptor gene alterations in subjects with 46,xy disorders of sex development",Ankara Üniversitesi,Tıpta Uzmanlık,Endokrinoloji ve Metabolizma Hastalıkları = Endocrinology and Metabolic Diseases ; Genetik = Genetics," onclick=tezDetay('D_oNgcFzqIYKBZPa-SsHXA','_j5Dre6vbl_1hGu8XPEEFw')"
260381,NESRİN AHU ASLAN,2009,İzole sistolik hipertansiyonlu hastalarda değişik hızlı seri anestezi indüksiyonu yöntemlerinin karşılaştırılması<br><span style='font-style: italic';>Comparison of different rapid sequence induction protocols in isolated systolic hypertensive patients,Ankara Üniversitesi,Tıpta Uzmanlık,Anestezi ve Reanimasyon = Anesthesiology and Reanimation," onclick=tezDetay('A_ksStsL73aXVHf9RDlUfQ','bUD515UjEb-_9HtNouYk5g')"
298724,ÖMER ÇİFTÇİ,2010,Atopik dermatitli çocuklarda t regulatuvar hücre düzeyi<br><span style='font-style: italic';>Regulatory t cell levels in children with atopic dermatitis,Ankara Üniversitesi,Tıpta Uzmanlık,Çocuk Sağlığı ve Hastalıkları = Child Health and Diseases," onclick=tezDetay('ZzDL_Kwnqts0Sr3fjjZepg','5kR229F7dp40slkMJ2S-mA')"
307935,EMEL GÖKDEMİR,2011,"Remisyondaki bipolar bozukluk tip 1 hastalarında komorbidite, mizaç ve intihar olasılığı ilişkisi<br><span style='font-style: italic';>Comorbidity in patients having bipolar disorder of type 1 in remission, relationship between temperament and suicide probability",Ankara Üniversitesi,Tıpta Uzmanlık,Psikiyatri = Psychiatry," onclick=tezDetay('ddSvyRX82P20NZOVS4tQnA','eeA6n4WMBofQ06h-RjX4rQ')"
307925,BÜŞRA SÜMEYYE POLAT,2011,Parkinson hastalığında antiparkinson tedaviye bağlı cinsel işlev bozukluğu ve hiperseksüalite sıklığı parkinson hastalığında antiparkinson tedaviye bağlı cinsel işlev bozukluğu ve hiperseksüalite sıklığıparkinson hastalığında antiparkinson tedaviye bağlı cinsel işlev bozukluğu ve hiperseksüalite sıklığı<br><span style='font-style: italic';>Sexual dysfunction and hypersexuality induced by antiparkinson medications in parkinson\'s disease,Ankara Üniversitesi,Tıpta Uzmanlık,Nöroloji = Neurology," onclick=tezDetay('6D9RqitZm-v66_3uD0biwA','VoeILwoPekU_worG-AHEfg')"
225987,PINAR TARI,2008,Soliter pulmoner nodüllerin benign malign ayrımında F18 FDG PET ile erken geç görüntülemenin rolü<br><span style='font-style: italic';>The role of dual time point F18 FDG PET imaging to differantiate malign benign solitary pulmonary nodules,Ankara Üniversitesi,Tıpta Uzmanlık,Radyoloji ve Nükleer Tıp = Radiology and Nuclear Medicine," onclick=tezDetay('KelhroLfc7SeQYWrXwy1Kg','bPP2R_ODFxt6_UkInXGmQQ')"
306334,PERTEVNİYAL BODAMYALI,2011,Yüz kontakt dermatitlerinde kozmetik allerjenlerle patch test sonuçlarının değerlendirilmesi<br><span style='font-style: italic';>Evaluation of contact sensitivity to cosmetics in patients with face contact dermatitis,Ankara Üniversitesi,Tıpta Uzmanlık,Dermatoloji = Dermatology," onclick=tezDetay('a8ZNk61THEU-WWtmV1Tgow','3FXwkxl1VWsBr-6okh2pCw')"
271660,ŞİYAR ERSÖZ,2010,"Bilateral subtotal tiroidektomi yapılan multinodüler guatr olgularında, rezidü tiroid dokusunda mikronodül oranı<br><span style='font-style: italic';>The ratio of micronodules in residual tyroid tissue, the patient who performed bilateral subtotal tyroidectomy at multynodular goitre",Ankara Üniversitesi,Tıpta Uzmanlık,Genel Cerrahi = General Surgery," onclick=tezDetay('NR0kt1d86PT8rkWVHxa_Ng','oGBF5L5q5DlyGSOKjNiizw')"
