tez_no,yazar,yıl,title,üniversite,tez_türü,konu,tez_detay
314441,ERDİNÇ ACAR,2012,Cerrahi uygulanan vertebra kırıklarında klinik ve radyolojik sonuçların değerlendirilmesi<br><span style='font-style: italic';>Evaluation of clinical and radiological results in operated thoracolumbar vertebra fractures,Ankara Üniversitesi,Tıpta Uzmanlık,Ortopedi ve Travmatoloji = Orthopedics and Traumatology," onclick=tezDetay('sm_MhyNyZbtzCWULkGtSTw','hwoKMJsxMs9cvgNvAtejcQ')"
314484,EMEL OKULU,2012,Prematüre yenidoğanlarda çok erken profilaktik sürfaktan uygulamasının klinik etkinliğinin değerlendirilmesi<br><span style='font-style: italic';>Evaluation of the clinical efficacy of very early prophylactic surfactant administration in premature newborns,Ankara Üniversitesi,Tıpta Uzmanlık,Çocuk Sağlığı ve Hastalıkları = Child Health and Diseases," onclick=tezDetay('v5juCSAcnW93iu0q84Giqw','nNWoiEmnSodXRi1xiHClxA')"
326483,REFİYE SELİN AYBAR,2012,Obez ve obez olmayan hastalarda truviev videolaringoskop ile macintosh laringoskop kullanıldığında zor entübasyonun karşılaştırılması<br><span style='font-style: italic';>The comperation of difficult entubations performed with truview laryngoscope or macintosh laryngoscope in obese and nonobese patients,Ankara Üniversitesi,Tıpta Uzmanlık,Anestezi ve Reanimasyon = Anesthesiology and Reanimation," onclick=tezDetay('yqUFOGklAlbrRIHdYtU8ag','nJ1I5RldmrAGf5w1tg7N1Q')"
406934,SEDA KAYNAK ŞAHAP,2015,Pediatrik manyetik rezonans kolanjiopankreatografi uygulamaları<br><span style='font-style: italic';>Pediatric magnetic resonance cholangiopancreatography imaging,Ankara Üniversitesi,Tıpta Uzmanlık,Radyoloji ve Nükleer Tıp = Radiology and Nuclear Medicine," onclick=tezDetay('OeR2uXzvoblWuNayany7YA','xzBmrqqdHx-9D-fTmWJphA')"
448771,EMRE ANIL ÖZBEK,2016,"İntramedüller çivileme yöntemi ile opere edilen tibia cisim kırıklı hastaların takibinde, diz çevresi kas kuvvetleri, staheli rotasyonel profili ve fonksiyonel sonuçların değerlendirilmesi<br><span style='font-style: italic';>Do the loss of thigh muscle strength and tibial malrotation cause anterior KNEE pain after tibia intramedullary nailing?",Ankara Üniversitesi,Tıpta Uzmanlık,Ortopedi ve Travmatoloji = Orthopedics and Traumatology," onclick=tezDetay('Ne4KiPJ64BXuifkSJXFlWg','qqqP4a5zbqostATb7BOPaw')"
384216,EBRU KAHRAMAN,2014,Abdominal aort anevrizmalarının endovasküler greft stent ile tedavisinde erken ve geç takip sonuçlarının değerlendirilmesi (Retrospektif çalışma)<br><span style='font-style: italic';>The evaluation of early end late follow up results in patients had abdominal aortic aneurysm with endovasculer greft stent repair,Ankara Üniversitesi,Tıpta Uzmanlık,Radyoloji ve Nükleer Tıp = Radiology and Nuclear Medicine," onclick=tezDetay('TwmeMn_ud55rdl-ihlRvSg','1s8hiKVy1N26KrjxHuhREw')"
384207,BİLGE İPEK TORUN,2014,Botulinum toksini uygulaması için musculus sternocleidomastoideus ve ense kaslarının anatomik standardizasyonunun belirlenmesi<br><span style='font-style: italic';>Botulinum toksini uygulamasi i̇çin musculus sternocleidomastoideus ve ense kaslarinin anatomik standardizasyonunun belirlenmesi,Ankara Üniversitesi,Tıpta Uzmanlık,Anatomi = Anatomy," onclick=tezDetay('d_zyodbkeAFxayQ1MeALKA','RLJCttNmEifRrCAyw1dJwg')"
384218,EGEMEN ÇİÇEK,2014,Total tiroidektomi ameliyatı sonrası okside rejenere sellülozun ses kalitesi üzerine etkisi<br><span style='font-style: italic';>The effect of oxidized regenerated cellulose on voice quality after total thyroidectomy,Ankara Üniversitesi,Tıpta Uzmanlık,Genel Cerrahi = General Surgery," onclick=tezDetay('WObwjlA9sDW0fmN0KH6WCw','YUzMoVQkVk2kC9c5cxfwMQ')"
384263,YAHYA EFE GÜNER,2014,Primer glioblastoma (DSÖ 4. derece) hastalarında mdr1 geni ekspresyon ve metilasyonu<br><span style='font-style: italic';>Mdr1 gene expression and methylation on primary glioblastoma (who grade IV) patients,Ankara Üniversitesi,Tıpta Uzmanlık,Nöroşirürji = Neurosurgery," onclick=tezDetay('eRc2jW8FXVaFh-P10ksx6w','yaOAy4Kzz3jmBCXcKBI3Ig')"
448766,BURÇİN DUR,2016,Çocukluk çağı malignitelerinde tanı gecikmesinin sıklığı ve nedenleri<br><span style='font-style: italic';>Causes and frequency of diagnosis delay in childhood malignancies,Ankara Üniversitesi,Tıpta Uzmanlık,Onkoloji = Oncology ; Çocuk Sağlığı ve Hastalıkları = Child Health and Diseases," onclick=tezDetay('ywaX_QH811Sj5mx7bhzCcg','b5ZyUl-m1GEn4d3mOc7OOA')"
314432,FUNDA DATLI YAKARYILMAZ,2012,Vitamin D replasmanının insulin direnci üzerine etkisi<br><span style='font-style: italic';>The effects of vitamin D replacement on insulin resistance,Ankara Üniversitesi,Tıpta Uzmanlık,Endokrinoloji ve Metabolizma Hastalıkları = Endocrinology and Metabolic Diseases," onclick=tezDetay('1Aa3LvEcGow3xisNw1h4sQ','QwioTkHK2bbleuNIzjz_hw')"
443689,ÇİĞDEM GONCA,2016,Akciğer kanserli hastalarda yaşın torakotomi komplikasyonlari ve sağkalım üzerine etkileri<br><span style='font-style: italic';>Effects of age on the complications and survival after thoracotomy,Ankara Üniversitesi,Tıpta Uzmanlık,Göğüs Kalp ve Damar Cerrahisi = Thoracic and Cardiovascular Surgery," onclick=tezDetay('VFYa8gPyY__S5IJT6mtTqw','ca1gUJgSXEUdAadZDPmUIA')"
384219,EKİN OKTAY OĞUZ,2014,Kollajen doku hastalığı olan bireylerde (akciğer tutulumu olan veya olmayan) serum KL-6 glikoprotein düzeyinin akciğer tutulumundaki rolü<br><span style='font-style: italic';>The role of serum KL-6 glycoprotein levels in lung involvement patients with connective tissue diseases,Ankara Üniversitesi,Tıpta Uzmanlık,Romatoloji = Rheumatology," onclick=tezDetay('aplJmo0-7idSC9tTU2_VzA','RcBcB7yTNZ_hAum9DiqRoQ')"
314446,ÖZGÜR ALTMIŞDÖRTOĞLU,2012,Yumuşak doku sarkomlu hastalarda radyoterapi sonuçları ve prognostik faktörler<br><span style='font-style: italic';>Results and prognostic factors in radiotherapy for soft tissue sarcomas,Ankara Üniversitesi,Tıpta Uzmanlık,Onkoloji = Oncology," onclick=tezDetay('5Wr9DbSp2yQGkdePrLaHJA','7AB8jfeAeZZjcvXCoP3Idw')"
314399,ZEHRA BAYKAL TUTAL,2012,Koroner arter bypass greft cerrahisi uygulanan hastalarda Euroscore ve Care risk değerlendirme modellerinin retrospektif olarak karşılaştırılması<br><span style='font-style: italic';>Retrospective comparison of Euroscore and Care risk evaluation models in a group of coronary artery bypass graft patients,Ankara Üniversitesi,Tıpta Uzmanlık,Anestezi ve Reanimasyon = Anesthesiology and Reanimation," onclick=tezDetay('roAlewZQd_qYOu-bXgTmxw','UILJtPN8mmgFpxLjyQoFgg')"
493447,İLKER UFUK SAYICI,2018,Sadece anne sütü ile beslenen sağlıklı bebeklerin idrarında ve annelerinin süt ve idrarında bisfenol a düzeylerinin belirlenmesi<br><span style='font-style: italic';>Determination of bisphenol a in urinary of babies fed only by breast milk and in urinary and breast milk of their mothers,Ankara Üniversitesi,Tıpta Uzmanlık,Çocuk Sağlığı ve Hastalıkları = Child Health and Diseases," onclick=tezDetay('MbC8NLV4eDVAvNWPX7sWwQ','HODfHvmmCZQBbpeZDOJy0w')"
365163,ERDEM ÖZTÜRK,2013,Transforming büyüme faktörünün gelişen embriyonik üreter üzerine etkisi: Farelerde in-vitro megaüreter modeli<br><span style='font-style: italic';>Effects of transforming büyüme factor on the developing embryonic ureter: An in-vitro megaureter model in mice,Ankara Üniversitesi,Tıpta Uzmanlık,Üroloji = Urology," onclick=tezDetay('12dPG9lylzTdN_QmJD0YIA','GBsBZgq787BCpQRu5PiJaA')"
443663,TOLGAHAN TUNCAL,2016,Alkol bağımlılığı sendromu ve klinik öncelikler: Boyutlu düşünme örneğinde kimi saptamalar<br><span style='font-style: italic';>Alcohol dependence syndrome and clinical priorities: some observations in the sample of dimensional-thinking,Ankara Üniversitesi,Tıpta Uzmanlık,Psikiyatri = Psychiatry ; Uyuşturucu Alışkanlığı ve Alkolizm = Drug Addiction and Alcoholism," onclick=tezDetay('qiRK9sCT7NpPlBJPlEdfdw','su_MFih8ADbelZ_amvq75g')"
334196,FERİDE PINAR ALTAY,2013,Diyabetik nefropati ve D vitamini arasındaki ilişki<br><span style='font-style: italic';>The association of vitamin D with diabetic nephropahty,Ankara Üniversitesi,Tıpta Uzmanlık,Endokrinoloji ve Metabolizma Hastalıkları = Endocrinology and Metabolic Diseases," onclick=tezDetay('q5AxuTOy94tzyou_3LBHoQ','Nz0dpx5HoxIfYSMaSo3LQg')"
419864,SEÇKİN ÖZGÜL,2016,Hepatit B virüs ve hepatit D virüs ilişkili hepatoselüler karsinomlu hastalarda RS17401966 tek nükleotid polimorfizmi varlığı ve hepatoselüler karsinom gelişimindeki etkisi<br><span style='font-style: italic';>Presence of RS17401966 single nucleotide polymorphism in patients with hepatitis B virus and hepatitis D virus related hepatocellular carcinoma and influence in the development of hepatocellular carcinoma,Ankara Üniversitesi,Tıpta Uzmanlık,Gastroenteroloji = Gastroenterology," onclick=tezDetay('YojOb8Ym8Bkwa4X7uqAnGQ','xUnnOO0-X-lEc1oNSUktXQ')"
415008,SEHER YÜKSEL,2014,Kolorektal karsinoma ve öncü lezyonlarında mikrosatellit instabilitesinin immünhistokimyasal olarak değerlendirilmesi<br><span style='font-style: italic';>Immunohistochemical evaluation of microsatellite instability in colorectal carcinoma and precursor lesions of colorectal carcinoma,Ankara Üniversitesi,Tıpta Uzmanlık,Patoloji = Pathology," onclick=tezDetay('cibBiynr-1F8-ZFNQnR0Iw','S93xZMG7sjuJ4anHoxge1Q')"
326497,ZEYNEP KÖKEN BAYINDIR,2012,Farklı kinolon grubu antibiyotiklerin fekal florada kinolon dirençli escherıchıa coli seleksiyonu üzerine etkisi<br><span style='font-style: italic';>The effect of different groups of qui nolones on selection of quinolone resistant escherichia coli in the fecal flora,Ankara Üniversitesi,Tıpta Uzmanlık,Klinik Bakteriyoloji ve Enfeksiyon Hastalıkları = Clinical Microbiology and Infectious Diseases," onclick=tezDetay('K4v-okcFzgzltY873saS5Q','LBpij8yhNEdYzfATj1NsTQ')"
394210,ESRA BULUT,2015,"İnflamatuar barsak hastalığı olan bireylerde hastalık tipi, aktivitesinin cinsel yaşantı ve hayat kalitesi üzerine etkisi<br><span style='font-style: italic';>The influence of disease type and activity to sexual life and health quality in inflammatory bowel disease",Ankara Üniversitesi,Tıpta Uzmanlık,Gastroenteroloji = Gastroenterology," onclick=tezDetay('Y9yCCZo00vmyDFtf1VfTCw','-VawvS3GHKP0YIrnVxChgQ')"
386629,TUĞBA YURDAKUL,2015,"Sıfır-bir yaş bebek sahibi annelerde, doğum sonrası depresif semptom taramasında; Edinburgh Doğum Sonrası Depresyon Ölçeği ile Hasta Sağlık Anketi\'nin karşılaştırılması<br><span style='font-style: italic';>Comparison of Edinburgh Postnatal Depression Scale (EPDS) and Patient Health Questionnaire (PHQ-9) to screen postpartum depressive symptoms among mothers of 0-1 year old babies",Ankara Üniversitesi,Tıpta Uzmanlık,Aile Hekimliği = Family Medicine," onclick=tezDetay('C4oyl81tMrihqZU4mf_mhQ','Yw3-FMvW-Gu3t_ieUeeq7Q')"
493445,GÜLER İSRAFİLOVA,2018,Geç folliküler ve luteal fazda başlanan ovulasyon indüksiyon protokollerinde oosit ve embriyo kalitesinin standart protokollerle karşılaştırılması<br><span style='font-style: italic';>Comparison of oocyte and embryo quality in late follicular and luteal phase start ovari̇an stimulation cycles with conventional start ovarian stimulation cycles,Ankara Üniversitesi,Tıpta Uzmanlık,Kadın Hastalıkları ve Doğum = Obstetrics and Gynecology," onclick=tezDetay('bcB0w2xaB3xT9Zb2O4Rq9w','mi6ADLxndPDWzq-Ngo3Urw')"
386648,GÜNER KILIÇ,2015,Hepatit B enfeksiyonuna bağlı sirotik hastalarda uzun süreli oral antiviral ajan kullanımının hastalık seyrine etkisi<br><span style='font-style: italic';>Long-term using of oral antiviral agent efficacy of disease progression in the patient of cirrhotic depend on Hepatitis B  infection,Ankara Üniversitesi,Tıpta Uzmanlık,Gastroenteroloji = Gastroenterology," onclick=tezDetay('IAFmLLgVH7rRiSBtCEpo5A','pcq9beymPPxkK1aP_5-coQ')"
406937,PARVİZ HACİYEV,2015,2 CM\'den küçük böbrek taşlarının tedavisinde retrograd intrarenal cerrahi ve mikro perkütan tekniklerinin karşılaştırılması<br><span style='font-style: italic';>Micropercutaneous nephrolithotomy (microperc) vs retrograde intrarenal surgery for the management of ≤2 CM renal stones,Ankara Üniversitesi,Tıpta Uzmanlık,Üroloji = Urology," onclick=tezDetay('8j0-Zg7VGvcnm35-0V0gsw','mDyKGcwsw_XHQSA8qZapJg')"
535618,AHKAM GÖKSEL KANMAZ,2014,"Doğum esnasında annedeki preinflamatuar belirteçlerin doğum süresi, şekli ve postpartum komplikasyonları değerlendirmedeki yeri<br><span style='font-style: italic';>Evaluation of labor time, type and postpartum complications with proinflammatory markers taken during term labor",Ankara Üniversitesi,Tıpta Uzmanlık,Kadın Hastalıkları ve Doğum = Obstetrics and Gynecology," onclick=tezDetay('Y_XAKvx_Eh5_bHqp3ykr3A','Y3TkbkMDGH-OIScChz1Y4A')"
326485,ONUR ÖZGÜRAL,2012,Erken tavuk embriyolarında levetirasetamın orta hat kapanmasına etkisi<br><span style='font-style: italic';>Erken tavuk embriyolarında levetirasetamın orta hat kapanmasına etkisi,Ankara Üniversitesi,Tıpta Uzmanlık,Nöroşirürji = Neurosurgery," onclick=tezDetay('qCXJqFUefHNQJw43wQH4aw','tU4hk-SZxHLuczsL1AQjcw')"
326528,OĞUZ HAN EDEBAL,2012,Prenatal dörtlü tarama testinde down sendromu riski eşik değerin üstünde çıkan gebelerin serumlarında oksidan/antioksidan durumun araştırılması<br><span style='font-style: italic';>Investigation of oxidant/antioxidant status in sera from pregnant at high risk of carrying a down syndrome?affected fetus according to prenatal quadruple test,Ankara Üniversitesi,Tıpta Uzmanlık,Biyokimya = Biochemistry," onclick=tezDetay('AlkfWdAhcim59cbRg2KjqA','3zlCKdt3HC6bOCrU-4iz8w')"
314480,CUMHUR BAŞARAN,2012,Kraniyotomilerde kafatası sinir bloğu uygulanan ve uygulanmayan hastalarda metoprololün bis skoru ve hemodinamik yanıt üzerine etkileri<br><span style='font-style: italic';>The effect of metoprolol on bis score and the hemodynamic response in patients undergoing craniotomy with or without scalp nerve block,Ankara Üniversitesi,Tıpta Uzmanlık,Anestezi ve Reanimasyon = Anesthesiology and Reanimation," onclick=tezDetay('N-2QWZXBkKAU3EvnqLLVZw','ltLyZDwY1KxQKqGgi7bF4A')"
365164,ÇAĞATAY UĞUR,2013,Otizm spektrum bozukluklarında vitamin D düzeyleri<br><span style='font-style: italic';>Vitamin D levels in children with autism spectrum disorders,Ankara Üniversitesi,Tıpta Uzmanlık,Psikiyatri = Psychiatry," onclick=tezDetay('BwAVI-4uBx4huB5uArgOMQ','vnEBjL3lccum65RALui7OA')"
406939,ÖZGE DUR,2015,Primer immün yetmezlik tanısında 10 uyarıcı işaretin önemi<br><span style='font-style: italic';>Thei̇mportance of 10 warni̇ng si̇gns i̇n the di̇agnosi̇s of pri̇mary i̇mmunodefi̇ci̇enci̇es,Ankara Üniversitesi,Tıpta Uzmanlık,Çocuk Sağlığı ve Hastalıkları = Child Health and Diseases," onclick=tezDetay('d8Yey8w9SLMxuWcPQCZKVA','i3Eidc2FpETbRFvQeSTqGQ')"
326501,CİHAN AYDIN,2012,Iskemi reperfüzyon hasarı iloprost ve proantosiyanidin ile önlenebilir mi hayvan modelinde bir alt ekstremite iskemi çalışması<br><span style='font-style: italic';>İskemi reperfüzyon hasari iloprost ve proantosiyanidin ile önlenebilir mi hayvan modelinde bir alt ekstremite iskemi çalişmasi,Ankara Üniversitesi,Tıpta Uzmanlık,Genel Cerrahi = General Surgery," onclick=tezDetay('QRQtmUoIHOVs6LVYzr5JLg','MJN4_jId9YMn9AcTm5YZ5g')"
525389,HASAY GULİYEV,2018,Kafa tabanı cerrahisinde navigasyon kullanımı<br><span style='font-style: italic';>Use of navigation system in skull base surgery,Ankara Üniversitesi,Tıpta Uzmanlık,Kulak Burun ve Boğaz = Otorhinolaryngology (Ear-Nose-Throat)," onclick=tezDetay('qV1ZMxujQZbbYcwpTiaa9Q','o6Ufc069c6q-9Px8a_vkvg')"
384200,ALPER KAHRAMAN,2014,İn vitro fertilizasyon-intrasitoplazmik sperm enjeksiyonu ile elde edilen gebeliklerde perinatal sonuçlarin değerlendirmesi<br><span style='font-style: italic';>Assesment of perinatal outcomes of pregnancies conceived by in vitro fertilization-intracytoplasmic sperm injection,Ankara Üniversitesi,Tıpta Uzmanlık,Kadın Hastalıkları ve Doğum = Obstetrics and Gynecology," onclick=tezDetay('3rlluHZoIkBUJITw9gU5tw','TcTWHKbyhTumPn3dZfrfYg')"
384291,İSMAYIL GOYUSHOV,2014,"Radial arter kullanılarak koroner işlem yapılan hastalarda erken dönemde, kısa süreli ulnar arter basısının işleme bağlı gelişen radial arter tıkanması üzerine etkisi ve güvenilirliği<br><span style='font-style: italic';>Safety and effect of transient ulnar artery compression to acute radial artery occlusion after transradial catheterization in short term",Ankara Üniversitesi,Tıpta Uzmanlık,Kardiyoloji = Cardiology," onclick=tezDetay('QaoNY9BhK9t580c1_cnrQw','K3X6anAS6yZ4hXB_xfKCFA')"
433416,MALAHAT MUSAYEVA,2016,EGFR mutasyonu bulunduran ve bulundurmayan akciğer karsinoması olgularında morfolojik ve immünhistokimyasal özellikler<br><span style='font-style: italic';>Morphological and immunohistochemical features of lung carcinoma with or without EGFR mutation,Ankara Üniversitesi,Tıpta Uzmanlık,Patoloji = Pathology," onclick=tezDetay('LdddVV9NTgJqhqGsA9Wsrg','xPcHai0lfrdqpLAJza6P3w')"
492675,YUSUF GÜREL,2018,Konuşma bozukluğu olan / kardeşlerinde özgül öğrenme bozukluğu öyküsü olan okul öncesi çocukların sağlıklı kontrollerle erken okur-yazarlık test puanları açısından karşılaştırılması<br><span style='font-style: italic';>Comparison of pre-school children with speech disorder/ pre-school children whose siblings have a history of learning disorder with healthy controls with respect to early literacy scores,Ankara Üniversitesi,Tıpta Uzmanlık,Psikiyatri = Psychiatry," onclick=tezDetay('J1T47JbxbSBHywn5rqMwnQ','KsSsw63Zgg_zkRb1qirwLA')"
480890,ASLI HORASAN FİLİZER,2017,"Videolaringoskopa adaptasyon sürecinin, iki farklı eğitim şekliyle karşılaştırılması<br><span style='font-style: italic';>Comparison of videolarginogoscope adaptation process with two different education methods",Ankara Üniversitesi,Tıpta Uzmanlık,Anestezi ve Reanimasyon = Anesthesiology and Reanimation," onclick=tezDetay('7VUNm1f3lxoXr_Wf5D_2SA','KuZpL9AWgv07zUae8A6FcQ')"
448769,CİHAN EROL,2016,Hepatit C virus enfeksiyonuna bağlı dekompanse sirotik ve karaciğer nakil hastalarında sofosbuvir/ledipasvir tedavisinin etkinliği ve tolerabilitesi<br><span style='font-style: italic';>Efficacy and safety of the sofosbuvir/ledipasvir treatment in chc-related decompensated cirrhosis and recurrent HCV infection after liver transplantation,Ankara Üniversitesi,Tıpta Uzmanlık,Gastroenteroloji = Gastroenterology ; Klinik Bakteriyoloji ve Enfeksiyon Hastalıkları = Clinical Microbiology and Infectious Diseases," onclick=tezDetay('wXvp-_jKxA1Qq7Q0h0_vuw','ZV0WC9tZGo_l0RV_V0GfQw')"
384221,ELİF DUMAN,2014,Özofagus kanseri tanı ve evrelendirilmesinde PET-BT\'nin yeri ve önemi<br><span style='font-style: italic';>The role of PET-CT in the diagnosis and staging of eusophageal cancers,Ankara Üniversitesi,Tıpta Uzmanlık,Göğüs Kalp ve Damar Cerrahisi = Thoracic and Cardiovascular Surgery," onclick=tezDetay('kAi6KKxdGHijmzD8R7hxQQ','P-0LAEDhyqf4avCzg0CDtg')"
525409,BURAK BAHADIR,2018,Tenoksikamın orta hat kapanmasına etkisi: Erken dönem tavuk embriyo modeli<br><span style='font-style: italic';>The effect of tenoxicam on closure of the midline: Early chicken embryo model,Ankara Üniversitesi,Tıpta Uzmanlık,Nöroşirürji = Neurosurgery," onclick=tezDetay('myK65GX9XneyfsjBu8Q8zQ','l9NqMRDi-BolUw31aL_zKw')"
443683,FİDAN DÜNDAR,2016,Huzursuz bacak sendromu ve sigara<br><span style='font-style: italic';>,Ankara Üniversitesi,Tıpta Uzmanlık,Nöroloji = Neurology," onclick=tezDetay('mUt4Z8iODBm2-pPc0JpJhw','n5_eaVKmSOfHLRlAzu5AYw')"
314451,YÜKSEL ÜRÜN,2012,Trastuzumab ile tedavi edilen meme kanserli hastalarda kardiyotoksisitenin erken belirlenmesinde serum biyobelirteçlerinin rolü<br><span style='font-style: italic';>The role of serum biomarkers in early detection of trastuzumab related carditoxicity in patients with breast cancer,Ankara Üniversitesi,Tıpta Uzmanlık,Onkoloji = Oncology," onclick=tezDetay('1sft6wl-y4xJUG7U5h65iA','eqzZBhVLI28yzhau4c0jEw')"
536143,AYŞE CEREN DOĞANÖZÜ,2018,Laparoskopik kolorektal cerrahi geçiren hastalarda epidural analjezinin PVI (pleth variability index)ile hedefe yönelik sıvı tedavisi üzerine etkisi<br><span style='font-style: italic';>Effect of epidural analgesia on goal-directed fluid therapy guided with PVI (pleth variability index) in patients who underwent laparoscopic colorectal surgery,Ankara Üniversitesi,Tıpta Uzmanlık,Anestezi ve Reanimasyon = Anesthesiology and Reanimation," onclick=tezDetay('GqQnPkc2o4efvOT6LwAsQQ','aZ-_poU2hVK9aHHBTsWkRQ')"
525383,TUĞÇE ERTÜRK YILMAZ,2018,Kaposi sarkomu\'nun deri lezyonlarında dermatoskopik bulgular ve dermatopatolojik korelasyonları<br><span style='font-style: italic';>Dermatoscopic findings of kaposi\'s sarcoma and dermatopathological correlations,Ankara Üniversitesi,Tıpta Uzmanlık,Dermatoloji = Dermatology," onclick=tezDetay('0f92A1Y7eKvA1sgB-jKoeg','IJMNmkR1mfyvjSJ9eV_DVQ')"
468976,DUYGU KABA,2017,DSM-5 tanı kriterlerine göre erken çocukluk döneminde otizm spektrum bozukluğu<br><span style='font-style: italic';>Evaluation of DSM-5 autism spectrum disorder diagnostic criterias in early childhood,Ankara Üniversitesi,Tıpta Uzmanlık,Psikiyatri = Psychiatry," onclick=tezDetay('eflvFO-rXr9OiOu5c3m_FQ','DQKEXZJz7Gj5p18OKaJU2Q')"
448789,SHAHRIYAR FATULLAYEV,2016,Üst ve alt ekstremite kemik tümörlerinde ekstremite koruyucu cerrahi kapsamında vaskülarize fibula grefti ile rekonstrüksiyon sonrasında kaynama sürelerinin karşılaştırılmalı değerlendirilmesi<br><span style='font-style: italic';>Evaluation of upper and lower extremity bone tumors compared with union times after reconstruction with vascularized fibular graft in the context of limb salvage surgery,Ankara Üniversitesi,Tıpta Uzmanlık,Ortopedi ve Travmatoloji = Orthopedics and Traumatology," onclick=tezDetay('DozR5rbV1viM68dVqneGqA','j5RbL-C0VbOKMdnh6fgMNw')"
468982,ILKIN HASHIMOV,2017,Transplantasyon sonrası canlı karaciğer donörlerinde sağlıkla ilgili yaşam kalitesinin değerlendirilmesi<br><span style='font-style: italic';>Evaluation of healthy quality of life in living liver donors after transplantation,Ankara Üniversitesi,Tıpta Uzmanlık,Genel Cerrahi = General Surgery," onclick=tezDetay('qilmC-KLnWnM04lEe059Mw','a_BSIYe5dNeFSHC3VW2szg')"
384282,GÜRBEY SÖĞÜT,2014,Aterosklerotik kalp hastalığı olanlarda TSH-aspirin direnci ilişkisi<br><span style='font-style: italic';>The relationship between TSH and aspirin resistance in atherosclerotic heart disease,Ankara Üniversitesi,Tıpta Uzmanlık,Kardiyoloji = Cardiology," onclick=tezDetay('l1j8D36uYrb5ZLzmT3L__g','YPmx2juwbEh68f4k6hJHYg')"
536007,ESEN COŞKUN,2018,Periton diyaliz hastalarında beslenme durumunun belirleyicileri<br><span style='font-style: italic';>Determinants of nutritional status in peritoneal dialysis patients,Ankara Üniversitesi,Tıpta Uzmanlık,Nefroloji = Nephrology," onclick=tezDetay('AvFDfZnAH4KvbybMHXZ8-w','fJFV4Zqh9a5klFj-YJC7bA')"
384293,MEHMET ÇAVUŞ,2014,Ekstremite liposarkomlarında prognozu etkileyen faktörlerin değerlendirilmesi ve uzun dönem takip sonuçlarımız<br><span style='font-style: italic';>Evaluation of the prognostic factors in extremity liposarcomas  and our long-term follow-up results,Ankara Üniversitesi,Tıpta Uzmanlık,Ortopedi ve Travmatoloji = Orthopedics and Traumatology," onclick=tezDetay('z1qnKOOpiPp4U0_AaEe5Rg','D6SIjNYjwb3nUoeoRu8iAw')"
384248,SEDA BAHSİ,2014,"Amniyon sıvı incelenmesinde down sendromu tespit edilmiş gebelerde oksidan/antioksidan sistem, IL-6 ve IL-10 parametrelerinin değerlendirilmesi<br><span style='font-style: italic';>Evaluation of oxidant / antioxidant system parameters, IL-6 and IL-10 levels  in amniotic fluid of pregnancies with down sydrome",Ankara Üniversitesi,Tıpta Uzmanlık,Biyokimya = Biochemistry," onclick=tezDetay('Lf0rwB13T_heHQQ8EJwRrw','02LIQC-KbynbYnTpKgUy0Q')"
386630,AYNUR ACIBUCA,2015,Atriyal fibrilasyon ablasyonu yapılan hastalarda nörolojik sonuçlar ve bu sonuçların nöron spesifik enolaz düzeyleri ile ilişkisi<br><span style='font-style: italic';>Correlation of neuron-specific enolase levels with neurological outcomes in patients undergoing catheter ablation for atrial fibrillation,Ankara Üniversitesi,Tıpta Uzmanlık,Kardiyoloji = Cardiology," onclick=tezDetay('94-tg5M0qIC_2ZWJINzIvw','mSp5NFpqzK7GWMuKfcZdig')"
525393,MEHMET FATİH KAĞAN DEĞİRMENCİ,2018,Behçet üveiti olan hastalarda mikroperimetri ve optik koherens tomografi bulgularının değerlendirilmesi<br><span style='font-style: italic';>Evaluation of microperimetry and optical coherence tomography findings in patients with behcet uveitis,Ankara Üniversitesi,Tıpta Uzmanlık,Göz Hastalıkları = Eye Diseases," onclick=tezDetay('Qr3zRrKoLJP4NVHJyA0UFA','eLIy8gDPOZpl-yFsRpkOwQ')"
365172,RİFAT SERAV İLHAN,2014,Bipolar tip-II bozuklukta ötimik dönemde psikososyal işlevselliğin klinik ve bilişsel yordayıcıları<br><span style='font-style: italic';>Clinical and cognitive predictors of psychosocial functioning in euthymic period of bipolar disorder type II patients,Ankara Üniversitesi,Tıpta Uzmanlık,Psikiyatri = Psychiatry," onclick=tezDetay('ifWN0sgKgqrMn1k8zOoSew','iD_tqHlkUEuE7gPWWj9pWQ')"
314447,AYŞEGÜL GÜRSOY ÇORUH,2012,Tiroid nodüllerinde ultrasonografi ve renkli doppler ultrasonografi bulguları<br><span style='font-style: italic';>Ultrasonography and color doppler ultrasonography results for thyroid nodules,Ankara Üniversitesi,Tıpta Uzmanlık,Radyoloji ve Nükleer Tıp = Radiology and Nuclear Medicine," onclick=tezDetay('mqNKXTUTG8oSvWBt0Y2-tw','TIfJnlo5Vr0g94VR7MTnUw')"
