tez_no,yazar,yıl,title,üniversite,tez_türü,konu,tez_detay
266821,SADIK ÇAYAN MULAMAHMUTOĞLU,2010,Altmışbeş yaş ve üstü popülasyonda inflamasyon ile arteryel sertliğin ilişkisi<br><span style='font-style: italic';>The relationship between arterial stiffness and inflammation in patients over sixty-five years old,Ankara Üniversitesi,Tıpta Uzmanlık,Geriatri = Geriatrics ; Kardiyoloji = Cardiology," onclick=tezDetay('Y9h-kUAWrfx0Sj8RQL993w','6aQ2TEKUEQlbwDmsNUS6HA')"
306320,OLCAY YAKA,2011,Ventilatör ilişkili pnömoni şüphesi olan hastalarda kantitatif trakeal aspirat kültürü ile kör bronkoalveoler lavaj kültürünün tanısal uyumu<br><span style='font-style: italic';>The diagnostic adaptation of quantitative tracheal aspirate culture and blind bronchoalveolar lavage culture in patients with suspected ventilator-associated pneumonia,Ankara Üniversitesi,Tıpta Uzmanlık,Anestezi ve Reanimasyon = Anesthesiology and Reanimation," onclick=tezDetay('eRPLpI9DpWhDFXeS4k2fqQ','DgiWRnQzVnciuVjLIHi0nQ')"
225990,ARİF YAVUZ AKSOY,2007,Akut pankreatit olgularında şiddetin belirlenmesinde prokalsitonin strip test ile Ranson ve APACHE-II skorlarının karşılaştırması<br><span style='font-style: italic';>The comparison of procalcitonin strip test with Ranson and APACHE-II scores in predicting the severity of acute pancreatitis,Ankara Üniversitesi,Tıpta Uzmanlık,Genel Cerrahi = General Surgery," onclick=tezDetay('o4qvA5ziv9ci0KAPVO3OJA','NojeyqqFk4eB75np60Im1A')"
225985,TOGAY MÜDERRİS,2007,Güvenli frontal reses diseksiyonu için endoskopik cerrahi anatomi<br><span style='font-style: italic';>Endoscopic surgical anatomy of frontal recess for safe frontal sinusotomy,Ankara Üniversitesi,Tıpta Uzmanlık,Anatomi = Anatomy ; Kulak Burun ve Boğaz = Otorhinolaryngology (Ear-Nose-Throat)," onclick=tezDetay('n6keRaB-Fs2CDYCzgUXnkg','ko95RJ95RdJuofMUuleOkA')"
175208,ADAM GYEDU,2007,Aksiler lenf nodu diseksiyonu yapılmış olan hastalarda postoperatif dönemde oluşabilecek kas denervasyonunun değerlendirilmesi<br><span style='font-style: italic';>Evalution of muscle denervation in patients who have undergone axillary lymph node dissection,Ankara Üniversitesi,Tıpta Uzmanlık,Genel Cerrahi = General Surgery," onclick=tezDetay('v-viav6yhMIB6HnLP0Jx1w','g50Yq_nSAM2MEZUMmyQHTg')"
175230,M. GHASEM SHARİFİ MALAYER,2007,Trafik kazalarında ruhsal problemler ve intihar düşüncelerinin rolü<br><span style='font-style: italic';>The role of the psychiatric problems and suicidal ideation in traffic accidents,Ankara Üniversitesi,Tıpta Uzmanlık,Psikiyatri = Psychiatry," onclick=tezDetay('L58HaG4WcxxuqTRD2F6rig','evYIBJrlaiRPFhmSbtU3jw')"
175246,SİMEL KENDİR,2007,Parietal penceredeki sulkal ve gyral yapıların kraniumdaki topografik noktalara göre konumu<br><span style='font-style: italic';>Sulcal and gyral structures in parietal window and their locations in relation with cranial topografic points,Ankara Üniversitesi,Tıpta Uzmanlık,Anatomi = Anatomy," onclick=tezDetay('VFw7wwFVe63mbVE-eocJ_w','vBUdnKc6Ph4hdGijIGQ6cw')"
260348,ESRA OKAN,2009,"Major abdominal cerrahilerde epidural veya intravenöz analjezi tekniklerinin postoperatif ağrı, solunum fonksiyon testleri ve sistemik komplikasyonlar açısından karşılaştırılması<br><span style='font-style: italic';>The comparision of the effects of epidural and intravenous analgesia techniques on postoperative pain, pulmonary function tests and systemic complications in major abdominal surgery",Ankara Üniversitesi,Tıpta Uzmanlık,Anestezi ve Reanimasyon = Anesthesiology and Reanimation," onclick=tezDetay('hwICgzhrrvUmmBkpTqlSCg','T-ygHVRz_wmkXabnxX-PmQ')"
271656,SEVİL TİMUROĞLU,2010,Laparoskopik kolesistektomi sonrası midazolamın bulantı kusma üzerine etkisi<br><span style='font-style: italic';>The effect of midazolam on nausea and vomiting following laparoscopic cholecystectomy,Ankara Üniversitesi,Tıpta Uzmanlık,Anestezi ve Reanimasyon = Anesthesiology and Reanimation," onclick=tezDetay('Qc9-cP48AdT3G-OHSDq8ew','-V5v0ich94VX-ZSYRr5cHQ')"
260361,MEHMET NAMUSLU,2009,Sigara kullanımının aktif sporcuların plazma oksidan /antioksidan sistemi üzerine olan etkilrinin araştırılması ve taze portakal suyunun sigara kaynaklı oksidasyon reaksiyonları üzerine olan etkilerinin belirlenmesi<br><span style='font-style: italic';>Effects of orange juice consumption on plasma oxidant and antioxidant parameters in smoker and nonsmoker athletes,Ankara Üniversitesi,Tıpta Uzmanlık,Biyokimya = Biochemistry," onclick=tezDetay('9BZIYz0j-2Cw2XiaZgCSEA','aiwVDKiK_IhqbF8f6avywQ')"
298751,SERPİL ERGÜLÜ EŞMEN,2010,Renal transplant alıcılarında arteriyel sertliği etkileyen faktörler<br><span style='font-style: italic';>Arterial stiffness in living related kidney transplant recipients and affecting factors,Ankara Üniversitesi,Tıpta Uzmanlık,Nefroloji = Nephrology," onclick=tezDetay('4s1fxPU4rqwyouDgEokHjg','wSWzPpzGg8egzb_aYi7SkQ')"
175202,FATİH OĞUZ ÖNDER,2006,Sıçanlarda oluşturulan deneysel akut etanole bağlı hepatotoksisite modelinde karaciğerde peroksizom proliferatörünce aktive edilen reseptör alfa (PPARa) ekspresyonunun serum tümör nekrozis faktör alfa (TNFa) seviyesi ile olan ilişkisi<br><span style='font-style: italic';>Relation of serum TNFa and hepatic expression pf PPARa in acute alcohol toxicty model in rats,Ankara Üniversitesi,Tıpta Uzmanlık,Endokrinoloji ve Metabolizma Hastalıkları = Endocrinology and Metabolic Diseases ; Gastroenteroloji = Gastroenterology," onclick=tezDetay('qSLdIZDx9AjSGaqpct_0Tw','JyMCkaYQbFOZs_YiLM0GqQ')"
175209,CEMAL ULUSOY,2007,Meme kanserinde bireysel risk öngörüsü; gail modeli\'nin türkiyede uygulanması<br><span style='font-style: italic';>Individual risk assessment in breat cancer; application of gail model in Turkey,Ankara Üniversitesi,Tıpta Uzmanlık,Genel Cerrahi = General Surgery," onclick=tezDetay('cM9OLI8Fk2v4TPFH1ELjNQ','V5eCGzID7L2p4q-5rhyP7g')"
175231,İBRAHİM AKALIN,2007,Lösemik hematopoezda anjiotensin dönüştürücü enzim (ACE) insersiyon/delesyon (I/D) gen polimorfizmi<br><span style='font-style: italic';>Angiotensin converting enzyme (ACE) insersion/deletion (I/D) gene polymorphisms in leukemic hematopoiesis,Ankara Üniversitesi,Tıpta Uzmanlık,Hematoloji = Hematology," onclick=tezDetay('uxpsL-i8kzPOe-cVcBff2A','6VxHpmuuMhzZrCDI4Z3Q5Q')"
271644,FİGEN ÖZTÜRK MAMİK,2010,Konjenital idiopatik skolyozlu çocuk ve adölesanlarda posterior füzyon cerrahisi sonrası postoperatif analjezi takibi<br><span style='font-style: italic';>Postpoperative analgesic evaluation on posterior fusion operation of congenital idiopatic scoliosis on adolescent and children,Ankara Üniversitesi,Tıpta Uzmanlık,Anestezi ve Reanimasyon = Anesthesiology and Reanimation," onclick=tezDetay('NDGOAbfVxZ74yY2UVtkPMg','L4x7ew7D2IBhFCiEfGczlQ')"
266840,HÜLYA DENİZ,2010,Kronik obstruktif akciğer hastalığında radyolojik tüberküloz sekellerinin yaygınlığı ve bu sekelleri taşıyan hastaların klinik özelliklerinin değerlendirilmesi<br><span style='font-style: italic';>Frequency of radiologic sequela of prior tuberculosis in COPD and clinical evaluation of patients with this sequelaes.,Ankara Üniversitesi,Tıpta Uzmanlık,Göğüs Hastalıkları = Chest Diseases," onclick=tezDetay('xeDnlPgl66AWoJECpWE9uw','EZ24zwQQz2tdWAyxrhjcHQ')"
266831,H. ERSİN ADIGÜZEL,2010,Revizyon kalça protezi uygulamalarımız ve değerlendirilmesi<br><span style='font-style: italic';>Our clinical revision total hip arthroplasty patients and their evaluation,Ankara Üniversitesi,Tıpta Uzmanlık,Ortopedi ve Travmatoloji = Orthopedics and Traumatology," onclick=tezDetay('Fc8o1wVQjwU9QnEQTg1G1A','poIBRSW-8zLYEnMwXauuww')"
260379,MEHMET BAYRAM,2009,Bölünmüş doz platin içeren kemoterapi tedavileri planlanmış ileri evre küçük hücreli dışı akciğer kanserli olgularda tedaviye bağlı olası elektrolit bozuklukları ve klinik önemi<br><span style='font-style: italic';>Incidence and clinical siginifance of electrolyte abnormalities resulting from chemotherapy in advanced non small cell lung cancer patiens receiving divided doses of cisplatin containing chemotherapy,Ankara Üniversitesi,Tıpta Uzmanlık,Onkoloji = Oncology," onclick=tezDetay('9t4S9Pq1BfTnDCe8tOT_vg','W04zYrKgRx9MqERLSoFlcA')"
306346,SEÇİL KEPİL ÖZDEMİR,2011,Polene duyarlı allerjik rinitli hastalarda mevsim öncesi allergoid immünoterapinin klinik ve immünolojik etkileri<br><span style='font-style: italic';>Clinical and immunological effects of preseasonal grass pollen allergoid immunotherapy in patients with allergic rhinitis,Ankara Üniversitesi,Tıpta Uzmanlık,Allerji ve İmmünoloji = Allergy and Immunology," onclick=tezDetay('WYEVElVuKH1fuE0boqHfpw','5y2bLtI2KADkli8yX4Xn4w')"
266791,MEHMET ONUR ÇANDIR,2010,Suçiçeği komplikasyonları<br><span style='font-style: italic';>Complications of varicella,Ankara Üniversitesi,Tıpta Uzmanlık,Çocuk Sağlığı ve Hastalıkları = Child Health and Diseases," onclick=tezDetay('uoER5pgntb-ic64ceqWyUw','aARQ6J5DO5tFdvnAqYWCmQ')"
271643,VOLKAN BAYTAŞ,2010,"Sezaryen için spinal anestezide, kullanılan lokal anesteziğe eklenen iki farklı morfin dozunun kontrol grubu ile karşılaştırılarak değerlendirilmesi<br><span style='font-style: italic';>Evaluatin of two different morphine doses whıch are added to local anaesthetic used ın spinal anaesthesia for caesarean by comparıng wıth the control group",Ankara Üniversitesi,Tıpta Uzmanlık,Anestezi ve Reanimasyon = Anesthesiology and Reanimation," onclick=tezDetay('r-qFYJ89SFb-LyMPL0B2nQ','Vw4W26_iKl45KPntsdVj7w')"
271647,ESRA TEMELTAŞ,2010,"Fetal yara iyileşmesinin modulasyonu : Skarlı ve skarsız iyileşen fetal dokularda elastin, hyaluronik asit gibi ekstrasellüler matriks elemanlarının değerlendirilmesi<br><span style='font-style: italic';>Modulation of fetal wound healing: To evaluate extracellular matrix members such as elastin, hyaluronic acid in fetal wounds with scar tissue and without scar tissue",Ankara Üniversitesi,Tıpta Uzmanlık,Çocuk Cerrahisi = Pediatric Surgery," onclick=tezDetay('FapxV3bhv7pmZry254QrRQ','GjpSXHd5QMQ2tg9qnx217w')"
229960,BİLGE BÜLBÜL ŞEN,2009,Kontakt dermatitli olgularda topikal ilaçlara bağlı kontakt duyarlılığın değerlendirilmesi<br><span style='font-style: italic';>Evaluation of contact sensitivity to topical drugs in patients with contact dermatitis,Ankara Üniversitesi,Tıpta Uzmanlık,Dermatoloji = Dermatology," onclick=tezDetay('LlGcLss4RAb05pMBOVBDEg','lsUnGvLB_I0qKoB0QRH3Ig')"
266826,MOHAMMAD REZA AFRANCHEH,2010,Renovasküler hipertansiyon tedavisinde primer renal stent ve geçdönem takip sonuçları<br><span style='font-style: italic';>Primarry renal stent application and the results of long term follow-up as treatment for renovascular hpertension,Ankara Üniversitesi,Tıpta Uzmanlık,Radyoloji ve Nükleer Tıp = Radiology and Nuclear Medicine," onclick=tezDetay('bWmkV_yCYvOdKBFEfTUktQ','2BwQVqQr4mg8U2I5bptDrw')"
298788,BAVER ACAR,2011,Adölasan idiyopatik skolyozun cerrahi tedavisinde posteriordan intraoperatif geçici germe yöntemi ile tedavi sonuçları<br><span style='font-style: italic';>Surgical treatment of adolescent ıdiopathic scoliosis treatment results in ıntraoperative posterior stretching,Ankara Üniversitesi,Tıpta Uzmanlık,Ortopedi ve Travmatoloji = Orthopedics and Traumatology," onclick=tezDetay('Wf9UJ2kR1M5OSfH4R6nKVA','qbT9Bjez3d2KiY7KlTR4Kg')"
230454,DEMET HAFIZOĞLU,2008,Kronik böbrek yetmezliği ve nefrotik sendromlu hastalarda polisakkarit pnömokok aşısının etkinliğinin değerlendirilmesi<br><span style='font-style: italic';>Evaluation of polysaccharide pneumococcal vaccination efficacity in patients with nephrotic syndrome and chronic renal failure,Ankara Üniversitesi,Tıpta Uzmanlık,Çocuk Sağlığı ve Hastalıkları = Child Health and Diseases," onclick=tezDetay('LEcE9oIHZ27PJEYXauL8HQ','8DqmNJIOTkx7wzpJxqc2mA')"
266804,ONUR AYDINLI,2010,Ülseratif kolit ve irritabl barsak sendromlu hastalarda intestinal mast hücre değerlendirmesi<br><span style='font-style: italic';>Evaluation of intestinal mast cells the patients with ulcerative colitis and irritable bowel syndrome,Ankara Üniversitesi,Tıpta Uzmanlık,Gastroenteroloji = Gastroenterology," onclick=tezDetay('IjIR5kfYRjGeribaeGg3lA','xrfg7o2MuxY7ugYqcEjl5Q')"
298746,REŞAT DUMAN,2011,Farklı ambliyopi tiplerinde klinik seyir ve tedaviye cevap<br><span style='font-style: italic';>Clinical courses and treatment responses in various amblyopia types,Ankara Üniversitesi,Tıpta Uzmanlık,Göz Hastalıkları = Eye Diseases," onclick=tezDetay('gdXOTMqQRas0wh0He4KfIQ','Bb3HSUYl6zrj_zX4-BV5oA')"
260387,HATİCE GERMEN ÜNVERDİ,2009,"Kemiğin dev hücreli tümörlerinde histopatolojik prognostik kriterlerin belirlenmesi ve doku mikroarrey blokları üzerinde immünhistokimyasal CD117, Ki 67, c-Myc VE p53 ekspresyonlarının prognozla ilişkisinin araştırılması<br><span style='font-style: italic';>Histopathological and prognostic criteria in giant cell tumor of bone, and the relationship between the prognosis and immunohistochemical expression of CD117, Ki67, c-myc and p53 on tissue microarray blocks",Ankara Üniversitesi,Tıpta Uzmanlık,Patoloji = Pathology," onclick=tezDetay('lRw9qV3-YAqIdmRndd9qww','6WZiGlXxez6nUZPlx4IwXA')"
230449,MURAT GÖZÜKÜÇÜK,2008,"Polikistik over sendromlu kadınlarda adiponektin ve leptin düzeylerinin insülin rezistansı, vücut kitle indeksi, klinik ve laboratuar bulguları ile ilişkisi<br><span style='font-style: italic';>The relation of serum adiponectin and leptin levels with insulin resistance, body mass index, clinical and laboratory findings in women with polycystic ovary syndrom",Ankara Üniversitesi,Tıpta Uzmanlık,Kadın Hastalıkları ve Doğum = Obstetrics and Gynecology," onclick=tezDetay('ZQLZEWFvCx8XSMN9aN0RQQ','Ow3QmJ-au4xTDQBPNX9DsQ')"
260340,ÖMER FARUK AKÇA,2009,"Enkoprezis tanısı alan çocukların komorbid psikopatolojileri, aile özellikleri, anne-babaların kişilik özellikleri ve psikiyatrik belirtilerinin araştırılması<br><span style='font-style: italic';>Comorbid psychiatric disorders, parental psychiatric and temperamental features and family functioning of children with encopresis",Ankara Üniversitesi,Tıpta Uzmanlık,Psikiyatri = Psychiatry ; Çocuk Sağlığı ve Hastalıkları = Child Health and Diseases," onclick=tezDetay('XYCztwPCin1v7adn-B84xg','L7ODjlIoM1z7xsuE6NOvOw')"
260312,BURCU SAVRAN ŞAHİN,2009,Akciğer kanserinin intratorasik evrelemesinde multidedektör bilgisayarlı tomografi<br><span style='font-style: italic';>Multi-detector Computer Tomography for Intrathoracic Staging of Lung Cancer,Ankara Üniversitesi,Tıpta Uzmanlık,Radyoloji ve Nükleer Tıp = Radiology and Nuclear Medicine," onclick=tezDetay('H7_x_A-jokpIyLFe9VQh7w','fjvgmhc3Zd5JNyW-Iubfxg')"
230462,ŞENAY ALİEVA HASANOVA,2008,Konjonktiva tümörlerinde tanı ve tedavi<br><span style='font-style: italic';>Diagnosis and treatment in conjunctival tumors,Ankara Üniversitesi,Tıpta Uzmanlık,Göz Hastalıkları = Eye Diseases," onclick=tezDetay('UpmOsfPjhA5bTCl9-xngtQ','tBN7-XDQWu79oSDRUG0QhQ')"
298775,REŞAT MEHMET BAHA,2011,Günde tek doz verilen asetilsalisilik asidin farklı hasta popülasyonlarında gün içindeki etkinliğini değerlendirme<br><span style='font-style: italic';>Assessment of efficacy of single dose acetysalicylic acid during a day in different patient populations,Ankara Üniversitesi,Tıpta Uzmanlık,Kardiyoloji = Cardiology," onclick=tezDetay('XDT7E7lHbaZ4gm4l59r5sg','WCtVPBNqaFcOLZWxuBKQqw')"
266813,ALİ ERASLAN,2010,Glukozamin-sülfatın ön çapraz bağ rekonstrüksiyonu sonrası diz ağrısı ve fonksiyonu üzerine etkisi<br><span style='font-style: italic';>The effect of glucosamine-sulfate on knee pain and function after anterior cruciate ligament reconstruction,Ankara Üniversitesi,Tıpta Uzmanlık,Spor = Sports," onclick=tezDetay('lgPc1DBSXi98hv9z5-36tw','DmisaegNEXUYppK2kYfslQ')"
164321,MELTEM İLERİ AKÇABOY,2005,Tekrarlayan nörokardiyolojinik senkoplu çocuklarda kalp hızı değişkenliği<br><span style='font-style: italic';>Heart rate variability in children with recurrent neurocardiogenic syncope,Ankara Üniversitesi,Tıpta Uzmanlık,Çocuk Sağlığı ve Hastalıkları = Child Health and Diseases," onclick=tezDetay('rObxTBQL_Y_u5N4xJbY_ng','-W59YOfTonpkN_bcZOHyiQ')"
164337,ÖZLEM SARIŞEN,2005,Park Sağlık Ocağı bölgesinde yaşayan 40 yaş üzeri nüfusta SF-36 ölçeği ile yaşam kalitesi ölçümü ve hipertansiyon ile ilişkisi<br><span style='font-style: italic';>Evaluation of health related quality of life of over 40 year old people in Park Health Center region and its relation with hypertension,Ankara Üniversitesi,Tıpta Uzmanlık,Halk Sağlığı = Public Health," onclick=tezDetay('v9o9L5A_JHQ4lJ3QgNNr3Q','B_vSUfFQYu77JUQSt5Pp5g')"
164322,HÜLYA ÖZKAN ULU,2005,Ögmentasyon amacı ile kolosistoplasti ve prefabrik mesane uygulamasının mesane kontraktilitesine etkileri<br><span style='font-style: italic';>The effects of colocystoplasty and prefabricated urinary bladder techniques for auqmentation on urinary bladder,Ankara Üniversitesi,Tıpta Uzmanlık,Çocuk Cerrahisi = Pediatric Surgery," onclick=tezDetay('sk50IJRngEUXgsPyHmMJYA','2xtEDRkh2RS8woBzbRj4jg')"
164338,SABA KİREMİTÇİ,2005,Renal hücreli karsinoma tiplendirmesinde proliferasyon ve fenotipin yeri. Bunların prognoz ile olan ilişkisi -immünhistokimyasal çalışma-<br><span style='font-style: italic';>Renal cell carcinoma: Characterization of phenotype and proliferative activity -an immunohistochemical study-,Ankara Üniversitesi,Tıpta Uzmanlık,Patoloji = Pathology," onclick=tezDetay('7WSlr-rrHtg5xU6hj8M3_g','HXT1bkYqQZ5TJruOqECAew')"
164339,WASSİM DANDACHİ,2005,İlizarov sirküler eksternal fiksatörü uygulama sonuçlarımız<br><span style='font-style: italic';>Ilizarov applications and our results,Ankara Üniversitesi,Tıpta Uzmanlık,Ortopedi ve Travmatoloji = Orthopedics and Traumatology," onclick=tezDetay('shqdvmDI9FfiyqCav83JJw','cQfuajcrirwPHUWhdBJrzw')"
230440,SERHAN YILMAZ,2008,"Venöz yetmezliğin (Varis) cerrahi tedavisinde büyük safen venin ayak bileği-kasık arası çıkartılması (Stripping) ile diz-kasık arası çıkartılması yöntemlerinin hastaların semptomlar, yaşam kalitesi, nüks ve komplikasyonlar yönünden karşılaştırılması<br><span style='font-style: italic';>Comparison of ankle-groin great saphenous vein stripping and kneegroin saphenous vein stripping methods for symptoms, quality of life, recurrence and complications: A prospective randomized study",Ankara Üniversitesi,Tıpta Uzmanlık,Genel Cerrahi = General Surgery," onclick=tezDetay('bbfIJkO6ck4H8P7U8cBuEw','X5D42HQ7V4NpPyJvLOQyVA')"
164340,MEHMET ARMANGİL,2005,Kombine asetabulum kırıkları tedavisinde genişletilmiş triradiat yaklaşım<br><span style='font-style: italic';>Extensile triradite approach in management of combined acetabular fractures,Ankara Üniversitesi,Tıpta Uzmanlık,Ortopedi ve Travmatoloji = Orthopedics and Traumatology," onclick=tezDetay('nBnKuCqyMu3VHuEDn7Giaw','-w7Wsg_qHdfXoLB-eZp0Cw')"
164323,PERİHAN ERDOĞDU,2005,Total diz artroplastisi yapılan hastalarda postoperatif ağrı tedavisi amacı ile femoral sinir bloğunda sürekli infüzyon yönetimi ile ropivakaine adjuvan tramadol<br><span style='font-style: italic';>Continious femoral nerve block with ropivacaine and tramadol in patients undergoing total knee arthroplasty for postop- pain treatment,Ankara Üniversitesi,Tıpta Uzmanlık,Anestezi ve Reanimasyon = Anesthesiology and Reanimation," onclick=tezDetay('hWkAdI4otE3O967Jh8V5YA','LnkVlxFRfk7miQI1lFsgsg')"
164341,SİBEL SOYUPEK,2005,Akut inmede konvansiyonel BT ve perfüzyon BT görüntülemenin karşılaştırılması<br><span style='font-style: italic';>Comprasion of conventional CT and perfusion CT in acute stroke,Ankara Üniversitesi,Tıpta Uzmanlık,Radyoloji ve Nükleer Tıp = Radiology and Nuclear Medicine," onclick=tezDetay('vCC9wloyOgfH6LVyBPElUQ','Kcd-DEwn6tVxaVKarz5adg')"
164342,EBRU BOSTANOĞLU,2005,"Kolelitiazisli hastaların safra kesesi dokusu, safra sıvısı ve safra taşlarında Helicobacter pylori ve diğer mikroorganizmaların varlığının araştırılması<br><span style='font-style: italic';>Evaluation of the presence of Helicobacter pylori and other microorganisms in gallbladder tissue, bile and gallstones with cholelithiasis",Ankara Üniversitesi,Tıpta Uzmanlık,Mikrobiyoloji = Microbiology," onclick=tezDetay('YySJBVONo3sDrPJ5r1gkNg','6AUzC7GORHTBjtHFV01Dng')"
164324,SİNEM KÜÇÜKAKIN TOLU,2005,Jinekolojik operasyonlarda preemptif lornoksikamın postoperatif ağrı tedavisine etkileri<br><span style='font-style: italic';>The effects of preemptive lornoxicam on postoperative pain management in gynecological surgery,Ankara Üniversitesi,Tıpta Uzmanlık,Anestezi ve Reanimasyon = Anesthesiology and Reanimation," onclick=tezDetay('4UnzRGjMoMH9jt0Doa_JUQ','tvdPK-jyJP1CcHYJYnNDzA')"
164343,KEMAL MİNTAŞ,2005,Tinea pedis/onikomikoz etkeni olarak izole edilen mantarların tanısı ve tanıda direkt mikroskopi ile calcofluor white boyasının yeri<br><span style='font-style: italic';>Identification of dermatophytes isolated from tinea pedis and/our onycomycosis and importance of calcofluor white stain as a diagnostic method for dermatophytes,Ankara Üniversitesi,Tıpta Uzmanlık,Mikrobiyoloji = Microbiology," onclick=tezDetay('5cRh6XLX5tj-4LzypjwP7Q','Qso2vPTkUWp-Ohk9qdGBFg')"
164344,ÖZLEM GENÇ,2005,Kronik adenotosillitli olgularda Chylamydia pneumoniae varlığının çeşitli yöntemlerle araştırılması<br><span style='font-style: italic';>Investigation of Chylamydia pneumoniae with different methods in chronic adenotosillitis cases,Ankara Üniversitesi,Tıpta Uzmanlık,Mikrobiyoloji = Microbiology," onclick=tezDetay('JcH_f4G5nZn1wK5Tzi2CmQ','Mo08iODvlE1BdHoLhW_mpg')"
230455,FUAT EKİZ,2008,"Özofagus kanseri (Adenokarsinom), barrett özofagus ve kron?k özofajit gelişiminde metilentetrahidrofolat redüktaz polimorfizmlerinin (C677T, A1298C) önemi<br><span style='font-style: italic';>Methylenetetrahydrofolate reductase C677T, A1298C polymorphisms in patients with esophageal adenocarcinoma, Barrett?s esophagus and chronic esophagitis.",Ankara Üniversitesi,Tıpta Uzmanlık,Gastroenteroloji = Gastroenterology ; Onkoloji = Oncology," onclick=tezDetay('fekO9D5t8pw_cbiGbw6g4w','2h4jU4UDLKcX5FB88y9NmA')"
164325,BAŞAK ATABEY BİLGİN,2005,"Kardiyopulmoner bypass uygulanan erişkin hastalarda desfluran ve fentanil anestezisinin uyanıklık, farkında olma üzerinde etkilerinin karşılaştırılması ve bispektral indeks monitorizasyonunun etkinliği<br><span style='font-style: italic';>The comparison of the desflurane and fentanyl anesthesia on awareness in patients undergo",Ankara Üniversitesi,Tıpta Uzmanlık,Anestezi ve Reanimasyon = Anesthesiology and Reanimation," onclick=tezDetay('gtw3NIlqMdY51KS5JZdE5g','TCZal-9LZZGi5QE6tMR8IQ')"
164345,NURHAN ALBAYRAK,2005,İnsan ağız epitel hücresi ve insan ağız epitel hücre dizinin (KB) farklı miktarlardaki Streptococcus pyogenes\'e karşı bakterisidal etkisinin ve sitokin yanıtının araştırılması<br><span style='font-style: italic';>Evaluation of oral epithelial cells and oral epithelial cell line\'s (KB) bactericidal effect and cytokine response against different doses of Streptococcus pyogenes,Ankara Üniversitesi,Tıpta Uzmanlık,Mikrobiyoloji = Microbiology," onclick=tezDetay('r_VxYJ9B8wyRlWTJPSiD3g','BH64n9vW5J6gaE0MrFOIwg')"
260330,ZİNET GÜL ERSOY,2009,Kronik obstrüktif akciğer hastalığı akut atağında prokalsitoninin klinik önemi<br><span style='font-style: italic';>Clinical importance of procalcitonin in chronic obstructive pulmonary disease acute exacerbation,Ankara Üniversitesi,Tıpta Uzmanlık,Göğüs Hastalıkları = Chest Diseases," onclick=tezDetay('7B6z6nnrStZPCBVdi5pBDQ','giR-XeMo-5UMUCudkcXWuQ')"
229967,MAHMUT SERHAN AKKUŞ,2009,Normal ve preeklampsili gebeliklerde insan plasenta dokusundaki yapısal değişikliklerin incelenmesi<br><span style='font-style: italic';>Examination of the ultrastructural differences in human placental tissue in the healthy and preeclamptic pregnancies,Ankara Üniversitesi,Tıpta Uzmanlık,Histoloji ve Embriyoloji = Histology and Embryology," onclick=tezDetay('uosTQ0QOks4B5v9P5NCXuA','yhy2uG7-G69CfECGNRd-pw')"
230452,MEHPARE ÖZKAN,2008,Çocukluk çağı migren ve gerilim tipi baş ağrısında EEG\'nin ayırıcı tanıdaki önemi: eşlik eden voltaj supresyonu ve diğer EEG değişikliklerinin araştırılması<br><span style='font-style: italic';>The value of EEG in differantial diagnosis of pediatric migraine and tension type headaches: Evaluation for accompanying voltage supression and other EEG abnormalities,Ankara Üniversitesi,Tıpta Uzmanlık,Çocuk Sağlığı ve Hastalıkları = Child Health and Diseases," onclick=tezDetay('O1n9JvxxR7r9h8MWx8XPDw','MyB8Ef76YC9UkQmZQuh6dg')"
164346,ÖZGÜR HİLAL ERİNANÇ,2005,"Kolorektal karinogenezde TGF-beta smad arayolu, matriks metalloproteinazlar ve doku inhibitörleri ile ilişkisi<br><span style='font-style: italic';>The significance of TGF-beta/smad pathway in association with matrix metalloproteinases and their tissue inhibitors in adenoma-carcinoma sequence of the colorectum",Ankara Üniversitesi,Tıpta Uzmanlık,Patoloji = Pathology," onclick=tezDetay('gTmDhItucU-LfvPG041njQ','l_UmzyBp0H1eXOJxtgQsGQ')"
