tez_no,yazar,yıl,title,üniversite,tez_türü,konu,tez_detay
461603,SÜLEYMAN ÖZSARI,2017,Serum osmolaritesi ile koroner anjiyografi sonuçlarına göre belirlenen koroner arter darlığı derecesi arasındaki ilişkinin incelenmesi<br><span style='font-style: italic';>Evaluation of the correlation between serum osmolority and degree of coronary artery stenosis determined by coronary angiography,Ankara Üniversitesi,Tıpta Uzmanlık,Aile Hekimliği = Family Medicine," onclick=tezDetay('7tn-iNLgKlT5Y41A2n-M2g','o7-1tcynOW7hzjp896hmrA')"
326496,GÜLE AYDIN,2012,Çoklu ilaca dirençli acinetobacter baumannii suşları ile gram negatif enterik bakterilerde çeşitli antibiyotiklerin sinerjistik etkilerinin değerlendirilmesi<br><span style='font-style: italic';>Evaluation of synergistic activity of various antibiotic combinations against multidrug-resistant acinetobacter baumannii and gram negative enteric bacteria,Ankara Üniversitesi,Tıpta Uzmanlık,Klinik Bakteriyoloji ve Enfeksiyon Hastalıkları = Clinical Microbiology and Infectious Diseases," onclick=tezDetay('Ivw_AD0AXE_WaExYsMppIQ','xbEUkpxgh3Sf16Vj7D7lCw')"
334189,DENİZ DERYA KÖSEOĞLU TAYMUR,2013,Bakteriyemisi olan yoğun bakım hastalarında serum prokalsitonin düzeyinin önemi<br><span style='font-style: italic';>The importance of procalcitonin in bacteriemic intensive care unit patients,Ankara Üniversitesi,Tıpta Uzmanlık,Klinik Bakteriyoloji ve Enfeksiyon Hastalıkları = Clinical Microbiology and Infectious Diseases," onclick=tezDetay('K3uBzkCTtYUS_vyvCow6RQ','_AcyIpT78ilBWrwM9jesdw')"
461596,AYTEKİN KULEYİN,2017,Yenidoğan beslenmesinde Iowa Infant Feeding Attitudes Scale (IIFAS) ölçeğinin Türk babalarında geçerlik ve güvenirliğinin değerlendirilmesi<br><span style='font-style: italic';>Assessment of validity and reliability of Iowa Infant Feeding Attitudes Scale (IIFAS) scale in Turkish fathers at newborn nutrition,Ankara Üniversitesi,Tıpta Uzmanlık,Halk Sağlığı = Public Health," onclick=tezDetay('gS_F5yBh8EMyt9zEYS4UpQ','ma0MqEj0Rv2nXK1zVh0Pgw')"
392909,GÜZİN ÇAKMAK,2015,"Malign ve benign tiroid tümörlerinde PET\'de tutulum ile tümör sitopatolojisi, hastalık yaygınlığı ve moleküler belirteçlerin ilişkisi<br><span style='font-style: italic';>Relation of PET positivity with tumor cytopathology and molecular markers in malign and benign thyroid tumors",Ankara Üniversitesi,Tıpta Uzmanlık,Endokrinoloji ve Metabolizma Hastalıkları = Endocrinology and Metabolic Diseases," onclick=tezDetay('wdPUlQUhK4yC4Yy0s6Qe4w','jY_IFAa9b5ooaURAPBTfqg')"
455794,DERYA GÜZEL,2013,Deneysel tip 1 diabetes mellitus\'ta aralıklı hipoksinin kalpte hıf-1/vegf yolağı üzerine etkisi<br><span style='font-style: italic';>Effect of intermittent hypoxia on cardiac hif-1/vegf pathway in the experimental type 1 diabetes mellitus,Ankara Üniversitesi,Tıpta Uzmanlık,Fizyoloji = Physiology," onclick=tezDetay('GTzCitC6DLiSG8RuYAjRYw','rFfA98uw8NBO9sVlsZJV_A')"
334195,SERDAR ALAN,2013,"Doğumda göbek kordonu sıvazlamanın prematüre yenidoğanlarda hematolojik, hemodinamik parametreler ve prematürelikle ilişkili morbiditeler üzerine etkilerinin değerlendirilmesi<br><span style='font-style: italic';>Evaluation of the effects of umbilical cord milking on hematologic and hemodynamic parameters and premature-related morbidities in premature neonates",Ankara Üniversitesi,Tıpta Uzmanlık,Çocuk Sağlığı ve Hastalıkları = Child Health and Diseases," onclick=tezDetay('NVicTJwfryIPgq-d7kXy6Q','53CNXKKcWF-3ZwDN8NXu_g')"
406941,TUĞÇE KALIN,2015,Ankara Üniversitesi Tıp Fakültesi çocuk onkoloji polikliniğine periferik lenfadenopati ile başvuran hastaların retrospektif değerlendirilmesi<br><span style='font-style: italic';>Retrospective review of patients with peripheral lymphadenopathy who admitted to pediatric oncology clinic of Ankara University Medical school,Ankara Üniversitesi,Tıpta Uzmanlık,Çocuk Sağlığı ve Hastalıkları = Child Health and Diseases," onclick=tezDetay('dpOkrF8Ee3xyL0C3i56HbA','j85QLgFTneG202twXAq38A')"
443680,HATİCE KÜBRA KONCA,2016,Doğuştan kalp hastalığı olan çocuklarda yaşam kalitesinin ölçümlendirilmesi ve sosyodemografik özellikler<br><span style='font-style: italic';>Assessment of sociodemographic characteristics and quality of life in children with congenital heart disease,Ankara Üniversitesi,Tıpta Uzmanlık,Çocuk Sağlığı ve Hastalıkları = Child Health and Diseases," onclick=tezDetay('AlRr_LEopwrGtsXbFk4F4Q','3-JN_51iRQgC-YNQcDUACw')"
443684,FEYZA TÜNTAŞ BİLEN,2016,İdiyopatik intrakraniyal hipertansiyon olgularında optik koherens tomografi ve optik koherens tomografi anjiyografi bulgularının değerlendirilmesi<br><span style='font-style: italic';>To evaluate the optic coherence tomography and optic coherence tomography angiography findings in idiopathic intracranial hypertension cases,Ankara Üniversitesi,Tıpta Uzmanlık,Göz Hastalıkları = Eye Diseases," onclick=tezDetay('OMGnxPvZI-12I2bx3GvxQw','A5SisEN7oNZP8ax9_eArZA')"
461607,MİNE CEYLAN DOĞAN,2017,"Bir üniversite hastanesi aile hekimliği polikliniğine başvuran hastaların kolorektal kanserden korunmaya yönelik sağlık inançları<br><span style='font-style: italic';>The health beliefs of the patients, who were referred to the family medicine outpatient service of a university hospital, on prevention from colorectal cancer",Ankara Üniversitesi,Tıpta Uzmanlık,Aile Hekimliği = Family Medicine," onclick=tezDetay('lRITjlWpYDI_BIer2MbHMQ','ccTt2xg29i50pGzy_eslAg')"
461610,HÜSEYİN GÖKTAŞ,2016,Kronik atrial fibrilasyonun cerrahi tedavisinde mini-maze prosedürlerinde kullanılan enerji kaynaklarının sonuçlarının karşılaştırılması<br><span style='font-style: italic';>Comparison of the results of energy sources used in mini-maze procedures in the surgical treatment of chronic atrial fibrillation,Ankara Üniversitesi,Tıpta Uzmanlık,Göğüs Kalp ve Damar Cerrahisi = Thoracic and Cardiovascular Surgery," onclick=tezDetay('mchnJap-B1yWzWy1kqnzGQ','LqiQHq3oNJncSQ6Yr-uf-g')"
461606,PELİN ÜNSAL,2017,Behçet hastalarında serum interlökin 36 reseptör antagonisti ve serum interlökin 36 alfa\'nın patogenezdeki önemi<br><span style='font-style: italic';>The importance of the pathogenesis the serum levels of interleukin-36 receptor antagonist and interlekin-36 alpha in Behcet\'s patients,Ankara Üniversitesi,Tıpta Uzmanlık,Allerji ve İmmünoloji = Allergy and Immunology," onclick=tezDetay('W-4pDaX6n70fsK2YXbo9bQ','YRnlOuBNqTMNDVZNCcLhfw')"
493439,PELİN ÜNALDİ,2017,Ankara Üniversitesi Tıp Fakültesi Kadın Hastalıkları ve Doğum Ana Bilim Dalı polikliniklerine başvuran gebelerde tetanoz bağışıklığı ve ilişkili etmenler<br><span style='font-style: italic';>Tetanus immunity and related factors among pregnants who apply to outpatient clinics of the department of gynecology and obstetric clinic of Ankara University School of Medicine,Ankara Üniversitesi,Tıpta Uzmanlık,Halk Sağlığı = Public Health ; Kadın Hastalıkları ve Doğum = Obstetrics and Gynecology ; Klinik Bakteriyoloji ve Enfeksiyon Hastalıkları = Clinical Microbiology and Infectious Diseases," onclick=tezDetay('ph32C-MKFwaWGgSzCYMWww','EO6z2Z6VvOjgRAWYXl4K1w')"
384238,NEŞE GÜNEŞ,2014,"Romatoid artritli hastaların birinci derece akrabalarında romatoid artrit 2010 ACR/eular tanı kriterlerinin, romatoid faktör (RF) ve siklik sitrüline peptid (CCP) pozitiflik oranlarının ve sigara kullaniminin sağlıklı bireylerle karşılaştırılması<br><span style='font-style: italic';>Comparison of 2010 ACR/eular rheumatoid arthritis classification criteria with the positivity of rheumatid factor (RF) and cyclic citrullinated peptide (CCP), smoking status in first degree relatives of rhemutoid arthritis patients and healthy volunteers",Ankara Üniversitesi,Tıpta Uzmanlık,Fiziksel Tıp ve Rehabilitasyon = Physical Medicine and Rehabilitation," onclick=tezDetay('XhywggKz-UYjoFc_0v-Qwg','4ZYmNfoXifQMJno6GPmKUg')"
433409,İBRAHİM DÜNDAR,2016,Kuadriseps kas grubu statik germelerinin zamana göre izokinetik kuvvet ve sıçrama üzerine etkileri<br><span style='font-style: italic';>,Ankara Üniversitesi,Tıpta Uzmanlık,Spor = Sports," onclick=tezDetay('2IdjwQFPrsr-oEmdYclqRQ','wnF6XdaswM5-o0r1aN4o_w')"
455810,ELİF BERNA KÖKSOY,2013,Allojeneik hematopoietik kök hücre nakli yapılan hastalarda fungal enfeksiyon ve sitomegalovirus enfeksiyonu gelişimindeki transplantasyon öncesi ve sonrası risk faktörleri (2005 yılı ve sonrası)<br><span style='font-style: italic';>Risk factors before and after transplantation for the development of fungal infection and cytomegalovirus infection in patients undergoing allogeneic hematopoietic stem cell transplantation (2005 and afterwards),Ankara Üniversitesi,Tıpta Uzmanlık,Hematoloji = Hematology," onclick=tezDetay('lyMl5ovZ0f64iY6pjYZcrw','6l9Fj7CoN3l8nAB2q4oQuw')"
326527,SİLA YÜCE ÇITIR,2013,Yaygın gelişimsel bozukluğu olan bireylerde otizm spektrum anketi (OSA)geçerliğinin gösterilmesi<br><span style='font-style: italic';>Validity of autism spectrum quotient for individuals with pervasive development disorder,Ankara Üniversitesi,Tıpta Uzmanlık,Psikiyatri = Psychiatry," onclick=tezDetay('2GlqVmR7RwQJCQliO-0M0w','LNK3S4gcRiVjRfgsWv3FOQ')"
433425,ÖZGE KOÇKARA,2016,"Plazmada kemik morfojen protein (BMP) ailesinin artrit ile ilişkili alt grupları olan 2, 3 (osteogenin), 4, 5, 6, 7 (OP-1), 9 (GDF2), 14 (GDF5)\'ün ve bu alt grup inhibitör (NOGGİN, sklerostin) düzeylerinin romatoid artrit hastalık aktivitesi, klinik ve radyolojik progresyonuyla ilişkilendirilmesi<br><span style='font-style: italic';>Plasma levels of bone morphogenetic protein (BMP) subgroups 2, 3 (osteogenin), 4, 5, 6, 7 (OP-1), 9 (GDF2), 14 (GDF5) which are related with arthritis and their inhibitors (NOGGİN, sclerostin) in rheumatoid arthritis patients and correlation with disease activity, clinical and radiographic progression",Ankara Üniversitesi,Tıpta Uzmanlık,Romatoloji = Rheumatology," onclick=tezDetay('xo_Asz3yhovC2RwmXctR1w','uvumh4ZFuwz9xsOW1U3Qzg')"
326507,ASLIHAN UZUN,2012,Travmatik olmayan çocukluk çağı kataraktlarında cerrahi tedavi sonrası görsel sonuçlar ve komplikasyonlar<br><span style='font-style: italic';>Visual results and complications after surgical treatment of nontraumatic pediatric cataracts,Ankara Üniversitesi,Tıpta Uzmanlık,Göz Hastalıkları = Eye Diseases," onclick=tezDetay('5PDzpgUsVowKKV3o7VSO8Q','kqeB5dDZ_INLvY2I6aIeFQ')"
480888,YENER YOĞUN,2017,Dejeneratif rotator manşet yırtıklarının cerrahisinde preoperatif radyolojik kriterlerin fonksiyonel sonuçlar üzerine etksisi<br><span style='font-style: italic';>The effect of preoperative radiological criteria on functional outcomes in the surgery of degenerative rotator cuff tears,Ankara Üniversitesi,Tıpta Uzmanlık,Ortopedi ve Travmatoloji = Orthopedics and Traumatology," onclick=tezDetay('skKL2RwLjKA897KIdlz5xg','TrRFl5FHBADgJ4J-MuYBiQ')"
394203,SERCAN ERGEN,2015,"Erken sakroiliit tanısında, dinamik MRG ile stır sekansı bulgularının karşılaştırılması ve klinik, laboratuar bulguları ile korelasyonunu<br><span style='font-style: italic';>We aimed to compare stir sequences and dynamic MRİ in early diagnosis of sacroiliitis and to evaluate the correlation between them and laboratory findings",Ankara Üniversitesi,Tıpta Uzmanlık,Radyoloji ve Nükleer Tıp = Radiology and Nuclear Medicine," onclick=tezDetay('DsXMV2qI4XCKH3y7wH7_wg','jO7u1oxDXXvnFfGK_hy5yA')"
433398,DUYGU ACAR,2016,"Kronik obstrüktüf akciğer hastalığında klinik, radyolojik ve fonksiyonel parametrelerle fenotiplerin değerlendirilmesi<br><span style='font-style: italic';>Assesment of phenotypes with clinical, radiologic and functional parameters in COPD",Ankara Üniversitesi,Tıpta Uzmanlık,Göğüs Hastalıkları = Chest Diseases," onclick=tezDetay('Yw526ZX-Re7fAACBb3ISUQ','E85o6HKLS_EZJO8TJ8DYJA')"
513796,SABİHA TEZCAN AYDEMİR,2018,Hafif evre alzheimer tipi demans hastalarında kendi yüzünü tanımanın morf yüz yöntemi ile değerlendirilmesi<br><span style='font-style: italic';>Evaluation of self face recognition in patients with mild stage alzheimer\'s disease BY morphed face method,Ankara Üniversitesi,Tıpta Uzmanlık,Nöroloji = Neurology," onclick=tezDetay('7pO9UfszRvldex3GamHdnw','0WAy6eMC9TZXak_vhRlrrg')"
334192,BİLGEHAN ÇAĞDAŞ SONBAHAR,2013,Abdominoperineal rezeksiyon uygulanmış hastalarda parastomal herninin saptanmasında fizik muayene ile bilgisayarlı tomografinin karşılaştırılması<br><span style='font-style: italic';>The patients that abdominoperineal resections comparison of the specificity physical examination with computed tomographic for diagnosis parastomal hernia,Ankara Üniversitesi,Tıpta Uzmanlık,Genel Cerrahi = General Surgery," onclick=tezDetay('Qzldlrn8JhEstF08jZddag','gLv40OFwc6xPqCn9yP2ZTQ')"
471337,TURAL FATULLAYEV,2017,Transsfenoidal cerrahilerden sonra sfenoid sinüsün durumu<br><span style='font-style: italic';>Transsfenoidal cerrahi̇lerden sonra sfenoi̇d si̇nüsün durumu,Ankara Üniversitesi,Tıpta Uzmanlık,Kulak Burun ve Boğaz = Otorhinolaryngology (Ear-Nose-Throat)," onclick=tezDetay('oCKRjSof_ZF6L1uHgmxoXg','8GbqpVdX7F_AauuuSqJhmA')"
386628,GÜLDEN PAÇACI,2015,Dahili yoğun bakım ünitesine kabul edilen kritik hastalarda erken dönemde vitamin D düzeyi değişimi ve buna etki edebilecek faktörler<br><span style='font-style: italic';>Early vitamin D changes on critical patients admitted to the internal intensive care unit and factors may effect vitamin D levels,Ankara Üniversitesi,Tıpta Uzmanlık,Endokrinoloji ve Metabolizma Hastalıkları = Endocrinology and Metabolic Diseases," onclick=tezDetay('YMIfLi2bZPJMdZ1NzgxkMQ','8c10ghJys3sb8zodsVHQJA')"
513035,GÖKTUĞ ÖMERCİOĞLU,2018,Deneysel tip 1 diyabetes mellitus\'ta aerobik egzersizin lipopolisakkarit ile hasar oluşturulmuş sıçan akciğerleri üzerine etkisi<br><span style='font-style: italic';>The effect of aerobic exercise in TYPE 1 diabetes mellitus on lipopolysaccharide induced rat lung injury,Ankara Üniversitesi,Tıpta Uzmanlık,Fizyoloji = Physiology," onclick=tezDetay('pJxt_5P9h_HkN_As0gqhXw','eLe3Q-9NDglGXTkJUFT4jA')"
513036,MUSTAFA ALPARSLAN EROĞLU,2018,Zor entübasyon olduğu öngörülen hastalarda C-MAC videolaringoskopun macintosh veya D-blade\'i ile gerçekleştirilen endotrakeal entübasyon uygulamasının hemodinamik yanıt üzerine etkilerinin karşılaştırılması<br><span style='font-style: italic';>,Ankara Üniversitesi,Tıpta Uzmanlık,Anestezi ve Reanimasyon = Anesthesiology and Reanimation," onclick=tezDetay('4lA2vrg8qKRv1ldOmVr4KA','afSuqPwhrdf_yywoO2i6rw')"
326521,MİNE ARAZ,2012,18f-NAF PET /BT\'nin metastatik kemik hastalığının gösterilmesindeki rolü<br><span style='font-style: italic';>The role of 18F-NAF PET /CT in metastatic bone disease,Ankara Üniversitesi,Tıpta Uzmanlık,Radyoloji ve Nükleer Tıp = Radiology and Nuclear Medicine," onclick=tezDetay('Is4JZiFiDG7GfUOXnU16uw','zvkXRaLoe-KefGTn2wCq8A')"
443685,AMRAH ABDULLAYEV,2016,Şizofreni hastalarında yüzdeki duygu ifadelerini tanıma sırasındaki korteks aktivitesinin yakın kızılötesi spektroskopi ile değerlendirilmesi<br><span style='font-style: italic';>Cortical activity assessment by near infrared spectroscopy during facial emotion recognition in schizophrenic patients,Ankara Üniversitesi,Tıpta Uzmanlık,Psikiyatri = Psychiatry," onclick=tezDetay('s5u26sWPm7h9VInwBnYyFQ','AKKLdK6Hnm8LKEtzCQVOmQ')"
480897,KEMAL BOZKURT,2017,Spinal anestezi uygulanan hipertansiyon tanısı olan hastalarda kristaloid infüzyonuna başlama zamanının hemodinamik yanıt üzerine etkisi<br><span style='font-style: italic';>The effect of the time of starting cyristalloid infusion on hemodynamic response in hypertensive patients undergoing spinal anesthesia,Ankara Üniversitesi,Tıpta Uzmanlık,Anestezi ve Reanimasyon = Anesthesiology and Reanimation," onclick=tezDetay('wH-cSdPVIImbVbcsGABh_w','1U6n9v6mVVwch4rTvcCPsA')"
326523,OKAN ÇİÇEK,2012,Karaciğerin nöroendokrin tümör metastazlarının tedavisinde 90y\'ın etkinliği<br><span style='font-style: italic';>Efficacy of intra-arterial 90y treatment in hepatic neuroendocrine tumor metastases,Ankara Üniversitesi,Tıpta Uzmanlık,Radyoloji ve Nükleer Tıp = Radiology and Nuclear Medicine," onclick=tezDetay('J5qOfBhv6WHKtX_sKofgpg','dGzJJQiCugNycdovVmRb3A')"
314445,SERCAN YILMAZ,2012,Akciğer kanserlerinde doz volüm histogram parametreleri ile radyasyon pnömonisi gelişim riskinin değerlendirilmesi<br><span style='font-style: italic';>The risk assessment of development radiation pneumonitis with dose volume histogram parameters in lung cancer,Ankara Üniversitesi,Tıpta Uzmanlık,Onkoloji = Oncology," onclick=tezDetay('CkO51lI2C8ummnAyikEt7Q','bxH4PkWL6OmzW795MC2TwQ')"
480889,ZEYNEP TUZLALI,2017,Rat flep iskemi reperfüzyon modelinde uzak iskemik ön koşullanma ve uzak iskemik ön koşullanmaya eklenen adenozin\'in etkinliğinin araştırılması<br><span style='font-style: italic';>The effects of remote ischaemic preconditioning and adenosine with remote ischaemic preconditioning in rat flap ischaemia reperfusion injury model,Ankara Üniversitesi,Tıpta Uzmanlık,Plastik ve Rekonstrüktif Cerrahi = Plastic and Reconstructive Surgery," onclick=tezDetay('QaPyqxqgiZhm7Ickd9C6cQ','OYAH3nOU2NmpOtc8WS8gfg')"
326512,MEHMET SABAHATTİN GÜLEŞ,2012,Mamak bölgesinde 65 yaş üstü kişilerde serum protein elektroforezinde monoklonal gammapati sıklığı<br><span style='font-style: italic';>Prevelance of monoclonal gammopathy of serum protein electrophresis at over the age 65 years among people living in mamak district,Ankara Üniversitesi,Tıpta Uzmanlık,Geriatri = Geriatrics ; Hematoloji = Hematology ; Romatoloji = Rheumatology," onclick=tezDetay('lT0ovEimaPmS0gGVLZL_6A','09P-2bjDe-pHSeJDmetJlA')"
461600,TUĞRUL BIYIKLIOĞLU,2017,Bir üniversite hastanesinde endokrinoloji ve metabolizma hastalıkları polikliniğine başvuran tip 2 diyabet hastalarının güçlendirme düzeylerinin belirlenmesi<br><span style='font-style: italic';>Evaluation of the empowerment levels of type 2 diabetes patients seen in an outpatient clinic of a university hospital\'s department of endocrinology and metabolic diseases,Ankara Üniversitesi,Tıpta Uzmanlık,Aile Hekimliği = Family Medicine," onclick=tezDetay('ptucKYLJnH_4PXsG51G7iQ','m1JUX3kHPJf0zlSImRoEPg')"
417504,EMRAH SALMAN,2015,"Ankara\'daki çeşitli hastanelerde değişik yöntemler ile toksin pozitifliği saptanan dışkı örneklerinden elde edilen clostridium difficile izolatlarının toksin genlerinin araştırılması, pcr ribotiplendirimi ve ribotipler ile antimikrobiyal duyarlılıkları arasındaki ilişkinin ortaya çıkarılması<br><span style='font-style: italic';>Molecular characterization of toxin genes in clostridium difficile isolates from  toxin positivite stool samples obtained by different methods from several hospitals in ankara and association between PCR ribotypes and antimicrobial susceptibility among clostridium difficile isolates",Ankara Üniversitesi,Tıpta Uzmanlık,Mikrobiyoloji = Microbiology," onclick=tezDetay('WWeAcq1exuNZVIbns409wQ','hpnhdpZcTDXGm0y4p17ZOQ')"
417509,GÖKHAN KOCAMAN,2016,Subsolid nodüllerin cerrahi yönetimi<br><span style='font-style: italic';>Management of subsolid nodules,Ankara Üniversitesi,Tıpta Uzmanlık,Göğüs Kalp ve Damar Cerrahisi = Thoracic and Cardiovascular Surgery," onclick=tezDetay('T_ah15cuKGb2D_oR74Wvew','69r4syZUYf08X5Ra_T_66g')"
384212,CHANİFE MEMET,2014,Yaşlılarda dejeneratif aort kapak darlığı gelişmesinde oksidatif stresin rolü var mı?<br><span style='font-style: italic';>,Ankara Üniversitesi,Tıpta Uzmanlık,Kardiyoloji = Cardiology," onclick=tezDetay('pB-9GPAXQ7Eq1R4w5ervYA','KYE2h3HEq4lwH0E92J17Mg')"
334207,SEVGİ BAŞER,2013,Pediyatrik AML hastalarında FMS like tyrosin kinase 3 (FLT3)  ve nücleophosmin 1 (NPM1)  mutasyonları<br><span style='font-style: italic';>Fms-like thyrosine kinase 3 (FLT3) and nucleophosmin 1 (NPM1)  mutations in pediatric AML,Ankara Üniversitesi,Tıpta Uzmanlık,Genetik = Genetics," onclick=tezDetay('KwiNKeMbNVUaOCUVPq2cGQ','4YzE4saEBSJCQfkDjINr0g')"
406913,AHMET ABDULLAYEV,2015,Obstrüktif uyku apne sendromunda glokom varlığının değerlendirilmesi<br><span style='font-style: italic';>İnvestigation of glaucomotous changes in patients with obstuctive sleep apnea syndrome,Ankara Üniversitesi,Tıpta Uzmanlık,Göz Hastalıkları = Eye Diseases," onclick=tezDetay('SCLp0EaNh6hNQ6bP92tM5w','GWlDD74L7GYbmG2nUCoiCA')"
314433,GÜNER KARAVELİ,2012,Behçet hastalığında osteoprotegerin ve TRAIL seviyeleri ve önemi<br><span style='font-style: italic';>The importance of opg and TRAIL levels in behcet disease,Ankara Üniversitesi,Tıpta Uzmanlık,Allerji ve İmmünoloji = Allergy and Immunology," onclick=tezDetay('ITor_H0uijp2N_q-CO_yZw','r6zl3PkueIVkME0ZSU7a4Q')"
384255,ŞEREF ORAY,2014,"Sentetik, biyosentetik, biyolojik ve bazı işlemlerden geçirilen meshlere karşı gelişen adezyonların karşılaştırılması<br><span style='font-style: italic';>A comprasion of adhesions occured aganist to the synthetic, biosyntetic  biological and fibrin glue impregnated syntetic meshes",Ankara Üniversitesi,Tıpta Uzmanlık,Genel Cerrahi = General Surgery," onclick=tezDetay('IgjdJCm_yBy8jKFsg1g1Gw','3SOqQL_O6iMdV96cnjwuOw')"
433387,ASLIHAN GÜRÜN KAYA,2016,Hipertansiyonu olan ve olmayan obstrüktif uyku apne sendromlu hastalarda polisomnografik değişiklikler<br><span style='font-style: italic';>Polysomnographic differences between obstructive sleep apnea syndrome patients with or without hypertension,Ankara Üniversitesi,Tıpta Uzmanlık,Göğüs Hastalıkları = Chest Diseases," onclick=tezDetay('4V9phj3pYuJHrcw3SogPFA','Ixz2I0-IIH3dwR9hyibxUw')"
384257,TUBA ALIŞKAN TÜRKBEY,2014,"Subakut inmeli hastaların rehabilitasyonunda xbox kinect(tm) oyun sisteminin uygulanabilirliği, güvenilirliği ve etkinliği: Tek kör randomize kontrollü pilot çalışma<br><span style='font-style: italic';>Feasibility, safety and efficacy of xbox kinect(tm) game system in rehabilitation of subacute stroke patients: A single blind randomized controlled pilot study",Ankara Üniversitesi,Tıpta Uzmanlık,Fiziksel Tıp ve Rehabilitasyon = Physical Medicine and Rehabilitation," onclick=tezDetay('qOpmqxlkG2b_Sqt_VzkrwQ','lTqCmgvCKJoKP9c6Jr_IYw')"
417501,EBRU ÇOBANOĞLU,2015,Alzheimer tipi demans ve karışık tip demans hastalarında apati ile ilişkili faktörlerin değerlendirilmesi<br><span style='font-style: italic';>,Ankara Üniversitesi,Tıpta Uzmanlık,Psikiyatri = Psychiatry," onclick=tezDetay('IUeTqOl0geSVD4caNEUPnQ','Gv5nQC9pQN6o-qUKplFw8Q')"
384289,İSA DEDE,2013,Tamoksifen direncinde survivin gen ekspresyonunun klinik önemi<br><span style='font-style: italic';>Role of survivin expression in tamoxifen resistance in patient with early breast cancer,Ankara Üniversitesi,Tıpta Uzmanlık,Onkoloji = Oncology," onclick=tezDetay('NumZA32lB5WnXkpLOr_pkw','3jGCg9rzvKC4E33egM14sA')"
384294,MEHMET ALİ KOÇ,2014,Abdominal AORT  anevrizması tarama programı<br><span style='font-style: italic';>Abdominal aortic aneurysm screening program,Ankara Üniversitesi,Tıpta Uzmanlık,Genel Cerrahi = General Surgery ; Göğüs Kalp ve Damar Cerrahisi = Thoracic and Cardiovascular Surgery," onclick=tezDetay('fPM9ECec3k9uj2-SwRc5Vw','hYnPDtu0sHY0GlQcd9EjBQ')"
334205,DİĞDEM KURU ÖZ,2013,Beyin tümörlerinin cerrahi planlamasında difüzyon tensör manyetik rezonans görüntülemenin katkısı<br><span style='font-style: italic';>The efficiency of diffusin tensor magnetic resonance imaging in preoperative arrangement of brain tumors,Ankara Üniversitesi,Tıpta Uzmanlık,Radyoloji ve Nükleer Tıp = Radiology and Nuclear Medicine," onclick=tezDetay('uQDVhlj6Oa_BAd1my1-pbg','JsA_gv_ESmPCiWMnsoN5yQ')"
448784,SEDA ŞAHİN,2016,Ailevi akdeniz ateşi olan çocuklarda genotip fenotip ilişkisi<br><span style='font-style: italic';>Relationship between genotype and fenotype in children with familial mediterranean fever,Ankara Üniversitesi,Tıpta Uzmanlık,Çocuk Sağlığı ve Hastalıkları = Child Health and Diseases," onclick=tezDetay('OOnJT-3hAkKUmVeyralqew','YKsmWJJtCebs7xT4YN8hsQ')"
326519,SEYDA ERDOĞAN,2012,Parkinson hastalığında bilateral subtalamik çekirdek üzerine uygulanan derin beyin uyarımının yordayıcıları<br><span style='font-style: italic';>The predictors of bilateral subthalamic nucleus deep brain stimulation in parkinson\'s disease,Ankara Üniversitesi,Tıpta Uzmanlık,Nöroloji = Neurology," onclick=tezDetay('vpNWCkwcQl0GBkb3ORekHw','fDUrphdK_homg4Smwi0ngA')"
384235,NAZMİYE BENGÜ KARAÇAĞLAR,2014,Çocukluk çağı ekzojen obezitesinde metabolik sendrom  parametrelerinin değerlendirilmesi<br><span style='font-style: italic';>Evaluation of metabolic syndrome parameters in childhood eksogen obesity,Ankara Üniversitesi,Tıpta Uzmanlık,Çocuk Sağlığı ve Hastalıkları = Child Health and Diseases," onclick=tezDetay('qqHTj6i_Ejc9ps59BLgR1w','ainKd5XAvqIB5apmfTMPVA')"
307922,ALİ İHSAN HASDE,2012,Triküspid kapak cerrahisi uygulanan hastalarda; kros klmep altinda kardiyak arrest halinde opere edilen hastalar ile çalişan kalpte opere edilen hastalarin operatif-postoperatif sonuçlarinin retrospektif olarak karşilaştirilmasi<br><span style='font-style: italic';>The comparison of the operative and postoperative results of the tricuspid valve surgery with and without aortic cross-clamping (Retrospective study),Ankara Üniversitesi,Tıpta Uzmanlık,Göğüs Kalp ve Damar Cerrahisi = Thoracic and Cardiovascular Surgery," onclick=tezDetay('byudLJ2UmO5wE25iAvfaxw','J2jTHDzc3VsXkmoJTdSTqQ')"
