tez_no,yazar,yıl,title,üniversite,tez_türü,konu,tez_detay
266817,TUNCAY YÜCE,2010,Aşırı aktif mesane sendromu tedavisinde antikolinerjikler ile ağırlıklı vajinal koniler ile yaptırılan pelvik taban kas egzersizlerinin etkisinin karşılaştırılması<br><span style='font-style: italic';>To compare effect of anticholinergic agents and pelvic floor muscle training with vaginal cones in treatment of overactive bladder syndrom,Ankara Üniversitesi,Tıpta Uzmanlık,Kadın Hastalıkları ve Doğum = Obstetrics and Gynecology," onclick=tezDetay('ry-aaGIbg3ImtrXZxWUMQw','2WBdu0o3dN3g0X29mpYGkQ')"
230445,MÜYESSER SAYKI ARSLAN,2008,Non-alkolik yağlı karaciğeri olanlarda endotelyal fonksiyon bozukluğu ve kardiyovasküler risk profilinin belirlenmesi: metabolik sendrom birlikteliğinin etkinliği<br><span style='font-style: italic';>Investigation of endothelial dysfunction and cardiovascular risk profile in non-alcoholic fatty liver: The effect of metabolic syndrome,Ankara Üniversitesi,Tıpta Uzmanlık,Gastroenteroloji = Gastroenterology," onclick=tezDetay('RcnW-e9SYWRUt2Y7etM4TA','7OQKdOYN5JgZgpgDNbMZzw')"
298726,ÇAĞLAR ÖDEK,2011,Çocukluk çağı kanserlerinde serum transforming growth factor-ß1 düzeylerinin ve prognoz açısından öneminin belirlenmesi<br><span style='font-style: italic';>The ımportance of serum transforming growth factor-ß1 levels andıts effect on prognosis in childhood malignancies,Ankara Üniversitesi,Tıpta Uzmanlık,Onkoloji = Oncology ; Çocuk Sağlığı ve Hastalıkları = Child Health and Diseases," onclick=tezDetay('bwjPCxKCVkv5LJXO7-Vg6g','Qmd--oJCVFIhSpoF6XtLMg')"
266816,GÜLŞEN DOĞAN DURDAĞ,2010,Serumda ve foliküler sıvıdaki gebelikle ilişkili plazma protein-A (PAPP-A) değerlerinin embryo gelişimi ve erken gebelik sonuçları ile ilişkisi<br><span style='font-style: italic';>The association of pregnancy associated plasma protein?A (PAPP-A) levels in serum and follicular fluid with embryo development and early pregnancy results,Ankara Üniversitesi,Tıpta Uzmanlık,Kadın Hastalıkları ve Doğum = Obstetrics and Gynecology," onclick=tezDetay('L4wKNrZEN2zoKm14YjOQVQ','VF-Ex9cWDchH_PARJnkILQ')"
171434,EDA AYBERKİN,2006,Çocukluk çağı kanserlerinde epidemiyolojik özelliklerin incelenmesi<br><span style='font-style: italic';>Epidemiological patterns of childhood cancer,Ankara Üniversitesi,Tıpta Uzmanlık,Çocuk Sağlığı ve Hastalıkları = Child Health and Diseases," onclick=tezDetay('IHr9YTh_Xt1Dwb2woPmmVg','sBc-ds16HHa4m-ACK7hpYw')"
266830,YAVUZ EMRE ŞÜKÜR,2010,Uterin miyomların yerleşimlerine ve büyüklüklerine göre mitotik aktivitelerinin ve patolojik özelliklerinin karşılaştırılması<br><span style='font-style: italic';>The clinical and pathological differences of uterine leiomyomas due to their locations and sizes,Ankara Üniversitesi,Tıpta Uzmanlık,Kadın Hastalıkları ve Doğum = Obstetrics and Gynecology," onclick=tezDetay('mhtw73FmuomeEdAwGe0h9g','tD5G49iyUIn_nyPrPxEekg')"
271651,SELÇUK ÖZTÜRK,2010,Romatizmal mitral darlığında ilerleme hızı ve ilerleme hızını etkileyen faktörlerin değerlendirilmesi<br><span style='font-style: italic';>Progression in rheumatic mitral stenosis and effecting factors,Ankara Üniversitesi,Tıpta Uzmanlık,Kardiyoloji = Cardiology," onclick=tezDetay('mNxNpjIWAKor1Nilx2bGpQ','LD2jJJSY7imvbteNDcUMGQ')"
171435,ÇİĞDEM GENÇ SEL,2006,Çocukluk yaş grubunda santral ve periferik sinir sistemi hastalıklarında çölyak hastalığı sıklığı<br><span style='font-style: italic';>The prevalance of celiac diseases in patients with nonspesific neurological disorders,Ankara Üniversitesi,Tıpta Uzmanlık,Çocuk Sağlığı ve Hastalıkları = Child Health and Diseases," onclick=tezDetay('LFC_Csf5OJs0VuSxWsXZvw','n63v5BppYUVVh8AbojydgQ')"
226006,SERKAN KAHRAMAN,2007,"Yasa bağlı makula dejenerasyonunda subfoveal/ juxtafoveal koroid neovaskülarizasyonunun optikal koherens tomografi rehberliğinde fotodinamik tedavisi<br><span style='font-style: italic';>The treatment of subfoveal/juxtafoveal choroidal neovascular membranes, which is secondary to age related macular degeneration, with photodynamic therapy implemented under the guidance of optical coherence tomography",Ankara Üniversitesi,Tıpta Uzmanlık,Göz Hastalıkları = Eye Diseases," onclick=tezDetay('ms6WfvzzpXQWroh3ovhiYQ','hmIfZnf5C8wsU9KOEjtLdA')"
226009,MEHMET AKİF TÜRKOĞLU,2008,"Memenin malign ve benign lezyonlarında glutatyon-S-transferaz, glutatyon redüktaz, glukoz 6 fosfat dehidrogenaz, 6 fosfoglukonat dehidrogenaz enzim düzeylerinin histopatoloji ile ?liskisi<br><span style='font-style: italic';>The relationship of glutathione S-transferase, glutathione reductase, glucose-6-phosphate dehydrogenase and 6 phosphogluconate dehydrogenase enzyme levels with histopathology of malignant and benign lesions of the breast",Ankara Üniversitesi,Tıpta Uzmanlık,Genel Cerrahi = General Surgery," onclick=tezDetay('ybys907XMhjR-qR3uEveqQ','qV55Au3Moae8D22MrIMydQ')"
226015,ŞİRALİ OBA,2008,Fonksiyonel rezidüel kapasite (FRK) ölçümüne göre yapılan recruitment basıncı tespiti ve PEEP tİtrasyonunun kan gazı sonuçları İle korelasyonu<br><span style='font-style: italic';>Detecting recruitment pressure according to functional residual capacity and arterial blood gas analysis results correlation with PEEP titration,Ankara Üniversitesi,Tıpta Uzmanlık,Anestezi ve Reanimasyon = Anesthesiology and Reanimation," onclick=tezDetay('YAbHBWEITApmMGx_h9jKyw','QVyBcbYQFBcOPjZCaqHw2w')"
260308,ZEYNEP TUNCAY,2009,Hematolojik ve nefrolojik olgularda femoral yolla uygulanan kalıcı kateterlerin radyolojik ve klinik takip sonuçlarının araştırılması<br><span style='font-style: italic';>Radiologic and clinical outcomes of femoral tunneled catheters in hematology and nephrology patients,Ankara Üniversitesi,Tıpta Uzmanlık,Radyoloji ve Nükleer Tıp = Radiology and Nuclear Medicine," onclick=tezDetay('Hmu9VyVRIL_ii8oCM42dNQ','MOC15AkF6PlPQiVP_IPivw')"
171436,PEMBE DERİN OYGAR,2006,Çocuklarda diyabetik ketoasidoz tedavisi ve sonuçları<br><span style='font-style: italic';>Diabetic ketoacidosis treatment and results in children,Ankara Üniversitesi,Tıpta Uzmanlık,Çocuk Sağlığı ve Hastalıkları = Child Health and Diseases," onclick=tezDetay('Q4-2UXV3VDLgLMdAblQ34A','1_MMoWsQX3OjBwak146rUw')"
229531,ESRA AKGÜN,2008,"Kraniyotomilerde çivili başlığa hemodinam?k yanıtın baskılanmasında; kafatası sinir blokları, infiltrasyon bloğu ve IV Esmolol\'ün etkileri<br><span style='font-style: italic';>Effects of skull block, skull infiltration and IV Esmolol injection for preventing hemodynamic response to pin-head holder",Ankara Üniversitesi,Tıpta Uzmanlık,Anestezi ve Reanimasyon = Anesthesiology and Reanimation," onclick=tezDetay('7cH17zcONtBMz6jAjIMirA','40BF4_x00OENKV5wtvYYsg')"
260323,ETHEM TURGAY CERİT,2009,Akromegali hastalarında IGF-1 ile glukoz sonrası büyüme hormonu düzeyleri arasındaki diskordans ve acroqol anketinin biyokimyasal remisyon durumu ile ilişkisinin araştırılması<br><span style='font-style: italic';>Discordance of IGF-1 and growth hormone levels after glucose load and evaluation of the corralation between AcroQoL score with biochemical status ın acromegalic patients,Ankara Üniversitesi,Tıpta Uzmanlık,Endokrinoloji ve Metabolizma Hastalıkları = Endocrinology and Metabolic Diseases," onclick=tezDetay('ojvyMrgf1cx9VjuvsJRVwQ','pvggMM6MFaeVXe25Ve11dA')"
260304,SEZER VATANSEVER,2009,Fibroadenomlarda basıklaşma bulgusu<br><span style='font-style: italic';>Flatness finding in fibroadenomas,Ankara Üniversitesi,Tıpta Uzmanlık,Radyoloji ve Nükleer Tıp = Radiology and Nuclear Medicine," onclick=tezDetay('6WqTlH3MnnjB2tCdLkaRSA','D0-gvlU6ZfiHqDY_QH1lpg')"
266793,ZEYNEP BİRSİN ÖZÇAKAR,2010,Ailevi ve sporadik steroide dirençli nefrotik sendrom olgularında podosin gen değişimleri<br><span style='font-style: italic';>Analysis of NPHS2 mutations in familial and sporadic steroid resistant nephrotic syndrome patients,Ankara Üniversitesi,Tıpta Uzmanlık,Genetik = Genetics ; Nefroloji = Nephrology ; Çocuk Sağlığı ve Hastalıkları = Child Health and Diseases," onclick=tezDetay('A4qf65fPOEwZgM2Y1DZARw','aQfhndGZIY8RilKO3fLi_A')"
271634,MÜGE ÖZCAN,2010,Son dönem böbrek yetmezlikli hastalarda arteriyel sertlik ile vasküler histomorfometrik bulguların korelasyonu<br><span style='font-style: italic';>The correlation of arterial stiffness and vascular histomorphometric findings in end stage renal disease,Ankara Üniversitesi,Tıpta Uzmanlık,Nefroloji = Nephrology," onclick=tezDetay('W02gXL9ijTf6InGtOPQvEg','mb_4_dqzB5zTSMT4_DNY3A')"
260344,ISMAHAN BOZBEY,2009,"Ankilozan Spondilitli hastalarda spinal inflamasyonun Manyetik Rezonans Görüntüleme (MRG) ile tespiti ve AS Hastalık Aktivite İndeksi (BASDAI), AS Fonksiyonel İndeksi (BASFI), AS Metroloji İndeksi (BASMI), AS Radyoloji İndeksi ile korelasyonu<br><span style='font-style: italic';>Defining of spinal inflammation by Magnetic Resonance Imaging (MRI) and correlation with AS Disease Activity Index (BASDAI), AS Functional Index (BASFI), AS Metrology Index (BASMI), AS Radiology Index (BASRI) in Patients with Ankylosing Spondylitis",Ankara Üniversitesi,Tıpta Uzmanlık,Fiziksel Tıp ve Rehabilitasyon = Physical Medicine and Rehabilitation," onclick=tezDetay('SjawuF4jRrEbznDwhwtXwQ','Ey2iRplSdAbGUQ7UXwEazA')"
260319,ARSIN ULUÇ,2009,"Prefabrike, ?sham? ve vaskülerize olmayan sıçan femoral sinirinin fonksiyonel ve histopatolojik olarak karşılaştırılması (Deneysel çalışma)<br><span style='font-style: italic';>Functional and histopathologic study of prefabricated, sham and non-vascularized rat femoral nerve",Ankara Üniversitesi,Tıpta Uzmanlık,Plastik ve Rekonstrüktif Cerrahi = Plastic and Reconstructive Surgery," onclick=tezDetay('HORPDRIRdOdiCTgi0TCarA','e11___OrJumb1ljE-rmU9g')"
260384,MAHMUT ECEL,2009,Nonarteritik ön iskemik optik nöropatili hastalarda vasküler biyomarker olarak homosistein ve C-reaktif protein\'in hastalık ile ilgili korelasyonunun incelenmesi<br><span style='font-style: italic';>Investigation of the correlation of homocysteine and C-reactive protein as vascular biomarkers to the disease with patients with nonarteritic anterior ischeamic optical neuropathy,Ankara Üniversitesi,Tıpta Uzmanlık,Göz Hastalıkları = Eye Diseases," onclick=tezDetay('vHAW9ud8JZqD2m4BfbMwww','c_SKIAhscF0xSbELeo8l0w')"
260321,TOLGA TAŞÇI,2009,Oral ve transdermal hormon replasman tedavisinin monosit kemoatraktan protein-1 düzeylerine etkisi<br><span style='font-style: italic';>Effects of transdermal and orally administered hormone replacement therapy on monocyte chemoattractant protein-1 concentrations,Ankara Üniversitesi,Tıpta Uzmanlık,Kadın Hastalıkları ve Doğum = Obstetrics and Gynecology," onclick=tezDetay('6pEVXQs_PvWSIKjY8UiOJQ','Z9XFPaUjfu3MLtej4R_2Gg')"
271635,HARUN ERDAL,2010,Hepatosellüler karsinomada Glypican-3 tümör belirtecinin tanısal değeri ve prognostik faktörlerle ilişkisi: Alfa Fetoprotein ile karşılaştırılması<br><span style='font-style: italic';>Value of Glypican-3 as a tumor marker and its correlatıon with prognostıc factors in patients with hepatocellular carcinoma and comparison with Alpha Fetoprotein,Ankara Üniversitesi,Tıpta Uzmanlık,Gastroenteroloji = Gastroenterology ; Onkoloji = Oncology," onclick=tezDetay('SlMDr7ILdi9C04CXbURheg','SB1T043mdvm2ghWwQWJqwg')"
260346,ARİF TİMUROĞLU,2009,Sepsisten septik şoka geçişte inflamatuar parametrelerin seyri<br><span style='font-style: italic';>Inflammatory parameters trends during progression from sepsis to septic shock,Ankara Üniversitesi,Tıpta Uzmanlık,Anestezi ve Reanimasyon = Anesthesiology and Reanimation," onclick=tezDetay('d8Ye4Rub1MxPDhwp9rsXSQ','N_9RWzEUIatPK8G1nBkP_A')"
260375,SABAHATTİN KOCADAĞ,2009,Ankara Üniversitesi Tıp Fakültesi Hastaneleri\'ndeki sağlık çalışanlarında işyeri şiddeti ve ilişkili etmenler<br><span style='font-style: italic';>Workplace violence and related factors among health workers in Hospitals of Ankara University Faculty of Medicine.,Ankara Üniversitesi,Tıpta Uzmanlık,Halk Sağlığı = Public Health," onclick=tezDetay('GRXZPqwvUw8g2DyZw2phBQ','DjlE8mmawdADdnTO-hRq9w')"
420897,MURAT SARICI,2009,"Meme küçültme amelı̇yatlarının hemogram, kan glukoz, ı̇nsülı̇n ve lı̇pı̇t profı̇lı̇ne etkı̇lerı̇<br><span style='font-style: italic';>Effects of reducti̇on mammoplasty on hemogram blood glucose insulin and lipid profile",Ankara Üniversitesi,Tıpta Uzmanlık,Plastik ve Rekonstrüktif Cerrahi = Plastic and Reconstructive Surgery," onclick=tezDetay('MwihyWHoMifCvYofffU4YA','jUHpkW8kjnUgeUKGduJCSQ')"
260331,ASLIHAN YALÇIN,2009,Kemik metastazlı akciğer kanseri olgularında serum kemik metabolizması ürünlerinin klinik önemi<br><span style='font-style: italic';>Clinical importance of bone metabolism markers of bone metastasis in lung cancer,Ankara Üniversitesi,Tıpta Uzmanlık,Göğüs Hastalıkları = Chest Diseases," onclick=tezDetay('J1An0zEjOR5u_1dhVD95AQ','vYEX0L4yFJsb-6zgmsk47A')"
260343,GÜLİZ ALTOPARLAK,2009,Diz osteoartritli hastalarda klinik değerlendirme parametreleri ile manyetik rezonans görüntüleme bulgularının ilişkisi<br><span style='font-style: italic';>The relation between clinical evaluation parameters and magnetic resonance imaging findings in patients with knee osteoarthritis,Ankara Üniversitesi,Tıpta Uzmanlık,Fiziksel Tıp ve Rehabilitasyon = Physical Medicine and Rehabilitation," onclick=tezDetay('rgUD1IKRQ8zXb_LaGjqEcQ','aHbNpP6Xs02wdLbPmDhR4Q')"
225989,AHMET YILMAZ,2008,Subakromiyal ağrılı omuz sorunlarında konservatif tedavinin fonksiyonel son durum üzerinde etkinliğinin 6 aylık prospektif gözlemsel değerlendirimi<br><span style='font-style: italic';>The effectiveness of conservative treatment in shoulder subacromial pain problems: A prospective observational functional outcome study,Ankara Üniversitesi,Tıpta Uzmanlık,Fiziksel Tıp ve Rehabilitasyon = Physical Medicine and Rehabilitation," onclick=tezDetay('G9G2OJLDf7Rp7VvSJKYEqw','We8d70iSQmBlshX7kPDeJw')"
260349,MOHAMMAD AKBARİ,2009,Omega-3 yağ asidinin karaciğer rejenerasyonuna olan etkisi; Ratlarda deneysel çalışma<br><span style='font-style: italic';>The effect of omega-3 fatty acids on the liver regeneration; An experimental study on the rats,Ankara Üniversitesi,Tıpta Uzmanlık,Genel Cerrahi = General Surgery," onclick=tezDetay('gN45X5VSTGdODpV54CtPuA','dVe5OkUZISQa0-W4hFEFkw')"
266807,TURAN HİLMİ YEŞİL,2009,Metabolik sendromlu yaşlı bireylerde serum yüksek moleküler ağırlıklı adiponektin düzeyi ile arteryal sertlik arasındaki ilişki<br><span style='font-style: italic';>Relation between serum high molecular weight adiponectin level and arterial stiffness in the elderly with metabolic syndrome,Ankara Üniversitesi,Tıpta Uzmanlık,Geriatri = Geriatrics," onclick=tezDetay('HQld9J3YGWYB--Y6ZMyPTA','BlP6OkaFG3PMIO2gXu2HuQ')"
229962,CEVRİYE CANSIZ,2008,Overin seröz adenokarsinomları ve seröz borderline tümörlerinde RAS/RAF/MEK/MAPK yolağındaki moleküler değişikliklerin immünhistokimyasal olarak araştırılması<br><span style='font-style: italic';>Immunohistochemical detection of RAS/RAF/MEK/MAPK pathway on serous adenocarcinoma and serous borderline tumors of ovary,Ankara Üniversitesi,Tıpta Uzmanlık,Patoloji = Pathology," onclick=tezDetay('Jr-_Qhgt04J0gNlAnuONZQ','nlcssBK5FVOwJ62LIvky5A')"
260329,ÜLKÜ BOLOL,2009,"Stabil dönem bronşiektazili olgularda dispne derecesi,yaşam kalitesi ve efor kapasitesi arasındaki ilişkinin değerlendirilmesi<br><span style='font-style: italic';>Interpretation of relationship between dyspnea degree, quality of life and effort capacity at stabilized period bronchiectasis patients.",Ankara Üniversitesi,Tıpta Uzmanlık,Göğüs Hastalıkları = Chest Diseases," onclick=tezDetay('6TWYflNnultiNZGAV4NPKg','GOKgkoGFt7tDzkFEPHQ1Qw')"
661120,FEHMİ ÇAVUŞOĞLU,2010,"Atan kalpte koroner arter bypass greftleme cerrahisinde fentanil ile remifentanil anestezisinin hemodinamik yanıt, erken ekstübasyon ve derlenmeye etkilerinin karşılaştırılması<br><span style='font-style: italic';>Comparison of the effects of fentanyl and remifentanil anesthesia to hemodynamic responses, early extubation and recovery in beathing heart coronary artery bypass grafting.",Ankara Üniversitesi,Tıpta Uzmanlık,Anestezi ve Reanimasyon = Anesthesiology and Reanimation," onclick=tezDetay('_hxqgoiqGNWQAmHp8XTdCg','LjZARsskID17nkA0wUG6aQ')"
271659,DERYA YILDIZLAR,2010,El osteoartritinde ultrason ve kısa dalga diaterminin etkinliğinin araştırılması<br><span style='font-style: italic';>An investigation of the effectiveness of therapeutic ultrasound and short wave diathermy in hand osteoarthritis,Ankara Üniversitesi,Tıpta Uzmanlık,Fiziksel Tıp ve Rehabilitasyon = Physical Medicine and Rehabilitation," onclick=tezDetay('84bMzDfv6K-rj_F72UdAWQ','KaFcs_g9WPa2nfoOLk0hJg')"
260315,ŞULE ALIÇCI,2009,Hematolojik olgularda kullanılan yarı kalıcı tünelli kateterlerin radyolojik ve klinik takip sonuçları<br><span style='font-style: italic';>Analysing the results of radiologic and clinic progress in patients with hematological disease that were implanted long-term tunneled central venous catheter,Ankara Üniversitesi,Tıpta Uzmanlık,Radyoloji ve Nükleer Tıp = Radiology and Nuclear Medicine," onclick=tezDetay('leMYon25xEipQUp9X2idMQ','PpreeyuSPZPytz18jbitZw')"
260322,ZEYNAL DOĞAN,2009,Yaşlılarda üriner inkontinans sıklığı ve düzeltilebilir sebepleri<br><span style='font-style: italic';>The frequency and transient causes of urinary incontinence in the elderly,Ankara Üniversitesi,Tıpta Uzmanlık,Geriatri = Geriatrics ; Üroloji = Urology," onclick=tezDetay('zbNrSMODlp6zT3Ot0eOO8A','Bcd7XJALo93i_eIuj8Nsig')"
260347,SEVAL KARAKAYA,2009,Sigara içen hastalarda total intravenöz anestezi uygulamasında kas gevşetici ilaç tüketimi: Rokuronyum bromidin etki süresinin karşılaştırılması<br><span style='font-style: italic';> ,Ankara Üniversitesi,Tıpta Uzmanlık,Anestezi ve Reanimasyon = Anesthesiology and Reanimation," onclick=tezDetay('ZxqoGY08HOLfRjKA4T3lDg','Gjfh9emEFT3_5WCUjWZJgA')"
260352,ERCAN GENCER,2009,Yenidoğanlarda trombosit fonksiyonları ve endotel ilişkisi<br><span style='font-style: italic';>Platelet functions and endothelial relationship in newborns,Ankara Üniversitesi,Tıpta Uzmanlık,Fizyoloji = Physiology," onclick=tezDetay('i3yf0tlCX96MRZ2YFnDObw','4ZWjfhlJ0sYe41SD_avDKw')"
260357,SUAT EKİNCİ,2009,Erişkin dikkat eksikliği hiperaktivite bozukluğu olan hastalarda duygudurum bozukluğu görülme sıklığı ve mizaç özellikleri<br><span style='font-style: italic';>The comorbidity prevelance and the temperament characteristics in adults with ADHD,Ankara Üniversitesi,Tıpta Uzmanlık,Psikiyatri = Psychiatry," onclick=tezDetay('GQ5IuLG65lq4fEEeCDEFcQ','Y-Q3vEe_d7zu1OK493tCBw')"
307933,ALİ ŞAHİN,2011,Sistemik sklerozlu hastalarda lenfosit mikrok(ş)imerizmi<br><span style='font-style: italic';>Lymphocyte microchimerism in patients with systemic sclerosis,Ankara Üniversitesi,Tıpta Uzmanlık,Romatoloji = Rheumatology," onclick=tezDetay('YngKs2RVangUcKBNCJv1mw','Y13NLBRuDIWs1vmy_85m8A')"
266805,PELİN ÖZYOL,2010,Korneanın yeniden şekillendirilmesi ile miyopi tedavisi (ORTO-K)<br><span style='font-style: italic';>Treatment of myopia with corneal reshaping (ORTHO-K),Ankara Üniversitesi,Tıpta Uzmanlık,Göz Hastalıkları = Eye Diseases," onclick=tezDetay('gmM6YrlQH03MQ1hbXhKAcA','aDIhZoF0RxfxgqnzQVuQkA')"
271631,BURCU POLAT GÜLTEKİN,2010,Orbita kitlelerinde histopatolojik tanıya göre sınıflandırma ve tedavi<br><span style='font-style: italic';>Classification and treatment of orbital tumors according to histopathologic diagnosis,Ankara Üniversitesi,Tıpta Uzmanlık,Göz Hastalıkları = Eye Diseases," onclick=tezDetay('oZ1vlr2wnRyLkTmSYUKPag','jXU04LijUr2OSWGicNCDSA')"
266798,ANIL AKTAŞ TAPISIZ,2010,Akut gastroenteriti olan 5 yaş altı çocuklarda rotavirüs suşlarının PCR ile tiplendirilmesi ve belirlenen tiplerin klinik ağırlık derecesi ile ilişkisi<br><span style='font-style: italic';>Typing of rotavirus strains by PCR in children with acute gastroenteritis under 5 years old and relations between genotypes and clinical severity scores,Ankara Üniversitesi,Tıpta Uzmanlık,Çocuk Sağlığı ve Hastalıkları = Child Health and Diseases," onclick=tezDetay('C-0RcgKffvbfL53TmZcZMw','0w-aTuQ4eIoFiis5NVuzWQ')"
229988,TUBA DUYGU YILMAZ,2009,Ankara Üniversitesi Tıp Fakültesi Hastaneleri\'\'nde tıpta uzmanlık öğrencilerinin tükenmişlik düzeyi ve ilişkili etmenler<br><span style='font-style: italic';>The level of burnout and related factors on residents in Hospitals of Ankara University Faculty of Medicine,Ankara Üniversitesi,Tıpta Uzmanlık,Halk Sağlığı = Public Health," onclick=tezDetay('gsu_p0tszPoZESxiQCaU3A','SweGWhny5XZ5JKTEibEssA')"
164948,ENGİN KARADENİZ,2005,Displastik kalçalarda rotasyonel asetabular osteotomi uygulamaları ve sonuçları<br><span style='font-style: italic';>Results and treatment rotational acetabular osteotomy for dysplastic hips,Ankara Üniversitesi,Tıpta Uzmanlık,Ortopedi ve Travmatoloji = Orthopedics and Traumatology," onclick=tezDetay('cNziKS70c9u_ppP0UuJyIA','PPZnJYvsrNiyUV95AcUUhA')"
164966,KADRİYE ŞERİFE BOYNUKALIN,2005,"Presbiakuzide, saf ses ve konuşma odyometrisi, otoakustik emisyon, beyin sapı odyometrik incelemelerini kullanarak patolojinin lokalizasyonunun değerlendirilmesi<br><span style='font-style: italic';>The evaluation of pathologic localization by using puro tone audiometry, speech audiometry, distortion product otoacoustic emission, and auditory brain stem response in presbycusis",Ankara Üniversitesi,Tıpta Uzmanlık,Kulak Burun ve Boğaz = Otorhinolaryngology (Ear-Nose-Throat)," onclick=tezDetay('XUdUW9RKdFtGhFGCM0kMvQ','TbGlgqSaGaIAm57Xa4HLSA')"
164985,FATMA AYSUN ERASLAN,2005,"Lokal ileri evre akciğer kanserinde konvansiyonel radyoterapi ve eşzamanlı ek doz radyoterapi tekniklerinin prospektif ve randomize olarak karşılaştırılması<br><span style='font-style: italic';>Concomitant boost radiotherapy or conventional radiotherapy for locally advanced non small cell lung cancer: Procpective, randomized study",Ankara Üniversitesi,Tıpta Uzmanlık,Onkoloji = Oncology," onclick=tezDetay('CReV8gBlJ7AcfoWH-kepyg','3J36o09GjOLVG_tA8et3YA')"
164315,NESLİHAN PARMAK,2005,Fakoemüsifikasyonda kullanılan irrigasyon sıvı sıcaklığının kornea endoteline etkisi<br><span style='font-style: italic';>The effect of temperature of irrigating solution during phacoemulsif ication,Ankara Üniversitesi,Tıpta Uzmanlık,Göz Hastalıkları = Eye Diseases," onclick=tezDetay('YyuEAzEN2cMHHkbTz2yzIA','4TT6ECepRLBrCDUY7ao_mg')"
164316,HALE ELİF AKMEŞE,2005,Uvea melanomlarında rutenyum 106 plak radyoterapisi<br><span style='font-style: italic';>Ru-106 plaque radiothrepahy in the treatment of uveal melanoma,Ankara Üniversitesi,Tıpta Uzmanlık,Göz Hastalıkları = Eye Diseases," onclick=tezDetay('Ad2STQGXPC_7P1AxxF6ekA','4PgHY04EcXGJv0ee2Llj8g')"
164332,ALİ KAYA,2005,Brakial arterde egzersiz sonrası arteriyel akım formu ve zaman ilişkisinin renkli doppler US ile ortaya konulması<br><span style='font-style: italic';>Definition of bost exercise arterial waveform and time relationship in the brachial artery by color doppler ultrasound,Ankara Üniversitesi,Tıpta Uzmanlık,Radyoloji ve Nükleer Tıp = Radiology and Nuclear Medicine," onclick=tezDetay('URri06FAtVpUk7uK39MYlg','Eap7norkkmfk28A5mlELMg')"
229969,ULAŞ SÖZENER,2009,Perianal abse drenajından sonra verilecek antibiyotik tedavisi perianal fistül gelişimini etkiler mi?<br><span style='font-style: italic';>Does adjuvant antibiotic treatment after drainage of perianal abscess prevent the development anal fistula?,Ankara Üniversitesi,Tıpta Uzmanlık,Genel Cerrahi = General Surgery," onclick=tezDetay('HNOKoib7uAfXWT3l8cBdbw','6FNcsuudLI-sxapWhTJWnQ')"
164317,BATUHAN SAÇILANATEŞ,2005,Karsinoid tümörlerde cerrahi tedavi<br><span style='font-style: italic';>Surgical treatment of carcinoid tumors,Ankara Üniversitesi,Tıpta Uzmanlık,Göğüs Kalp ve Damar Cerrahisi = Thoracic and Cardiovascular Surgery," onclick=tezDetay('Oq7oMSsp9WFWw6FTu6iGog','VH0VxAkOmc5P6uFpb-xT8A')"
266820,BURAK SUVAK,2010,Renal transplant alıcılarında donör spesifik ve non spesifik antikorların değerlendirilmesi<br><span style='font-style: italic';>The evaluation of donor spesific and non spesific antibodies in renal transplant recipients,Ankara Üniversitesi,Tıpta Uzmanlık,Nefroloji = Nephrology," onclick=tezDetay('yhcY3wwYPFY_bQApTFW_Ag','C90NBY2VgnuJqNZIgOdPKg')"
164949,RAMAZAN AKMEŞE,2005,Skolyozun cerrahi tedavisinde subtransvers proçes telleme metodu<br><span style='font-style: italic';>Subtransverse process wiring technique in the surgical treatment of scoliosis,Ankara Üniversitesi,Tıpta Uzmanlık,Ortopedi ve Travmatoloji = Orthopedics and Traumatology," onclick=tezDetay('z6bYUJFH5djJPk2CIls9OA','dBzCkqpRdXoZpkqGqKmkUw')"
164318,GÜL SOYKAN,2005,"Postmenapozal osteoporozda sitokinlerin rolü: Östrojen düzeyi, kemik dansitesi ve kemik döngü belirleyicileri ile ilişkisi<br><span style='font-style: italic';>The role of the cytokines in postmenopausal osteoporosis: Relation with estrogen level, bone density and bone turnover biomarkes",Ankara Üniversitesi,Tıpta Uzmanlık,Fiziksel Tıp ve Rehabilitasyon = Physical Medicine and Rehabilitation," onclick=tezDetay('1WHukw_TqBlDX_gZPVDD1A','4s81HQsYCZMlpANnDUyR5A')"
