tez_no,yazar,yıl,title,üniversite,tez_türü,konu,tez_detay
289208,SAADET TAŞTABAN BAYRAKTAR,2011,Patent foramen ovaleye bağlı paradoksal embolizmde iskemik inme için ipuçları ve tedavinin etkinliğinin araştırılması.<br><span style='font-style: italic';>Clinical clues to paradoxical embolism in patient with patent foramen ovale and the effect of different therapies on stroke prevention.,Eskişehir Osmangazi Üniversitesi,Tıpta Uzmanlık,Kardiyoloji = Cardiology ; Nöroloji = Neurology," onclick=tezDetay('D5YuWSyjHmL1VVKejtMK1w','MGYYQgMpXsrjQARzGsGO7w')"
236720,ÇİĞDEM DEVİR,2009,Kolorektal lezyonların saptanmasında 64 dedektörlü BT kolonografi ile konvansiyonel kolonoskopi sonuçlarının karşılaştırılması<br><span style='font-style: italic';>Detection of colorectal lesions by comparing results of 64-multidedector row CT colonography and conventional colonography,Eskişehir Osmangazi Üniversitesi,Tıpta Uzmanlık,Radyoloji ve Nükleer Tıp = Radiology and Nuclear Medicine," onclick=tezDetay('QsfZLH4l3_EqvZnTmNg0eA','JoX3SyGcpBfv5UJtP_skKA')"
365981,BENGÜ DOĞAN,2014,Toplum kökenli pnömonide biyolojik belirteçlerin prognoz ve tedavinin izlemindeki önemi<br><span style='font-style: italic';>The importance of biological indicators in prognosis and treatment monitoring on community acquired pneumonia.,Eskişehir Osmangazi Üniversitesi,Tıpta Uzmanlık,Göğüs Hastalıkları = Chest Diseases," onclick=tezDetay('nqpkxM30f915KYdG-GYdpw','CqxOa9Nq2A29RAN0VThJWw')"
118124,ALP İLHAMİ GÜNER,2002,Yenidoğan sıçanlarda deneysel ilerleyici kommünikan tip hidrosefalide ventrikül basınç ve ventrikül volüm ilişkisinin araştırılması<br><span style='font-style: italic';> ,Eskişehir Osmangazi Üniversitesi,Tıpta Uzmanlık,Nöroşirürji = Neurosurgery," onclick=tezDetay('MNFbfDV3lAP6CZSWm9H8ew','qWgPRwVd08ldZRDPaIY49g')"
118125,MURAT VURAL,2002,İntrakraniyal menenjiomların klinik ve istatistiksel analizi<br><span style='font-style: italic';> ,Eskişehir Osmangazi Üniversitesi,Tıpta Uzmanlık,Nöroşirürji = Neurosurgery," onclick=tezDetay('4jWj_tMxUHjIVSSjk938Ow','aDBzunDZqocwoKB4Rta-TQ')"
440388,PINAR GÖRÜNMEZ,2016,"Belçika- Almanya-Hollanda\'da yaşayan Türk vatandaşlarının Türkiye ziyareti sırasında nazofarengeal meningokok taşıyıcılığı sıklığı ve serogrup tayini<br><span style='font-style: italic';>Nasopharyngeal meningococcal carriage rate and serogroup distribution of Turkish citizens lived in Belgium, Germany and Netherlands during their visit to Turkey",Eskişehir Osmangazi Üniversitesi,Tıpta Uzmanlık,Aile Hekimliği = Family Medicine ; Klinik Bakteriyoloji ve Enfeksiyon Hastalıkları = Clinical Microbiology and Infectious Diseases," onclick=tezDetay('pJjX7uifHDi898Fc_35wuw','K_M9fkjgwKn68W9BEP7C0w')"
681857,SEHER SEZİN YILMAZ,2021,"Multipl skleroz\'da yorgunluk, kognitif bozukluk ve görsel reaktivitenin korelasyonu<br><span style='font-style: italic';>The correlation of failure, cognitive disorder and visual reactivity in multiple sclerosis",Eskişehir Osmangazi Üniversitesi,Tıpta Uzmanlık,Nöroloji = Neurology," onclick=tezDetay('7zJePp4mq3CRPIZSxsSjzQ','EVCm_ga6D7CCNt5d0c7V-g')"
194585,ÇAĞATAY ERMAN ÖZTÜRK,2007,İndüksiyonda kullanılan %1 ve %2 propofol formülasyonlarının enjeksiyon ağrısı ve entübasyona hemodinamik yanıt açısından karşılaştırılması<br><span style='font-style: italic';>Comparison of 1 % and 2 % propofol formulations used in induction by means of their hemodynamic response to injection pain and intubation,Eskişehir Osmangazi Üniversitesi,Tıpta Uzmanlık,Anestezi ve Reanimasyon = Anesthesiology and Reanimation," onclick=tezDetay('8EucjJLDP_9D6ozxZsY_lQ','bzLcAxNAiD3jLg4AU7MHmg')"
623436,İLKER UÇAR,2020,İleri evre over kanseri olan hastalarda neoadjuvan kemoterapi alan hastalar ile almayanların karşılaştırılması<br><span style='font-style: italic';>Comparison of advanced stage ovarian cancer patients who received neoadjuvant chemotherapy and those who did not receive neoadjuvant chemotherapy,Eskişehir Osmangazi Üniversitesi,Tıpta Uzmanlık,Kadın Hastalıkları ve Doğum = Obstetrics and Gynecology," onclick=tezDetay('1-P6v6xakuCkVSGCyK9yaQ','gKR8MjXbZsHPU6a-u2rfHw')"
417376,MEHMET ENES GÖKLER,2015,Eskişehir Osmangazi Üniversitesi Sağlık Uygulama ve Araştırma Hastanesi\'nde endoürolojik cerrahi işlem sonrası gelişen hastane enfeksiyonlarının maliyeti ve kontrol önlemlerinin etkisi<br><span style='font-style: italic';>The cost of heathcare associated infections developing after endourologic surgery and the impact of control measures in Eski̇şehi̇r Osmangazi̇ Uni̇versi̇ty Health Practice and Research Hospital,Eskişehir Osmangazi Üniversitesi,Tıpta Uzmanlık,Halk Sağlığı = Public Health," onclick=tezDetay('T_ufL704hTKQJSMDMcSMRw','rweQ9QAEHa09wou8rSaF2A')"
557887,AYTEK HÜSEYİN ÇELİKSÖZ,2019,Femur trokanterik kırıklarının proksimal femoral çivi ile tedavisinde başarıyı etkileyen faktörler<br><span style='font-style: italic';>Factors affecting success in the treatment of femoral trochanteric fractures with proximal femoral nails,Eskişehir Osmangazi Üniversitesi,Tıpta Uzmanlık,Ortopedi ve Travmatoloji = Orthopedics and Traumatology," onclick=tezDetay('oWoKK0iLn91UmNYUxR3cbg','dL_bee0aCI07fAjZxMx0Mw')"
673232,İNSAF YILMAZ,2021,"Akut kolanjit tanısı ile endoskopi retrograd kolanjio pankreotografi yapılan hastaların safra kültürlerinde üreyen mikrobiyal ajanlar, bu ajanların antibiyotik duyarlılıkları, hastanın klinik ve laboratuvarı ile ilişkisi<br><span style='font-style: italic';>Microbial agents produced in bile cultures of patients undergoing endoscopic retrograde cholangio pancreatoraphy with diagnosis of acute cholangitis, these agents\' antibiotic suscebtibility; and their relationships with clinic and laboratory of the patient",Eskişehir Osmangazi Üniversitesi,Tıpta Uzmanlık,Gastroenteroloji = Gastroenterology," onclick=tezDetay('cJMlLALMiClp-vWyBP4uRA','LNN3L0QhsaYycro-OT7Rdg')"
426665,FATİH TAŞTEKİN,2016,Trombosit aferezinin donör koagülasyon sistemi üzerine etkisi<br><span style='font-style: italic';>The effect of plateletpheresis on coagulation system of healthy donors,Eskişehir Osmangazi Üniversitesi,Tıpta Uzmanlık,Hematoloji = Hematology," onclick=tezDetay('RqJFEYZE0t5Mavs24HHLGg','T6BezHikXjV_hDhfSlyXXQ')"
315844,MURAT DURDU,2012,Vaskülit tanısı ile takip edilen hastaların klinik ve laboratuvar özelliklerinin retrospektif olarak değerlendirilmesi<br><span style='font-style: italic';>A retrospective analysis on clinical and laboratory features of patients with vasculitis.,Eskişehir Osmangazi Üniversitesi,Tıpta Uzmanlık,Romatoloji = Rheumatology," onclick=tezDetay('fYA7Sm2TXEdPK41Zxst_Ig','B2CCbN5G_v5X2XClLwuAbQ')"
466502,ELİF GÖNEN,2017,Obstrüktif olmayan üreteropelvik bileşke darlığı olan çocuklarda dinamik böbrek sintigrafi bulgularının değerlendirilmesi<br><span style='font-style: italic';>Evaluation of dynamic kidney scintigraghy findings in non-occlusive uretheropelvic junction obstruction in children,Eskişehir Osmangazi Üniversitesi,Tıpta Uzmanlık,Çocuk Sağlığı ve Hastalıkları = Child Health and Diseases," onclick=tezDetay('OwUcrmPIBabjdRLwZYzMTw','bA9IWrYL2OPVoenOtpo4YA')"
203464,TÜLAY BAKAR,2008,Konjenital sensörinöral işitme kayıplı hastalarda 64 dedektörlü temporal kemik bilgisayarlı tomografi ve temporal kemik magnetik rezonans görüntüleme bulguları.<br><span style='font-style: italic';>Diagnoses in patients having congenital sensorineural hearing lose by 64 slice temporal bone computarized tomography and temporal bone magnetic resonance imaging.,Eskişehir Osmangazi Üniversitesi,Tıpta Uzmanlık,Kulak Burun ve Boğaz = Otorhinolaryngology (Ear-Nose-Throat) ; Radyoloji ve Nükleer Tıp = Radiology and Nuclear Medicine," onclick=tezDetay('AouSQWevFwqvbtWcQ_u_0A','83NzhPjW8zTYI7SuWqK17Q')"
406819,NEHİR ÖZGÜL MENGÜLLÜOĞLU,2015,"Türkiye\'de birinci basamak sağlık hizmetlerinde aile hekimliği  uygulamasına geçilmesinin aile hekimliği uzmanlık tezlerine etkisi<br><span style='font-style: italic';>The effect of family medicine specialist thesis, on implementation of family medicine primary health services in Turkey",Eskişehir Osmangazi Üniversitesi,Tıpta Uzmanlık,Aile Hekimliği = Family Medicine," onclick=tezDetay('uJoTAc-quU4Ezj0Xr3SWxQ','B1oBVBk8nBaePkgQiqfR7g')"
623215,MUNİSE ÇALIŞKAN,2020,Kemoterapi almış hastalarda geç dönem kardiyotoksisitenin doku doppler ekokardiyografi ile değerlendirilmesi<br><span style='font-style: italic';>Evaluation of late cardiotoxicity with tissue doppler echocardiography in chemoteraphy patients,Eskişehir Osmangazi Üniversitesi,Tıpta Uzmanlık,Çocuk Sağlığı ve Hastalıkları = Child Health and Diseases," onclick=tezDetay('eS0hn9mYrrOHUOQZ5pFGuA','7X06capv0_DVmeqosmjO3w')"
194907,AYŞE ERKAN,2007,Laparoskopik kolesistektomi cerrahisinde esmolol\' ün hemodinamik parametreler ile QT aralığı ve QT disersiyonu üzerine etkisi<br><span style='font-style: italic';>Effects of esmolol in laparoscopic cholecystectomy on hemodynamic changes with QT intervals and QT dispertion in electrocardiography.,Eskişehir Osmangazi Üniversitesi,Tıpta Uzmanlık,Anestezi ve Reanimasyon = Anesthesiology and Reanimation," onclick=tezDetay('mYEuNBBf9_6z6zIaDTidoA','tPIRUT5vfPFShHs_3hh9_g')"
347683,SEVİL AKBABA TÜRKOĞLU,2013,Depresif bozukluğu olan kadın hastalarda çocukluk çağı ruhsal travmaları ve fonksiyonel olmayan tutumlarla ilişkisi<br><span style='font-style: italic';>Disfunctional attitudes and relationship with childhood traumas in female patients with depressive disorder,Eskişehir Osmangazi Üniversitesi,Tıpta Uzmanlık,Psikiyatri = Psychiatry," onclick=tezDetay('q9Krr8ZlwJryi3YqJ0Q4wg','5LJumj8FBtpXdLmW_LLxiQ')"
447534,ÇAĞDAŞ ALP UZAN,2016,Kontinyu spinal anestezi yapılan hastalarda spinal blok kalitesi ve postspinal baş ağrısı sıklıklarının retrospektif olarak değerlendirilmesi<br><span style='font-style: italic';>Retrospective evaluation of post-dural puncture headache frequency and spinal block quality in patients which continuous spinal anesthesia performed,Eskişehir Osmangazi Üniversitesi,Tıpta Uzmanlık,Anestezi ve Reanimasyon = Anesthesiology and Reanimation," onclick=tezDetay('KfM2Fm2UAIk3mmzTutViqQ','q_rpXC07dz-p56rYPrLKWA')"
698560,NESLİHAN BOZKOÇ VASİ,2021,Tirozin kinaz inhibitörü ve immunmodülatör tedavi alan onkolojik hasta grubunda tiroid disfonksiyon gelişimi ve hastalık prognozu arasındaki ilişkinin araştırılması<br><span style='font-style: italic';>Evaluation of tyrosine kinase inhibitors and immunecheckpoint inhibitors-induced thyroid disorders and their relationship ondisease prognosis in oncological patients,Eskişehir Osmangazi Üniversitesi,Tıpta Uzmanlık,Endokrinoloji ve Metabolizma Hastalıkları = Endocrinology and Metabolic Diseases," onclick=tezDetay('1tisUpBADu84uAcQyOrz2w','RgrvMr7WCK7zZFrjoww7vg')"
466500,AYŞE AĞAOĞLU,2017,"Eskişehir Osmangazi Üniversitesi Tıp Fakültesi Çocuk Alerji ve İmmünoloji Polikliniği\'ne solunum yolu şikayetleri ile başvuran 5 yaş ve altı çocuklarda inhaler mantar alerjisi sıklığı ve ilişkili faktörler<br><span style='font-style: italic';>Frequency of mold allergy and associated factors in children aged 5 and under that presented with respiratory complaints to Pediatric Chest Diseases, Allergy and Immunology Outpatient Clinic in the Medical Faculty of Eskişehir Osmangazi University",Eskişehir Osmangazi Üniversitesi,Tıpta Uzmanlık,Aile Hekimliği = Family Medicine," onclick=tezDetay('7Vl7a_lft8lf1RLtsbp7oA','F1f7yvQM8qlAx3cQ5j_kow')"
196165,MUZAFFERE ÖKTEN GENÇ,2007,Batın cerrahisi uygulanacak vakalarda premedikasyonda intramüsküler olarak verilen alfa-2 agonist olan deksmedetomidin ve midazolamın hemodinamik parametreler üzerine olan etkileri<br><span style='font-style: italic';>The effects of alfa-2 agonist dexmedetomidine and midazolam as intramusculer premedication on the hemodynamic parameters of the patients undergoing laparotomy surgery,Eskişehir Osmangazi Üniversitesi,Tıpta Uzmanlık,Anestezi ve Reanimasyon = Anesthesiology and Reanimation," onclick=tezDetay('Sz7G6TPWan19KBAVAb4I3w','NoxOL1EuZ7jlgHm1Ly_rLA')"
225866,SABRİ HERDEM,2008,Kanser hastalarında psikiyatrik komorbidite ve intihar düşüncesi<br><span style='font-style: italic';>Psychiatric comorbidity and suicidal thoughts in cancer patients,Eskişehir Osmangazi Üniversitesi,Tıpta Uzmanlık,Demografi = Demography," onclick=tezDetay('_6gGVwRkXEnzQ0dqMXiM5A','FpGVjbZckFoiirs-MK7X4A')"
315847,HÜLYA TURGUT,2012,Akut dönemdeki iki uçlu duygudurum bozukluğu ve şizofreni hastalarında sosyodemografik özellikler ile hezeyan içeriklerinin karşılaştırılması<br><span style='font-style: italic';>The comparasion of sociodemographic properties and contents of delusions of patients with schizophrenia and bipolar disorder in their acute phase,Eskişehir Osmangazi Üniversitesi,Tıpta Uzmanlık,Psikiyatri = Psychiatry," onclick=tezDetay('A-mwm-ny5tO5xfiDjdD2Iw','ntDO1_LA2EY4CmC0DtPLBg')"
359274,HÜSAMETTİN ÖZDEMİR,2014,Medial malleol kırıklarının kapalı redüksiyon perkütan tespit yöntemi ile tedavisi ve sonuçlarının değerlendirilmesi<br><span style='font-style: italic';>Evaluation of the treatment of medial malleolus fractures by closed reduction and percutaneous fixation (CRPF) and the treatment results,Eskişehir Osmangazi Üniversitesi,Tıpta Uzmanlık,Ortopedi ve Travmatoloji = Orthopedics and Traumatology," onclick=tezDetay('uswajSG4RISG9g0zsKZRxg','3RMz8zHtE0KbsQT6NBSImw')"
440379,BEYTULLAH ALTINKAYNAK,2016,Diyabetik nefropatili hastalarda kolekalsiferol\'ün (vitamin D3) albüminüri üzerine etkisinin retrospektif olarak değerlendirilmesi<br><span style='font-style: italic';>Determining of the vitamin D3 effect on albuminuria among the patients with diabetic nephropathy: A retrospective study,Eskişehir Osmangazi Üniversitesi,Tıpta Uzmanlık,Nefroloji = Nephrology," onclick=tezDetay('jX3V0BgFu6Lq4cbqP80nLg','vsY4UWKkRZEGtApkzV7etQ')"
466495,RUŞENGÜL KORUK,2017,Acil servise başvuran hastalarda kontrastlı bilgisayarlı tomografi sonrası opak nefropatisi olasılığı<br><span style='font-style: italic';>Possibility of opaque nephropathy after contrast-enhanced computerized tomography in emergency deparment patients,Eskişehir Osmangazi Üniversitesi,Tıpta Uzmanlık,Nefroloji = Nephrology," onclick=tezDetay('rBARYh2o_hnBAuXRhf81bg','YvoMv-xrRUmYSSHaNOzWSg')"
271855,ÇİĞDEM ÇELİK,2010,Relapsing remitting multipl skleroz hastalarında nöropatik ağrı sıklığı<br><span style='font-style: italic';>Neuropathic pain frequecy in patients of relapsing remitting multiple sclerosis,Eskişehir Osmangazi Üniversitesi,Tıpta Uzmanlık,Nöroloji = Neurology," onclick=tezDetay('POXRZA5H4zTIVxew4PUZRw','9W92cpkeHOPiw_f6xVEL0w')"
650328,ALİ YILMAZ,2020,Yaşlılık nedeniyle hukuki ehliyet değerlendirmesi istenilen olgularda hukuki ehliyet değerlendirme formu\'nun (hedef) uygulanabilirliğinin ölçülmesi<br><span style='font-style: italic';>Measuring the applicability of the legal capacity assesment form in cases that are requiered to adress legal capacity due to old age,Eskişehir Osmangazi Üniversitesi,Tıpta Uzmanlık,Adli Tıp = Forensic Medicine," onclick=tezDetay('q4I_Yi3M8bLNI4DQUXtRUg','RfnESq3N2CIn7RSuE_V7-Q')"
440389,GÜLÇİN BOZAN,2016,Tekrarlayan hışıltılı süt çocuklarında mycoplasma pneumoniae ve clamidia pneumoniae etkenlerinin sıklığı ve atopi ilişkisi<br><span style='font-style: italic';>Infants with recurrent wheezing prevalence and atopy association of mycoplasma pneumoniae and chlamydia pneumoniae infections,Eskişehir Osmangazi Üniversitesi,Tıpta Uzmanlık,Çocuk Sağlığı ve Hastalıkları = Child Health and Diseases," onclick=tezDetay('MK9111MOb1IatzOYU0J1Tg','1rAo4o8pza7qe4Dpb3dn4g')"
513396,ASLI DENİZ,2018,Preterm ve term bebeklerin anne sütündeki total oksidan seviyesi ve total antioksidan kapasitenin laktasyon evrelerine göre incelenmesi<br><span style='font-style: italic';>Evaluation of total oxidant status and total antioxidant capacity in breast milk of preterm and term neonates during the course of lactation,Eskişehir Osmangazi Üniversitesi,Tıpta Uzmanlık,Çocuk Sağlığı ve Hastalıkları = Child Health and Diseases," onclick=tezDetay('n3ezXHloDfw6Uu_hdvayBw','ZsmPN3ylmNI2nEzspsQxIg')"
203621,ARZU ARGUN TÜRKKAN,2008,Klinik örneklerden soyutlanan anaerop bakterilerin tanımlanması ve E-test yöntemi ile antibiyotik duyarlılıklarının belirlenmesi<br><span style='font-style: italic';>Identification anaerobic bacteria isolated from clinical samples and determination of antibiotic suspectibilities by E-test methods.,Eskişehir Osmangazi Üniversitesi,Tıpta Uzmanlık,Mikrobiyoloji = Microbiology," onclick=tezDetay('LYAzzy09J4RFJFtmV8RCMw','0is-TsK5oFLIaFZOV3rECA')"
203461,MEHRDAD AMİRİ,2008,"Akneli hastalarda, cinsel hormonların çalışması ve akne ile ilişkisinin araştırılması<br><span style='font-style: italic';>Akneli hastalarda, cinsel hormonlarin çalişmasi ve akne ile ilişkisinin araştirilmasi",Eskişehir Osmangazi Üniversitesi,Tıpta Uzmanlık,Dermatoloji = Dermatology," onclick=tezDetay('xibtrF3bfJ-Tm5w2wYJ65g','NKQAc835Txc0xs0GXfT0hQ')"
703076,EMRE YOLDAŞ,2021,Ratlarda etilen glikol ve hidroksi-l-prolin ile indüklenmiş böbrek taşı modelinde baicaleinin koruyucu ve tedavi edici etkisinin araştırılması<br><span style='font-style: italic';>Investigation of protective and therapeutic effect of baicalein in kidney stone model induced by ethylene glycol and hydroxy-1-proline in rats,Eskişehir Osmangazi Üniversitesi,Tıpta Uzmanlık,Üroloji = Urology," onclick=tezDetay('GPpY8vus0fg3O7GcAuCXWw','32DgjipnelY2qLpLpQYzaA')"
522896,BURCU ÖZEK ÖR,2018,Spiral arter doppler bulgularının ve anjiojenik-antianjiojenik faktörlerin preeklmpsi gelişmesini öngörmedeki rolü<br><span style='font-style: italic';>The role of spiral artery doppler findings and angiogenic-antiangiogenic factors in predicting the development of preeclampsia,Eskişehir Osmangazi Üniversitesi,Tıpta Uzmanlık,Kadın Hastalıkları ve Doğum = Obstetrics and Gynecology," onclick=tezDetay('im5YyNBLtlIeIy1R4r-qHQ','pvZpa-SRKpzByVV2P9u5BQ')"
194687,İMRAN SAĞLIK,2007,"Genotype mycobacteria direct test yönteminin klasik tanı yöntemleriyle karşılaştırılması, izole edilen M. tuberculosis complex\'de izoniazid ve rifampisin direncinin aranması<br><span style='font-style: italic';>Comparison of the genotype mycobacteria direct assay method with the conventional identification methods in the search of mycobacteria in the sputum samples, search of izoniazid and rifampisin resistance in the M. tuberculosis complex isolated",Eskişehir Osmangazi Üniversitesi,Tıpta Uzmanlık,Mikrobiyoloji = Microbiology," onclick=tezDetay('RsgUeJCWhdwdLcAUcjpBbA','lIlDiTg6QZrN13uncx7AeQ')"
196171,GÜVEN BARIŞ CANSU,2007,Romatoid artrit hastalarında adiponektin düzeyi ile hastalık etkinliği ve akut faz yanıtınn ilişkisi<br><span style='font-style: italic';>Association of adiponectin levels with disease activity and acute phase reactants in patients with rheumatoid arthritis,Eskişehir Osmangazi Üniversitesi,Tıpta Uzmanlık,Romatoloji = Rheumatology," onclick=tezDetay('Zux-065lxua72GspZyF65Q','2DwLAKk_zLXFJ4RDGpyxLg')"
334024,NURGÜL TUNÇÇEKİÇLER,2013,Spinoserebellar ataksili olgularda MRG ile kantitatif volüm ölçümleri ve klinik korelasyonu<br><span style='font-style: italic';>Volumetric analysis with magnetic resonance imaging in spinocerebellar ataxia cases and clinical correlation,Eskişehir Osmangazi Üniversitesi,Tıpta Uzmanlık,Nöroloji = Neurology ; Radyoloji ve Nükleer Tıp = Radiology and Nuclear Medicine," onclick=tezDetay('DPcUUq3XZd0i5kUnrh_gSA','fu-EO2PkzWHOjG4moBDdog')"
194894,BENLİ BOYLU BANU,2007,"Laminektomi cerrahisi uygulanan hastalarda peroperatif olarak verilen lornoksikamın postoperatif morfin tüketimi üzerine etkisi ve hasta memnuniyeti<br><span style='font-style: italic';>Detecting the effect of perioperative IV lornoxicam on postoperative morphine consumption and adverse effects in patients, undergoing discectomy and laminectomy",Eskişehir Osmangazi Üniversitesi,Tıpta Uzmanlık,Anestezi ve Reanimasyon = Anesthesiology and Reanimation," onclick=tezDetay('9ZAbI28jpomlVK3-zsWEdQ','M0q70XtEAcgO5QKyE88C_Q')"
351226,COŞKUN KAYA,2013,Twinkling artefaktının böbrek taşlarının in vivo biyokimyasal yapıları ile ilişkilendirilmesi<br><span style='font-style: italic';>Relation of twinkling artifact with in vivo biochemical composition of kidney stones,Eskişehir Osmangazi Üniversitesi,Tıpta Uzmanlık,Üroloji = Urology," onclick=tezDetay('1zMSC-Dem7-uGBLgkdz7Tw','pPl2EdGRJ19JBDthoIKbXQ')"
360259,FATMA KELEŞ ACISU,2014,Hipertansif ebeveynlerin normotansif çocuklarında homosistein düzeyleri<br><span style='font-style: italic';>Homocysteine levels in normotensive children with hypertensive parents,Eskişehir Osmangazi Üniversitesi,Tıpta Uzmanlık,Çocuk Sağlığı ve Hastalıkları = Child Health and Diseases," onclick=tezDetay('WaNE1SyhsanCSKpnZ7AvUQ','Wtj4pGmqMC8IMTEwYwXikw')"
194576,SAVAŞ BEYAZTAŞ,2007,Atriyum fibrilasyonu olup DCS ile sinüs ritmine dönen olgularda ramipril doz titrasyonunun nükse etkisi<br><span style='font-style: italic';>The effect of ramipril dose titration on recurrence in patients with AF who had sinus rhythm after DCS,Eskişehir Osmangazi Üniversitesi,Tıpta Uzmanlık,Kardiyoloji = Cardiology," onclick=tezDetay('MekGN8Ih54BcrC8K_Z9wYg','zWApAZULj7M_gm5Yi20aAA')"
365980,HATİCE ŞAHİN,2014,Obsesif kompulsif bozukluğu olan hastalarda obsesif inanışlar ve nörokognitif esneklik arasındaki ilişki<br><span style='font-style: italic';>Relationship between obsessive beliefs and neurocognitive flexibility in patients with obsessive compulsive disorder,Eskişehir Osmangazi Üniversitesi,Tıpta Uzmanlık,Psikiyatri = Psychiatry," onclick=tezDetay('xQTYx5yq4ImmP4Jg--NR1w','MJxJAXlA1rN4wanZJ7pnqw')"
281919,ESRA DİKOĞLU,2011,"Eskişehir bölgesinde miyokard infarktüsü geçiren hastalarda Metilentetrahidrofolat Redüktaz geni polimorfizmlerinin (C677T, A1298C) araştırılması.<br><span style='font-style: italic';>Investigation on Methylenetetrahydrofolate reductase gene polymorphisms (C677T, A1298C) on the myocardial infarction patients around Eskisehir region",Eskişehir Osmangazi Üniversitesi,Tıpta Uzmanlık,Genetik = Genetics," onclick=tezDetay('IOlpFHAr5y3znv1XrchJnw','6Z9vIon7OZh04SVj0bTbXA')"
316632,DUYGU ÖZKORUCU YILDIRGAN,2012,"Deneysel nefrotik sendrom\'da ghrelin, sCD80 ve sCTLA-4\'ün rolü<br><span style='font-style: italic';>The role of ghrelin, sCD80 and sCTLA-4 in experimental nephrotic syndrome",Eskişehir Osmangazi Üniversitesi,Tıpta Uzmanlık,Nefroloji = Nephrology ; Çocuk Sağlığı ve Hastalıkları = Child Health and Diseases," onclick=tezDetay('idxsiuu2bM0do8NV5u169A','bGl8-V03iR7T6J7eU7UqNg')"
329196,AHMET KÜÇÜK,2012,Çocuk uzun kemik kırıklarında intramedüller tel uygulaması<br><span style='font-style: italic';>Titanium intramedullary elastic nailing for pediatric long bone fracture treatment,Eskişehir Osmangazi Üniversitesi,Tıpta Uzmanlık,Ortopedi ve Travmatoloji = Orthopedics and Traumatology," onclick=tezDetay('8Xb1zw3QRE3bJDdbbXWXMw','mIY0UclmWfeu57HDzARU5w')"
324147,NECLA İPAR,2012,Ekzojen obezitesi olan hastalarda total oksidatif stres ve total antioksidan kapasite düzeyleri; probiyotiklerin bu düzeylere etkisi<br><span style='font-style: italic';>Total oxidative stress and total antioxidant capacity in patients with exogenous obesity and potential role of add-on probiotics,Eskişehir Osmangazi Üniversitesi,Tıpta Uzmanlık,Beslenme ve Diyetetik = Nutrition and Dietetics ; Çocuk Sağlığı ve Hastalıkları = Child Health and Diseases," onclick=tezDetay('ihsaTQBXpohIqL6m_fmA7w','BH5tlbkk8c2ggwTxywmBjw')"
225870,ALİ OTUZBİR,2009,"Hidroksiapatit ve gümüş kaplanmış protez implantların in vivo antimikrobiyal etkinliğinin değerlendirilmesi, hayvanlarda deneysel çalışma<br><span style='font-style: italic';>Evaluation of in vivo antimicrobial efficiency of hidroxyapatite- and silver-coated prothesis implants, an experimental animal study",Eskişehir Osmangazi Üniversitesi,Tıpta Uzmanlık,Ortopedi ve Travmatoloji = Orthopedics and Traumatology," onclick=tezDetay('THp2pIDATQN4VEXIlz1_KQ','-pcGhiqLsnNJt3TJ2bkdnw')"
315845,NURHAYAT BİRCAN,2012,"Arteriyel oklüziv hastalığı olan hastalarda homosistein, von willebrand faktör, fibrin, CRP, kollesterolün diagnostik değeri<br><span style='font-style: italic';>Homocystein, von willebrand factor (vwf), fibrin, C-reactive protein (CRP) and diagnostic value of cholesterol in patients with arterial occlusive disease",Eskişehir Osmangazi Üniversitesi,Tıpta Uzmanlık,Göğüs Kalp ve Damar Cerrahisi = Thoracic and Cardiovascular Surgery," onclick=tezDetay('5xlO0NrIPDnxV2toiGgQGw','7a3L4lA5DlZdhHgHU0b06A')"
663664,RESUL EKİCİ,2021,Preoperatif nötrofil/lenfosit oranının ve eritrosit dağılım genişliğinin izole kalp kapak ameliyatlarında postoperatif prognoza etkisinin araştırılması<br><span style='font-style: italic';>Investigation of the effect of preoperative neutrophil/lymphocyte ratio and erythrocyte distribution witdth on postoperative prognosis in isolated heart valve surgery,Eskişehir Osmangazi Üniversitesi,Tıpta Uzmanlık,Anestezi ve Reanimasyon = Anesthesiology and Reanimation," onclick=tezDetay('TcQcx3-tOHC8t5xygOuCyg','OYBUWsxvlsfakc9cxQuolw')"
