tez_no,yazar,yıl,title,üniversite,tez_türü,konu,tez_detay
787871,SETENAY KAYA,2023,Eskişehir Osmangazi Üniversitesi Tıp Fakültesi Hastanesinde çalışanhekim ve hemşirelerin otizm spektrum bozukluğu hakkındaki bilgidüzeylerinin incelenmesi<br><span style='font-style: italic';>Research of knowledge levels of physicians and nurses working ateskisehir Osmangazi University Medical Faculty Hospital on autism spectrumdisorder,Eskişehir Osmangazi Üniversitesi,Tıpta Uzmanlık,Aile Hekimliği = Family Medicine," onclick=tezDetay('J42hFRYhOjR4zjkMrzmiqg','iW0aDuGVu6nU85h0RiYnHw')"
773268,BURCU VURAL ATALAY,2022,Çocuk acil servisinde akut apandisit tanısı alan hastalarda pediatrik apandisit skorlamasının değerleri ile abdominal ultrasonografi bulguları ve abdominal bilgisayarlı tomografi bulgularının karşılaştırılması<br><span style='font-style: italic';>Comparison of pediatric appendicitis scoring values with abdominal ultrasonography findings and abdominal computed tomography findings in patients diagnosed with acute appendicitis in the pediatric emergency department,Eskişehir Osmangazi Üniversitesi,Tıpta Uzmanlık,Çocuk Sağlığı ve Hastalıkları = Child Health and Diseases," onclick=tezDetay('Eo5Ur0YpTBkdfAq4xQkl6g','YaFWX7j0gNRv0jbtdoXZ6g')"
773644,FATMA SU DEMİR,2022,"Yüksek volümlü bir ERCP merkezinin kalite göstergelerinin incelenmesi; ESOGÜ Tıp Fakültesi Gastroenteroloji Bilim Dalının 2803 olgudaki sonuçları<br><span style='font-style: italic';>Analysis of quality indicators of a HİGH volume ERCP center;results of esogu faculty of medicine gastroenterology department in 2803 cases. Eskisehir Osmangazi University Faculty of Medicine, department of internal medicine",Eskişehir Osmangazi Üniversitesi,Tıpta Uzmanlık,Gastroenteroloji = Gastroenterology," onclick=tezDetay('2gbuIkjXVPl6C9GcrpV5VA','TJPxQz1goS2nj4glX86EWw')"
779084,EGE ATEŞ,2022,Kitle iletişim araçlarında yer alan sağlıkla ilgili bilgilerin Eskişehir Osmangazi Üniversitesi Tıp Fakültesi hastanesi aile hekimliği polikliniğine başvuran hastaların sağlık davranışlarına etkisinin değerlendirilmesi<br><span style='font-style: italic';>Evaluation of the effect of health-related information in mass media on health behaviors of patients applying to Eskişehir Osmangazi University Medical Faculty Hospital family medicine outpatient clinic,Eskişehir Osmangazi Üniversitesi,Tıpta Uzmanlık,Aile Hekimliği = Family Medicine," onclick=tezDetay('oGQBghtEOP412KNs2GN3jg','KSLhAtnIxjt6JqK9b-3tTQ')"
787826,OBAIDULLAH AHMADZAI,2022,Acil serviste st elevasyonlu miyokard infarktüsü tanısı alan olgularda perfüzyon indeksi ölçümünün hasta idaresindeki yeri ve etkisinin değerlendirilmesi<br><span style='font-style: italic';>The place of perfusion index measurement in patient management and group analysis in patients WHO recorded myocardial infarction in the emergency department,Eskişehir Osmangazi Üniversitesi,Tıpta Uzmanlık,Acil Tıp = Emergency Medicine," onclick=tezDetay('x8fq-rTsEH2IZKFjgvoOfA','OSy36GUxdlmsmkoFSL_Z6w')"
787748,FERDA ECE İNCE ERCAN,2022,"Şizofreni bakım verenlerinde bağlanma, başa çıkma stilleri ve travma sonrası büyümenin hastaların işlevselliği ile ilişkisinin değerlendirilmesi<br><span style='font-style: italic';>Evaluation of the relationship between attachment, copingstyles, and posttraumatic growth in caregivers of schizophrenia withpatients functioning",Eskişehir Osmangazi Üniversitesi,Tıpta Uzmanlık,Psikiyatri = Psychiatry," onclick=tezDetay('srJNsb7cTbclFvrn_H_M5g','4WHuhWpp47Crcj5bXnee0w')"
773325,TUNA HAN YÜCE,2022,Malign mezotelyoma hastalarında BAP-1 sunusunun tedavi cevabı ve prognoz üzerine etkileri<br><span style='font-style: italic';>The effects of BAP-1 expression on prognosis and treatment response and in malignant mesothelioma patients,Eskişehir Osmangazi Üniversitesi,Tıpta Uzmanlık,Göğüs Hastalıkları = Chest Diseases," onclick=tezDetay('ABb0gfGK1l51rnusvQOZRA','stpA7A-DXLF9mg_UqmN4ow')"
896102,HALİL İBRAHİM YANIK,2024,Akneli hastalarda skar oluşumunda etkili faktörlerin araştırılması<br><span style='font-style: italic';>Investigation of factors affecting scar formation in acne patients,Eskişehir Osmangazi Üniversitesi,Tıpta Uzmanlık,Dermatoloji = Dermatology," onclick=tezDetay('jdrCRND5S78aIcSIwr_SZw','n5IFGCT5BAnAB0fLNTvmqA')"
896013,EZGİ PALA,2024,Diyalize girmeyen kronik böbrek hastalığı olan çocuklarda anjiotensin peptit düzeylerinin araştırılması<br><span style='font-style: italic';>Research of angiotensin peptides levels in children with pre-dialysis chronic kidney disease,Eskişehir Osmangazi Üniversitesi,Tıpta Uzmanlık,Çocuk Sağlığı ve Hastalıkları = Child Health and Diseases," onclick=tezDetay('4AsutVgvrIarq0al-1RBHA','I1zU16-8Qf-B5tDgD1WXOw')"
896082,SİMAY ARMAĞAN YALVAÇ,2024,Yenidoğan geç sepsisinde endotelyal glikokaliks komponentleri düzeylerinin değerlendirilmesi<br><span style='font-style: italic';>Evaluation of endothelial glycocalyx components levels in late-onset newborn sepsis,Eskişehir Osmangazi Üniversitesi,Tıpta Uzmanlık,Çocuk Sağlığı ve Hastalıkları = Child Health and Diseases," onclick=tezDetay('bqGP_6Kym2RUMNm9iMKSwQ','mk6OOT22Vjfc7Kvyn5kgLg')"
895869,BEKİR CEBE,2024,Rotator cuff sendromlu hastalarda omuz ekleminin nöromekanik yöntemlerle değerlendirilmesi<br><span style='font-style: italic';>Evaluation of shoulder joint with neuromechanical methods in patients with rotator cuff syndrome,Eskişehir Osmangazi Üniversitesi,Tıpta Uzmanlık,Ortopedi ve Travmatoloji = Orthopedics and Traumatology," onclick=tezDetay('w_8SMbmk7-EJWzJB3vv2mg','T57sG8b7rKyUqm6MaPVnuQ')"
896042,MEHMETCAN YEŞİLKAYA,2024,Parkinson hastalarında ve bakım verenlerinde cihaz destekli tedavilerin farkındalığının incelenmesi<br><span style='font-style: italic';>Examining the awareness of devi̇ce- assisted treatments in parkinson\'s disease patients and their caregivers,Eskişehir Osmangazi Üniversitesi,Tıpta Uzmanlık,Nöroloji = Neurology," onclick=tezDetay('5g6SiRMdsGfPSYShYniW0A','p8Tii3Ntv1AsYpiJVgKFnA')"
896108,FATİH ENES DURMAZ,2024,Kalp yetmezliği olan diyabetik hastalarda kanşekeri regülasyonu ile aortik stiffness ve aritmi sıklığı ilişkisinin değerlendirilmesi<br><span style='font-style: italic';>Evaluation of the relationship between blood glukoz regulation and aortic stiffness and arrhythmia frequency in diabetic patients with heart failure,Eskişehir Osmangazi Üniversitesi,Tıpta Uzmanlık,Kardiyoloji = Cardiology," onclick=tezDetay('UxIVU6u6GJKQBwq4oJvW1g','rkLAX9jm65-aVyCHgixMyA')"
895878,ILKIN HASANOV,2024,Koroner bilgisayarlı tomografik anjiografide perikoroner yağ dokunun koroner arter darlığı ile ilişkisinindeğerlendirilmesi<br><span style='font-style: italic';>Evaluation of the relationship between pericoronary fat tissue andcoronary artery stenosis in coronary computed tomographic angiography,Eskişehir Osmangazi Üniversitesi,Tıpta Uzmanlık,Radyoloji ve Nükleer Tıp = Radiology and Nuclear Medicine," onclick=tezDetay('Bv8bMsDtBUZx3fNXZibhcg','NfgMpg3C23AX-DU-s0v_Wg')"
895925,MELİHA ERTAN,2024,COVİD pandemisi sürecinde COVİD enfeksiyonu geçirmiş gebelerde gebelik sonuçlarının retrospektif incelenmesi<br><span style='font-style: italic';>Retrospective examination of pregnancy outcomes in pregnants with COVID infection during the COVID pandemic,Eskişehir Osmangazi Üniversitesi,Tıpta Uzmanlık,Kadın Hastalıkları ve Doğum = Obstetrics and Gynecology," onclick=tezDetay('_qkAZOTTjzLIyH1HrR9bkg','Z2nlIYAjd-l4M-UrxEFXZg')"
896107,MUSTAFA YİĞİT KARACA,2024,Endometrium karsinomu nedeniyle opere edilen hastalarda preoperatif serum ca125 değerlerinin myometrial invazyon derinliği ve lenfovasküler invazyon varlığını öngörmedeki rolünü retrospektif olarak değerlendirilmesi<br><span style='font-style: italic';>Evaluation of the role of preoperative serum ca125 levels in predicting myometrial invasion depth and presence of lymphovascular invasion in patients undergoing surgery for endometrial carcinoma: a retrospective study,Eskişehir Osmangazi Üniversitesi,Tıpta Uzmanlık,Kadın Hastalıkları ve Doğum = Obstetrics and Gynecology," onclick=tezDetay('VuOas4euTbSPQ6cXnbihfw','HofstGdLDnv1dUdgxlqHyA')"
895872,ÇAĞATAY CİHAN,2024,"Meniere hastalığında geç kontrastlı ve konvansiyonel MRG bulgularının klinik korelasyonu, gözlemci tecrübesinin önemi<br><span style='font-style: italic';>Clinical correlation of late contrast and conventional MRI findings in Meniere\'s disease, the importance of observer experience",Eskişehir Osmangazi Üniversitesi,Tıpta Uzmanlık,Radyoloji ve Nükleer Tıp = Radiology and Nuclear Medicine," onclick=tezDetay('YBvHizTEln5gn5o8M2qu6A','2_u8gOc_BBUScutEpEUWag')"
895880,GİZEM BAŞYAZICI EKİNCİ,2024,Glioblastoma multiforme\'de karbon monoksitin temozolomid ile karşılaştırmalı terapötik etkisinin araştırılması-hücre kültür çalışması<br><span style='font-style: italic';>Therapeutic effect of carbon monoxide on Glioblastoma multiforme compared with temozolomid-cell culture study,Eskişehir Osmangazi Üniversitesi,Tıpta Uzmanlık,Nöroşirürji = Neurosurgery," onclick=tezDetay('psAnyJd1tLMGPEjUhOEYZg','ysuguA9mHR8vLHeaZNs7rA')"
896093,SELVA DİLAN GÖLBAŞI KOÇ,2024,Fitness salonlarında egzersiz yapanların spor süplementleri bilgi düzeylerinin değerlendirilmesi için ölçek geliştirme ve Eskişehir örneğinde genel-spor beslenmesi bilgi düzeyleri ile birlikte süplement kullanımının değerlendirilmesi<br><span style='font-style: italic';>Development of a scale to assess knowledge levels about sports supplements in individuals exercising at fitness centers and the evaluation of general-sports nutrition knowledge and supplement use: The case of Eskisehir,Eskişehir Osmangazi Üniversitesi,Tıpta Uzmanlık,Halk Sağlığı = Public Health," onclick=tezDetay('pE_hAVLFZIhT8RdQSK365Q','cL5Q5ZN1vM9X7qspKSEqbg')"
896103,AHMET COŞAR,2024,Meme küçültme ameliyatı geçiren hastaların muayene ve görüntüleme bulguları ile patoloji sonuçlarının değerlendirilmesi<br><span style='font-style: italic';>,Eskişehir Osmangazi Üniversitesi,Tıpta Uzmanlık,Plastik ve Rekonstrüktif Cerrahi = Plastic and Reconstructive Surgery," onclick=tezDetay('4SUuQ1JMBtOaiYngp6ljIA','sE21EPlAxH01-jy2mBo3Rg')"
896136,MEHMET ATEŞ,2024,Plevral lezyonların ayırıcı tanısında flor 18 fluorodeoksiglukoz pozitron emisyon tomografisi/bilgisayarlı tomografinin rolünün değerlendirilmesi<br><span style='font-style: italic';>Evaluation of the role of fluorine 18 fluorodeoxyglucose positron emission tomography/computed tomography in the differential diagnosis of pleural lesions,Eskişehir Osmangazi Üniversitesi,Tıpta Uzmanlık,Radyoloji ve Nükleer Tıp = Radiology and Nuclear Medicine," onclick=tezDetay('oynti9fyZMBmOWBW-vxkRQ','u6IpO57dl3Qo1iAr34UKEA')"
873993,ÇAĞATAY BALKIŞ,2024,Açıklanamayan infertilitesi olan hastalarda saptanan endometrial polip ve septum için histeroskopik tedavinin tüp bebek tedavi sonuçlarına etkisi<br><span style='font-style: italic';>The effect of hysteroscopic treatment on in-vitro fertilization treatment outcomes in patients with unexplained infertility having endometrial polyps or uterine septum,Eskişehir Osmangazi Üniversitesi,Tıpta Uzmanlık,Kadın Hastalıkları ve Doğum = Obstetrics and Gynecology," onclick=tezDetay('NiObXa1ONN_oigk1pLqdmg','bBdgm17OGjR0mEIJfMlYyg')"
896104,ERKİN CEMEK,2024,Beyin sisi ile kronik hastalık görülme sıklığının değerlendirilmesi<br><span style='font-style: italic';>Evaluation of the frequency of chronic disease with brain fog,Eskişehir Osmangazi Üniversitesi,Tıpta Uzmanlık,Aile Hekimliği = Family Medicine," onclick=tezDetay('CcH1GGlEZAwmCAY6WPjl5A','5zDpqxRYy_PwGAdaEOKCUg')"
681346,MEHMET BAŞ,2021,COVID-19 pandemisinin acil servis üzerine etkisinin değerlendirilmesi<br><span style='font-style: italic';>Evaluation of the effect of the COVID-19 pandemic on the emergencyservice,Eskişehir Osmangazi Üniversitesi,Tıpta Uzmanlık,İlk ve Acil Yardım = Emergency and First Aid," onclick=tezDetay('ucGeJrhvCL8DAZsZ1ErPIQ','Q1G3_37mEstgaanjNiGb3g')"
496993,ŞENOL DENİZ,2018,Gebelerin çocukluk çağı aşılarına karşı bilgi ve tutumlarının değerlendirilmesi<br><span style='font-style: italic';>Evaluation of information and attitudes of pregnants on childhood vaccinations,Eskişehir Osmangazi Üniversitesi,Tıpta Uzmanlık,Aile Hekimliği = Family Medicine," onclick=tezDetay('IpagXEV_L1b1xxpYPRrVfA','4LN5UeW0VGE93sW_PmJ3tg')"
196169,UĞUR BİLGE,2008,Bazı kronik hastalıklarda ruhsal bozuklukların sıklığı ve sosyodemografik değişkenlerle ilişkisi<br><span style='font-style: italic';>Frequency of psychiatric disorders in several chronic diseases and their relationships with sociodemografic variables,Eskişehir Osmangazi Üniversitesi,Tıpta Uzmanlık,Aile Hekimliği = Family Medicine," onclick=tezDetay('Mk-51J1sFTRFm355P_2nJA','xWm9ggDnIcVp7SIufvVPtg')"
203622,AYBER CEMİLE TUNA ÖZGEÇ,2008,Aksiller pleksus blokajında prilokaine eklenen deksametazonun blokaj süresine etkisi<br><span style='font-style: italic';>The effect of dexamethasone added to prilocaine on the duration of axillary plexus block,Eskişehir Osmangazi Üniversitesi,Tıpta Uzmanlık,Anestezi ve Reanimasyon = Anesthesiology and Reanimation," onclick=tezDetay('Y5axjeKPOVX099UDLKTSsw','PZaCKhEdxEBnwGZgcduLcA')"
141945,MEHMET ERTUĞRUL,2004,Deneysel septik artrit erken döneminde farklı drenaj yöntemlerinin etkinliğinin karşılaştırılması<br><span style='font-style: italic';>,Eskişehir Osmangazi Üniversitesi,Tıpta Uzmanlık,Ortopedi ve Travmatoloji = Orthopedics and Traumatology," onclick=tezDetay('4d5CNvEyb9jSxjfRli506g','HB92xDls0EQ-JtKQY7b2kQ')"
388712,MÜGE GENEK ÜLGEN,2015,Bir Üniversite hastanesi psikiyatri polikliniğine başvuran ve antidepresan tedavi başlanan hastalarda cinsel işlev bozukluğu yaygınlığının incelenmesi<br><span style='font-style: italic';>Investigation of sexual dysfunction prevalance in the patients who have applied to an University hospital department of psychiatry outpatient clinic and being treated with antidepressants,Eskişehir Osmangazi Üniversitesi,Tıpta Uzmanlık,Psikiyatri = Psychiatry," onclick=tezDetay('d5m_5G4lTjiCzzFfm1BmbA','QW3jYGzjBipU9b4g9FBicQ')"
281927,EMİNE ARSLAN,2011,Kliniğimizde son iki yılda erken doğum yapan olguların maternal fetal açıdan irdelenmesi<br><span style='font-style: italic';>Maternal and fetal evaluation of the preterm delivery cases of our clinic in the last two years,Eskişehir Osmangazi Üniversitesi,Tıpta Uzmanlık,Kadın Hastalıkları ve Doğum = Obstetrics and Gynecology," onclick=tezDetay('1Ih_iDo-j_6ojIfGnBYSQw','Aq-nCKaLcP11BHQ56xJLlg')"
634558,ÖMER SÖZER,2020,"Keratokonus hastaları ve kontrol grubunda vitamin B12, folat(B9), riboflavin(B2) ve homosistein kan düzeylerinin araştırılması<br><span style='font-style: italic';>Investigation of blood levels of vitamin B12, folate (B9), riboflavin (b2) and homocysteine in keratoconus patients and control groups",Eskişehir Osmangazi Üniversitesi,Tıpta Uzmanlık,Göz Hastalıkları = Eye Diseases," onclick=tezDetay('bVMGB2piHUl4bLOwq_Gj4w','Oma1hYc0W5DYWt3Oj-n3vQ')"
460074,SERKAN SUNGUR,2017,ESOGÜ Tıp Fakültesi Acil Servis\'e başvuran yetişkin zehirlenme vakalarının aile hekimliği bakış açısıyla geriye dönük incelenmesi<br><span style='font-style: italic';>Retrospective analysis of adult poisoning cases attending to the emergency service of  ESOGU medical faculty according to family medicine\'s perspective,Eskişehir Osmangazi Üniversitesi,Tıpta Uzmanlık,Aile Hekimliği = Family Medicine," onclick=tezDetay('jHUjwskIll7p_hosAJcEzw','qyRHqJt6g4KKiMRzxLZ8kQ')"
680687,AZAD GÜLER,2021,Malign plevral sıvılı hastaların sağkalımlarının analizinde lent skorlamasının geçerlilik güvenirliğinin değerlendirilmesi<br><span style='font-style: italic';>Evaluation of validity and reliability of lent scoring in analysis of survival of patients with malignant pleural fluid,Eskişehir Osmangazi Üniversitesi,Tıpta Uzmanlık,Göğüs Hastalıkları = Chest Diseases," onclick=tezDetay('jAAmT5s0uYvQyoykAAF5cg','bcN6o6EryR9v7gKnlrBERg')"
281077,MÜNİRE PINARBAŞLI,2011,Eskişehir\'de klinik örneklerde ve sularda Legionella spp.. araştırılması<br><span style='font-style: italic';>An investigation of Legionella spp. in clinical samples and waters in eskisehir.,Eskişehir Osmangazi Üniversitesi,Tıpta Uzmanlık,Mikrobiyoloji = Microbiology," onclick=tezDetay('Ybcn8z7DNLnZnuRJTiyuKg','7AuX1FGPwe8tiE0ZA_65Vg')"
196179,İSMAİL KIRLI,2008,Kronik böbrek yetmezlikli hastalarda 25(OH)d3 düzeyi<br><span style='font-style: italic';> ,Eskişehir Osmangazi Üniversitesi,Tıpta Uzmanlık,Nefroloji = Nephrology," onclick=tezDetay('GpQ0sUhduVb13I4SbEGhzw','kG9EQsUsXYbXxbdlZoyiNA')"
248791,HURİYE ÖZGEN,2010,Akut romatizmal ateşte plazma adiponektin düzeyleri ve sitokinlerle ilişkisi<br><span style='font-style: italic';>Plasma adiponectin levels and relations with cytokines in children with acute rheumatic fever,Eskişehir Osmangazi Üniversitesi,Tıpta Uzmanlık,Kardiyoloji = Cardiology ; Çocuk Sağlığı ve Hastalıkları = Child Health and Diseases," onclick=tezDetay('COgYc6Zh5pEMlqDp-31QgA','l2mzwz-PHXKL4boy4K251w')"
266860,YASEMİN ÖZ,2010,"Vorikonazol, amfoterisin B ve kaspofunginin tek başına ve kombinasyonda Candida krusei izolatlarına karşı in vitro farmakodinamik etkinliği<br><span style='font-style: italic';>In Vitro pharmacodynamic activities of voriconazole, amphotericin B and caspofungin alone and in combination against clinical isolates of Candida krusei",Eskişehir Osmangazi Üniversitesi,Tıpta Uzmanlık,Mikrobiyoloji = Microbiology," onclick=tezDetay('rPwVdDGJeuTQKHe_yN2ioQ','Hz-enBaVgwcZCbgSauFcuQ')"
426675,EMEL ÖZTÜRK,2016,Çocuklarda antibiyotik ilişkili ishal sıklığı<br><span style='font-style: italic';>Antibiotic associated diarrhea incidance in children,Eskişehir Osmangazi Üniversitesi,Tıpta Uzmanlık,Aile Hekimliği = Family Medicine," onclick=tezDetay('XZXYOd1NgwF8Lf6IK9Q3Lg','p5fzJpk9iHYuQO4oXo3vUA')"
315846,SELEN KUZGUN,2012,Klasik strok rehabilitasyon programı ile kombine edilen ayna tedavisinin motor ve fonksiyonel iyileşme üzerine etkinliğinin araştırılması<br><span style='font-style: italic';>The efficacy of mirror therapy combined with conventional stroke rehabilitation program on motor and functional recovery,Eskişehir Osmangazi Üniversitesi,Tıpta Uzmanlık,Fiziksel Tıp ve Rehabilitasyon = Physical Medicine and Rehabilitation," onclick=tezDetay('XSUry9ozoKVkGFF-E7YHwA','jLp-4sw_yYCTq4l4RG9xaQ')"
396503,SENAN TAHMAZOV,2015,Dilate kardiyomiyopati hastaların immunadsorpsiyon tedavisi<br><span style='font-style: italic';>İmmunabsorption therapy in patients with dilated cardiomyopathy,Eskişehir Osmangazi Üniversitesi,Tıpta Uzmanlık,Kardiyoloji = Cardiology," onclick=tezDetay('l6bcmNpKUriLibf2EIfO9g','jXxEmju6xstuePITZXAaaA')"
673209,MERAL BARIŞ,2021,"Ebeveynlerin ulusal bağışıklama programı dışındaki aşılarla ilgili bilgi, tutum ve davranışlarının değerlendirilmesi<br><span style='font-style: italic';>Evaluation of parents\' knowledge, attitudes and behaviors about vaccines not-included in the national immunization program",Eskişehir Osmangazi Üniversitesi,Tıpta Uzmanlık,Çocuk Sağlığı ve Hastalıkları = Child Health and Diseases," onclick=tezDetay('FrXCxs1SPofDKLcIagEScg','bGJN-2tPEBckfuW-ZamgZg')"
267436,İLKER HATİPOĞLU,2010,Deneysel spinal kord travmasında Sildenafil\'in etkinliğinin araştırılması<br><span style='font-style: italic';>The effect of Sildenafil following experimental spinal cord injury,Eskişehir Osmangazi Üniversitesi,Tıpta Uzmanlık,Nöroşirürji = Neurosurgery," onclick=tezDetay('HwcLd1gMouUnBtTp8I0Swg','lx1-pBMvuf02Te5ChewE8Q')"
654524,TUGAY AVCI,2020,Yüksek doz tedavi almayan miyelodisplastik sendrom ve akut miyeloid lösemi hastalarının değerlendirilmesi<br><span style='font-style: italic';>Evaluation of patients with myelodysplastic syndrome and acute myeloid leukemia not receiving high-dose therapy,Eskişehir Osmangazi Üniversitesi,Tıpta Uzmanlık,Hematoloji = Hematology," onclick=tezDetay('uoSrF0WCdv-8Hzjhmhdcig','Tl0gpvKBvjvYG0bEcBgkBw')"
466499,ÜMİT AKKEMİK,2017,"Kliniğimizde postlaminektomi sendromu tanılı hastalarda yapılan girişimsel işlemlerin tedavi etkinliğinin retrospektif olarak araştırılması<br><span style='font-style: italic';>Retrospective investigation of the effectiveness of interventional procedures in patients with postlaminectomy syndrome, in our clinic",Eskişehir Osmangazi Üniversitesi,Tıpta Uzmanlık,Anestezi ve Reanimasyon = Anesthesiology and Reanimation," onclick=tezDetay('MN2OWhfjqnfGOH-roBEVIQ','eSlcr4NKHPKZHGnUIw7LXQ')"
225068,GÜNEY BADEMCİ,2008,"Non-sendromik nörosensöriyal tip işitme kaybı olan hastalarda GJB2, GJB3 ve GJB6 genlerinin MLPA yöntemi ile incelenmesi.<br><span style='font-style: italic';>Studying GJB2, GJB3 and GJB6 genes in patients with non-syndromic neurosensorial type hearing loss by MLPA technique.",Eskişehir Osmangazi Üniversitesi,Tıpta Uzmanlık,Genetik = Genetics," onclick=tezDetay('lRnUwDgmQkgbpXmCogcEuA','maem-KWxw6SNXWPewa-ToQ')"
203462,ÖZLEM EYİSOY ÖZBAYBURTLU,2008,Periferik arter hastalığı olan hastalarda aortoiliak bölge ve alt ekstremite arterlerinin 64-multidedektör BT ile değerlendirilmesi ve etkinliğinin dijital konvansiyonel anjiyografi ile karşılaştırılması<br><span style='font-style: italic';>Evaluation of aortoiliac region and lower extremity arteries with 64-multidedector row CT angiography and comparison of efficiency with digital subtraction angiography Patient with peripheral arterial diasease.,Eskişehir Osmangazi Üniversitesi,Tıpta Uzmanlık,Göğüs Kalp ve Damar Cerrahisi = Thoracic and Cardiovascular Surgery ; Radyoloji ve Nükleer Tıp = Radiology and Nuclear Medicine," onclick=tezDetay('M9YzsYHXiJgoWsXoi_m5dQ','Hsu1nKQkmy9PSKGUtjaZsg')"
272428,FATMA ÇAĞLAR KILIÇ,2011,Yenidoğan yoğun bakım ünitesinden taburcu olan çocuklarda hepatit B aşısına immün yanıtın değerlendirilmesi<br><span style='font-style: italic';>Evaluation of immune response to hepatitis B vaccine in children who were discharged from the neonatal intensive care unit,Eskişehir Osmangazi Üniversitesi,Tıpta Uzmanlık,Çocuk Sağlığı ve Hastalıkları = Child Health and Diseases," onclick=tezDetay('DYIz5wKiWA8DZEq_d6N3eA','O9cmAZXgb7ZzPNCVa6oUXQ')"
440380,ÇİÇEK KAPLAN,2016,Eskişehir Osmangazi Üniversitesi Sağlık Uygulama ve Araştırma Hastanesi acil servise başvuran 65 yaş üstü hastalarda çoklu ilaç kullanımı<br><span style='font-style: italic';>Determination of polypharmacy in patients over 65 years of age who presented to the emergency department Eskisehir Osmangazi University Faculty of Medicine,Eskişehir Osmangazi Üniversitesi,Tıpta Uzmanlık,Aile Hekimliği = Family Medicine ; Geriatri = Geriatrics ; İlk ve Acil Yardım = Emergency and First Aid," onclick=tezDetay('fwJBLGl0Sn0atxXcISRggw','vEfhphy2923UgV4uQ3FYEQ')"
709651,BERKER IŞIM,2021,Diyabetli gebe hastaların maternal ve fetal komplikasyonlarının değerlendirilmesi<br><span style='font-style: italic';>The evaluation of maternal and fetal complications in diabetic pregnant patients,Eskişehir Osmangazi Üniversitesi,Tıpta Uzmanlık,Kadın Hastalıkları ve Doğum = Obstetrics and Gynecology," onclick=tezDetay('izRAvvO_TTSPF2PQG8oP4g','40pJhnGRLYTlq-OGXc-iaQ')"
435641,BURCU KÖKOĞLU,2016,Çocukluk çağı zehirlenmelerinin retrospektif analizi<br><span style='font-style: italic';>A retrospective analysis of childhood poisoning,Eskişehir Osmangazi Üniversitesi,Tıpta Uzmanlık,Çocuk Sağlığı ve Hastalıkları = Child Health and Diseases," onclick=tezDetay('eCWbncjapfeiyjT-MLUeEg','wRI44hfyaNxavkm0DUsOrw')"
271858,PELİN UZUN SARITAŞ,2010,"Geriatrik hastalarda uygulanan spinal anestezide profilaktik efedrin, ringer laktat ve kolloid uygulamalarının hemodinamik parametreler üzerine ektkilerinin karşılaştırılması<br><span style='font-style: italic';>Comparison of the effect of prophylactic ephedrine, ringer\'s lactate and colloid applied during spinal anesthesia on hemodynamic parameters in geriatric patients",Eskişehir Osmangazi Üniversitesi,Tıpta Uzmanlık,Anestezi ve Reanimasyon = Anesthesiology and Reanimation," onclick=tezDetay('1BhiLMSmidcuMNlFfbglyg','PLz91sXzCKYsqi1ChE5wWw')"
267433,REMZİ ÇAYLAK,2010,"Gümüş kaplı titanyum intramedüller rodların açık kırık tedavisinde etkinliğinin araştırılması, hayvanlarda deneysel çalışma<br><span style='font-style: italic';>Determination of silver coated titanium intramedullary rods efficiency in open fractures, invivo study",Eskişehir Osmangazi Üniversitesi,Tıpta Uzmanlık,Ortopedi ve Travmatoloji = Orthopedics and Traumatology," onclick=tezDetay('6GQfcih5CV_2PrXTRsxbJw','YZrgHJ_IsfiHXpGkNa0xWQ')"
319108,BARTU BADAK,2012,Superıor mezenterik arter oklüzyonu oluşturulan ratlarda Milrinonun iskemi reperfüzyon hasarına koruyucu etkisi<br><span style='font-style: italic';>The protective effect of milrinone on ischemia reperfusion injury on rats that have ligated superior mesenteric artery,Eskişehir Osmangazi Üniversitesi,Tıpta Uzmanlık,Genel Cerrahi = General Surgery," onclick=tezDetay('67vSukoEUKuit3fnZ-4NxQ','nwyx_c7NdPs8b1QAtkOxog')"
