tez_no,yazar,yıl,title,üniversite,tez_türü,konu,tez_detay
308094,YASEMİN TEKİN ULUDAĞ,2012,Şizofreni ve bipolar afektif bozukluk tanısı almış hastalarda madde kullanım yaygınlığı; karşılaştırmalı bir çalışma<br><span style='font-style: italic';>Prevalance of substance abuse in patients diagnosed as schizophrenia and bipolar affective disorder; a comparative study,Eskişehir Osmangazi Üniversitesi,Tıpta Uzmanlık,Psikiyatri = Psychiatry," onclick=tezDetay('uNsRhScs5K7mF1ppKXOLyg','AAxOwTsAak6dv1OW7nD8NA')"
247444,HANİFE AYŞEGÜL OTUZBİR,2010,İndirek hiperbilirubinemili yenidoğanlarda hazırlayıcı faktörler ve etyoloji<br><span style='font-style: italic';>Contributory factors and etiology in neonates with indirect hyperbilirubinemia,Eskişehir Osmangazi Üniversitesi,Tıpta Uzmanlık,Çocuk Sağlığı ve Hastalıkları = Child Health and Diseases," onclick=tezDetay('T-AqK4e4oi_H1nd0c-tXAw','zJ0TStjQq3KMj2PeH9tUUw')"
308092,MEHMET ÖZGÜR ARSLANOĞLU,2012,Yenidoğan solunum sistemi hastalıklarında pentraksin III (PTX3) düzeyleri<br><span style='font-style: italic';>Pentraxin III (PTX3) levels in newborn respiratory disorders,Eskişehir Osmangazi Üniversitesi,Tıpta Uzmanlık,Çocuk Sağlığı ve Hastalıkları = Child Health and Diseases," onclick=tezDetay('aFUUJ7dRtaib4EZi1ihjQA','0Xv7hRTRe8mBwOCctIrAkQ')"
193396,ZAFER YILDIZ,2006,Preterm gebelik olgularında servikovajinal sıvıda fetal fibronektin ve fosforilize insülin benzeri büyüme faktörü bağlayıcı protein-1\'in doğumu öngörü gücü<br><span style='font-style: italic';>Volue of fetal fibfonectin and phosphorylated insulin like growth factor binding protein-1 in cervicovaginal fluid at predicting preterm delivery in preterm labor,Eskişehir Osmangazi Üniversitesi,Tıpta Uzmanlık,Kadın Hastalıkları ve Doğum = Obstetrics and Gynecology," onclick=tezDetay('PokMaSpL9j1QbVwRezwqfw','fV5sHYoIhCDTYMPUNMUJKw')"
308022,BURCU KÖYDEN,2012,Pulmoner embolide klinik belirleyiciler<br><span style='font-style: italic';>Clinical determinants of pulmonary embolism,Eskişehir Osmangazi Üniversitesi,Tıpta Uzmanlık,Göğüs Hastalıkları = Chest Diseases," onclick=tezDetay('XzgUK4wlPE_tiv34dGWRMg','Bb1AKmMlzSNT-bjKAG1ssw')"
665209,DUYGU KESEBİ ISGANDEROV,2021,"Hipofiz adenomlarının klinik, laboratuar ve medikal olarak retrospektif değerlendirilmesi<br><span style='font-style: italic';>Retrospective evaluation of pituitary adenomas as clinical, laboratory and medical",Eskişehir Osmangazi Üniversitesi,Tıpta Uzmanlık,Endokrinoloji ve Metabolizma Hastalıkları = Endocrinology and Metabolic Diseases," onclick=tezDetay('KCbpxEsp9s4tYNDCHlj8ZA','drPPI7UT3a_svdy8RsO25A')"
319109,CANDAN DUMAN,2012,Tiyopental indüksiyonu sonrası hipotansiyonu önlemede preoperatif verilen kristoloid ve kolloidlerin etkilerinin karşılaştırılması<br><span style='font-style: italic';>Comparison of effects of crytalloid versus colloid fluids which are given at preoperative period in order to prevent hypotension after thiopental induction,Eskişehir Osmangazi Üniversitesi,Tıpta Uzmanlık,Anestezi ve Reanimasyon = Anesthesiology and Reanimation," onclick=tezDetay('SaVpedNAkivxuNK5a9eh3w','Gg3x3nk9mXycjwBNIG8H1Q')"
396498,ŞABEN ŞAKALAR,2015,Acil servise başvuran hastalarda akut kolesistit şiddetinin belirlenmesinde kan prokalsitonin düzeyi<br><span style='font-style: italic';>Blood procalcitonin level in determinig the severity of acute cholecystitis in the emergency department,Eskişehir Osmangazi Üniversitesi,Tıpta Uzmanlık,İlk ve Acil Yardım = Emergency and First Aid," onclick=tezDetay('LvgaGfUpRHFqhqFGa44OWQ','-ejFUokhZs98UHfQ6ujbfw')"
195294,SERKAN TÜĞEN,2007,"Probiotiklerin kolon anastomozlarına ve ileus oluşturulan ratlarda intestinal floraya ve bakteriyel translokasyona olan etkisi, antibiotikler ile karşılaştırılması<br><span style='font-style: italic';>The effect of probiotics on colonic anastomosis,to intestinal flora and bacterial translocation in ileus made rats;comparison with antibiotics.",Eskişehir Osmangazi Üniversitesi,Tıpta Uzmanlık,Genel Cerrahi = General Surgery," onclick=tezDetay('ienn57KTKFhaBcihW6NChg','9I1Rpui6wR6JuHrKifVVTw')"
195303,BARIŞ RAFET KARAKAŞ,2007,Deneysel strangülasyon ileusunda troloks tedavisinin etkileri<br><span style='font-style: italic';>The effects of trolox treatment in the experimental strangulation obstruction,Eskişehir Osmangazi Üniversitesi,Tıpta Uzmanlık,Genel Cerrahi = General Surgery," onclick=tezDetay('EEwYmLtWUbacLiXv5mxw8Q','egQ4odoD3QQEZ2Q4LV2K3A')"
193988,ERSAN TOMUŞ,2007,Femur trokanterik bölge kırıklarında internal tespit ile endoprotez uygulamalarının karşılaştırılması<br><span style='font-style: italic';>The comparison of internal fixation and the endoprosthesis application in the fractures of femur trochanteric region,Eskişehir Osmangazi Üniversitesi,Tıpta Uzmanlık,Ortopedi ve Travmatoloji = Orthopedics and Traumatology," onclick=tezDetay('Gx0teIcWbjVXQPhjAt0Pfw','o4werwmDMwPtNZUG-CCFBA')"
435650,PINAR SIRMATEL,2016,Lenfomalı hastalarda otolog hematopoetik kök hücre nakli sonrası malign olmayan geç yan etkiler<br><span style='font-style: italic';>patients with lymphoma autologous hematopoietic stem cell transplantation for malignant after non late side effects,Eskişehir Osmangazi Üniversitesi,Tıpta Uzmanlık,Hematoloji = Hematology," onclick=tezDetay('1efFKGu6qvpAXQYWl6tEAg','soUf8l87xr_11mrBQ4kfPQ')"
163533,BÜLENT KENAN KOCATÜRK,2005,Postmortem interval tayini açısından postmortem göz muayenesinin önemi<br><span style='font-style: italic';>,Eskişehir Osmangazi Üniversitesi,Tıpta Uzmanlık,Adli Tıp = Forensic Medicine," onclick=tezDetay('lju0gRiF9137mFyDzF7rjA','tvZ4JnZw2CAdifqN0PKxIg')"
163534,SAYGIN NAYMAN ALPAT,2005,Kronik aktif hepatit C tedavisinde kullanılan pegile interferon tedavilerinin yaşam kalitesi üzerine etkisi<br><span style='font-style: italic';> ,Eskişehir Osmangazi Üniversitesi,Tıpta Uzmanlık,Klinik Bakteriyoloji ve Enfeksiyon Hastalıkları = Clinical Microbiology and Infectious Diseases," onclick=tezDetay('nuTOYsrFeIMtBXd2IbzYPA','SX0zL4Uh9CSbs_TAgBU54w')"
247445,MÜGE KESKİN,2010,Metastatik kolorektal kanserli hastalarda serum VEGF ve basicFGF düzeylerinin hastaların tedaviye yanıt ve progresyonsuz sağkalımlarını belirlemedeki değeri<br><span style='font-style: italic';>Importance of serum VEGF and basicFGF levels in determining response to treatment and progression free survival in patients with metastatic colorectal cancer,Eskişehir Osmangazi Üniversitesi,Tıpta Uzmanlık,Onkoloji = Oncology," onclick=tezDetay('3iTVAMZbyf5Q8eW7oE6BBA','bNGHebgiVqEJFVg5C6zTMA')"
247452,İNCİ ARIKAN,2010,Eskişehir\'de bir sağlıklı kalp programı uygulaması<br><span style='font-style: italic';>A special healthy heart program application at the Eskisehir district,Eskişehir Osmangazi Üniversitesi,Tıpta Uzmanlık,Halk Sağlığı = Public Health," onclick=tezDetay('9dypjO9Qh4wuGNGnazGxzg','OP_n-TG7iUICCTc2AbU5PQ')"
519049,MEHMET OKAN YILDIRIM,2018,Yoğun bakım ünitesinde nozokomiyal acinetobacter bakteriyemisine yol açan risk faktörlerinin değerlendirilmesi<br><span style='font-style: italic';>Evaluation of risk factors for nosocomial acinetobacter bacteremia in intensive care unit,Eskişehir Osmangazi Üniversitesi,Tıpta Uzmanlık,Klinik Bakteriyoloji ve Enfeksiyon Hastalıkları = Clinical Microbiology and Infectious Diseases," onclick=tezDetay('qqNXNI0r9MZs7LyEIjIvTQ','j6UEVO0DTUSHLIPfkcfPkQ')"
347684,GÜLÜZAR ÖZÇELİK,2013,Rokuronyuma bağlı enjeksiyon ağrısının önlenmesinde lidokain ve remifentanil ön ilaç uygulamalarının etkinliklerinin karşılaştırılması<br><span style='font-style: italic';>Comparison of lidocain and remifentanyl as initial drugs before rocuronium in order to prevent injection pain,Eskişehir Osmangazi Üniversitesi,Tıpta Uzmanlık,Anestezi ve Reanimasyon = Anesthesiology and Reanimation," onclick=tezDetay('zTbDpsgGj7Wl-nYjLIBZhQ','6lpwx965y2-nTMtUvk1SeQ')"
193397,ERCAN KAYA,2006,Larenks kanserli hastalarda yaşam kalitesinin değerlendirilmesi<br><span style='font-style: italic';>Quality of life after treatment in patients with laryngeal cancer,Eskişehir Osmangazi Üniversitesi,Tıpta Uzmanlık,Kulak Burun ve Boğaz = Otorhinolaryngology (Ear-Nose-Throat)," onclick=tezDetay('OGbGUV6NOHw80ZhmZQPvWA','KIlCAgX2aiP8EbXoxH4liA')"
163535,TUNCAY ERDEN,2005,Koroner arter bypass cerrahisinde preoperatif verilen nebivololun iskemi-reperfüzyon hasarına etkisi<br><span style='font-style: italic';> ,Eskişehir Osmangazi Üniversitesi,Tıpta Uzmanlık,Kardiyoloji = Cardiology," onclick=tezDetay('vVAsCHQRCmtXtmLV3OP9Jg','H8lAypeWvpNPsNUs9GsYVw')"
163536,AYŞE ÖZKIRIŞ,2005,Konjenital kalp hastalıklı çocuklarda anjiyogenezin biyokimyasal göstergesi olan VEGF ve MMP-9 düzeyleri ile BNP ilişkisinin değerlendirilmesi<br><span style='font-style: italic';> ,Eskişehir Osmangazi Üniversitesi,Tıpta Uzmanlık,Biyokimya = Biochemistry," onclick=tezDetay('rIJ38iCl72y_WRi4ziItrA','kLVGHZh_zJrlXfZIvYfjSw')"
316915,NAZİK ÇİĞDEM BOYRAZ,2012,Azotprotoksitsiz uygulanan düşük akımlı anestezide izofluranın hemodinamik parametreler üzerine etkisi<br><span style='font-style: italic';>Investigation the effect of isofluran on hemodynamic parameters in low flow anesthesia introduced without nitrous oxide,Eskişehir Osmangazi Üniversitesi,Tıpta Uzmanlık,Anestezi ve Reanimasyon = Anesthesiology and Reanimation," onclick=tezDetay('ITRGV6XMRIdBaSTs3u9DLQ','UKEODjxcSaPj43MNdkODrw')"
194101,MELTEM ŞORABATUR,2006,Yaşa bağlı makula dejenerasyonunda koroidal neovaskülarizasyonun verteporfinle fotodinamik tedavisi<br><span style='font-style: italic';>Photodynamic therapy of choroidal neovascularization in age-related macular degeneration with verteporfin,Eskişehir Osmangazi Üniversitesi,Tıpta Uzmanlık,Göz Hastalıkları = Eye Diseases," onclick=tezDetay('wzh03V481lf0EGh0Rly9bw','qXWm5Ii92x3D4PbKteav8w')"
329207,ÇAĞDAŞ VURAL,2013,Akut karbon monoksit zehirlenmesi ile başvuran çocuklarda kalp hızı değişkenliği ve kardiyak ritm bozuklukları<br><span style='font-style: italic';>Heart rate variability and cardiac rhythm disorders in children with acute carbon monoxide poisoning,Eskişehir Osmangazi Üniversitesi,Tıpta Uzmanlık,Çocuk Sağlığı ve Hastalıkları = Child Health and Diseases," onclick=tezDetay('2Hjn_uKRRsd5iAyWgdmFlg','06P2OYPSLvnVx0ZO_scSAA')"
680661,ZÜHRE AYTAÇ ÖZTURAN,2021,İntrauterin büyüme kısıtlılığı olan olgularda metabolik asidozu öngörmede NON-stres test(NST)ve doppler ultrasonografi (USG)\'nin tanısal değeri<br><span style='font-style: italic';>Diagnostic value of NON-stress test and doppler ultrasound in predicting the metabolic acidosis in cases with intrauterine growth restriction,Eskişehir Osmangazi Üniversitesi,Tıpta Uzmanlık,Kadın Hastalıkları ve Doğum = Obstetrics and Gynecology," onclick=tezDetay('jojSpjLEklNFn8Khpv_P4w','-D0Y384Y8OCx6EbQBCHQ8g')"
360205,BENGÜ ERTAN,2014,"OSAS\'lı hastalarda kognitif durum, otonomik fonksiyon, depresyon ve metabolik sendrom araştırılması<br><span style='font-style: italic';>İnvestigation of cognitive status, autonomic function, metabolic syndrome and depression  in patients with OSAS",Eskişehir Osmangazi Üniversitesi,Tıpta Uzmanlık,Nöroloji = Neurology," onclick=tezDetay('_P4sb1Awmr_UoSI_LgMfMg','Jj_fjQ0GFpkvy5yDyIo-ug')"
702727,YEŞİM YETİŞ,2021,"Eskişehir Osmangazi Üniversitesi Tıp fakültesi Adli Tıp Anabilim Dalına 2015 ile 2019 yılları arasında başvuran ensest vakalarının adli tıbbi değerlendirilmesi<br><span style='font-style: italic';>Forensic medical evaluation of incest cases applied to eskişehir Osmangazi University Faculty of Medicine, department of forensic medicine between 2015-2019",Eskişehir Osmangazi Üniversitesi,Tıpta Uzmanlık,Adli Tıp = Forensic Medicine," onclick=tezDetay('dxYsj9eh-nfmXQFe5KCdNg','Bllmizz9Y4kVwoCVbfB7qA')"
650335,HATİCE AYGAR,2020,"Lise öğrencilerinde akıllı telefon bağımlılığı, ruhsal durum ve uyku kalitesinin değerlendirilmesi<br><span style='font-style: italic';>Evaluation of smartphone addiction, mental status and sleep quality in HİGH school students",Eskişehir Osmangazi Üniversitesi,Tıpta Uzmanlık,Halk Sağlığı = Public Health," onclick=tezDetay('QYN3bXgv29s6ToOK7x1Hgw','OS9NuZFFHBA0xu6-47eGsA')"
156677,ŞULE ATAMAN,2004,Kronik ürtiker ve anjioödem ile tiroid otoimmünitesinin ilişkisi<br><span style='font-style: italic';> ,Eskişehir Osmangazi Üniversitesi,Tıpta Uzmanlık,Dermatoloji = Dermatology," onclick=tezDetay('5utR-UcGIzNySf5BRJ9u9A','sJT91rMnMgnnwyHefEYOzQ')"
247443,UMUT ALICI,2010,Çocuk cerrahisi ameliyatlarında ameliyat sürelerinin belirlenmesi<br><span style='font-style: italic';>Duration of operations in pediatric surgery cases,Eskişehir Osmangazi Üniversitesi,Tıpta Uzmanlık,Çocuk Cerrahisi = Pediatric Surgery," onclick=tezDetay('DQiMRRMs3M8fjBPlWsZxGg','srmZeOJnouS-HHqKZQpbMg')"
690132,REHA GÖKÇEOĞLU,2021,İntihar girişimi olan ve olmayan majör depresyon ve bipolar bozukluk tanılı hastalarda bilişsel işlevlerin değerlendirilmesi<br><span style='font-style: italic';>Evaluation of cognitive functions in patients with major depression and bipolar disorder with and without suicide attempts,Eskişehir Osmangazi Üniversitesi,Tıpta Uzmanlık,Psikiyatri = Psychiatry," onclick=tezDetay('hEIXyPfgjLBAfoe7COrJLA','gTH0PnJcjU9bVt3X7EJzbA')"
388716,ERDOĞAN YAŞAR,2015,Eskişehir bölgesinde psödoeksfoliasyon sendromu (PES) görülme sıklığının araştırılması<br><span style='font-style: italic';>Researching the incidence of pseudoexfoliation syndrome (PES) in eskişehir region,Eskişehir Osmangazi Üniversitesi,Tıpta Uzmanlık,Göz Hastalıkları = Eye Diseases," onclick=tezDetay('rBix3YKkeW73g5Llj2sq-Q','_tjPNUzO1erqSb3w4KMaFQ')"
267432,MEHMAN AĞAMALIYEV,2010,İlaç kaplı stent implantasyonunda intravasküler ultrason kullanımının akut tıkanma ve restenoz oranına etkisi<br><span style='font-style: italic';>Effect of intravascular ultrasound using on the rate of acute thrombosis and restenosis in drug-eluting stent implantation,Eskişehir Osmangazi Üniversitesi,Tıpta Uzmanlık,Kardiyoloji = Cardiology," onclick=tezDetay('YHLi_2nhGSns95PdF6fGUg','oOlXmONh0-dnajP9jgkJCw')"
504103,FARSHID SAFAPOUR,2018,Renal dysfunction and thrombolytic therapy in patients with acute ischemic stroke<br><span style='font-style: italic';>İntravenöz trombolitik tedavi uygulanan hastalarda glomerüler filtrasyon hızının inme prognozuna etkisi retrospektif çalışma,Eskişehir Osmangazi Üniversitesi,Tıpta Uzmanlık,Nöroloji = Neurology," onclick=tezDetay('0sncI1LPDdrmeqZ4XGl21g','60JtAVeSHnUB9_FKS_D1bg')"
303451,SÜLEYMAN ESAT ŞEN,2012,Acil servise başvuran yaşlı hastaların çoklu ilaç kullanımının hastaların klinik süreçlerine etkisi<br><span style='font-style: italic';>The effect of polypharmacy on clinical course of patients admitted to emergency department,Eskişehir Osmangazi Üniversitesi,Tıpta Uzmanlık,Geriatri = Geriatrics," onclick=tezDetay('9A_N_Ziwlz8MABzjvc5rpw','1v3gQDW5R_dnfVeBd75hlA')"
193420,LEVENT COŞKUN,2006,Preoperatif verilen kaptoprilin TİVA ile oluşturulan kontrollü hipotansiyonda etkilerinin araştırılması<br><span style='font-style: italic';>The investigation efficiency of captopril preoperatively in controlled hypotension with TIVA,Eskişehir Osmangazi Üniversitesi,Tıpta Uzmanlık,Anestezi ve Reanimasyon = Anesthesiology and Reanimation," onclick=tezDetay('gysKaARDRpRgbeRTeBtzWw','7RK2O2fLImmKUgp1_s_FBA')"
281921,ALİ DOKUMACIOĞLU,2011,Akut inme patogenezinde aterosklerotik plak ve biyokimyasal belirteçlerin ilişkisi<br><span style='font-style: italic';>Relationship between biochemical markers and atherosclerotic plaque in the pathogenesis of acute stroke,Eskişehir Osmangazi Üniversitesi,Tıpta Uzmanlık,Biyokimya = Biochemistry," onclick=tezDetay('zhwrloPAtji9XzQg9TqpZQ','5RlSqV9jZ214innblIkzvQ')"
319105,KENAN DÖLEK,2012,Orta kulak cerrahisinde uygulanan düşük akımlı desfluran+ remifentanil ve düşük akımlı sevofluran+ remifentanil anestezisinin intraoperatif kardiyovasküler sistem ve postoperatif derlenme üzerine etkilerinin karşılaştırılması<br><span style='font-style: italic';>The comparison of the effects of low flow desflurane + remifentanyl and low flow sevoflurane + remifentanyl anesthesia on the intraoperative cardiovascular system and postoperative recovery for the middle ear surgery,Eskişehir Osmangazi Üniversitesi,Tıpta Uzmanlık,Anestezi ve Reanimasyon = Anesthesiology and Reanimation," onclick=tezDetay('bn2fKiLP6wQ0DIJBlFpq4Q','qPdMbhagojTSPcJ4quhpIA')"
387202,AYNUR ÖZTÜRK ÖZER,2012,"Eskişehir\'de birinci basamak hizmeti veren doktorların sigara içicilik durumları ve sigara bıraktırma konusundaki tutumları<br><span style='font-style: italic';>Smoking status and the behaviours, about quitting smoking, of the medical doctors giving primary care services in Eskişehir",Eskişehir Osmangazi Üniversitesi,Tıpta Uzmanlık,Aile Hekimliği = Family Medicine," onclick=tezDetay('8JypVn0Hw9hdTSnK81Q5jg','E7-bOJFh5cbpTUeXaZTn9g')"
316631,EBRU KARAKOÇ,2012,Kardiovasküler cerrahi anestezisinde ekstrakorporeal dolaşımda sevoflurane ve desflurane kullanımının bıs monitorizasyonu ile değerlendirilmesi<br><span style='font-style: italic';>Evaluation of bis monitorization using sevoflurane versus desflurane during extracorporeal circulation in cardiovascular surgery anesthesia,Eskişehir Osmangazi Üniversitesi,Tıpta Uzmanlık,Anestezi ve Reanimasyon = Anesthesiology and Reanimation," onclick=tezDetay('rjcXev-cF7VV3TdvH2OsCQ','7al3aN-pHDSYnaoiX0Ek-A')"
453935,EGEMEN ÜNAL,2017,Topluma yönelik sigara karşıtı müdahalelerin etkililiği: Bir meta analiz çalışması<br><span style='font-style: italic';>Effectiveness of anti-smoking interventions towards community: A meta-analysis study,Eskişehir Osmangazi Üniversitesi,Tıpta Uzmanlık,Halk Sağlığı = Public Health," onclick=tezDetay('BRq3-XNeeGlNH6bXQ1jWDQ','Rl9QYjl1teyoSMtTQFrnFg')"
163844,TUNCER TEMEL,2005,Solid malignensili hastalarda hiperkoagülabilite ve hiperkoagülabilitenin tromboelastografi ile değerlendirilmesi<br><span style='font-style: italic';>,Eskişehir Osmangazi Üniversitesi,Tıpta Uzmanlık,Hematoloji = Hematology," onclick=tezDetay('2xGpqsIMAk8OnY9su_1WWg','z3LIIVNfM-_9pWzWCS6MHg')"
156568,ARZU İSTANBULLU,2004,Çocukluk çağı komplike idrar yolu enfeksiyonlarında antibiyotik direnç profili<br><span style='font-style: italic';> ,Eskişehir Osmangazi Üniversitesi,Tıpta Uzmanlık,Çocuk Sağlığı ve Hastalıkları = Child Health and Diseases," onclick=tezDetay('lVbF0TnVHNoZqYnGS1apCA','xeRy6sjNy-KcykxoJrDIWw')"
163845,GÖNÜL BAYLAN,2005,Ergenlerde yeme bozukluğu belirtilerinin prediktörleri<br><span style='font-style: italic';> ,Eskişehir Osmangazi Üniversitesi,Tıpta Uzmanlık,Psikiyatri = Psychiatry," onclick=tezDetay('txow_JnnMsgQOhh9CUmkvg','kSxk4rSYN3sommSvoIPeAQ')"
163732,ALAEDDİN KERİMOĞLU,2005,Deneysel spinal kord travmasında metilprednizolon ve koenzim Q10\'un etkinliğinin araştırılması<br><span style='font-style: italic';> ,Eskişehir Osmangazi Üniversitesi,Tıpta Uzmanlık,Nöroşirürji = Neurosurgery," onclick=tezDetay('2_XIUrfQxyTpM37RcNwbXg','giSS2z3iVGyflcY3Q9jKxg')"
156777,TURGUT ÜRE,2004,Batın cerrahisinde desfluran alan hastaların anestezi derinliğinin bis monitarizasyonu ile sağlanarak intravenöz flumazenil uygulanmasının postoperatif derlenme ve kognitif fonksiyonlar üzerine etkileri<br><span style='font-style: italic';> ,Eskişehir Osmangazi Üniversitesi,Tıpta Uzmanlık,Anestezi ve Reanimasyon = Anesthesiology and Reanimation," onclick=tezDetay('ZH2Q_vze2ubvcQi0_QksnQ','DCWEacFM3ACB4ADqKwSphA')"
163863,OYA AYAZ,2005,"Serebral palsili çocuklarda büyüme ve kemik metabolizmasının değerlendirilmesi, serum leptin ve IGF-1 düzeyleri<br><span style='font-style: italic';> ",Eskişehir Osmangazi Üniversitesi,Tıpta Uzmanlık,Çocuk Sağlığı ve Hastalıkları = Child Health and Diseases," onclick=tezDetay('OWvGagdvrMbvKY4TATvx4Q','kHHjl3iKedY4D6VpAsjvZQ')"
163864,DÖNDÜ ÜSKÜDAR,2005,Eskişehir bölgesinde sağlıklı erkeklerdeki aspirin rezistansı sıklığı<br><span style='font-style: italic';> ,Eskişehir Osmangazi Üniversitesi,Tıpta Uzmanlık,Eczacılık ve Farmakoloji = Pharmacy and Pharmacology ; Kardiyoloji = Cardiology," onclick=tezDetay('U1F030BvxI1bIlgAMIpfEg','h5wTJrycPJPvQn8wLirwSQ')"
163865,YASEMİN ÖZ,2005,Candida albicans izolatlarında amfoterisin B ile flukonazol ve vorikonazol kombinasyonlarının in vitro etkinliği<br><span style='font-style: italic';> ,Eskişehir Osmangazi Üniversitesi,Tıpta Uzmanlık,Mikrobiyoloji = Microbiology," onclick=tezDetay('wWlMJP_bMgwL54x3_Gt2eQ','51LGSOfMz4-LUO1x7dFqZg')"
691359,TAYFUN BATAN,2021,Seboreik  dermatit ile diyet alışkanlıkları ve psikoemosyonel durum ilişkisinin değerlendirilmesi<br><span style='font-style: italic';>Evaluation of the relationship between seborrheic dermatitis and dietary habits and psychoemotional status,Eskişehir Osmangazi Üniversitesi,Tıpta Uzmanlık,Dermatoloji = Dermatology," onclick=tezDetay('KbS5hXwH0pevG2DvGB88LA','5KV-VE2FJ4yML5Nr1SVbjw')"
163735,HALE MORAL,2005,Pulmoner arteryel hipertansiyon tansında invazif ve invazif olmayan methodların karşılaştrıılması ve tedaviye cevabın egzersiz testi ile değerlendirilmesi<br><span style='font-style: italic';> ,Eskişehir Osmangazi Üniversitesi,Tıpta Uzmanlık,Göğüs Hastalıkları = Chest Diseases," onclick=tezDetay('qri0_6vbsYewi_EHavt1WQ','WYdZPhU5Y4_LlvCahssyGg')"
163736,AYŞE ESRA KOKU AKSU,2005,Skindeks-29\'un Türkçe uyarlaması<br><span style='font-style: italic';>,Eskişehir Osmangazi Üniversitesi,Tıpta Uzmanlık,Dermatoloji = Dermatology," onclick=tezDetay('0gppVihBfErWNU3YqvBBgw','UwBHkC58MC7aG32L8jY3Sg')"
156779,SAVAŞ ZEYDANOĞLU,2004,Koroner arter by pass greftleme cerrahisinde remifentanil-fentanil anestezisinin erken ekstübasyon ve erken taburcu(Fast Track) karşılaştırılması<br><span style='font-style: italic';> ,Eskişehir Osmangazi Üniversitesi,Tıpta Uzmanlık,Anestezi ve Reanimasyon = Anesthesiology and Reanimation," onclick=tezDetay('bMSIGc6zGh3z2lA_4k-SAA','8gGSowVIbABV-wKRSobCPg')"
236568,LEVENT DENİZ,2009,Subakut inmeli kişilerde konvansiyonel yürüyüş eğitimi ile ağırlık destekli yürüme bandı yürüyüş eğitiminin terapotik etkilerinin karşılaştırılması<br><span style='font-style: italic';>Comparing therapeutic effects of conventional gait training andbody-weight support treadmill gait training in subacute stroke people,Eskişehir Osmangazi Üniversitesi,Tıpta Uzmanlık,Fiziksel Tıp ve Rehabilitasyon = Physical Medicine and Rehabilitation," onclick=tezDetay('pkWN5Bhl8Pa3vY2gpLCVww','K-JPN5XF6qjweiseFP7AEQ')"
512671,BAŞAK UYGUN AĞIREL,2018,Çocuklarda alerjik olmayan rinit için risk faktörleri ve alerjik rinit ile karşılaştırılması<br><span style='font-style: italic';>Risk factors of nonallergic rhinitis and comparison with allergic rhinitis in children,Eskişehir Osmangazi Üniversitesi,Tıpta Uzmanlık,Allerji ve İmmünoloji = Allergy and Immunology ; Çocuk Sağlığı ve Hastalıkları = Child Health and Diseases," onclick=tezDetay('CGHBUSCJaLzmB3Ihp4ahAA','TxidlLITLGDnCnrddUY3XQ')"
164478,SELÇUK KARA,2005,"Pseudoeksfoliatif glokom ve pseudoeksfoliatif sendromlu hastaların hümör aköz ve serumlarında matriks metalloproteinaz-2 (MMP-2),doku matriks metalloproteinaz-inhibitörü-2 (TİMP-2), transforming growth faktör Beta-1(TGFB-1) ve homosistein düzeyleri<br><span style='font-style: italic';> ",Eskişehir Osmangazi Üniversitesi,Tıpta Uzmanlık,Göz Hastalıkları = Eye Diseases," onclick=tezDetay('mzjO9x7nAjt0IC6UPIJH0A','TnVkr6jjR_P8HAJXj7ixtg')"
163868,HAVA ÜSKÜDAR,2005,Multiple myelom hastalarında dolaşan endotel hücreleri<br><span style='font-style: italic';> ,Eskişehir Osmangazi Üniversitesi,Tıpta Uzmanlık,Hematoloji = Hematology," onclick=tezDetay('V9Fqf2cKnqYdAYfmoZ2oMw','5YjIdDnXxqF-BoVLV59Ejw')"
664897,ÖZLEM YILMAZ,2021,Farklı propofol preparatlarının enjeksiyon ağrısı üzerine etkisi<br><span style='font-style: italic';>The effect of different propofol preparations on injection pain.,Eskişehir Osmangazi Üniversitesi,Tıpta Uzmanlık,Anestezi ve Reanimasyon = Anesthesiology and Reanimation," onclick=tezDetay('8W13A-SEqh7_MmvDuwSVsQ','g1Q1L0fnb0dWfSBwJSh7nQ')"
566178,EMİNE ÖZGÜN,2019,Laparoskopi yapılan pediatrik hastalarda renal oksijenizasyon near infrared spektroskopi ile değerlendirilmesi<br><span style='font-style: italic';>Evaluation of renal oxygenation near infrared spectroscopy in pediatric patients undergoing Laparoscopy,Eskişehir Osmangazi Üniversitesi,Tıpta Uzmanlık,Anestezi ve Reanimasyon = Anesthesiology and Reanimation," onclick=tezDetay('8wN1AObpDsdt6y6_nKg45A','ymosBr-clj39_dd-BKhBeQ')"
353940,AYÇA PEKER,2013,Detrusor overaktivitesi olan hastalarda farklı antimuskarinik antikolinerjik ilaçların etkinliğinin karşılaştırılması<br><span style='font-style: italic';>Comparision of efficacy of different antimuscarinic anticholinergic drugs in detrusor overactivity,Eskişehir Osmangazi Üniversitesi,Tıpta Uzmanlık,Kadın Hastalıkları ve Doğum = Obstetrics and Gynecology," onclick=tezDetay('J1M5YB9LJFId1ZDhPODj8g','9-gDj7YGMB0gJL-inyG3Cw')"
