tez_no,yazar,yıl,title,üniversite,tez_türü,konu,tez_detay
863830,ŞEYMA BOZKURT,2024,Ailevi akdeniz ateşi hastalığı olanlarda serum prolidaz enzim aktivitesi ile endotel disfonksiyonu ve kardiyak fonksiyonlar arasında ilişkinin araştırılması<br><span style='font-style: italic';>Investigation of the relationship between serum prolidase enzyme activity and endothelial dysfunction and cardiac functions in those with family mediterranean fever,Hitit Üniversitesi,Tıpta Uzmanlık,İç Hastalıkları = Internal diseases," onclick=tezDetay('kYEH7DH1copL267La0vowA','kyKzGiKToAg8n_MU7XhCUA')"
861536,ZEYNEP ŞAHİN,2024,Otozomal dominant polikistik böbrek hastalarında hastalık evresi ile serum endotrophin düzeyleri arasındaki ilişki<br><span style='font-style: italic';>The relationship between disease stage and serum endotrophin levels in autosomal dominant polycystic kidney patients,Hitit Üniversitesi,Tıpta Uzmanlık,İç Hastalıkları = Internal diseases," onclick=tezDetay('eXhDPJkH7yzcbPIe38XmWQ','B-JLY1PgwKmFuobNh6vI8g')"
857198,FİDAN İNCİLER,2024,Glasgow blatchford skorunun üst gastrointestinal sistem kanamalarında prognozu öngörmedeki etkinliğinin değerlendirilmesi<br><span style='font-style: italic';>Evaluation of the effectiveness of Glasgow blatchford score in predicting prognosis in upper gastrointestinal system bleeding,Hitit Üniversitesi,Tıpta Uzmanlık,İç Hastalıkları = Internal diseases," onclick=tezDetay('0rSQxnfG-dqlf4qvobdxZg','Z2IB9UDgVUDDgPjOztmR-A')"
863140,ÜMMÜGÜLSÜM KAYA,2024,Psoriasis hastalık şiddeti ve algılanan sosyal desteğin sosyal görünüş kaygısına etkisi<br><span style='font-style: italic';>The impact of psoriasis disease severity and perceived social support on social appearance anxiety,Hitit Üniversitesi,Tıpta Uzmanlık,Aile Hekimliği = Family Medicine ; Dermatoloji = Dermatology ; Psikiyatri = Psychiatry," onclick=tezDetay('aZG1mYy1rz0j_0OkVLrjCg','Jwjr8iGuFqdJ14oRqdxwiw')"
873073,MÜCAHİT DOĞAN,2024,Transrektal ultrasonografi eşliğinde prostat biyopsisi öncesinde povidon iodin ve B.T enema karışımı ile rektal temizliğin işleme bağlı enfektif komplikasyonlara etkisi<br><span style='font-style: italic';>The effect of rectal cleaning with povidone iodine and B.T enema mixture before transrectal ultrasonography-guided prostate biopsy on procedure-related infective complications,Hitit Üniversitesi,Tıpta Uzmanlık,Üroloji = Urology," onclick=tezDetay('Jq-IpOf6zI_PGWRvqlClxw','OJd6iHAYjumE8W3wjsQWiw')"
870416,MEHMET BERKSUN TUTAN,2024,Akut kolesistit tanısında serum kalprotektin düzeyinin tanısal değeri ve komplike kolesistit öngörüsündeki yeri<br><span style='font-style: italic';>Diagnostic value of serum calprotectin level in the diagnosis of acute cholecystitis and its role in the prediction of complicated cholecystitis,Hitit Üniversitesi,Tıpta Uzmanlık,Genel Cerrahi = General Surgery," onclick=tezDetay('lZ50UOoM4747TqaLRrcMsg','C5J642nowj9FuHCF5wDnZA')"
873112,EMİNE JANSET UNCULU,2024,Hipoparatiroidi tanısı almış postmenopozal hastaların laboratuvar ve kemik mineral dansitometri verilerinin değerlendirilmesi<br><span style='font-style: italic';>Evaluation of laboratory and bone mineral densitometry data in postmenopausal patients diagnosed with hypoparathyroidism,Hitit Üniversitesi,Tıpta Uzmanlık,Endokrinoloji ve Metabolizma Hastalıkları = Endocrinology and Metabolic Diseases," onclick=tezDetay('HjqUIuw-XlNTmrTHogvamg','Bj7PG4gm3CeumtqmzNVEQA')"
863143,AYSEN USTAÖMER,2024,Çocuklarda problemli medya kullanımının uyku üzerine etkisi<br><span style='font-style: italic';>The effect of problematic media use on sleep in children,Hitit Üniversitesi,Tıpta Uzmanlık,Aile Hekimliği = Family Medicine ; Psikiyatri = Psychiatry," onclick=tezDetay('9pB4yhaXAYypArI781Rdrw','c3mweNIxIqMKTOKoZl-j-g')"
851748,DİLRUBA NUR ÖZDEMİR,2023,HALPskorunun organik ve fonksiyonel dispepsi ayrımını öngörmedeki rolü<br><span style='font-style: italic';>The role of HALP score in predicting the distinction of organic and functional dyspepsia,Hitit Üniversitesi,Tıpta Uzmanlık,İç Hastalıkları = Internal diseases," onclick=tezDetay('71gWmLnWGstwYgmWRs_sXQ','mQ9XcqqcEgaLAhXFAsmyKQ')"
838279,ÇAĞDAŞ KOCAMAN,2023,Karbapeneme dirençli klebsıella pneumonıae suşlarında karbapenem direncinin fenotipik ve genotipik yöntemlerle araştırılması<br><span style='font-style: italic';>Investigation of carbapenem resistance in carbapenem-resistant klebsiella pneumoniae strains by phenotypic and genotypic methods,Hitit Üniversitesi,Tıpta Uzmanlık,Mikrobiyoloji = Microbiology," onclick=tezDetay('T08qvqjZhPJaJgZRD6kDWQ','_-Tb_MSYa79Viit6U12YzQ')"
798049,YASEMİN KARAKURT GÖDEK,2023,Diyabetik olmayan kronik böbrek hastalarında serum ürik asit düzeyi ile 24 saatlik kan basıncı değişkenliği arasındaki ilişki<br><span style='font-style: italic';>The relationship between serum uric acid level and 24 HOUR blood pressure variability in NON-diabetic patients with chronic kidney disease,Hitit Üniversitesi,Tıpta Uzmanlık,İç Hastalıkları = Internal diseases," onclick=tezDetay('ORZHVWhwHKwWCoihZzeA9w','v2WCPnNhtu8IETckdbQ8bw')"
