tez_no,yazar,yıl,title,üniversite,tez_türü,konu,tez_detay
90334,A. HAMİT ASSAF,2000,"Sefodizimin immünomodülatör (Biyolojik yanıt düzenleyici) etkisinin, kronik böbrek yetmezliği olan hastalarda incelenmesi<br><span style='font-style: italic';>",İstanbul Üniversitesi,Tıpta Uzmanlık,Mikrobiyoloji = Microbiology," onclick=tezDetay('l_71geeRB1-jIKLDnY00WA','l_71geeRB1-jIKLDnY00WA')"
86883,SONGÜL ÖZERTÜRK,1999,Şizofrenide yumuşak nörolojik işaretler ve kognitif işlev özellikleri<br><span style='font-style: italic';>The Neurological soft signs and cognitive functions,İstanbul Üniversitesi,Tıpta Uzmanlık,Psikiyatri = Psychiatry," onclick=tezDetay('EFV5fOPdotAiU2wd-W5hzA','EFV5fOPdotAiU2wd-W5hzA')"
86884,MEHMET CAN GÜNGEN,1999,Standardize mini mental testin Türk yaşlı popülasyonunda demansiyel sendromların tanınmasında eğitim düzeylerine göre geçerlilik ve güvenilirliğinin incelenmesi<br><span style='font-style: italic';>,İstanbul Üniversitesi,Tıpta Uzmanlık,Psikiyatri = Psychiatry," onclick=tezDetay('oSqjuLhsDCWXX-GYguhSIA','oSqjuLhsDCWXX-GYguhSIA')"
138595,HAKAN SUİÇMEZ,2003,Tek taraflı kavernöz sinir kesisi sonrası sıçan korpus kavernozumundaki brain derived neurotrophic factor (BDNF) düzeyindeki değişiklikler<br><span style='font-style: italic';>Alterations in brain derived neurotrophic factor (BDNF) levels in rat corpus cavernous nerve damage,İstanbul Üniversitesi,Tıpta Uzmanlık,Üroloji = Urology," onclick=tezDetay('HJ3dJph6RLR5axl4j0HNxQ','7eaXsCWmZZ-iUE9JCWr0LQ')"
108543,DEMİRHAN DIRAÇOĞLU,2001,Diz osteoartritinde proprioseptif duyu ve fonksiyonel durumun kinestezi/denge ve güçlendirme egzersizleriyle ilişkisi<br><span style='font-style: italic';> ,İstanbul Üniversitesi,Tıpta Uzmanlık,Fiziksel Tıp ve Rehabilitasyon = Physical Medicine and Rehabilitation," onclick=tezDetay('4ZyKIaAn9OrvVBDu5bTLoA','tSpDmcH9kMtbWRtsajNdCA')"
90335,AYNUR ENGİN,2000,"Hastanede yatan hastaların dışkılarından izole edilen enterekok cinsi bakterilerde vankomisin, yüksek düzey aminoglikozid ve diğer antimikrobiklere direncin araştırılması<br><span style='font-style: italic';> ",İstanbul Üniversitesi,Tıpta Uzmanlık,Klinik Bakteriyoloji ve Enfeksiyon Hastalıkları = Clinical Microbiology and Infectious Diseases," onclick=tezDetay('rg5bVLpPMUG1rAJS3jXeRQ','rg5bVLpPMUG1rAJS3jXeRQ')"
90418,OSMAN YOKUŞ,2000,Kronik böbrek yetersizliğinde oral kalsitriol tedavisinin insülin rezistansına etkisi<br><span style='font-style: italic';>,İstanbul Üniversitesi,Tıpta Uzmanlık,Nefroloji = Nephrology," onclick=tezDetay('byP1jDxwp17IZNoXz58OKQ','byP1jDxwp17IZNoXz58OKQ')"
90436,OSMAN NURİ ŞENEL,2000,Elektrik yaralanması sonrası kan reolojisindeki değişiklikler ve serbest oksijen radikallerinin kan reolojisi üzerindeki etkileri<br><span style='font-style: italic';>,İstanbul Üniversitesi,Tıpta Uzmanlık,Plastik ve Rekonstrüktif Cerrahi = Plastic and Reconstructive Surgery," onclick=tezDetay('JtK3CGhAMtVbDyOJ_oIPnA','JtK3CGhAMtVbDyOJ_oIPnA')"
86885,ASLI BOSTANCI CANER,1999,"Diyabetik, hipertiroidili ve sağlıklı kontrol grubunda depresif semptomatolojinin taranması<br><span style='font-style: italic';>The Evaluation of depressive symptomatology on diabetics, hyperthyroid patients and healthy control group",İstanbul Üniversitesi,Tıpta Uzmanlık,Psikiyatri = Psychiatry," onclick=tezDetay('lLwmK6emr4p0f41Dr2wBsg','lLwmK6emr4p0f41Dr2wBsg')"
90336,BİRGÜL TOPRAKÇI,2000,Bir kısım haemophilus türlerinin nazofarinks sürüntülerinden üretilmesinde değişik besiyerlerindeki değişik kültür özellikleri<br><span style='font-style: italic';>Some medium properties of isolation of haemophilus from nasopheryngeal swabs using different medias,İstanbul Üniversitesi,Tıpta Uzmanlık,Mikrobiyoloji = Microbiology," onclick=tezDetay('mu1XYgqWSo8g44VIXUAM7A','mu1XYgqWSo8g44VIXUAM7A')"
86843,VURAL ÖZCAN,1999,Tek ventrikül fizyolojisindeki kalplerde bidireksiyonel kavo-pulmoner anastomoz<br><span style='font-style: italic';>Bidirectional cavopulmonary anastomozis in univentriculer hearts,İstanbul Üniversitesi,Tıpta Uzmanlık,Göğüs Kalp ve Damar Cerrahisi = Thoracic and Cardiovascular Surgery," onclick=tezDetay('LKyJZ0uxnNqSxajjGq6OrQ','LKyJZ0uxnNqSxajjGq6OrQ')"
103245,MERAL ÇETİN TÜRKER,2001,Yaşlanmanın respiratuar silia yapısında meydana getirdiği değişikliklerin ultrastrüktürel düzeyde incelenmesi<br><span style='font-style: italic';> ,İstanbul Üniversitesi,Tıpta Uzmanlık,Morfoloji = Morphology," onclick=tezDetay('DasMYEaEcgdE-w96Y0aCSA','dsFlVy3L7FDjTyfNi9vsXQ')"
107971,FARUK YENCİLEK,2001,Hiperkalsiürik ve hiperokzalürik sıçanlarda kristalüri ile sialik asit ilişkisi<br><span style='font-style: italic';>Relationship between crystalluri and sialic acid in hyperoxaluric and hypercalciuric rats,İstanbul Üniversitesi,Tıpta Uzmanlık,Üroloji = Urology," onclick=tezDetay('v6zc9k9jvuqR5JmRzmqosA','FslbWEt4kP-iH13icMVZmQ')"
107972,ARMAN ÇEKMEN,2001,Evre T1 ve T2 renal hücre karsinomlu olgularda HLA\'nın rolü<br><span style='font-style: italic';>The Role of HLA in the facts with renal cell carcinoma stage T1 and T2,İstanbul Üniversitesi,Tıpta Uzmanlık,Onkoloji = Oncology ; Üroloji = Urology," onclick=tezDetay('G8O-LEJ8EyS2mHabUzIgnw','ZF-tSgGY2nnxpZQMdat4qQ')"
69747,FARUK EROĞLU,1998,Primer açık açılı glokom tedavisinde %2 dorzolamid hidrokloridin yeri<br><span style='font-style: italic';>2% Dorzolamid hydrochloride in treatment of primary open-angle glaucoma,İstanbul Üniversitesi,Tıpta Uzmanlık,Göz Hastalıkları = Eye Diseases," onclick=tezDetay('UfxzZu8HlTCtzXFvareueg','UfxzZu8HlTCtzXFvareueg')"
91725,MUSTAFA KEMAL ÖZTÜRK,2000,Küçükçekmece Eğitim Araştırma Sağlık Grup Başkanlığı Bölgesi\'nde 0-9 yaş grubunda epilepsi ve febril konvülziyon prevalansı<br><span style='font-style: italic';>,İstanbul Üniversitesi,Tıpta Uzmanlık,Halk Sağlığı = Public Health," onclick=tezDetay('pCqaqk5eXM1Kt4lIdeaB0A','fXdElKlVE1cYaStEtUCckw')"
91745,TÜLAY SAMANCI,2000,Diabetik hastalarda bozulmuş lökosit fonksiyonları üzerine nikotinamidin etkisi<br><span style='font-style: italic';>The Affect of nicotinamide on impaired leukocyte functions in diabetic patients,İstanbul Üniversitesi,Tıpta Uzmanlık,Endokrinoloji ve Metabolizma Hastalıkları = Endocrinology and Metabolic Diseases ; Klinik Bakteriyoloji ve Enfeksiyon Hastalıkları = Clinical Microbiology and Infectious Diseases," onclick=tezDetay('wrdhx-Uzkj8h24Zxq9QxkQ','Fs1Xs0MiXeYAMNIjWzR5qA')"
91769,İBRAHİM BAĞÇİVAN,2000,Tip 2 diabet ve diabetik komplikasyonlarda antikardiolipin antikor düzeyleri<br><span style='font-style: italic';>Levels anticardiolipin antibodies in complicated and uncomplicated type 2 diabetes mellitus,İstanbul Üniversitesi,Tıpta Uzmanlık,Endokrinoloji ve Metabolizma Hastalıkları = Endocrinology and Metabolic Diseases," onclick=tezDetay('IQlpBCqzrA41xT8s2EK_wQ','l-4_HFdbZW26l_bQCr3q4g')"
111464,HOJJAT SHABABI,2001,"Gastrointestinal sistem kanserlerinin cerrahi tedavi sonrası interlokin 6, tiroid, büyüme ve prolaktin hormonlarının serum düzey değişiklikleri ve takip protokolüne etkileri<br><span style='font-style: italic';>The influences of difference of the IL-6, \'thyroid\' growth and prolactin hormons serum levels the management protocol in gastrointestinal cancer surgery",İstanbul Üniversitesi,Tıpta Uzmanlık,Genel Cerrahi = General Surgery," onclick=tezDetay('8Uj7MO6mhhiF3jCL9zEImg','8NBnTy9Wd2ST45QNaf4Wvg')"
111487,RUŞEN COŞAR,2001,Çok aşamalı deneysel deri karsinogenezinde amifostinin kanser kemopreventif etkilerinin araştırılması<br><span style='font-style: italic';>Does amifostine have any chemopreventive effect in mouse skin tumorigenesis,İstanbul Üniversitesi,Tıpta Uzmanlık,Onkoloji = Oncology ; Radyoloji ve Nükleer Tıp = Radiology and Nuclear Medicine," onclick=tezDetay('2akxEPlB1mucIej1g0ieYw','K-bjkHahIpwF6kPZoWPC1w')"
129717,ŞENAY MUTLU ARAT,2003,Feokromositomanın tanısı ameliyat öncesi hazırlığı ve takibi<br><span style='font-style: italic';>Diagnosis of pheocromocytoma preoperative management and clinical course,İstanbul Üniversitesi,Tıpta Uzmanlık,Endokrinoloji ve Metabolizma Hastalıkları = Endocrinology and Metabolic Diseases," onclick=tezDetay('o1eb_hbj3PRYUcO9sNIyOQ','qMRELe7YGcFe_kk8zZAOmg')"
124292,SERDAR BAKİ ALBAYRAK,2003,"İnsan glioblastoma multiforme primer hücre kültüründe ve sıçan C6 gliom modelinde, tibolon ve medroksi progesteron asetat (MPA) tedavisi<br><span style='font-style: italic';>Tibolon and medroxy pregesterone acetate treatment on the primary human glioblastoma cell culture and on the rat C 6 malignant glioma model",İstanbul Üniversitesi,Tıpta Uzmanlık,Nöroşirürji = Neurosurgery," onclick=tezDetay('4SOdDHAHEyqau0-oEDkHDA','HN8ckZYZ4yR2lFl0e9DIGw')"
124293,HAKAN KAYA,2003,Meme kanserinde multifokalitenin prognoz ve sağkalım üzerine etkisi<br><span style='font-style: italic';> ,İstanbul Üniversitesi,Tıpta Uzmanlık,Genel Cerrahi = General Surgery," onclick=tezDetay('UuptLMNkulj2ROlK0sa6dw','lXWyd2vpoIy33dGCPGofCQ')"
124294,MURAT EMİN GÜVELİ,2003,Lokal ileri supraglottik larenks kanserinde cerrahi ve radyoterapi tedavi sonuçlarının değerlendirilmesi<br><span style='font-style: italic';>,İstanbul Üniversitesi,Tıpta Uzmanlık,Onkoloji = Oncology ; Radyoloji ve Nükleer Tıp = Radiology and Nuclear Medicine," onclick=tezDetay('u26--njackHcBjarLLD3ug','cQb5XxD0eaj1c65N6vV-tw')"
124357,BURÇAK SAYGI ERZİK,2003,Komplikasyonlu gebeliklerin etiyolojisinde kalıtsal trombofililerin ve homosistein metabolizmasının yeri<br><span style='font-style: italic';>The role of inherited thrombophilia and homocysteine metabolism in complicated pregnancies,İstanbul Üniversitesi,Tıpta Uzmanlık,Kadın Hastalıkları ve Doğum = Obstetrics and Gynecology," onclick=tezDetay('z3O8sp6Yp4wYXQnONYdauA','tCF8haysuITAUhSsVxspPw')"
124378,TANER TANRIVERDİ,2003,Anevrizmal subaraknoid kanamada BOS ve serum ICAM-1 ve VCAM-1 değerleri<br><span style='font-style: italic';>CSF and serum levels of ICAM-1 and VCAM-1 an aneurysmal subarachnoid hemorrhage,İstanbul Üniversitesi,Tıpta Uzmanlık,Nöroşirürji = Neurosurgery," onclick=tezDetay('JvwrkP0bl2TL32sWRcim_g','wxgpeA-GTrLLxipG2WBilQ')"
91834,ALİYE AYDOĞAN,2000,Tip II Diabetes Mellitus\'ta donuk omuzun tedavi cevabını etkileyen faktörler<br><span style='font-style: italic';>Effective factors of frozen shaulder therapy results in type II diabetes mellitus,İstanbul Üniversitesi,Tıpta Uzmanlık,Fiziksel Tıp ve Rehabilitasyon = Physical Medicine and Rehabilitation," onclick=tezDetay('u6XeKgba44wy6GsGSle3_w','5VSGoLRFY-xU2UBPyUJy9w')"
124379,İBRAHİM TOPÇU,2003,Örneklerle Türkiye Tıp Encümeni\'nin bilimsel faaliyetleri (1946-1966)<br><span style='font-style: italic';>The scientific activities of the Turkish Medical Committee by examples (1946-1966),İstanbul Üniversitesi,Tıpta Uzmanlık,Deontoloji ve Tıp Tarihi = Medical History and Ethics," onclick=tezDetay('kOyj3nEVeCKfXftsisbJyw','4pnZNw1y8KVVX1lX-0rXkw')"
698375,ÖZNUR DEMİROLUK,2003,Laparoskopik ameliyatlarda uygulanan peep ve recruitment manevrasının ameliyat sonrası solunum mekanikleri ve arter kan gazı üzerine etkilerinin karşılaştırılması<br><span style='font-style: italic';>Comparison of the effects of peep and recruitment maneuver applied in laparoscopic surgery on postoperative respiratory mechanics and artery blood gas,İstanbul Üniversitesi,Tıpta Uzmanlık,Anestezi ve Reanimasyon = Anesthesiology and Reanimation," onclick=tezDetay('FNpWmlZHSrupgcKk-rUaBg','RIOVvHyS2PekKUe-0iPz2g')"
124296,ERYİĞİT EREN,2003,"Sıçanlarda hipertonik solüsyon, askorbik asit ve düşük molekül ağırlıklı heparinin akut nekrotizan pankreatite etkileri (deneysel çalışma)<br><span style='font-style: italic';>",İstanbul Üniversitesi,Tıpta Uzmanlık,Genel Cerrahi = General Surgery," onclick=tezDetay('86oZwRNIwuupBi2cy_mzbw','tx6zCTl5s6BprQ6kZ07C5g')"
124297,SASAN RADJAZİ,2003,Karaciğer kitle lezyonların saptanması ve karakterizasyonunda hepatobiliyer kontrast ajan olan MN-DPDP\'ın yeri<br><span style='font-style: italic';> ,İstanbul Üniversitesi,Tıpta Uzmanlık,Radyoloji ve Nükleer Tıp = Radiology and Nuclear Medicine," onclick=tezDetay('-X24xnTkwMBN7yiXhqSYvw','SsdPBxkHCAfSR7Rs_3ss-w')"
124298,ÖMER DEVECİOĞLU,2003,Çocukluk çağının ileri evre hodgkin hastalığında nitrojen mustard içeren ve içermeyen tedavi protokollerinin karşılaştırılması<br><span style='font-style: italic';> ,İstanbul Üniversitesi,Tıpta Uzmanlık,Çocuk Sağlığı ve Hastalıkları = Child Health and Diseases," onclick=tezDetay('rnKIiavvndLr8XlkNhApYw','YJ2Hew9o9KSgG_LCVuu8Qw')"
124358,SAİME DEMİRCİ,2003,Postmenopozal osteoporozda; egzersiz ve/veya medikal tedaviyi içeren üç farklı tedavi protokolünün etkinliğinin değerlendirilmesi<br><span style='font-style: italic';> ,İstanbul Üniversitesi,Tıpta Uzmanlık,Fiziksel Tıp ve Rehabilitasyon = Physical Medicine and Rehabilitation," onclick=tezDetay('QJmxc0pN5kDug8-A3yLTeg','obynsLAhFcE1bdO1Cl3hAw')"
124359,BAHATTİN ONAR,2003,Cerrahi menopoz ve doğal menopozdaki hastalarda oksidatif protein hasarının karşılaştırılması<br><span style='font-style: italic';> ,İstanbul Üniversitesi,Tıpta Uzmanlık,Kadın Hastalıkları ve Doğum = Obstetrics and Gynecology," onclick=tezDetay('YPPetJ5809J9xZZlAW_oTg','Phsw29N1EXWwVRXghI_xvA')"
124360,DÜZGÜN KORKMAZ,2003,Endometriozis patogenezinde serbest radikallerin ve apoptozisin rolü<br><span style='font-style: italic';>The role of free radicals and apoptosis in the pathogenesis of endometriosis,İstanbul Üniversitesi,Tıpta Uzmanlık,Kadın Hastalıkları ve Doğum = Obstetrics and Gynecology," onclick=tezDetay('iXjjWrrXRxUChUaUsVirNQ','hDzhIoynGxcQ7EGvbEzYDA')"
124380,SEDAT UYGUN,2003,Pulmoner sarkoidozlu hastalarda serum ACE (angiotensin converting enzim) düzeyi ve bronkoalveolar lavaj sıvısında CD4/CD8 oranı ile radyolojik evre ilişkiiiisi ve prognoz<br><span style='font-style: italic';>Pulmonary sarcoidosis: correlation of serum angiotensin-converting enzyme and in bronchoalveolar lavage CD4/CD8 lymhocytes rate with radiologic phasing and prognosis,İstanbul Üniversitesi,Tıpta Uzmanlık,Endokrinoloji ve Metabolizma Hastalıkları = Endocrinology and Metabolic Diseases," onclick=tezDetay('BMO3r-isbiVGmtzqfQUlcQ','9pmsNhPHy0Tgv8ukLntusA')"
69674,ORHAN ARAL,1998,Sınıflandırılamayan artropilerde sinovyal biyopsinin katkısı<br><span style='font-style: italic';>,İstanbul Üniversitesi,Tıpta Uzmanlık,Endokrinoloji ve Metabolizma Hastalıkları = Endocrinology and Metabolic Diseases ; Romatoloji = Rheumatology," onclick=tezDetay('4d6X_q_zqmPr7z_vQDXouQ','4d6X_q_zqmPr7z_vQDXouQ')"
69675,MEHMET TUNCAY DURUÖZ,1998,"Romatoid el fonksiyonel yetersizlik göstergesinin geliştirilmesi, geçerliliğinin araştırılması ve fonksiyonel engelliliğin değerlendirilmesinde kullanılabilirliği<br><span style='font-style: italic';>",İstanbul Üniversitesi,Tıpta Uzmanlık,Endokrinoloji ve Metabolizma Hastalıkları = Endocrinology and Metabolic Diseases ; Romatoloji = Rheumatology," onclick=tezDetay('TVA4yaVg6_IR3whVBTO6Ow','TVA4yaVg6_IR3whVBTO6Ow')"
69676,SÜLEYMAN TÜRK,1998,Posttransplant hiperlipidemide fluvastatin kullanımı<br><span style='font-style: italic';>,İstanbul Üniversitesi,Tıpta Uzmanlık,Endokrinoloji ve Metabolizma Hastalıkları = Endocrinology and Metabolic Diseases ; Nefroloji = Nephrology," onclick=tezDetay('JsjDsdiXPOvd-neCHBETbA','JsjDsdiXPOvd-neCHBETbA')"
69700,KENAN MİDİLLİ,1998,"İstanbul ve çevresinden toplanan çeşitli su örneklerinde aeromonas cinsi bakterilerin varlığı, sıklığı ve biyotip özellikleri<br><span style='font-style: italic';>The Occurence, frequency and biotyping of aeromonas in diverse water samples collected in Istanbul",İstanbul Üniversitesi,Tıpta Uzmanlık,Mikrobiyoloji = Microbiology," onclick=tezDetay('tpZXJzrj6X5l6HnzFHqWCA','tpZXJzrj6X5l6HnzFHqWCA')"
124299,ERBİL YAĞMUR,2003,"Endometriozis olgularında serum CA-125, interlökin-6, tümör nekrozis faktör-alfa ve eritropoietin düzeyleri<br><span style='font-style: italic';> ",İstanbul Üniversitesi,Tıpta Uzmanlık,Kadın Hastalıkları ve Doğum = Obstetrics and Gynecology," onclick=tezDetay('sVmOrh2wHBW4jb259FY2rw','acQpKp7-yYFuZpFaJ06B_Q')"
124300,MEHMET ÖNER ŞANLI,2003,4p15.3-4p1 bölgesinde yer alan SLC34A2 geninin testiküler mikrolitiazis ile olan ilişkisi<br><span style='font-style: italic';> ,İstanbul Üniversitesi,Tıpta Uzmanlık,Üroloji = Urology," onclick=tezDetay('1di4LeNEdNN9Urkho9ouSQ','7rKDTdEY5ocCQbjI2vrmjA')"
124301,PEYMAN AMİNPOUR,2003,Akson sayımı yöntemindeki ortalama motor ünite potansiyeli alanı ile ön boynuz hastalığı ve miyopatilerin ayırımı<br><span style='font-style: italic';> ,İstanbul Üniversitesi,Tıpta Uzmanlık,Nöroloji = Neurology," onclick=tezDetay('jV3rfM1StETI8ET391gUGQ','IGD3aSxv4s10tHUzMGREqw')"
124303,ÖZLEM ALTAY YÜCEL,2003,1-24 ay arasında konvülziyon geçiren çocuklarda kısa dönemli prognoz<br><span style='font-style: italic';> ,İstanbul Üniversitesi,Tıpta Uzmanlık,Çocuk Sağlığı ve Hastalıkları = Child Health and Diseases," onclick=tezDetay('N9rAdDV_WcRHbQ1VO8zi0w','I_V7jHLwUh7selI6yGeMcg')"
91746,ZEKİ KARAKAYA,2000,"Hipertiroidili kadınlarda, serum seks hormonu bağlayıcı globulin (SHBG), total testosteron ve dehidroepiandrosteron sülfat (DHEA-SO4) düzeyleri<br><span style='font-style: italic';>Serum sex hormon binding globuline (SHBG, total testosterone and dehydroepiandrosterone sulphate (DHEA-SO4) levels between hyperthyroidism women",İstanbul Üniversitesi,Tıpta Uzmanlık,Endokrinoloji ve Metabolizma Hastalıkları = Endocrinology and Metabolic Diseases ; Kadın Hastalıkları ve Doğum = Obstetrics and Gynecology," onclick=tezDetay('iOjmoKPVNVjJvK8PbJmM1w','-eKCoFv-Ff5Z6CecrtQ_Fg')"
91770,ALİ SAİT TURGUT,2000,Hipopitüitarizmi olan hastalarda serum lipid ve leptin seviyeleri ile büyüme hormonunun etkileri<br><span style='font-style: italic';>,İstanbul Üniversitesi,Tıpta Uzmanlık,Endokrinoloji ve Metabolizma Hastalıkları = Endocrinology and Metabolic Diseases ; Kardiyoloji = Cardiology," onclick=tezDetay('KH9V8PnqgJsSZtDAwyl5jw','XgS4V2Khj1aT9BF02DnBnQ')"
124361,ÖZLEM ÖZBEK,2003,Kronik lenfositik lösemide hasta özelliklerinin ve sağkalımın incelenmesi<br><span style='font-style: italic';> ,İstanbul Üniversitesi,Tıpta Uzmanlık,Hematoloji = Hematology," onclick=tezDetay('ODWt4xafPqB4BxBu_qkKcQ','gJPVUv7jvl1WgG6fZWaXbw')"
124363,KEZBAN BERBEROĞLU,2003,Metoksi izobütil izonitrilin (MIBI) multipl miyelom ve lösemi dışı çocukluk çağı kanserlerinde kemik iliği tutulumunun belirlenmesindeki yeri<br><span style='font-style: italic';> ,İstanbul Üniversitesi,Tıpta Uzmanlık,Radyoloji ve Nükleer Tıp = Radiology and Nuclear Medicine," onclick=tezDetay('JzovmokBUVHXnWFmUwWh9g','uks0-yu4BmBDuP9rrbJMMA')"
124381,NİL YAVUZ,2003,Epitelyal over kanserlerinde tümör belirteçlerinin prognostik faktör olarak rolü<br><span style='font-style: italic';>The prognostic rules of the tumor markers in epithelial ovarian carcinoma,İstanbul Üniversitesi,Tıpta Uzmanlık,Kadın Hastalıkları ve Doğum = Obstetrics and Gynecology," onclick=tezDetay('2fjk0u4bkLLP_xPQIKHMyA','CPOB40zdetc2vIHLhY4BKg')"
124382,FATMA YURDAKUL,2003,"Tireidektomi yapılan hastalarda iki anestezi yönteminin karşılaştırılması: Sufentanil/propofol, sufentanil/sevofluran<br><span style='font-style: italic';>Comparison of sufentanil/propofol, sufentanil/sevoflurane combination in patients undergoing tyroidectomy",İstanbul Üniversitesi,Tıpta Uzmanlık,Anestezi ve Reanimasyon = Anesthesiology and Reanimation," onclick=tezDetay('mnr_L5Xr93j3Si1yLV3Cyg','wjd9YmkgAKkr5IfpmYlE2g')"
69701,NİLGÜN KANSAK,1998,Sağlıklı ve diyabetik hamilelerde idrarın bakteriyolojik incelenmesi<br><span style='font-style: italic';>,İstanbul Üniversitesi,Tıpta Uzmanlık,Kadın Hastalıkları ve Doğum = Obstetrics and Gynecology ; Mikrobiyoloji = Microbiology," onclick=tezDetay('hn3ddMDJqNqKF1KFe1C9og','hn3ddMDJqNqKF1KFe1C9og')"
69748,EBRU SAFGÖNÜL ÜNAL,1998,Kataraktlı hastalar için katlanır intraoküler lenslerin üstünlükleri<br><span style='font-style: italic';>,İstanbul Üniversitesi,Tıpta Uzmanlık,Göz Hastalıkları = Eye Diseases," onclick=tezDetay('6ehgNJMaePtDhlqw5R-HEQ','6ehgNJMaePtDhlqw5R-HEQ')"
69749,MUSTAFA KAVVASOĞLU,1998,"Primer açık açılı glokomda timolol maleat, betaxolol ve carteololün oküler kan akım hızına olan etkileri<br><span style='font-style: italic';>",İstanbul Üniversitesi,Tıpta Uzmanlık,Göz Hastalıkları = Eye Diseases," onclick=tezDetay('nJbsLNIE1uJLO2zxHZwbPA','nJbsLNIE1uJLO2zxHZwbPA')"
129682,HÜSEYİN COŞKUN,2003,Sürekli periton diyalizi alan hastalarda egzersizin metabolik ve fonksiyonel parametrelere etkisi<br><span style='font-style: italic';> ,İstanbul Üniversitesi,Tıpta Uzmanlık,Çocuk Sağlığı ve Hastalıkları = Child Health and Diseases," onclick=tezDetay('GNCQ7k_OUEl-9sGGwUetoQ','DwC0XKBr4pNEv1IGHf28hA')"
124304,ERSİN SELÇUK ÜNAL,2003,Erken evre meme kanserinde in vitro bromodeoksiüridin işaretleme indeksinin standart prognostik ve prediktif faktörlerle karşılaştırılması<br><span style='font-style: italic';> ,İstanbul Üniversitesi,Tıpta Uzmanlık,Genel Cerrahi = General Surgery," onclick=tezDetay('CIL0_hILWaM9qmY-W-R2Fg','lvDb_j1GpMP_7x5t5jcu6w')"
124364,SEMRA AKINTÜRK,2003,Behçet hastalığında uzun dönem AFT ve genital ülserasyonla seyreden olguların klinik değerlendirilmesi<br><span style='font-style: italic';>Clinical evaluation of the cases with long term oral apht and genital ulceration in Behçet\'s disease,İstanbul Üniversitesi,Tıpta Uzmanlık,Dermatoloji = Dermatology," onclick=tezDetay('prOdyUcVhxJJX6pgM665ow','Jn9GJOA4SAW8aJBrYFb-Tg')"
124383,HÜSEYİN KARABAY,2003,Sağ ve sol hemikolektomili sıçanlarda deneysel karsinogenezde COX-2 inhibitörünün koruyuculuğu<br><span style='font-style: italic';> ,İstanbul Üniversitesi,Tıpta Uzmanlık,Genel Cerrahi = General Surgery," onclick=tezDetay('PEx1CoV-HTSFX15iR4MU7w','B8tHyOa8u7ubhRbrIi7qAQ')"
69447,KORAY ELTER,1998,Farklı (varyant) lüteinizan hormonun polikistik ovaryum sendromu etyolojisindeki önemi<br><span style='font-style: italic';>The Role of variant luteinizing hormone in the etiology of polycystic ovary syndrome,İstanbul Üniversitesi,Tıpta Uzmanlık,Kadın Hastalıkları ve Doğum = Obstetrics and Gynecology," onclick=tezDetay('6O5xr9bHZt6Vp5pd3tbQSQ','6O5xr9bHZt6Vp5pd3tbQSQ')"
124523,GÜRSEL ACARTÜRK,2003,Kardiyovasküler risk faktörleri açısından renal replasman tedavilerinin karşılaştırılması<br><span style='font-style: italic';> ,İstanbul Üniversitesi,Tıpta Uzmanlık,Kardiyoloji = Cardiology ; Nefroloji = Nephrology," onclick=tezDetay('ROJGaJw8rboC_rZJlj2lTg','nlGw_Jtg_5emVeOWyseULA')"
91747,ZİYA MİTHAT BIYIKLI,2000,Karaciğer sirozlu hastalarda helicobacter pylori eradikasyon tedavisinin serum amonyak düzeyine etkisi<br><span style='font-style: italic';>Effects of helicobacter pylori eradication therapy on serum ammonia level in patients with liver cirrhosis,İstanbul Üniversitesi,Tıpta Uzmanlık,Gastroenteroloji = Gastroenterology ; Hematoloji = Hematology ; Klinik Bakteriyoloji ve Enfeksiyon Hastalıkları = Clinical Microbiology and Infectious Diseases," onclick=tezDetay('v7DlDu-mE3SK2i-7UGQ9Xg','XkWQa93hGrOTonKseGZkwg')"
91772,ALİ ÇETİNKAYA,2000,Sirotik asit tedavisinde albumin infüzyonunun diüretik tedaviye yanıt üzerindeki etkisi<br><span style='font-style: italic';>The Effect of albumin infusion on response of diuretic therapy in treatment of cirrhosis with ascites,İstanbul Üniversitesi,Tıpta Uzmanlık,Gastroenteroloji = Gastroenterology," onclick=tezDetay('3-HxpEwER3XvC4pkSGwBAw','FGFygonKRFoIXGEyl3OnEg')"
91773,TÜRKER ÖZTÜRK,2000,220 Asitli hastanın etyolojik özellikleri<br><span style='font-style: italic';>,İstanbul Üniversitesi,Tıpta Uzmanlık,Gastroenteroloji = Gastroenterology," onclick=tezDetay('ny-18Pff3gva1M_xR5GI-A','L7o3MHuCODcy_zjlud-Q3A')"
69702,ŞAHİDE SEDGİ,1998,Tüberkülöz menenjit<br><span style='font-style: italic';>,İstanbul Üniversitesi,Tıpta Uzmanlık,Klinik Bakteriyoloji ve Enfeksiyon Hastalıkları = Clinical Microbiology and Infectious Diseases," onclick=tezDetay('BILdVe3i4jM7aag7XeQNRw','BILdVe3i4jM7aag7XeQNRw')"
91748,RECEP TUNÇ,2000,Behçet sendromlu hastalarda faktör analizinin gösterdiği hedef organ ilişkileri<br><span style='font-style: italic';>Target organ associations in Behcet\'s syndrome analysed by factor analysis,İstanbul Üniversitesi,Tıpta Uzmanlık,Romatoloji = Rheumatology," onclick=tezDetay('5h0LKyEDkwbX4GL6tFT6-w','JsBcOG-VyzrmTDUN7Qj8EA')"
91749,MEHMET DEMİRCİOĞLU,2000,"Paroksimal nokturnal hemoglobinüri tanısında konvasiyonel yöntemler (Ham, Hukroz Lizis Testi) ile Jel testi ve flow cytomery yöntemlerinin karşılaştırılması<br><span style='font-style: italic';>The Comparison with conventional methods (Ham, Sucrose lysis test) to gel and flow cytometry in the diagnosis of paroxysmal nocturnal hemoglobinuria",İstanbul Üniversitesi,Tıpta Uzmanlık,Hematoloji = Hematology," onclick=tezDetay('tunv-9X9mtTBxI5qNMpJgA','K5Z-o0b9E82z8LT5QBBLnA')"
111417,BÜLENT ALİOĞLU,2001,Astımlı çocukların egzersize kardiyopulmoner yanıtı ile sistolik ve diyastolik kalp fonksiyonlarının sağlıklı çocuklarla karşılaştırılması<br><span style='font-style: italic';>,İstanbul Üniversitesi,Tıpta Uzmanlık,Çocuk Sağlığı ve Hastalıkları = Child Health and Diseases," onclick=tezDetay('gokpEMhVNtOUIwvfoZP5aw','qxCdQ1vfePkTbLmbrzzxEQ')"
