tez_no,yazar,yıl,title,üniversite,tez_türü,konu,tez_detay
86689,C. BURAK BOYNUK,1999,Alt ekstremite uzatma cerrahisi ve komplikasyonları<br><span style='font-style: italic';>Limb lengthening surgery and complications,İstanbul Üniversitesi,Tıpta Uzmanlık,Ortopedi ve Travmatoloji = Orthopedics and Traumatology," onclick=tezDetay('zvHTOE14Dbb-oVXMuiSwuQ','zvHTOE14Dbb-oVXMuiSwuQ')"
157849,İLKSEN SÖYLER,2004,Fonksiyonel tek ventriküllü hastalarda \'ardiopulmoner bypass\'a girmeden yapılan ekstrakardiyak fontan ameliyatı<br><span style='font-style: italic';> ,İstanbul Üniversitesi,Tıpta Uzmanlık,Göğüs Kalp ve Damar Cerrahisi = Thoracic and Cardiovascular Surgery," onclick=tezDetay('e8RsjWxpZFP47UPe82Vdkw','4BcBVTPaqchiQeiAOS8TzQ')"
157850,TOLGA DEMİR,2004,"Kardiyopulmoner bypass sonrası gelişen miyokardiyal, pulmoner ve serebral hasarlarının önlenmesinde kordikosteroidlerin etkisi (klinik araştırma)<br><span style='font-style: italic';>",İstanbul Üniversitesi,Tıpta Uzmanlık,Göğüs Kalp ve Damar Cerrahisi = Thoracic and Cardiovascular Surgery," onclick=tezDetay('43g9R_pYDAg4fP1XjpqszA','nmrDza2XW48HVHnrkSXHXw')"
79849,ELİF KOÇAK ŞİRİN,1999,Diz ekleminde osteonekroz ve osteokondritis dissekansın değerlendirilmesinde manyetik rezonans görüntüleme<br><span style='font-style: italic';>Magnetic resonance imaging in evaluation of the osteonecrosis and osteochondritis dissecans of the knee joint,İstanbul Üniversitesi,Tıpta Uzmanlık,Radyoloji ve Nükleer Tıp = Radiology and Nuclear Medicine," onclick=tezDetay('ZzEc9xSNZoLF8E5jBUQ0qg','ZzEc9xSNZoLF8E5jBUQ0qg')"
137968,SUAT HAYRİ KÜÇÜK,2003,"B6 vitamininin AGE oluşumu üzerine etkilerinin, STZ diabetik deneysel hayvanlarının böbrek dokularında incelenmesi<br><span style='font-style: italic';>Effects of vitamin B6 on formation of AGE in renal tissues of STZ induced diabetik rats",İstanbul Üniversitesi,Tıpta Uzmanlık,Biyokimya = Biochemistry," onclick=tezDetay('JX7Ido5dS1fekJZHwjBjdg','oVx5cGCD0PgoHEe-izaFEg')"
86462,ERAY SAVGAN GÜROL,1999,Ailesel Akdeniz ateşli çocuklarda büyümenin değerlendirilmesi ve IGF-1 düzeyleri<br><span style='font-style: italic';>Evaluation of grwoth and IGF-1 levels in children with FMF,İstanbul Üniversitesi,Tıpta Uzmanlık,Çocuk Sağlığı ve Hastalıkları = Child Health and Diseases," onclick=tezDetay('kbQJSdhYXY2wb-ScDuf3BQ','kbQJSdhYXY2wb-ScDuf3BQ')"
118579,SİBEL CANBOLANT,2002,Hasta hakları ve etik<br><span style='font-style: italic';>Patient rights and ethics,İstanbul Üniversitesi,Tıpta Uzmanlık,Deontoloji ve Tıp Tarihi = Medical History and Ethics," onclick=tezDetay('NQ47hia6kN46tfg6sFhJJQ','5yAp_puXlCNl5iQVJsS6oA')"
86561,İNCİLAY ÇELEBİ KARABULUT,1999,Subakromiyal sıkışma sendromunda lazer ve ultrason<br><span style='font-style: italic';>Place of laser and ultrasound in the treatment of subacromial impingement syndrome,İstanbul Üniversitesi,Tıpta Uzmanlık,Fiziksel Tıp ve Rehabilitasyon = Physical Medicine and Rehabilitation," onclick=tezDetay('xjZD_sizbELe2sR6_da7zw','xjZD_sizbELe2sR6_da7zw')"
79875,MUSTAFA ÖZDEMİR,1999,Vitiligo\'da cerrahi tedavi yöntemlerinin kontrollü karşılaştırılması ve \'basic fibroblast growth factor\' (bFGF) düzeyi<br><span style='font-style: italic';> ,İstanbul Üniversitesi,Tıpta Uzmanlık,Dermatoloji = Dermatology," onclick=tezDetay('GkqEywszexohwbBMyZvJ6w','GkqEywszexohwbBMyZvJ6w')"
79876,ZEKAYİ KUTLUBAY,1999,Liken planusta olası etyolojik ilişkiler ve oral mukoza ile tırnak tutulum sıklığı<br><span style='font-style: italic';>Probable aetiologic associations and frequencies of oral mucosa and nail involvement in lichen planus,İstanbul Üniversitesi,Tıpta Uzmanlık,Dermatoloji = Dermatology," onclick=tezDetay('8UY3dPR8biurL4_J0TYRiQ','8UY3dPR8biurL4_J0TYRiQ')"
79903,T. TİRAJE CELKAN,1999,Demir eksikliği ve kronik hastalık anemisinin ayırıcı tanısında solübl transferrin reseptörü<br><span style='font-style: italic';>Solubl transferrin receptor in the diagnosis of iron deficiency and chronic disease anemia,İstanbul Üniversitesi,Tıpta Uzmanlık,Çocuk Sağlığı ve Hastalıkları = Child Health and Diseases," onclick=tezDetay('hPop3sC2ep-tAJaU1eTB6A','hPop3sC2ep-tAJaU1eTB6A')"
138025,CİHAN AHMET ORAL,2003,İnsan beyin tümörlerinde nitrotirozin düzeyleri ve nitrik oksit metabolizması değişikliklerinin lipit peroksidasyonuları üzerine etkileri<br><span style='font-style: italic';>Alterations of nitrotyrosine levels and nitric oxide metabolism on lipid peroxidation in human brain tumours,İstanbul Üniversitesi,Tıpta Uzmanlık,Biyokimya = Biochemistry," onclick=tezDetay('f_hgYqqshKFuZuimZUT-CQ','4LfZhYg8h7Hwrldp57fumg')"
115788,AHMET AYTEKİN AKTAN,2002,Günübirlik artroskopi cerrahisinde remifentanil ve alfentanilin hemodinami ve derlenme üzerine etkileri<br><span style='font-style: italic';> ,İstanbul Üniversitesi,Tıpta Uzmanlık,Anestezi ve Reanimasyon = Anesthesiology and Reanimation," onclick=tezDetay('zhpdhhWeLNdvMfe2Icof1A','ZfF_yu9bmAAa8RGWZ9Eh7g')"
103393,METİN SAYLIK,2001,Proliferatif diyabetik retinopatinin tedavisinde pars plana vitrektominin yeri<br><span style='font-style: italic';>The place of pars plana vitrectomy in treatment of proliferative diabetic retinopathy,İstanbul Üniversitesi,Tıpta Uzmanlık,Göz Hastalıkları = Eye Diseases," onclick=tezDetay('UBqQJaAlNS6E2auBlUYQXg','6sqEicU6AQ-qBQLVNuc5vg')"
115851,M. SEDAT OFLUOĞLU,2002,Radyosinovektomi holmiyum-166 ferrik hidroksitle elde edilen ilk klinik sonuçlar<br><span style='font-style: italic';> ,İstanbul Üniversitesi,Tıpta Uzmanlık,Radyoloji ve Nükleer Tıp = Radiology and Nuclear Medicine," onclick=tezDetay('XUhx1lqrhvGa7pzDrnka0Q','o3XagQOQNJ7AkMvqoFBaWQ')"
115852,HAKAN GENÇHELLAÇ,2002,Pulmoner emboli olgularında eşlik eden derin ven trombozunun spiral bilgisayarlı tomografi ile eş zamanlı saptanması<br><span style='font-style: italic';> ,İstanbul Üniversitesi,Tıpta Uzmanlık,Radyoloji ve Nükleer Tıp = Radiology and Nuclear Medicine," onclick=tezDetay('7UzGKywZMynQox_g7YGMGg','-_01olFMyuqYP1J-75yvDw')"
118509,AHMET BİLİCİ,2002,Meme kanserinde karaciğer yağlanması kontrollü prospektif çalışma<br><span style='font-style: italic';>Hepatitic steatosis assoiated with breast cancer:prospective-controled study,İstanbul Üniversitesi,Tıpta Uzmanlık,Gastroenteroloji = Gastroenterology ; Onkoloji = Oncology," onclick=tezDetay('K-RNatwueUilr4h2rYotyQ','t6xwfo8hi_HfLKNpoliD5w')"
70743,ŞERMİN ŞENGÜN,1998,"Hafif ve orta dereceli esansiyel hipertansiyonda losartan potasyum ve fosinopril sodyum tedavisinin eritrosit osmotik frajilitesi, kan basıncı ve kan biyokimyasal değerlerine etkilerinin araştırılması<br><span style='font-style: italic';>",İstanbul Üniversitesi,Tıpta Uzmanlık,Eczacılık ve Farmakoloji = Pharmacy and Pharmacology," onclick=tezDetay('FPa_HYW3cde38hlYwdSozg','FPa_HYW3cde38hlYwdSozg')"
86331,VOLKAN ETUŞ,1999,Deneysel neonatal hidrosefali modelinde N-asetilsisteinin lipid peroksidasyonu üzerine etkisi<br><span style='font-style: italic';>The Effect of N-acetylcysteine on lipid peroxidation in experimental model of neonatal hydrocephalus,İstanbul Üniversitesi,Tıpta Uzmanlık,Nöroşirürji = Neurosurgery," onclick=tezDetay('4wX5Any221KE4Sy0NmW6jg','4wX5Any221KE4Sy0NmW6jg')"
131913,AYMAN AL-DARSANİ,2003,Genel anestezi altındaki hastalarda farklı pozisyonlarda santral ve periferik venöz basınç ilişkisi<br><span style='font-style: italic';>The relationship between central and peripheral venous pressure,İstanbul Üniversitesi,Tıpta Uzmanlık,Anestezi ve Reanimasyon = Anesthesiology and Reanimation," onclick=tezDetay('cii7g67JqHaWiCooXEcgUQ','7fJROXLz8myD0qU2B-ueqA')"
131914,FİLİZ KETENCİ SELÇUKOĞLU,2003,Toraks travmalı hastalarda patient controlled analgesia (PCA) uygulanması ile morfin ve tramadolün karşılaştırılması<br><span style='font-style: italic';>,İstanbul Üniversitesi,Tıpta Uzmanlık,Anestezi ve Reanimasyon = Anesthesiology and Reanimation," onclick=tezDetay('E0nSplAwwykrM7nWE21q9w','Qwv-fUDpvsSescz-Dt_MWw')"
115789,YASEMİN ÇELENK,2002,Günübirlik artroskopi cerrahisinde remifentanil infüzyonu eşliğinde kullanılan desfluran ve propofolün hemodinami ve derlenme üzerine etkileri<br><span style='font-style: italic';> ,İstanbul Üniversitesi,Tıpta Uzmanlık,Anestezi ve Reanimasyon = Anesthesiology and Reanimation," onclick=tezDetay('HUUZ2jGtjLM6mHM0fmJ6EQ','SSinZwwRcBFp6fimE2jjdw')"
115790,ALİ ÇİMEN,2002,Konvansiyonel radyofrekans ile pulsed radyofrekans uygulamalarının tavşan arka kök gangliyonu üzerine etkilerinin morfolojik değerlendirmesi<br><span style='font-style: italic';>The effects of conventional and pulsed radiofrequency applications on rabbit dorsal root ganglion : a morphological analysis,İstanbul Üniversitesi,Tıpta Uzmanlık,Anestezi ve Reanimasyon = Anesthesiology and Reanimation," onclick=tezDetay('8mVHSHKCsgoMWcemcl-JVw','UwAEB_tXkPbMTvLq5eIhEg')"
115791,AHMET DİLEK,2002,Tek akciğer ventilasyonunda basınç kontrollü ventilasyon ve PEEP uygulamasının etkileri<br><span style='font-style: italic';> ,İstanbul Üniversitesi,Tıpta Uzmanlık,Anestezi ve Reanimasyon = Anesthesiology and Reanimation," onclick=tezDetay('FQX4sHJa0QaFvdz9T9EMfA','e6jvWTr_10d3lMiZwWTZMg')"
137949,SEVİLAY NADİR,2003,"Enürezis; okul, aile ve sağlık hizmetleri<br><span style='font-style: italic';>",İstanbul Üniversitesi,Tıpta Uzmanlık,Aile Hekimliği = Family Medicine," onclick=tezDetay('I06tGf9Kq3kQGE6E3L4eQw','njb8xpG9KNTWedGIWDTChA')"
138026,EBRU İLHAN,2003,Koroner kalp hastalığında metilentetrahidrofolat redüktaz polimorfizminin araştırılması<br><span style='font-style: italic';>,İstanbul Üniversitesi,Tıpta Uzmanlık,Biyokimya = Biochemistry," onclick=tezDetay('GOUHbly7WYX-Q-H6oUD7lQ','duYjLMcdPbxFRC7lT1B7fQ')"
107796,ÖZLEM AKSU AÇIKGÖZ,2001,İstanbul ve çevresindeki kuş dışkılarında cryptococcus neoformans görülme sıklığı<br><span style='font-style: italic';> ,İstanbul Üniversitesi,Tıpta Uzmanlık,Mikrobiyoloji = Microbiology," onclick=tezDetay('SkI3HFX0Qf4gByGjhcrqhw','hWUpOIIXl8ijXStw8LDm1w')"
107892,HARUN TUĞCU,2001,Görüntü analizi yöntemi ile ateşli silah atış artıklarının tespiti<br><span style='font-style: italic';>Detection of gunshot residues by image analysis,İstanbul Üniversitesi,Tıpta Uzmanlık,Adli Tıp = Forensic Medicine," onclick=tezDetay('MX0wqZWzP8K_wM6coZZqaA','Dw0Pg9ldhA4rViCqxBz5_g')"
118181,EBRU KIZILKILIÇ,2002,Mide kanserli 683 hastanın retrospektif değerlendirilmesi<br><span style='font-style: italic';>Retrospectively analysis of 683 patients with gastric cancer,İstanbul Üniversitesi,Tıpta Uzmanlık,Onkoloji = Oncology," onclick=tezDetay('LYgVfd-VbfdpP84ymaSOMQ','rYGOKYOT9S6-rlx5-rsi3Q')"
118227,EMRE TOPAL,2002,"Hormon replasman tedavisi alan ve almayan postmenopozal kadınlarda plazminogen aktivatör inhibitör-1 (PAI-1), fibrinogen, D-dimer düzeylerinin karşılaştırılması ve klinik önemi<br><span style='font-style: italic';>PAI-1, dimer and fibrinogen levels in postmenopausal women receiving hormone replacement therapy or not",İstanbul Üniversitesi,Tıpta Uzmanlık,Kardiyoloji = Cardiology," onclick=tezDetay('-oYViDAy0e1q7nk68kvWxA','EcHy9sBsyRUUDigau2QnSg')"
115853,AYLİN HASANEFENDİOĞLU,2002,Meme kitlelerinin benign-malign ayrımında MR ve sintigrafi bulgularının karşılaştırılması<br><span style='font-style: italic';> ,İstanbul Üniversitesi,Tıpta Uzmanlık,Onkoloji = Oncology ; Radyoloji ve Nükleer Tıp = Radiology and Nuclear Medicine," onclick=tezDetay('fOVB87gBMyDJH3LPIFMHuA','U35p67GkRI6tMy5sQXFBvQ')"
115854,METİN HALAÇ,2002,Enfeksiyonların tanısında 99mTc siprofloksasin (Infecton) sintigrafisi<br><span style='font-style: italic';>Infecton scan in diagnosis of infections,İstanbul Üniversitesi,Tıpta Uzmanlık,Radyoloji ve Nükleer Tıp = Radiology and Nuclear Medicine," onclick=tezDetay('FgBcXolaTvvpq-bSJBerxg','J21XxEBLWzHukKIxY2gNgg')"
107919,AYŞE AKCAN ARIKAN,2001,Çocuklarda helicobacter pylori enfeksiyonu ile demir eksikliği ve anemi ilişkisi<br><span style='font-style: italic';>Helicobacter pylori infection and iron deficiency anemia in children,İstanbul Üniversitesi,Tıpta Uzmanlık,Çocuk Sağlığı ve Hastalıkları = Child Health and Diseases," onclick=tezDetay('esnP0nWbHE-zIchJBo2L9w','PoeaWhRR4vs1jXCr2mArjw')"
131792,SİBEL ALTUN,2003,Jüvenil idyopatik artritli çocuklarda Chlamydophilia pneumoniae seropozitifliğinin ve chlamydophilia pneumoniae DNA\' sının araştırılması<br><span style='font-style: italic';>Investigation of chlamydophilia pneumoniae seropositivity and Chilamydophilia pnemoniae DNA in children with juvenile idiopathic arthritis,İstanbul Üniversitesi,Tıpta Uzmanlık,Mikrobiyoloji = Microbiology," onclick=tezDetay('bUFQS1soR_qhXgdSz8iQXA','vW_uY_0f1UjxRhtgmuvEKQ')"
86516,NERMİN GÜLER,1999,Bronşiyal Astım\'lı okul çocuklarında pasif sigara içiminin etkileri<br><span style='font-style: italic';>,İstanbul Üniversitesi,Tıpta Uzmanlık,Çocuk Sağlığı ve Hastalıkları = Child Health and Diseases," onclick=tezDetay('rObCXhJdm58rKdThap7tHw','rObCXhJdm58rKdThap7tHw')"
132079,GÜLCAN BUGAY,2003,"istanbul Üniversitesi Cerrahpaşa Tıp Fakültesi Dahiliye Anabilim Dalı Geriatri Bilim Dalı Polikliniği\'ne başvuran hastalarda depresyonun sıklığı, demografik özellikler, fiziksel hastalık ve yaşam aktiviteleri ile ilişkisi<br><span style='font-style: italic';>Prevalence of depression and its correlation with demographic data, physical illness and activities of daily living among the patients attending the geriatry policlinic of the Internal Medicine Department of Istanbul University, Cerrahpaşa Medical Sc",İstanbul Üniversitesi,Tıpta Uzmanlık,Psikiyatri = Psychiatry," onclick=tezDetay('Hn1Xs-RyR7qF0ibB3UKrdA','B8fu9F96yC3GlOva9sJ_6w')"
86562,AZAR RAHİMPANAH,1999,Spinal kord yaralanmalarında klinik belirti ve bulgular ile elektonörofizyolojik bulguların karşılaştırılması<br><span style='font-style: italic';>The Comparison of the clinical signs and symptoms of spinal cord injury with electroneurophysiologic findings,İstanbul Üniversitesi,Tıpta Uzmanlık,Fiziksel Tıp ve Rehabilitasyon = Physical Medicine and Rehabilitation," onclick=tezDetay('zaF-pF76tWOwpo1wITP-eg','zaF-pF76tWOwpo1wITP-eg')"
118510,BÜNYAMİN KISACIK,2002,Tip 2 diabetes mellitus olgularında lispro insulin ile sağlanan postprandial glukoz kontrolünün oksidatif stres üzerine etkisi<br><span style='font-style: italic';>The Effect of postprandial glucose control on the oxidative stress maintained by lispro insulin in type 2 diabetes mellitus patients,İstanbul Üniversitesi,Tıpta Uzmanlık,Endokrinoloji ve Metabolizma Hastalıkları = Endocrinology and Metabolic Diseases," onclick=tezDetay('VlzR5jZpduplq0iD9uYKZw','wMM786_NxSxbV2kLPB6ADw')"
118511,MUAZZEZ EBRU AYATA UMGU,2002,Behçet Hastalığı\'nda sigaranın tekrarlayan oral ülserlere etkisi<br><span style='font-style: italic';>Effects of smoling on Behçet\'s disease related oral ulcers,İstanbul Üniversitesi,Tıpta Uzmanlık,Gastroenteroloji = Gastroenterology ; Romatoloji = Rheumatology," onclick=tezDetay('nJ_xXCrg_n0SIhQsqKNZ3w','vZ3zixaXHmxa0CYUHeKKlw')"
138159,ERDEM KAŞIKCIOĞLU,2003,Profesyonel güreşcilerde sol ventrikülün sistolik ve diyastolik fonksiyonlarında görülen değişikliklerin metabolik ölçütlerde değerlendirilmesi<br><span style='font-style: italic';>,İstanbul Üniversitesi,Tıpta Uzmanlık,Spor = Sports," onclick=tezDetay('0q3SSTrJxzEL-LKeWNLbkA','cU6JDScsB1my40m6hc8DUg')"
103372,HAŞİM USLU,2001,Preperimetrik glokomda optik sinir başının heidelberg retina tomografi ve sinir liflerinin optik koherens tomografi ile incelenmesi<br><span style='font-style: italic';>Evaluation of the optic nerve head by heidelberg retina tomography and the retinal nerve fiber layer by optical coherence tomography in preperimetric glaucoma,İstanbul Üniversitesi,Tıpta Uzmanlık,Göz Hastalıkları = Eye Diseases," onclick=tezDetay('vc5_XGOI-1-1Q6YLTTLvbQ','me8tV15JSj73py51gz8VXg')"
103374,M. NAİL NASRİ,2001,Egzotropia olgularında cerrahi sonuçlar ve sonuçları etkileyen faktörler<br><span style='font-style: italic';>The Outcome and the influencing factors of strabismus surgery in exotropia,İstanbul Üniversitesi,Tıpta Uzmanlık,Göz Hastalıkları = Eye Diseases," onclick=tezDetay('xR6YFppq1EBLDLaLuSz7IQ','6Z_QiLI9mb4JVpk93DCXzw')"
132200,ADNAN TANER KURDAL,2003,Otojen safen ven greftlerinde arterializasyon sonrası erken dönem değişikliklerinin önlenmesinde perivasküler desteğin in vitro düzenekte etkileri<br><span style='font-style: italic';>The effect of the perivascular support for otogenous saphenous vein on the early period after arterialization in an in vitro model,İstanbul Üniversitesi,Tıpta Uzmanlık,Göğüs Kalp ve Damar Cerrahisi = Thoracic and Cardiovascular Surgery," onclick=tezDetay('KpMr9Ac7AcFfuxfVJSplog','wLM6QXuwbkg9Vlvu0SCSOQ')"
115792,NECLA DERELİ,2002,İntramüsküler veya epidural yoldan uygulanan Ketamin\'in preemptif etkisinin karşılaştırılması<br><span style='font-style: italic';> ,İstanbul Üniversitesi,Tıpta Uzmanlık,Anestezi ve Reanimasyon = Anesthesiology and Reanimation," onclick=tezDetay('3belvLQhyNwULiNpnhy61w','ssUd-axwTW606G0km9lxtg')"
115793,VİLDAN ERSÖZ,2002,Diffüz kafa travmasında magnezyumun kan beyin bariyeri ve beyin ödemi üzerine etkisi<br><span style='font-style: italic';> ,İstanbul Üniversitesi,Tıpta Uzmanlık,Anestezi ve Reanimasyon = Anesthesiology and Reanimation ; Nöroşirürji = Neurosurgery," onclick=tezDetay('CfJdhXMmpfnOWoDnNAv69Q','EqyLg8nlNmOB8BPjA-a7fQ')"
115794,AYŞE EKİM,2002,Deneysel batın içi sepsis modelinde magnezyumun kan-beyin bariyeri geçirgenliği ve beyin ödemi üzerine etkileri<br><span style='font-style: italic';> ,İstanbul Üniversitesi,Tıpta Uzmanlık,Anestezi ve Reanimasyon = Anesthesiology and Reanimation ; Nöroşirürji = Neurosurgery," onclick=tezDetay('q0cOpH85_bg5h1JXgU7X6Q','v88r2HGz4QnY4UEpS0B4vg')"
115855,DENİZ ÇEBİ,2002,Pelvik psödofraktürlerin MR görünümleri<br><span style='font-style: italic';>Magnetic resonance imaging in osteomalacic pseudofractures of the pelvis,İstanbul Üniversitesi,Tıpta Uzmanlık,Radyoloji ve Nükleer Tıp = Radiology and Nuclear Medicine," onclick=tezDetay('hijG6x4MliSKv1Ye6JbY2w','xpTmjEQt-8-4Pz6knSxsLw')"
115856,REZZAN ÖZBAYRAKÇI,2002,İatrojenik nedenli ince barsak obstrüksiyonlarında enteroklizisin tanı değeri<br><span style='font-style: italic';>The Diagnostic value of enteroclysis in iatrogenic small bowel obstruction,İstanbul Üniversitesi,Tıpta Uzmanlık,Radyoloji ve Nükleer Tıp = Radiology and Nuclear Medicine," onclick=tezDetay('MipW7tFy6Vkgs-FoOKepig','RSeOMhApYd8atag67tkwOw')"
70744,SADETTİN VİLDAN ŞENSES,1998,5-aminoimidazol-4-karboksamid ribozid\'in (AICA-r) neonatal streptozotosin-diabetik rat izole torasik aorta yanıtları üzerindeki etkileri<br><span style='font-style: italic';>The Effect of 5-aminoimidazol-4-carboxamide riboside (AICA-r) on the responsiveness of isolated thoracic aortae from neonatal streptozotocin-diabetic rats,İstanbul Üniversitesi,Tıpta Uzmanlık,Eczacılık ve Farmakoloji = Pharmacy and Pharmacology," onclick=tezDetay('iQ3Cdcy67LyNmfWzFaMyJg','iQ3Cdcy67LyNmfWzFaMyJg')"
103605,SEHER KÜÇÜKOĞLU,2001,Behçet hastalığında görülen nodüler deri lezyonlarında ultrasonografi<br><span style='font-style: italic';>Ultrsonographic assessment in nodular skin lesions of Behçet disease,İstanbul Üniversitesi,Tıpta Uzmanlık,Dermatoloji = Dermatology," onclick=tezDetay('sSA7mGFoWZy8wmDzJZx14g','nrTnupujO2o8bnbPMQvIDA')"
115857,İBRAHİM HALİL BAYRAK,2002,Yumuşak doku malign fibröz histiyositomlarının tanısında MRG\'nin yeri<br><span style='font-style: italic';>Malignant fibrous histiocytoma of soft tissue diagnosis with MRG,İstanbul Üniversitesi,Tıpta Uzmanlık,Radyoloji ve Nükleer Tıp = Radiology and Nuclear Medicine," onclick=tezDetay('XSxioSCzdHFKR1q4E4Qstw','JM61XNej-WEtEX_98oo0zA')"
115858,İNCİ BALTEPE ALTIOK,2002,Ekstrakranial karotis arter darlığının bilgisayarlı tomografik anjiyografi ile değerlendirilmesi<br><span style='font-style: italic';> ,İstanbul Üniversitesi,Tıpta Uzmanlık,Radyoloji ve Nükleer Tıp = Radiology and Nuclear Medicine," onclick=tezDetay('PJwG30lZS_MbvsCoaLq0vw','N78dPMUAm9OK0K8sIyHLaQ')"
118512,SİBEL YİRMİBEŞÇİK,2002,"Kolorektal Nöroendokrin Tümörler\'de prognoz, anjiyogenez ve metalloproteinaz ekspresyonunun değerlendirilmesi<br><span style='font-style: italic';> ",İstanbul Üniversitesi,Tıpta Uzmanlık,Gastroenteroloji = Gastroenterology ; Onkoloji = Oncology," onclick=tezDetay('q3qjLfBnHVU8-5AEKLX9Nw','AQbA7WSNgwFuCgBU_ZchRg')"
86465,VOLKAN TUZCU,1999,Çocuklarda antrasiklin kardiyotoksisitesinin sinyal-ortalama EKG ile noninvazif değerlendirilmesi<br><span style='font-style: italic';>Signal-averaged ECG as a new screening total in anthracycline cardiomyopathy in children,İstanbul Üniversitesi,Tıpta Uzmanlık,Çocuk Sağlığı ve Hastalıkları = Child Health and Diseases," onclick=tezDetay('FylLUV8zLswOKGgASO7hTg','FylLUV8zLswOKGgASO7hTg')"
86466,CENAP ZEYBEK,1999,"Kistik fibroz olgularında akciğer grafisi ve yüksek rezolüsyonlu akciğer tomografisi bulgularının değerlendirilmesi, radyolojik ve klinik bulguların karşılaştırılması, radyolojinin tedaviye ve prognoza olan .....<br><span style='font-style: italic';>Evaluation of chest X-ray and HRCT findings in cystic fibrosis patients, correlation of clinical state and radiological findings",İstanbul Üniversitesi,Tıpta Uzmanlık,Çocuk Sağlığı ve Hastalıkları = Child Health and Diseases," onclick=tezDetay('nBMz0D6nyvXwa4JrDPgmvg','nBMz0D6nyvXwa4JrDPgmvg')"
108000,İ. ENGİN KANDIRALI,2001,Azoospermi patofizyolojisinde apoptosisin rolü<br><span style='font-style: italic';>The Role of apoptosis in the pathophysiology of azoospermia,İstanbul Üniversitesi,Tıpta Uzmanlık,Onkoloji = Oncology ; Üroloji = Urology," onclick=tezDetay('w02fWto1WfGI6uER_-U2wg','pdRj5EEBtoW2QpQGiHA6NA')"
103375,MUSTAFA ÜNAL,2001,"Katarakt oluşumu ile detonsifikasyon enzimlerinden glutatyon S-Transferaz (GST) enzimi polimorfizmi ve DNA tamir enzimlerinden XPD enzimi polimorfizmi arasındaki ilişkinin incelenmesi<br><span style='font-style: italic';>Evaluation of possible relationship between cataract formation and GST enzyme polymorphism, a member of antioxidant system, and XPD enzyme polymorphism, a DNA repair enzyme",İstanbul Üniversitesi,Tıpta Uzmanlık,Göz Hastalıkları = Eye Diseases," onclick=tezDetay('cXuikkn-qCXtLmi3Y1g5eg','wvMumdtfj1q1tQUg7MhIAw')"
118288,AYŞE DURDAN GÜNERİ,2002,"Gemsitabin, Dimetilsülfoksit (DMSO) ve Parasetamol\'ün FM3A hücre kültürlerinde proliferasyon üzerine etkileri<br><span style='font-style: italic';>The Effects of gemcitabine, dimethysulfoxide (DMSO) and paracetamol on proliferation FM3A cells cultures",İstanbul Üniversitesi,Tıpta Uzmanlık,Morfoloji = Morphology," onclick=tezDetay('uOh-t0c3sSJZNRD0GkfdXA','ceFLhIMcqgeLl11K668Wmw')"
118289,NURHAN ÜNLÜ CANEROĞLU,2002,"Obezitede akut faz proteinleri, proinflamatuar sitokinler, leptin ve hipertansiyonla ilişkisi<br><span style='font-style: italic';>Acute phase proteins, proinflamatuar cytokines, leptin in obesity and associations with hypertension",İstanbul Üniversitesi,Tıpta Uzmanlık,Endokrinoloji ve Metabolizma Hastalıkları = Endocrinology and Metabolic Diseases," onclick=tezDetay('H30FcoMd18JbgvAeh8k-vQ','abLrJEN8ynultMdyXIq4Ng')"
115795,YÜKSEL ELA,2002,"Laparoskopik kolesistektomi sonrası analjezi: İntraabdominal Morfin, Tramadol ve Bupivakain\'in karşılaştırılması<br><span style='font-style: italic';> ",İstanbul Üniversitesi,Tıpta Uzmanlık,Anestezi ve Reanimasyon = Anesthesiology and Reanimation," onclick=tezDetay('OJ5HzBKZgzdWCHC-_CXnvw','ltXLb4210UabmjOmHaOObg')"
115796,MURAT İSMAİLOV,2002,Yoğun bakım hastalarında uygulanan immünonutrisyonun nozokomiyal enfeksiyon gelişimine ve klinik sonuca etkisi<br><span style='font-style: italic';> ,İstanbul Üniversitesi,Tıpta Uzmanlık,Anestezi ve Reanimasyon = Anesthesiology and Reanimation," onclick=tezDetay('naKM00trjM3Iey9SfIJC4g','qt2ghR5HGxKhUjQ2AdYtZg')"
70932,AYŞE YILDIRIM,1998,Enteral nutrisyon toleransının SIRS klinik tablosundaki prognostik önemi<br><span style='font-style: italic';>The Prognostic importance of enteral nutrition tolerance in SIRS,İstanbul Üniversitesi,Tıpta Uzmanlık,Anestezi ve Reanimasyon = Anesthesiology and Reanimation," onclick=tezDetay('z0DgRGa0IYsMB4_Lfs7QXQ','z0DgRGa0IYsMB4_Lfs7QXQ')"
118513,TANSU TANRIVER,2002,1988-2001 yılları arasında primer hiperparatiroidi vakalarının klinik ve laboratuar bulgularının retrospektif incelemesi<br><span style='font-style: italic';>Clinical and laboratory findings of patients with primary hyperparathyroidism between years of 1988-2001,İstanbul Üniversitesi,Tıpta Uzmanlık,Endokrinoloji ve Metabolizma Hastalıkları = Endocrinology and Metabolic Diseases," onclick=tezDetay('H1XFXeT14tBIO-RIi3K7GA','t5r5Ru1CIsuvKFeI4mr2Sg')"
86845,AHMET SUHA DAĞLI,1999,Karotis stenozunda endarterektomi ve komplikasyonlar (Retrospektif çalışma)<br><span style='font-style: italic';>Complications and endarterectomy procedure in carotid artery stenosis,İstanbul Üniversitesi,Tıpta Uzmanlık,Göğüs Kalp ve Damar Cerrahisi = Thoracic and Cardiovascular Surgery," onclick=tezDetay('ExrlGhcVOo0OyY2HeuMg1Q','ExrlGhcVOo0OyY2HeuMg1Q')"
