tez_no,yazar,yıl,title,üniversite,tez_türü,konu,tez_detay
115612,N. HALUK AKSOY,2002,Kaplıca tedavisinin primer osteoartritli hastalarda plazma malondialdehit ve total antioksidan aktivite seviyeleri üzerine etkisi<br><span style='font-style: italic';>,İstanbul Üniversitesi,Tıpta Uzmanlık,Tıbbi Ekoloji ve Klimatoloji = Medical Ecology and Climatology," onclick=tezDetay('kIYuwcDYvQq5iboXaVkH4g','iXis2Gw9PL_WCXixdUXzwg')"
124320,DİLEK ERZENGİN,2003,Psoriasiste PUVA ve dar bant UVB tedavilerinin klinik etkinlik ve kardeş kromatid değişimi ve mikronukleus tayinleri ile karsinojenite özelliklerinin karşılaştırılması<br><span style='font-style: italic';> ,İstanbul Üniversitesi,Tıpta Uzmanlık,Dermatoloji = Dermatology," onclick=tezDetay('oNwt39DHK4DHj1apHPBGQQ','O_rvWAs1docp5g8QxovpLQ')"
124321,YEŞİM GÜROL,2003,Toplumdan kazanılmış pnömoni ve kronik bronşitin akut alevlenmesinden izole edilen bakterilerin yeni kinolonlara ve bazı antimikrobik ajanlara olan direnci<br><span style='font-style: italic';>The resistance to new quinolones and some antimicrobial agents of strains isolated from community-acquired pneumonia and acute exacerbations of chronic bronchitis,İstanbul Üniversitesi,Tıpta Uzmanlık,Mikrobiyoloji = Microbiology," onclick=tezDetay('GLZuNUvV5d_-74XZHHwyKA','2ItstEyVepUKNpYT4pFFmQ')"
124322,MAJDY SAMAHA,2003,Ekstraoküler kas felçlerinde etyoloji ve prognoz<br><span style='font-style: italic';>Etiology and prognosis of extra ocular muscle palsies,İstanbul Üniversitesi,Tıpta Uzmanlık,Göz Hastalıkları = Eye Diseases," onclick=tezDetay('jYbSol47gLYbAW6uLQacYQ','UzF-JHN8gFlUD2larBkp8A')"
124349,İLYAS AFACAN,2003,1993-2000 yılları arasında İstanbul ilindeki bildirimi zorunlu hastalıkların durumu<br><span style='font-style: italic';>Situation of mandotory reporting disease in Istanbul between 1993-2000 years,İstanbul Üniversitesi,Tıpta Uzmanlık,Halk Sağlığı = Public Health," onclick=tezDetay('6wS3LPSvjDI5UarhEB4G6Q','qWnCJbk3zxN2ORLLxf4lIw')"
70037,ZEKİ DOĞAN,1998,Koroner arter hastalığı lokalizasyonunun belirlenmesinde color kinesis-dobutamin stres ekokardiyografisi yönteminin yeri<br><span style='font-style: italic';>The Value of color kinesis-dobutamine stress echocardiography in evaluation of coronary artery disease localization,İstanbul Üniversitesi,Tıpta Uzmanlık,Kardiyoloji = Cardiology," onclick=tezDetay('4phndTOcRAnzE1_P58CKXA','4phndTOcRAnzE1_P58CKXA')"
70038,HALİT ÖZBEK,1998,Perkütan transluminal koroner anjioplasti ve intrakoroner stent uygulanan diabetes mellituslu hastalarda restenozun araştırılması (Karşılaştırmalı bir çalışma)<br><span style='font-style: italic';>,İstanbul Üniversitesi,Tıpta Uzmanlık,Kardiyoloji = Cardiology," onclick=tezDetay('LpponqITUY5T0ZYyAeY-Pw','LpponqITUY5T0ZYyAeY-Pw')"
70039,İSA COŞKUN,1998,Yeni bir hemodinamik parametre olarak \'PEAK\' aortik dp/dt ve normal sol ventrikül sistolik fonksiyonları olanlarda \'PEAK\' sol ventrikül dp/dt değeri ile ilişkisi<br><span style='font-style: italic';>,İstanbul Üniversitesi,Tıpta Uzmanlık,Kardiyoloji = Cardiology," onclick=tezDetay('Slx-irGoKsEmr3jHR9kKTA','Slx-irGoKsEmr3jHR9kKTA')"
115374,DENİZ GÜLABİ,2002,Radius distal uç kırıklarında unilateral eksternal fiksatör uygulaması ve sonuçlarının araştırılması<br><span style='font-style: italic';>The application of unilateral external fiksators in the fractures of the distal end of the radius and our outcomes,İstanbul Üniversitesi,Tıpta Uzmanlık,Ortopedi ve Travmatoloji = Orthopedics and Traumatology," onclick=tezDetay('-QA2Js7TqMLoMu5fFysqSg','_ZR4v4EFUXNDm-sUr2NMUA')"
115375,MUSTAFA UYSAL,2002,Tavşan medial kollateral ligamanlarında \'thermal shrinkage\' (büzüştürme) yöntemi ile meydana gelen değişikliklerin hareket ve immobilasyon sonrasında zamana bağlı biomekanik olarak karşılaştırılması (deneysel çalışma)<br><span style='font-style: italic';>The dependent mechanical and histological changes of ligaments after thermal shrinkage: Effect of immobilization,İstanbul Üniversitesi,Tıpta Uzmanlık,Ortopedi ve Travmatoloji = Orthopedics and Traumatology," onclick=tezDetay('KE3DNiDTXk5n8bptBMA-hg','Tmbh2YB0brRa7_CDfnTx5Q')"
115450,MUFEED A. I. ASHRAF,2002,Obez çocukların tedavisinde yüksek lifli diyetin rolü<br><span style='font-style: italic';>Role of high fiber diet in the treatment of obesity in children,İstanbul Üniversitesi,Tıpta Uzmanlık,Çocuk Sağlığı ve Hastalıkları = Child Health and Diseases," onclick=tezDetay('atMtGnZ5lACScE-zGaZPsw','bCUbbFh1jNvUY9VSn3kgGA')"
115451,BÜLENT BAŞTÜRK,2002,Henoch-Schönlein purpurasında uzun süreli prognoz ve mikroalbüminüri<br><span style='font-style: italic';>Long term prognosis in Henoch-Schönlein purpura and microalbuminuria,İstanbul Üniversitesi,Tıpta Uzmanlık,Çocuk Sağlığı ve Hastalıkları = Child Health and Diseases," onclick=tezDetay('2qXMzbolkncqlifplX69SA','lSSaBeSEe4pHB6-hq-joxg')"
70444,CELAL AKDENİZ,1998,Çocukluk çağı akut ve kronik artroplastilerinde Parvovirüs B 19\'un yeri<br><span style='font-style: italic';>,İstanbul Üniversitesi,Tıpta Uzmanlık,Çocuk Sağlığı ve Hastalıkları = Child Health and Diseases," onclick=tezDetay('C9rSkgpjVJ_0DAzUisLTLg','C9rSkgpjVJ_0DAzUisLTLg')"
70445,ALPER SOYSAL,1998,BCG aşılı sağlıklı çocuklarda tüberkülin testi takipleri ve sonuçlarının değerlendirilmesi<br><span style='font-style: italic';>,İstanbul Üniversitesi,Tıpta Uzmanlık,Çocuk Sağlığı ve Hastalıkları = Child Health and Diseases," onclick=tezDetay('6g1OSi3cmiukr7h1TeUV6w','6g1OSi3cmiukr7h1TeUV6w')"
115452,SEÇİL SÖZEN,2002,Down sendromlu çocuklarda çölyak hastalığı prevalansı ve antigliadin ve antiendomisyum antikorlarının tanısal üstünlüğünün araştırılması<br><span style='font-style: italic';>The Prevalence of celiac disease in down syndrome patients and the diagnostic value of antigliadin and antiendomysium antibodies,İstanbul Üniversitesi,Tıpta Uzmanlık,Çocuk Sağlığı ve Hastalıkları = Child Health and Diseases," onclick=tezDetay('vArIGeUSeP_95I8tWFZTCg','sA851FGDisRw6Xn-nNRvMQ')"
115501,EMRE BALIK,2002,Sıçanda intraperitoneal taurolidin uygulamasının ameliyat sonrası karın içi yapışıklıklara ve barsak dikiş hattı iyileşmesine etkileri (Deneysel çalışma)<br><span style='font-style: italic';> ,İstanbul Üniversitesi,Tıpta Uzmanlık,Genel Cerrahi = General Surgery," onclick=tezDetay('YfitCSKCiAj4Cm62zdNMnQ','GSgGECwjIyP3jeL7TMG5uQ')"
115502,ÖZDEN AVCI,2002,Adrenal tümörlerde prognostik faktörler<br><span style='font-style: italic';> ,İstanbul Üniversitesi,Tıpta Uzmanlık,Genel Cerrahi = General Surgery ; Onkoloji = Oncology," onclick=tezDetay('_w-jNuBch51myHkG5fWiXw','HRCT5P6kmm9_wTA7CY-dvQ')"
70495,İLHAN DALYANCI,1998,"Laparoskopik cerrahide hiperkapni ve asidoz dakika ventilasyonunu arttırmayı gerektirir mi?<br><span style='font-style: italic';>During laparoscopic surgery, is it required to increase ventilation because of hypercapnia and acidosis?",İstanbul Üniversitesi,Tıpta Uzmanlık,Anestezi ve Reanimasyon = Anesthesiology and Reanimation," onclick=tezDetay('flHbeMGx2obWVb_slRrDIA','flHbeMGx2obWVb_slRrDIA')"
156761,M. ANIL SÜZER,2004,Açık kalp cerrahisinde priming solüsyonunda hipertonik salin kullanımı ve entravasküler akciğer sıvısına etkisinin pulse contour yöntemi ile ölçümü<br><span style='font-style: italic';>,İstanbul Üniversitesi,Tıpta Uzmanlık,Anestezi ve Reanimasyon = Anesthesiology and Reanimation," onclick=tezDetay('iljZv8FLIzAt1jBYsaZ0TA','QxRoF2I1Dbb0Ben3ZMLn9g')"
156762,MÜJGAN POSTA,2004,Larinjeal maske yerleştirilmesinde etomidatın üç farklı dozunun yerleştirilme koşulları ve hemodinamik yanıt üzerine etkileri açısından karşılaştırılması<br><span style='font-style: italic';>Placing conditions of three different etomidate doses in putting a laringeal mask on and the comparison of it\'s effects on the hemodynamic result,İstanbul Üniversitesi,Tıpta Uzmanlık,Anestezi ve Reanimasyon = Anesthesiology and Reanimation," onclick=tezDetay('sKklbmjJKSTK2FiIY9EwGQ','1Yz_kTkw_37kdkqQNSQ0PQ')"
124323,MEHMET BİROL BİLGİÇ,2003,Deneysel neonatal nekrotizan enterokolit modelinde bombesinin barsak mukozası üzerine etkisi<br><span style='font-style: italic';>Effect of bombesin on the gut mucosa in experimental neonatal necrotizing enterocolitis,İstanbul Üniversitesi,Tıpta Uzmanlık,Çocuk Cerrahisi = Pediatric Surgery," onclick=tezDetay('yD2np-GWQEFmDJXFfhbBeQ','Zxyo4e742RwdKLdVNUoxnA')"
124324,GÜRKAN KILIÇ,2003,"Febril nötropenik pediatrik kanser hastalarında sedimantasyon, C-reaktif protein, prokalsitonin ve interlökin-6 düzeylerinin karşılaştırılması<br><span style='font-style: italic';>Erythrocyte sedimentation rate, CRP, procalcitonin, interleukin 6 levels in febrile neutropenic pediatric cancer patients",İstanbul Üniversitesi,Tıpta Uzmanlık,Çocuk Sağlığı ve Hastalıkları = Child Health and Diseases," onclick=tezDetay('pJ3I1A1P0qA_ft0M4-skrw','1Ob_m_5u-fvb6LZVtZl6Ng')"
124350,HANDE AKBAŞ,2003,Erken gebelik kayıplarının önceden belirlenmesinde ultrasonografik ve biyokimyasal belirteçlerin yeri<br><span style='font-style: italic';>Prognostic significance of ultrasonographic and biochemical markers in the prediction of early pregnancy failure,İstanbul Üniversitesi,Tıpta Uzmanlık,Kadın Hastalıkları ve Doğum = Obstetrics and Gynecology," onclick=tezDetay('_NVqFTPdEWdiT-Z3MtcN7Q','KunwIMWL-7c7skwwcJ1TIA')"
115613,BİLAL UYSAL,2002,Diz osteoartritinde balneoterapinin etkinliği<br><span style='font-style: italic';>,İstanbul Üniversitesi,Tıpta Uzmanlık,Tıbbi Ekoloji ve Klimatoloji = Medical Ecology and Climatology," onclick=tezDetay('JjayErl-JxH8oWPv9TsMRQ','9c5HlUjWkVGifE-yuMPiVQ')"
124351,ÖZDEN KARAALİ ARICI,2003,Perkütan nefrolitotripsi cerrahisinde genel anestezi özellikleri ve pron pozisyonunun solunum mekaniklerine etkisi<br><span style='font-style: italic';>A comparison of the histopathological protective effects of the histopathological protective effects of sevoflurane and desflurane in a model of incomplete cerebral ischemia in rast,İstanbul Üniversitesi,Tıpta Uzmanlık,Anestezi ve Reanimasyon = Anesthesiology and Reanimation," onclick=tezDetay('lCEDrXEvEoTlgseA66BjQQ','4_DZYNLihpjTqYo_eX8FvQ')"
124374,İHSAN RAMADAN,2003,Yüksek tibial osteotomide semitübüler plak ve vida (weber) fiksasyon tekniğinin multipl u çivileri ile biyomekanik karşılaştırılması<br><span style='font-style: italic';>The biomechanical comparison of semitubular plate and screw (weber) fixation technique with multiple u nails in high tibial osteotomy,İstanbul Üniversitesi,Tıpta Uzmanlık,Ortopedi ve Travmatoloji = Orthopedics and Traumatology," onclick=tezDetay('Rv0PldURjjj5wrnnJ-5khw','625DjzFwt7puoIJ-NLznEA')"
156664,EBRU DAVRAN,2004,Konvansiyonel ve laparoskopik apandektomi uygulanan hastalarda peritoneal fibrinolitik aktivite:prospektif non-randomize klinik çalışma<br><span style='font-style: italic';>Proteneal fibrinolytic activity in conventional and laparoscopic appendicectomy: a prospective non-randomized clinical trial,İstanbul Üniversitesi,Tıpta Uzmanlık,Genel Cerrahi = General Surgery," onclick=tezDetay('qtpYTH-ZL0zwgDLUupiLXw','QbbQcW47X1VDU_5lNdyhaw')"
69790,VEHBİ KESER,1998,Borderline kişilik bozukluğunda kendini yaralayıcı davranışın klinik değişkenler açısından incelenmesi<br><span style='font-style: italic';>,İstanbul Üniversitesi,Tıpta Uzmanlık,Psikiyatri = Psychiatry," onclick=tezDetay('-_S1wspUmKrNPLueU2CXsQ','-_S1wspUmKrNPLueU2CXsQ')"
69819,BERRİN ÖZKORKMAZ,1998,Pankreas adenokarsinomlarının değerlendirilmesinde spiral BT ve dinamik MR yöntemlerinin karşılaştırılması<br><span style='font-style: italic';>,İstanbul Üniversitesi,Tıpta Uzmanlık,Radyoloji ve Nükleer Tıp = Radiology and Nuclear Medicine," onclick=tezDetay('X_X30_UKPJV1AbHMdjbLig','X_X30_UKPJV1AbHMdjbLig')"
69820,ABDULLAH YAKUPOĞLU,1998,Vertebrobaziler arter diseksiyonları ve endovasküler tedavi yaklaşımları<br><span style='font-style: italic';>Dissection of the vertebrobaziller artery and endovascular treatment approaches,İstanbul Üniversitesi,Tıpta Uzmanlık,Radyoloji ve Nükleer Tıp = Radiology and Nuclear Medicine," onclick=tezDetay('oVosiKpxC9ZNgdJtx9ERLA','oVosiKpxC9ZNgdJtx9ERLA')"
115406,CEM COŞKUN AVCI,2002,Otojen hamstring tendonlarıyla artroskopik ön çapraz bağ rekonstrüksiyonu (transfiks tekniği)<br><span style='font-style: italic';>Anterior cruciate ligament reconstruction using hamstring tendons,İstanbul Üniversitesi,Tıpta Uzmanlık,Ortopedi ve Travmatoloji = Orthopedics and Traumatology," onclick=tezDetay('SndVYLMQyirYv-l9TXPFSg','24RzQafJ87SEllbqmQwz-g')"
115453,OSMAN ABALI,2002,Bipolar bozukluğu olan anne babaların çocuklarında dikkat eksikliği ve hiperaktivite bozukluğu<br><span style='font-style: italic';> ,İstanbul Üniversitesi,Tıpta Uzmanlık,Psikiyatri = Psychiatry ; Çocuk Sağlığı ve Hastalıkları = Child Health and Diseases," onclick=tezDetay('aO58nXrwJ7rXsoQT_K1SLg','Kazo2vaZbOtBsitb-jNhhA')"
69856,SHAHRAM YAGHOUBİ,1998,Varikosellerde fizik muayene ve renkli doppler ultrasonografi ile ven çapı ve reflü korelasyonu<br><span style='font-style: italic';>,İstanbul Üniversitesi,Tıpta Uzmanlık,Radyoloji ve Nükleer Tıp = Radiology and Nuclear Medicine," onclick=tezDetay('BzxX8M2ZW9bslanpNo62ZA','BzxX8M2ZW9bslanpNo62ZA')"
115454,VARTENİ HİLDA ÇERÇİ ÖZKAN,2002,Çocuklarda belirgin eritrosit sedimantasyon hızı yüksekliği ile hastalıklar arası ilişkinin değerlendirilmesi<br><span style='font-style: italic';>Evaluation of the relationship between the diseases and extremity elevated erythrocyte sedimentation rate,İstanbul Üniversitesi,Tıpta Uzmanlık,Çocuk Sağlığı ve Hastalıkları = Child Health and Diseases," onclick=tezDetay('g2hMXqktvekeqtaf5I333Q','RWsRTbPmJK7OdbG15OSpZw')"
115503,HIZIR YAKUP AKYILDIZ,2002,Solid organ yaralanmalarının nonoperatif tedavisi<br><span style='font-style: italic';> ,İstanbul Üniversitesi,Tıpta Uzmanlık,Genel Cerrahi = General Surgery," onclick=tezDetay('jadQhJL5Iez0YkxAsAssqQ','GUfUiSVQmT3RRcJVDw3R5A')"
115504,MUSTAFA AKBAY,2002,Lokal ileri evre meme kanserinde meme koruyucu cerrahinin yeri<br><span style='font-style: italic';>Breast conserving surgery in locally advanced breast cancers,İstanbul Üniversitesi,Tıpta Uzmanlık,Genel Cerrahi = General Surgery ; Onkoloji = Oncology," onclick=tezDetay('n0XO6hyTR0LSQaCZXvCUvQ','2-BHqc6LV4pWF79WAwGqNQ')"
115505,İSMAİL OKAN,2002,İnsan renal arter organ kültüründe in vitro anjiyoplasti sonrası gelişen restenozda BrdU ve p53 ün yeri<br><span style='font-style: italic';> ,İstanbul Üniversitesi,Tıpta Uzmanlık,Genel Cerrahi = General Surgery," onclick=tezDetay('jAB3IwguZy4Vp3A21bMe9Q','5H32KT3ad4tc3W-YFeFIsw')"
124286,ESER TURAN,2003,Kardiyopulmoner resüsitasyon uygulamalarının güncel standartlara ve algoritmalara uygunluğunun değerlendirilmesi<br><span style='font-style: italic';> ,İstanbul Üniversitesi,Tıpta Uzmanlık,Anestezi ve Reanimasyon = Anesthesiology and Reanimation," onclick=tezDetay('aRpH7IrVC0_y5He-9iUikQ','rmfgROh7DsCiNs1_hMbeCA')"
124287,ZÜHAL ÇELEBİ KOÇYILDIZ,2003,"Deneysel hipertansif hayvan modelinde crataegus tanacetifolia ekstresinin kan basıncı, damar duvarı ve lipid profili üzerine etkileri<br><span style='font-style: italic';> ",İstanbul Üniversitesi,Tıpta Uzmanlık,Fizyoloji = Physiology," onclick=tezDetay('10f6zdsU5e37Nu8B9v7yqg','tax4d_bEKHVCpfJFQ5gAqA')"
124352,BANU ATALAR,2003,Akciğer ışınlamalarında ışınlanan akciğer volümünün radyasyon pnömonisi üzerine etkisi<br><span style='font-style: italic';>The effect of irradiated lung volume on radiation pneumonitis,İstanbul Üniversitesi,Tıpta Uzmanlık,Onkoloji = Oncology ; Radyoloji ve Nükleer Tıp = Radiology and Nuclear Medicine," onclick=tezDetay('Vu15s1LNa_gH4qk0OTuY_w','V1l_JVV2Lq6nYwrQ9yWokw')"
70447,PINAR BERİK,1998,"Astım bronşialeli hastalarda kısa süreli yüksek doz sistemik steroid tedavisinin hipotalomo-hipofizo-adrenal eksen üzerine etkisi<br><span style='font-style: italic';>Short-term, high dose, systemic steroids in children with asthma. The Effect on the hypothalonic-pituitary-adrenal axis",İstanbul Üniversitesi,Tıpta Uzmanlık,Çocuk Sağlığı ve Hastalıkları = Child Health and Diseases," onclick=tezDetay('ysoxo09RWLRTv8QJbyfgrQ','ysoxo09RWLRTv8QJbyfgrQ')"
70448,NACİ ÖNER,1998,Aort koarktasyonu operasyonu geçiren çocuklarda egzersizin tansiyon arteriyel ve ekokardiyografi parametrelerine etkisi<br><span style='font-style: italic';>,İstanbul Üniversitesi,Tıpta Uzmanlık,Çocuk Sağlığı ve Hastalıkları = Child Health and Diseases," onclick=tezDetay('Hw8-6BGoRTpOcEXGqq_6_A','Hw8-6BGoRTpOcEXGqq_6_A')"
70496,KADER KESKİNBORA,1998,Anestezi idame ve derlenmesinde sevofluran ve propofolün etkilerinin karşılaştırılması<br><span style='font-style: italic';>The Comparative effect of sevoflura and propofol in maintenance and recovery of anesthesia,İstanbul Üniversitesi,Tıpta Uzmanlık,Anestezi ve Reanimasyon = Anesthesiology and Reanimation," onclick=tezDetay('j6ALmeq6KVIvnhr93_Ce-w','j6ALmeq6KVIvnhr93_Ce-w')"
124353,FATİH AYDOĞAN,2003,Meme kanserli hastalarda ameliyat sırasında aksiller disseksiyon kararı verilmesinde sentinel lenf nodüllerinin patolojik tanısının rolü<br><span style='font-style: italic';>The value of intraoperative pathological examination of sentinel lymph node to decide axillary dissection in patients with breast cancer,İstanbul Üniversitesi,Tıpta Uzmanlık,Genel Cerrahi = General Surgery," onclick=tezDetay('CO357TBeo1qu9JgzswFyEQ','cTkpXl7e992Z5k8k8aW0dA')"
124375,ÖZNUR ŞEN,2003,"Pressure support ventilation, CPAP ve T- parçasının weaning sürecinde hemodinamiye, solunum mekaniğine, arter kan gazlarına, weaning süresine ve başarısına etkilerinin araştırılması<br><span style='font-style: italic';>The effect of pressure support ventilation, CPAP and T-piece to hemodynami, respiratory mechanics, arterial blood gases weaning time and efficacy at the weaning period",İstanbul Üniversitesi,Tıpta Uzmanlık,Anestezi ve Reanimasyon = Anesthesiology and Reanimation," onclick=tezDetay('hIfK721V6bylwxgOImjsuQ','1QUpc0rny3uh87QqIrJzvQ')"
86564,ŞENİZ ÖK (DÖNERDENİZ),1999,Omurilik felçlilerinde yaşam kalitesinin değerlendirilmesi<br><span style='font-style: italic';>Quality of life of spinal cord injured patients in Turkey: A subgroup study,İstanbul Üniversitesi,Tıpta Uzmanlık,Fiziksel Tıp ve Rehabilitasyon = Physical Medicine and Rehabilitation," onclick=tezDetay('2E_jTfgwfrqCfYxd-kOlDQ','2E_jTfgwfrqCfYxd-kOlDQ')"
156806,RUKİYE BALSAK,2004,İnguinal operasyon geçiren pediatrik vakalarda kaudal yoldan uygulanan ropivakain ile intravenöz düşük doz ketaminin preemptif analjezik etkinliklerinin karşılaştırılması<br><span style='font-style: italic';> ,İstanbul Üniversitesi,Tıpta Uzmanlık,Anestezi ve Reanimasyon = Anesthesiology and Reanimation," onclick=tezDetay('h9Cyvvg8lpZ22PPSpFsIsA','J2QnYHORxaafosUL0Ym0Cg')"
70041,HÜSEYİN OFLAZ,1998,Anjioplasti ve stent uygulanan koroner kalp hastalarında chlamydia pneumoniae antikorları ve restenoz arasındaki ilişki<br><span style='font-style: italic';>,İstanbul Üniversitesi,Tıpta Uzmanlık,Kardiyoloji = Cardiology," onclick=tezDetay('QbomFuQlxktTTu0PHshCBA','QbomFuQlxktTTu0PHshCBA')"
86598,TAHİR ÜNAL,1999,"Kronik sinüzitli hastaların, nazal mukoza ve serumlarında bakır-çinko tayini<br><span style='font-style: italic';>Measurements of copper-zinc levels in the serum and nasal mucosal tissue of patients with chronic sinüsitis",İstanbul Üniversitesi,Tıpta Uzmanlık,Kulak Burun ve Boğaz = Otorhinolaryngology (Ear-Nose-Throat)," onclick=tezDetay('i62ZoPp360goqbaV6mS_bg','i62ZoPp360goqbaV6mS_bg')"
124288,GAYE TELCİ,2003,Kronik romatizmal kalp kapak hastalığı olan olgularda doku grubu incelemesi<br><span style='font-style: italic';>Major histocompatibility antigen anaysis (MHC) in patients with chronic rheumatic valvular heart disesase,İstanbul Üniversitesi,Tıpta Uzmanlık,Kardiyoloji = Cardiology," onclick=tezDetay('3d2GH2l-JnStZkugIXCC2w','hscsI-d_WhcvzWls4fIfnw')"
124289,ORHAN KOCAMAN,2003,Otozomal dominant polikistik böbrek hastalarında endotel disfonksiyonu ve artmış intima-media kalınlığı<br><span style='font-style: italic';>Endometrial dysfunction and increased carotid intima-media thickness in patients with autosomal dominant polycystic kidney disease,İstanbul Üniversitesi,Tıpta Uzmanlık,Nefroloji = Nephrology," onclick=tezDetay('gDIK1x4oi1RhiyNZKwiMyw','EYC4EQ19inqVQucfJQ3vxw')"
124354,EBRU ÇELİK,2003,Preeklampsi/intrauterin gelişme geriliğinde erken uterin arter doppler bulguları ve maternal serumda nitrit/nitrat düzeyleri<br><span style='font-style: italic';>Uterine artery doppler findings in preeclampsia/IUGR at early gestation and maternal serum nitrite/nitrate levels,İstanbul Üniversitesi,Tıpta Uzmanlık,Kadın Hastalıkları ve Doğum = Obstetrics and Gynecology," onclick=tezDetay('Pxj26DICBgNEPNMZxfRrVQ','ev_PFUUG0FtBMoZqoIhQsw')"
124376,ADNAN ŞAAR,2003,Endometriyal patolojilerin belirlenmesinde histeroskopinin yeri: Tanısal önemi ve diğer tanısal testlerle karşılaştırılması<br><span style='font-style: italic';>The role of hysteroscopy in diagnosis of endometrial pathology: Diagnostic value and comparison with the other diagnostic modalities,İstanbul Üniversitesi,Tıpta Uzmanlık,Kadın Hastalıkları ve Doğum = Obstetrics and Gynecology," onclick=tezDetay('P1XOScO5IW8eKj7yikP7JQ','hnyvpYch3d0eXrcn328uSg')"
79726,İSMAİL TÜRKER KÖKSAL,1999,Prostat kanserinde E-cadherin molekülünün prognostik değeri<br><span style='font-style: italic';>The Prognostic value of E-cadherin in the prostate cancer,İstanbul Üniversitesi,Tıpta Uzmanlık,Onkoloji = Oncology ; Üroloji = Urology," onclick=tezDetay('WMHFvsIGNFF-VYfjuXroIg','WMHFvsIGNFF-VYfjuXroIg')"
115510,KORAY KARABULUT,2002,Radyoterapi ve monoklonal TNF alfa antikorunun sol kolon anastomozu iyileşmesi üzerine etkileri<br><span style='font-style: italic';> ,İstanbul Üniversitesi,Tıpta Uzmanlık,Genel Cerrahi = General Surgery," onclick=tezDetay('bk-kc__CfzF3JLhxjxZ6Qw','fZmzyNQtfHFZvZRXRixBqQ')"
115511,AHMET KAŞOĞLU,2002,Morbid obezite cerrahisinde polypropylene greft ile yapılan gastroplastinin ince barsak mukozası üzerine etkisi<br><span style='font-style: italic';> ,İstanbul Üniversitesi,Tıpta Uzmanlık,Genel Cerrahi = General Surgery," onclick=tezDetay('R6xqjVYVgMUj_HiiLMZeYw','Qwtaew5EK6gjLsPw9ri-pw')"
70353,FİGEN KOCAMAN İNCİ,1998,"Normal gebelikte lipit peroksidasyon ürünleri, selenyuma bağlı glutatyon peroksidaz, süperoksit dismutaz, glutatyon, E ve C vitamini düzeylerinin incelenmesi<br><span style='font-style: italic';>Evalution of lipid peroxidation and antioxidant status components: CuZn superoxide dismutase, glutathione peroxidase, glutathione, vitamin E and C in pregnancy",İstanbul Üniversitesi,Tıpta Uzmanlık,Biyokimya = Biochemistry ; Kadın Hastalıkları ve Doğum = Obstetrics and Gynecology," onclick=tezDetay('NMIhJZC9d4DrqgdPJlkYTw','NMIhJZC9d4DrqgdPJlkYTw')"
124290,ÜMİT TÜZÜN,2003,Endobronşial tümörlerde sanal bronkoskopinin tanısal etkinliği<br><span style='font-style: italic';> ,İstanbul Üniversitesi,Tıpta Uzmanlık,Radyoloji ve Nükleer Tıp = Radiology and Nuclear Medicine," onclick=tezDetay('y5l9ka90zzpMlQJYWGirBQ','OkGYfHitffnb7yLTbS94dA')"
124291,İBRAHİM HALİL URAL,2003,Dejenere tavşan intervertebral disklerine fibroblast transplantasyonu ve sonuçları<br><span style='font-style: italic';> ,İstanbul Üniversitesi,Tıpta Uzmanlık,Fiziksel Tıp ve Rehabilitasyon = Physical Medicine and Rehabilitation," onclick=tezDetay('4g0pzwwbtgvYkG1dpz4oBQ','1ij7Ekbx5QZiQqQ9bf9Jkw')"
124355,GÜLSÜM SERCAN DAŞ,2003,Tanısal koroner anjiyografi öncesi ve sonrası serum CRP düzeylerinin karşılaştırılması<br><span style='font-style: italic';>Comparison of serum CRP levels before and after diagnostic coronary angiography,İstanbul Üniversitesi,Tıpta Uzmanlık,Kardiyoloji = Cardiology," onclick=tezDetay('vSKGXoN7MWVsHxGILt72Gg','VQcuVlV361htwztj2qu-gQ')"
115455,AYŞEGÜL ÜNÜVAR,2002,Akut immün trombositopenik purpura tanısı alan çocukların izlem sonuçları<br><span style='font-style: italic';> ,İstanbul Üniversitesi,Tıpta Uzmanlık,Çocuk Sağlığı ve Hastalıkları = Child Health and Diseases," onclick=tezDetay('C3H0SufFKNshHzkdVB2dVw','tQWQQgKn1xLP3TzslFsk_w')"
115506,HAKAN POLAT,2002,Hipertiroidi tedavisinde cerrahi ve radyoaktif iyot tedavisinin karşılaştırılması<br><span style='font-style: italic';> ,İstanbul Üniversitesi,Tıpta Uzmanlık,Genel Cerrahi = General Surgery," onclick=tezDetay('Dl8FC_1OKSAmVx4lyZKk9w','pJwQkQuNThDdL5vXREQUDA')"
115507,SERKAN SARI,2002,Morbid obezite cerrahisinde değişik sentetik materyaller ile yapılan gastroplastinin mide ve özofagus mukozası üzerine etkisi<br><span style='font-style: italic';> ,İstanbul Üniversitesi,Tıpta Uzmanlık,Genel Cerrahi = General Surgery," onclick=tezDetay('NmoLYKFKwSSwaarnonSGRA','GpcU9QpmmgPNVUvHBtZRCg')"
115508,BURHAN TAM,2002,Deneysel kolitte E vitamini ve selenyum etkisi<br><span style='font-style: italic';> ,İstanbul Üniversitesi,Tıpta Uzmanlık,Genel Cerrahi = General Surgery," onclick=tezDetay('y5hvAY3ey5mepnHIKZV7PA','6uc0z-lH2An20U7Y11NeXQ')"
