tez_no,yazar,yıl,title,üniversite,tez_türü,konu,tez_detay
763663,DİLEK ABUL,2011,Diyabetik maküla ödeminde intravitreal bevacizumab enjeksiyonusonuçlarımız<br><span style='font-style: italic';>The results of intravitreal bevacizumab injection for diabetic macular edema,Sağlık Bakanlığı,Tıpta Uzmanlık,Göz Hastalıkları = Eye Diseases," onclick=tezDetay('4Dp5IhnkLY2MyMIaZNmYHQ','GJE0EMTtVTi7q7gUEVwx3A')"
761669,ESRA AKDAŞ TEKİN,2008,"Günübirlik artroskopik diz cerrahisinde intraartiküler uygulanan bupivakain, fentanil, prednizolon karışımının tek doz ve infüzyon olmak üzere postoperatif analjezi açısından karşılaştırılması<br><span style='font-style: italic';>",Sağlık Bakanlığı,Tıpta Uzmanlık,Anestezi ve Reanimasyon = Anesthesiology and Reanimation," onclick=tezDetay('4if_Il2AuXkPnP10S31Yiw','srlvc76JBH8MAR3JZii24w')"
754596,SERHAN ÜNLÜ,2007,"Diz ekleminin morfometrik değerlendirilmesi ve klinik önemi\' Anatomik, radyolojik ve klinik çalışma\'<br><span style='font-style: italic';>Morphometric evaluation and clinical importance of the knee joint \' Anatomic, radiological and clinical study\'",Sağlık Bakanlığı,Tıpta Uzmanlık,Ortopedi ve Travmatoloji = Orthopedics and Traumatology," onclick=tezDetay('Hgxojwz5n745gHzAochZvw','y9ZYXFgS8yrAsoa-vUYwXA')"
759238,BETÜL BANU KARASU,2011,ST yükselmeli miyokard infarktüsü ile başvurup primer perkütan koroner girişim uygulanan hastalarda hastane içi mortalite belirteçleri<br><span style='font-style: italic';>In hospital mortality predictors of patients who undergo primary  percutaneous coronary interventi̇on (PCI) for st segment elevation myocardial  infarction (stemi),Sağlık Bakanlığı,Tıpta Uzmanlık,Kardiyoloji = Cardiology," onclick=tezDetay('jlO2u1tPh6S8N4W4z-uLVQ','WB8UEYR7JlPopNKSQgwxdA')"
754492,SİNAN TAŞÇI,2011,Diz eklemindeki kıkırdak lezyonlarına artroskopik olarak yapılan mikrokırık tedavisinin klinik sonuçları<br><span style='font-style: italic';>Clinical results of arthroscopic microfracture treatment to cartilage lesion in the knee joint,Sağlık Bakanlığı,Tıpta Uzmanlık,Ortopedi ve Travmatoloji = Orthopedics and Traumatology," onclick=tezDetay('ans12F4bQenJrSfSPxHZHQ','yu43yaFGf-2UU6eN6pWXkQ')"
771952,İLKER İNCE,2009,N-asetilsistein ile zenginleştirilmiş kardiyoplejinin mortalite ve morbiditeye etkisi<br><span style='font-style: italic';>The effect of n-acetylcysteine enriched cardioplegia on mortality and morbidity,Sağlık Bakanlığı,Tıpta Uzmanlık,Göğüs Kalp ve Damar Cerrahisi = Thoracic and Cardiovascular Surgery," onclick=tezDetay('7aeNhQxgoyXgwoXVGNc-2A','bx6TJMHi86hMuDJJII71wg')"
769800,GÜLCİHAN ÖZEK,2008,İnterrupter tekniğin hışıltılı infantın hava yolu direncini saptamada kullanılabilirliği ve astım tanısındaki yeri<br><span style='font-style: italic';>Availability of the interrupter technique in detecting the airway resistance of wheezy infant and its place in the diagnosis of asthma,Sağlık Bakanlığı,Tıpta Uzmanlık,Çocuk Sağlığı ve Hastalıkları = Child Health and Diseases," onclick=tezDetay('E2-GNw7lrgvRRfBgaZDQGQ','sLip6UOGoTzK1qZTllUIxA')"
776922,ULAŞ CIKLA,2010,Hipofiz adenomlarında transsfenoidal mikrocerrahi ve endoskopik cerrahinin klinik sonuçları<br><span style='font-style: italic';>Clinical results of transsphenoidal microsurgery and endoscopic surgery for pituitary macroadenomas,Sağlık Bakanlığı,Tıpta Uzmanlık,Nöroşirürji = Neurosurgery," onclick=tezDetay('3cMXcyPvAnrfz0AHQMHyMg','7-oIuWEZpxsUJL-W0ifP5A')"
772765,ÜMİT SEKMEN,2006,Prolen mesh ile fıtık onarımı yapılan sıçanlarda mesh  tespit biçiminin ve yerleştirildiği alanın mesh kontraksiyonu üzerine etkileri<br><span style='font-style: italic';>Effects of mesh fixation method and placement area on mesh contraction in hernia repaired with prolene mesh in rats,Sağlık Bakanlığı,Tıpta Uzmanlık,Genel Cerrahi = General Surgery," onclick=tezDetay('aNEBhF-dw2qU-_BlGWNovg','0LIjnlxJAVbZh56vGaXk0A')"
756311,BURÇ ESRA ŞAHİN,2011,Başağrısı hastalarında büyük oksipital sinir blokajyanıtları<br><span style='font-style: italic';>Greater occipital nerve blockage in headache patientsresponses,Sağlık Bakanlığı,Tıpta Uzmanlık,Nöroloji = Neurology," onclick=tezDetay('TbnuINSOtHcsBYUbKSeAHg','74G4TeBFRAVVqh7cuB8SnA')"
755033,RABİYE ALTINBAŞ,2009,HCV RNA pozitif kronik hepatit C hastalarında otoantikor prevalansı<br><span style='font-style: italic';>The prevalance of autoantibody in patients with HCV RNA positive chronic hepatitis C,Sağlık Bakanlığı,Tıpta Uzmanlık,Mikrobiyoloji = Microbiology," onclick=tezDetay('rloHsu9XO2qGnf9ANi13dA','kFz3LZTc0Gp3A2m5bZkIBQ')"
773616,MUSTAFA ŞİMŞEK,2009,"Torakotomi sonrasi torakal epidural anestezi ile fentanil, fentanil + ropivakain, fentanil + bupivakain, fentanil + levobupivakainin postoperatif ağriya etkileri<br><span style='font-style: italic';>The effects of fentanyl, fentanyl + ropivacaine, fentanyl + bupivacaine, fentanyl + levobupivacaine on postoperative pain with thoracic epidural anesthesia after thoracotomy",Sağlık Bakanlığı,Tıpta Uzmanlık,Anestezi ve Reanimasyon = Anesthesiology and Reanimation," onclick=tezDetay('XAlzpBi630AFaNWWbqOKVQ','nSm11BHDHjrYwKK9E1Oiag')"
767532,PELİN PINAR DENİZ,2009,"İnterstisyel akciğer hastalığında egzersiz kapasitesi, egzersize fizyolojik yanıtların değerlendirilmesinde 6 dakika yürüme testi ve artan hızda mekik yürüme testinin karşılaştırılması, egzersize dayanıklılıkta endurans mekik yürüme testi<br><span style='font-style: italic';>Comparison of six-minute walk test and incremental shuttle walk test in the evaluation of exercise capacity, physiological response to exercise in interstitial lung disease, and endurance shuttle walking test in exercise endurance ",Sağlık Bakanlığı,Tıpta Uzmanlık,Göğüs Hastalıkları = Chest Diseases," onclick=tezDetay('OxFiEdIW6VUhhuP1XfBxXQ','KoLRbRlFLmrrG21p-eA06A')"
772970,SEBİLE ÇOMÇALI,2008,Neovasküler glokomlu olgularda intravitreal bevacizumab etkinliği ve güvenilirliği<br><span style='font-style: italic';>The effectiveness and reliability of i̇ntravitreal bevacizumab in patients with neovascular glaucoma,Sağlık Bakanlığı,Tıpta Uzmanlık,Göz Hastalıkları = Eye Diseases," onclick=tezDetay('0FdUlfrla00Aa0JEIW5EUw','ThbBc2BG_E-abxguttLzYQ')"
841281,SEZGİN TOPUZ,2009,Asplenik hastaların tekli veya ikili aşı uygulaması sonrası immün profilleri(prospektif bir çalışma)<br><span style='font-style: italic';>Immune profiles of asplenic patients after single or binary vaccination(a prospective study),Sağlık Bakanlığı,Tıpta Uzmanlık,Genel Cerrahi = General Surgery," onclick=tezDetay('NgkGENaWHY4YOU1plxHl8w','JEFICMKyEqgIsCbedeocZg')"
769301,DAVUT AZBOY,2009,Koroner bypass cerrahisi öncesi yüksek serum nt-probnp seviyesinin postoperatiferatif atrial fibrilasyon gelişimesiyle olan ilişkisi<br><span style='font-style: italic';>Before coronary bypass surgerythe relationship of high serum nt-probnp level with the development of postoperatiferative atrial fibrilation,Sağlık Bakanlığı,Tıpta Uzmanlık,Göğüs Kalp ve Damar Cerrahisi = Thoracic and Cardiovascular Surgery," onclick=tezDetay('4Lawtr84pr2Olt2NfL4rrg','m5dSk86PwXt9CrsJWOZiYA')"
773284,ADEM DURMAZ,2008,Primer enürezis nokturnanın atopi ile ilişkisi<br><span style='font-style: italic';>The relationship of primary enuresis nocturna to atopy,Sağlık Bakanlığı,Tıpta Uzmanlık,Aile Hekimliği = Family Medicine ; Çocuk Sağlığı ve Hastalıkları = Child Health and Diseases," onclick=tezDetay('ISd7QY2rHVbdsJ2nhqaU6A','kV0nw-hAUMxsA3E1ibR8TQ')"
773454,AYLİN YÜCEL,2010,"Jüvenil idiopatik artrit tanılı hastalarda osteoporoz ve ilişkili faktörlerin, hastaların yaşam kalitesinin ve ailelerinin tükenmişlik durumunun değerlendirilmesi<br><span style='font-style: italic';>Evaluation of osteoporosis and associated factors, quality of life of patients and burnout of their families in patients diagnosed with juvenile idiopathic arthritis",Sağlık Bakanlığı,Tıpta Uzmanlık,Psikiyatri = Psychiatry ; Romatoloji = Rheumatology ; Çocuk Sağlığı ve Hastalıkları = Child Health and Diseases," onclick=tezDetay('dApi2ny7SmEMUNMAVWcr2Q','F6PsrVTtK0MiTwN3_R75dA')"
775808,ENDER ALAGÖZ,2007,Sıfır-oniki ay arası çocuklarda gelişimsel kalça displazisi konservatif tedavi sonuçları<br><span style='font-style: italic';>Conservative treatment results of developmental dysplasia of hip between the ages newborn and twelve months,Sağlık Bakanlığı,Tıpta Uzmanlık,Ortopedi ve Travmatoloji = Orthopedics and Traumatology," onclick=tezDetay('0PjU_nDy5SiS_yzxaeqqTA','UTxeSWZy43bRjy0R4o1l8Q')"
772898,PINAR DİYDEM YILMAZ,2011,Tip ıı diyabet olgularında karotis arter aterosklerozu ile mikrovasküler komplikasyonların ilişkisi ve ekstrakranial internal karotis arterden elde edilen doppler akım parametrelerinin mikroanjiopatinin gösterilmesindeki rolü<br><span style='font-style: italic';>The relationship of carotis artery athosclerosis and microvascular complications in type ii diabetes and the role of doppler flow parameters from the extracranial internal carotis artery in determining microangiopathy,Sağlık Bakanlığı,Tıpta Uzmanlık,Radyoloji ve Nükleer Tıp = Radiology and Nuclear Medicine," onclick=tezDetay('iOFX6RPCTeaN8QCc8MUcaQ','2R4PdPvkJBLfAlgLncxiIg')"
772790,DERYA ÖZTÜRK,2011,Skalp kesisi olan hastaların tedavi teknikleri açısından değerlendirilmesi<br><span style='font-style: italic';>Evaluation of patients with scalp laceration in terms of treatment techniques,Sağlık Bakanlığı,Tıpta Uzmanlık,Acil Tıp = Emergency Medicine," onclick=tezDetay('sSQzj0WrzBFC9MAEeD9tNA','tBgarW0GiwDw0XngRxCr-g')"
785699,MEHMET TAHA KÖKBIYIK,2010,Haydarpaşa Numune Eğitim ve Araştırma Hastanesi çocuk kliniğineH1N1 pandemik influenza öntanısıyla yatırılan hastaların klinik ve laboratuar bulgularının değerlendirilmesi<br><span style='font-style: italic';>Evaluation of clinical and laboratory findings of the patients prediagnosed as H1N1 pandemic influenza in Haydarpasa Numune Education and Research Hospital pediatry clinic,Sağlık Bakanlığı,Tıpta Uzmanlık,Çocuk Sağlığı ve Hastalıkları = Child Health and Diseases," onclick=tezDetay('1gW461XaRpYE9g4p926MFQ','O8TVZlD-C5W3bt_7AkI9Xg')"
772103,CEYDA BAŞKAN,2011,"Oküler hipertansiyonlu olgularda ve risk gruplarında standart akromatik perimetri, kısa dalga boylu perimetri ve optik koherens tomografi parametrelerinin ilişkisi<br><span style='font-style: italic';>The relationship of standard achromatic perimetry, short wavelength perimetry and optical coherence tomography parameters in ocular hypertension cases and risk groups",Sağlık Bakanlığı,Tıpta Uzmanlık,Göz Hastalıkları = Eye Diseases," onclick=tezDetay('egVSdVbHZMoJxCe0SdMwbw','Y6YygrmJoJ756kjhGGISNg')"
772123,HACI ÖMER DURMAZ,2005,Tonsillektomi ve/veya adenoidektomi yapılan çocuklardapreoperatif ve geç postoperatif immunglobulin seviyelerinin karşılaştırılması<br><span style='font-style: italic';>Comparison of preoperative and late postoperative immunglobulin levels in children with tonsillectomy and/or adenoidectomy,Sağlık Bakanlığı,Tıpta Uzmanlık,Kulak Burun ve Boğaz = Otorhinolaryngology (Ear-Nose-Throat)," onclick=tezDetay('h8-scS-NkvRbIMAvYI0HWw','JkfKwyCDIUKECtJx4dw1Qw')"
770230,ASLI VURAL,2011,Epikardial yağ dokusu hacmi ile sol ventrikül diastolik fonksiyonları arasındaki ilişki<br><span style='font-style: italic';>The relationship between epicardial fat tissue volume and left ventricle diastolic functions,Sağlık Bakanlığı,Tıpta Uzmanlık,Kardiyoloji = Cardiology," onclick=tezDetay('9j4EyDiWIJA03lVsLM4mXw','qfgqEAq4sOwRJxgEbQPRNg')"
845547,BİLGE OLGUN KELEŞ,2009,"Laparoskopik kolesistektomilerde magnezyum sülfat kullanımının desfluran tüketimi, derlenme ve postoperatif analjezi üzerine etkileri<br><span style='font-style: italic';>The effects of magnesium sulphate on desflurane requirement, early recovery and postoperative analgesia in laparascopic cholecystectomy",Sağlık Bakanlığı,Tıpta Uzmanlık,Anestezi ve Reanimasyon = Anesthesiology and Reanimation," onclick=tezDetay('esntT1lD9m1Dx0Qkbn96wQ','Bl9PIkxQuEnHI3WmjFyo6w')"
772317,AHMET KAN,2011,Demir eksikliği anemisinde iki ve üç değerlikli demir tedavilerine D vitamininin etkisi<br><span style='font-style: italic';>The effects of vitamin D support wi̇th ferrous sulphate and ferric polymaltose treatment in iron deficiency anemia,Sağlık Bakanlığı,Tıpta Uzmanlık,Çocuk Sağlığı ve Hastalıkları = Child Health and Diseases," onclick=tezDetay('5ty5uFLxH8PL8FVR_E-Wkg','ssU57F36YDcHDtmhxw9L3A')"
769932,NECATTİN FIRAT,2007,Laparoskopik kolesistektomi ameliyatında uygulanan standart ve düşük karın içi basıncın ameliyat sonrası agrı üzerine etkisinin karşılaştırılması<br><span style='font-style: italic';>,Sağlık Bakanlığı,Tıpta Uzmanlık,Genel Cerrahi = General Surgery," onclick=tezDetay('KNlOTJM4oiFjKcV-_ZD_-A','Sk05A2VbaNRVS8sOFXlFhw')"
754087,AYDIN KURT,2005,Daha önce hiç antipsikotik ilaç kullanmamış şizofreni hastalarında anormal istemsiz hareketler ve silik nörolojik belirtiler: Karşılaştırılmalı bir çalışma<br><span style='font-style: italic';>Abnormal involuntary movements and soft neurological signs in antipsychotic naive schi̇zophreni̇a patients: A Comparative study,Sağlık Bakanlığı,Tıpta Uzmanlık,Psikiyatri = Psychiatry," onclick=tezDetay('5x9facSvlhRMYN1Ad_TZSA','YiYNteobi4kV7n4rfVpWdQ')"
761425,EMEL UR ÖZÇELİK,2009,Orta serebral arter dal infarktlarında iskemik modifiye albumin düzeyi ve prognozla ilişkisi<br><span style='font-style: italic';>Ischemic modified albumin level and its relationship with prognosis in middle cerebral artery branch infarcts,Sağlık Bakanlığı,Tıpta Uzmanlık,Nöroloji = Neurology," onclick=tezDetay('LCkRCIIl2S2kl20dn89r6Q','L-FrUqCEQbnCU6lAcllk3A')"
772794,DENİZ YILMAZ,2008,Hafif-orta hipertansiyonlu obez tip 2 diyabetiklerde tedaviye eklenen telmisartanın insülin direnci ve kan şekeri üzerine etkisi<br><span style='font-style: italic';>Effect of telmisartan added to treatment on insulin resistance and blood sugar in obese type 2 diabetics with mild-moderate hypertension,Sağlık Bakanlığı,Tıpta Uzmanlık,İç Hastalıkları = Internal diseases," onclick=tezDetay('utepshIekE1npoQDJ7ShFA','ClCkFDUIwPkT1aznfXZAGQ')"
774100,ESRA TURAN ERKEK,2010,Evre 1 ve evre 2 kronik böbrek yetersizliğinin dipper ve non dipper kan basıncı paterni gelişimine etkisi<br><span style='font-style: italic';>Comparison of dipper and non-dipper hypertension patterns according to chronic kidney disease stage.  ( Istanbul 2010),Sağlık Bakanlığı,Tıpta Uzmanlık,İç Hastalıkları = Internal diseases," onclick=tezDetay('ilSowsh6v3jDd16j7PZ27A','2NmnOXiso89eQF7sp85V9w')"
773156,CEYLAN USLU DOĞAN,2009,Diffüz diyabetik maküla ödeminde intravitreal bevacizumab enjeksiyonu : Erken dönem sonuçlar<br><span style='font-style: italic';>,Sağlık Bakanlığı,Tıpta Uzmanlık,Göz Hastalıkları = Eye Diseases," onclick=tezDetay('R_gvgLSw8AMb7l1wPnVwpw','S28jZLFYP_8-LH6XukPcpQ')"
811766,ASİYE DEMİREL,2010,"Lumbar epidural aralığın tanımlanmasında; klasik direnç kaybı tekniği,otomatik direnç kaybı enjektörü tekniği veasılı damla tekniğinin karşılaştırılması<br><span style='font-style: italic';>The comparison of loss of resistance technique, automatic loss of resistance syringe and hanging drop technique for identifying epidural space",Sağlık Bakanlığı,Tıpta Uzmanlık,Anestezi ve Reanimasyon = Anesthesiology and Reanimation," onclick=tezDetay('WPUGNQl8O8QCBhbE3lU6qw','LWrHIZAJ-3k8xXQCefzTPw')"
773513,FATMA DEMİR YENİGÜRBÜZ,2011,Demir eksikliği anemisinin tiroid hormonları üzerine etkilerinin araştırılması<br><span style='font-style: italic';>,Sağlık Bakanlığı,Tıpta Uzmanlık,Hematoloji = Hematology," onclick=tezDetay('JMC47zx8ATPOXXxuHKrtzw','osc1kB97PRgW-DNHEpp6yg')"
773720,EVREN MÜGE TAŞDEMİR METE,2007,Karotis arter endarterektomi sonrası restenozgelişimi ve risk faktörlerinin analizi<br><span style='font-style: italic';>,Sağlık Bakanlığı,Tıpta Uzmanlık,Göğüs Kalp ve Damar Cerrahisi = Thoracic and Cardiovascular Surgery," onclick=tezDetay('_BTwEsFdeFmXnk4A4XHvuA','aUrVaglCQX05HA7CpthSuA')"
773809,AŞKIN KADİR PERÇEM,2009,İskemik kolon anastomozunda plasmidlere klonlanmışvasküler endotelyal growth faktör ve fibroblastik growthfaktör\' ün anastomoz yara iyileşmesi üzerine etkisi<br><span style='font-style: italic';>,Sağlık Bakanlığı,Tıpta Uzmanlık,Genel Cerrahi = General Surgery," onclick=tezDetay('xDYaPqX8s0hctNXi-79Avw','CvFzAzZBpXqXa8x9rZjoHQ')"
754777,MAHMUT DEMİR,2010,Hastanemiz yenidoğan yoğun bakım ünitesinde 01.01.2009- 31.12.2009 tarihleri arasında takip edilen hastaların maliyet analizi<br><span style='font-style: italic';>Cost analysis of the patients followed in the newborn intensive care unit of our hospital between 01.01.2009 - 31.12.2009,Sağlık Bakanlığı,Tıpta Uzmanlık,Çocuk Sağlığı ve Hastalıkları = Child Health and Diseases," onclick=tezDetay('lwtzpoS6tkUu94jNNFNLgg','0HmZGtyny_Jopzw67Gm11w')"
885455,AYŞE VAHAPOĞLU,2009,Comparison of bolus and infusion of esmolol on hemodynamic and parathormoneresponses to tracheal intubation<br><span style='font-style: italic';>Tek bolus doz veya infüzyon şeklinde esmolol kullanımının laringoskopi ve entübasyonakarşı gelişen hemodinamik cevapların önlenmesindeki etkinliğinin karşılaşırılması,Sağlık Bakanlığı,Tıpta Uzmanlık,Anestezi ve Reanimasyon = Anesthesiology and Reanimation," onclick=tezDetay('sgfIJ145RUKu-iWVRyLe8g','Vz10qfe93Jq6t5eot3rG9A')"
890739,ASLAN AYKUT,2011,Kliniğimizde takip edilen ön üveitlihastalarımızın etyolojik ve klinik olarakdeğerlendirilmesi<br><span style='font-style: italic';>Etiological and clinical evaluation of anterior uveitis patients followed in our clinic,Sağlık Bakanlığı,Tıpta Uzmanlık,Göz Hastalıkları = Eye Diseases," onclick=tezDetay('M04ciUAK-dcaS9G3QOJjtQ','ujRy3QgWXrw3JQeoOSH4Ng')"
887160,MEHMET YETİŞ,2009,Torakolomber burst kırıklarındaposterior enstrumantasyon vefüzyon şonuçlarımız<br><span style='font-style: italic';>Thoracolumbar burst fracturesposterior instrumentation andfusion results,Sağlık Bakanlığı,Tıpta Uzmanlık,Ortopedi ve Travmatoloji = Orthopedics and Traumatology," onclick=tezDetay('WlkiObt2N0raDm-8BkaeBw','c5rBqnD57Y-5XbwU4w6wmg')"
892104,KAMİL DOĞAN,2011,Kolorektal kanser hepatik metastazı saptanmasında doppler perfüzyon indeksi<br><span style='font-style: italic';>Doppler perfusion index in the detection of colorectal cancer hepatic metastasis,Sağlık Bakanlığı,Tıpta Uzmanlık,Radyoloji ve Nükleer Tıp = Radiology and Nuclear Medicine," onclick=tezDetay('J4ke3bD0yMKHpnjPUFYxww','DITryskoAbEpRw74HFD8RQ')"
892751,OSMAN ARIKAN,2010,Tibia plato kırıklarında cerrahi tedavi sonuçlarımız<br><span style='font-style: italic';>Our surgical treatment outcomes in tibial plateau fractures,Sağlık Bakanlığı,Tıpta Uzmanlık,Ortopedi ve Travmatoloji = Orthopedics and Traumatology," onclick=tezDetay('VXqtau4hIUWZ7q83VSsqoA','7lZTq--K4efFn_9grkwiIA')"
633146,IŞIN GENÇAY,2008,Laparoskopik kolesistektomi ameliyatlarında alveolar recruitment strateji uygulamasının arteriyel oksijenizasyon ve hemodinamik parametreler  üzerine  etkisi<br><span style='font-style: italic';>The effects of the alveolar recruitment maneuver on arterial oxygenation during laparoscopic cholecystectomy operations,Sağlık Bakanlığı,Tıpta Uzmanlık,Anestezi ve Reanimasyon = Anesthesiology and Reanimation," onclick=tezDetay('h3BlYxbP1DjjnDXwsUuA3A','KdJtn786U0Z13fmBcOxS3g')"
248916,BÜLENT YILDIRIM,2010,"Ekt uygulanan ve uygulanmayan psikotik özellikli manik hastaların tedavi protokolü, ek tedavi ve tespit uygulamaları açısından karşılaştırılması<br><span style='font-style: italic';>Comparison of treatment protocol, additional treatment and restraint application in ect and non-ect psychotic manic patients",Sağlık Bakanlığı,Tıpta Uzmanlık,Psikiyatri = Psychiatry," onclick=tezDetay('-HdadkvPQlNOhsampt1fJA','Btr4QIOcDt6Nh26vVSkYQw')"
422582,AYGÜL GÜZEL,2005,"Tüberkülozla ilişkili tartı kaybında leptin, insülin, c-reaktif protein ve lipid profilinin yeri<br><span style='font-style: italic';>The role of serum leptin, insulin, c-reactive protein, and lipid profiles on weight loss due to tuberculosis",Sağlık Bakanlığı,Tıpta Uzmanlık,Göğüs Hastalıkları = Chest Diseases," onclick=tezDetay('-HOl6Dpvhbi32vk1FLs9pA','PxWzD2pNC-hJth0LhmTvdw')"
604162,İLKER BURAK ARSLAN,2005,Yüksek frekans odyometri standardizasyonu<br><span style='font-style: italic';>The standardisation of high frequency audiometry,Sağlık Bakanlığı,Tıpta Uzmanlık,Kulak Burun ve Boğaz = Otorhinolaryngology (Ear-Nose-Throat)," onclick=tezDetay('vu-48pDTP_Y8K_f5Ve2dKw','4GpZTnGsIs0eVvXvzMnrCg')"
644277,EMİN DALDAL,2007,Sağ ve sol kolon obstrüksiyonlarında rezeksiyon ve primer anastomozun karşılaştırılması : Deneysel çalışma<br><span style='font-style: italic';>Comparison of resection and primary anastomosis in both right and left colonic obstructions: an experimental study,Sağlık Bakanlığı,Tıpta Uzmanlık,Genel Cerrahi = General Surgery," onclick=tezDetay('EzfUNm8P9rTK6QL6XtxldA','mmuTGJORbZ_R22Ot105lfg')"
523700,EVREN ALDEMİR,2009,"Manifest karotid arter stenozu olan yada olmayan vakalarda manyetik rezonans görüntülemede saptanan iskemik beyin hastalığının doppler incelemedeki akım hızı, RI değerleri ve plak morfolojileri ile olan ilişkisi<br><span style='font-style: italic';>Relationship between carotid artery flow velocity, RI values ​​and plaque morphologies in patients with ischemic brain disease with or without carotid artery stenosis",Sağlık Bakanlığı,Tıpta Uzmanlık,Radyoloji ve Nükleer Tıp = Radiology and Nuclear Medicine," onclick=tezDetay('h3JzQ6ZdGqXtAPiNZvHphA','i9qlOeWrNWlH1E1KLGL4Ow')"
622580,OSMAN ÖZDOĞAN,2009,"Tip 2 diabetes mellitus hastalarında serum asimetrik dimetilarjinin(ADMA) düzeylerinin kan lipid parametreleri, HbA1c ve karotis intima media kalınlığı arasındaki ilişki<br><span style='font-style: italic';>Relationship between blood lipid parameters, HbA1c and carotid intima media thickness of serum asymmetric dimethylarginine (ADMA) levels in patients with type 2 diabetes mellitus",Sağlık Bakanlığı,Tıpta Uzmanlık,İç Hastalıkları = Internal diseases," onclick=tezDetay('G-XDj9ml5St0KpznweniOA','bA6mA5KWUBjmQXSzAqgekw')"
536764,ATIL AVCI,2005,Behçet hastalığında serum prolaktin düzeyleri<br><span style='font-style: italic';>,Sağlık Bakanlığı,Tıpta Uzmanlık,Dermatoloji = Dermatology," onclick=tezDetay('KoKBrRlpj4c8J8a-FjrwSw','UGu-xoFKBptyjqhd9PxE9A')"
649469,MELİH BAĞIR,2009,Primer ve sekonder kalça osteoartritli olgularda çimentosuz total kalça protezi uygulamalarımız ve sonuçları<br><span style='font-style: italic';>Clinical outcomes of cementless total hip replacement in primary and secondary coxarthrosis,Sağlık Bakanlığı,Tıpta Uzmanlık,Ortopedi ve Travmatoloji = Orthopedics and Traumatology," onclick=tezDetay('qhWTg1yKk-kiQDdluqpxEw','zswJwe2ZS1--gRuE0_Agdw')"
271760,NİLAY ÖLÇEK,2010,Davranım bozukluğu tanısı alan hastaların ailesel değerlendirilmesi ve ebeveynlerinin psikiyatrik tanı dağılımı<br><span style='font-style: italic';>A brief familial assesment of conduct disorder patients and distribution of psychiatric diagnoses among their parents,Sağlık Bakanlığı,Tıpta Uzmanlık,Psikiyatri = Psychiatry," onclick=tezDetay('cCajS32aAjUdSI6EgI5v_Q','zN8XMmulUPZTGEidRBXzbw')"
230439,KEZİBAN BULAN,2009,Montelukastın alerjik deri testi üzerine etkisi<br><span style='font-style: italic';>,Sağlık Bakanlığı,Tıpta Uzmanlık,Çocuk Sağlığı ve Hastalıkları = Child Health and Diseases," onclick=tezDetay('46vsxl8QGlNK-7Hj-A_jDQ','Yov_qVDajk-ObVZs7f9now')"
514927,ÖZLEM KABAYEĞİT,2009,Romatoid artritli hastalarda metabolik sendrom sıklığının belirlenmesi<br><span style='font-style: italic';>Prevalence of the metabolic syndrome in rheumatoid arthritis,Sağlık Bakanlığı,Tıpta Uzmanlık,Romatoloji = Rheumatology," onclick=tezDetay('dLoIvd4FUgTlFxC8fEUu4w','UZNlP4iKH9IE-zHvLMTBLw')"
660282,ALPER TUNGA ÖZDEMİR,2007,Tip II diabetes mellitus hastalarında MDA-LDL-IgG düzeylerinin araştırılması<br><span style='font-style: italic';>The investigation of MDA-LDL-IgG levels of type II diabetes mellitus patients,Sağlık Bakanlığı,Tıpta Uzmanlık,Biyokimya = Biochemistry ; İç Hastalıkları = Internal diseases," onclick=tezDetay('K61zKTiELD0uvCtaz3V5gA','X5rKa7H4DGJMkoAP7VCwtw')"
248880,HURİYE GÜMÜŞ ERSEN,2010,"Suç işlemiş kadınların sosyodemografik özellikleri, anne-baba tutumları ve öfke ifade biçimlerinin değerlendirilmesid<br><span style='font-style: italic';>Evaluation of socio-demographic characteristics, parental attitude and anger expression among female offenders",Sağlık Bakanlığı,Tıpta Uzmanlık,Psikiyatri = Psychiatry," onclick=tezDetay('ToQq-sCbD9sihd3sQWr6ww','r6psz9KQ-YMKBGn72oSP1Q')"
