tez_no,yazar,yıl,title,üniversite,tez_türü,konu,tez_detay
224684,DİLEK YAVUZCAN ÖZTÜRK,2009,"Orta persistan astımlı çocuklarda toraks HRCT\'de patoloji varlığının; solunum fonksiyon testleri, metakolin bronş provakasyon testi, semptom ve medikal skorlarına olan etkisi<br><span style='font-style: italic';>",Sağlık Bakanlığı,Tıpta Uzmanlık,Çocuk Sağlığı ve Hastalıkları = Child Health and Diseases," onclick=tezDetay('0nh5cT3ond_JkWv7UN2DNw','3Sym6XYecVkCbKbXCy6v2Q')"
556888,ELİF ÜNVER KORĞALI,2006,Yenidoğan bebek bakımındaki geleneksel uygulamaların bebek sağlığı üzerine etkileri ve bu uygulamalarla ailelerin sosyoekonomik sosyokültürel düzeyleri arasındaki ilişki<br><span style='font-style: italic';>,Sağlık Bakanlığı,Tıpta Uzmanlık,Çocuk Sağlığı ve Hastalıkları = Child Health and Diseases," onclick=tezDetay('XzijhLKnjv5hAVTtBEaknw','G1yF77wXUEw_6Nner3ys9Q')"
420932,BORA KOÇ,2011,Safra yolu taşlarının tedavisinde laparoskopik koledok eksplorasyonu ile ercp\'nin karşılaştırılması<br><span style='font-style: italic';>Compari̇son of laparoscopi̇c choledoc explorati̇on and ercp for the treatment of bi̇le duct stones,Sağlık Bakanlığı,Tıpta Uzmanlık,Genel Cerrahi = General Surgery," onclick=tezDetay('5q24GW5SJXOBSbRDp93vIA','fcnqUGnqmmIJfZQwaQG0Tg')"
664987,ÖZGÜR ÖZTOP ÇAKMAK,2011,Esansiyel tremor hastalığında substansia nigranın transkraniyal sonografi ile değerlendirilmesi<br><span style='font-style: italic';>Evaluation of substantia nigra with  transcranial sonography in essential tremor,Sağlık Bakanlığı,Tıpta Uzmanlık,Nöroloji = Neurology," onclick=tezDetay('PSi0zChh0GkO00Faa8nr8Q','5lLxxx7yj9Us-12xrpTasQ')"
536253,NAİM ATA,2006,Tiroid disfonsksiyonu ve tiroid otoantikorları ile idrarla atılan protein miktarı arasındaki ilişki<br><span style='font-style: italic';>The relationship between thyroid dysfunction and thyroid autoantibody and proteinuria,Sağlık Bakanlığı,Tıpta Uzmanlık,Endokrinoloji ve Metabolizma Hastalıkları = Endocrinology and Metabolic Diseases," onclick=tezDetay('xhCoWip8ZFXnOaPkSMMtgw','xRznLLyTmuFYH31tH7WdpQ')"
411944,TÜLİN DEMİR,2008,Deri ve yumuşak doku enfeksiyonu etkeni olan toplum ve hastane kaynaklı staphylococcus aureus izolatlarının antimikrobiyal duyarlılık durumlarının ve panton valentıne leukocıdın toksini sıklığının araştırılması<br><span style='font-style: italic';>Investigation of panton valentine leukocidin toxin frequency and antimicrobial susceptibilities of community and hospital acquired staphylococcus aureus isolates related with skin and soft tissue infections,Sağlık Bakanlığı,Tıpta Uzmanlık,Mikrobiyoloji = Microbiology," onclick=tezDetay('Vm8lTlCYy-6N060sO96aPQ','rqjTVBb5XTIyMpZI0zkMtg')"
419758,AHMET GÜLER,2011,Non-iskemik dilate kardiyomyopatili hastalarda 2 boyutlu speckle tracking ekokardiyografi ile değerlendirilen sol atriyum fonksiyonlarının e/e\' ve b-tip natriüretik peptid düzeyleri ile ilişkisi<br><span style='font-style: italic';>The relationship of e/e\' and bnp levels with left atrial functions that is assessed by 2d-speckle echocardiography in patients with nonischemic dilated cardiomyopathy.,Sağlık Bakanlığı,Tıpta Uzmanlık,Kardiyoloji = Cardiology," onclick=tezDetay('Dp-S356WfkxNAcXJsaowSA','4X6_iiFXRFpJgLJLf764hw')"
487708,ATİLLA KIRCELLİ,2005,"Lineer fraktür varlığı, geç gelişen posterior fossa epidural hematomu açısından bir risk faktörümüdür<br><span style='font-style: italic';>Is the presence of linear fracture a predictor of delayed posterior fossa epidural hematoma",Sağlık Bakanlığı,Tıpta Uzmanlık,Nöroşirürji = Neurosurgery," onclick=tezDetay('WHt3JYrNcrMTsm8l_BW_qQ','-_aULXmOu3B1o2_derOD7A')"
558193,İLHAN BALİ,2008,Hydatid cyst of liver analysis of 52 cases<br><span style='font-style: italic';>Karaciğer kist hidatiği 52 olgunun analizi,Sağlık Bakanlığı,Tıpta Uzmanlık,Genel Cerrahi = General Surgery," onclick=tezDetay('whgYjonaXcp31ZThh45IiA','1yjusjyI5OiiC_L2W3afUg')"
619551,MAHMUT ÖZKIRIŞ,2005,Septoplasti operasyonu uygulanmış hastalardapostoperatif dönemde göz kültürü değişiklikleri<br><span style='font-style: italic';>,Sağlık Bakanlığı,Tıpta Uzmanlık,Kulak Burun ve Boğaz = Otorhinolaryngology (Ear-Nose-Throat)," onclick=tezDetay('oC9rC0YQftKy42nG09PK2Q','EH-sl4sdyeWd__vl1tG4pw')"
428782,SENEM KARABULUT,2010,Türk toplumunda organık ve fonksiyonel dispepsili  hastalarda etyolojiye yönelik analiz<br><span style='font-style: italic';>,Sağlık Bakanlığı,Tıpta Uzmanlık,Gastroenteroloji = Gastroenterology," onclick=tezDetay('CtZxXXz77jSKRL4vtpYsgg','4U3oa9znbLoO1KpJzrOgKQ')"
536145,RUKİYE AYDIN,2009,Geleneksel hidrojel ve silikon hidrojel kontakt lens kullanan hastalarda konjonktival değişikliklerin impresyon sitolojisi yöntemi ile karşılaştırılması<br><span style='font-style: italic';>Comparing conjunctival changes in conventional hydrogel and silicone hydrogel contact lens users with impression cytology,Sağlık Bakanlığı,Tıpta Uzmanlık,Göz Hastalıkları = Eye Diseases," onclick=tezDetay('I3BKbUE_BKPgPXYEUTwPDg','vTnDyCk3XgLmWyk-3ENO-A')"
271693,ŞEBNEM GÖNEN YAĞCI,2010,Sağlık personelinin doğum şekli ve bulguların sağlık personeli olmayanlarla karşılaştırılması<br><span style='font-style: italic';>,Sağlık Bakanlığı,Tıpta Uzmanlık,Kadın Hastalıkları ve Doğum = Obstetrics and Gynecology," onclick=tezDetay('NLhkJUojOdRLYY1Ro5Y4Qg','0xxPfpkHVOwyOUCkPDfadw')"
175542,TALİHA ÖNER,2008,Sağlıklı yenidoğanlarda ve annelerinde vitamin b12 eksikliğinin sıklığı<br><span style='font-style: italic';>,Sağlık Bakanlığı,Tıpta Uzmanlık,Çocuk Sağlığı ve Hastalıkları = Child Health and Diseases," onclick=tezDetay('DYKRSc-VmwEWWoA7JQX7Sg','47oEJ1N5l9KSGazAathYnQ')"
649493,MEHMET VEDAT ÇALDIR,2007,Antiplatelet direncinin miyokard enfarktüsü sonrası sol ventrikül trombüsü gelişimi üzerine etkisi<br><span style='font-style: italic';>The effect of anti-platelet resistance in the develeopment of left ventricular thrombus after myocardial infarction,Sağlık Bakanlığı,Tıpta Uzmanlık,Kardiyoloji = Cardiology," onclick=tezDetay('vP62x45wizkl0XL-ioQxBw','isWtk9ezeFUybqd9Fa675g')"
420697,ADEM YILDIRIM,2005,"Spinal kord yaralanmalı  hastaların rehabilitasyonunda  mekanik egzersiz istasyonunda uygulanan üst ekstremite egzersizlerinin fizyolojik (kas kuvveti, kan lipit profili, kardiyopulmoner), fonksiyonel, psikolojik ve hayat kalitesi üzerine etkileri<br><span style='font-style: italic';>The physiological (muscle strength, blood lipid profiles and cardiopulmonary), functional,psychological and quality of life effects of upper extremity circuit resistance training in rehabilitation of patients with spinal cord injury",Sağlık Bakanlığı,Tıpta Uzmanlık,Fiziksel Tıp ve Rehabilitasyon = Physical Medicine and Rehabilitation," onclick=tezDetay('-D7TcsjuxYIkx28e1TU9KQ','r-wpAZ0efGy0lCnflva7tA')"
640798,SUNA SADIÇ YOLDAŞ,2007,Pilonidal sinüs cerrahisinde epidural anestezi ile genel anestezinin karşılaştırılması<br><span style='font-style: italic';>Comparison of epidural anesthesia with general anesthesia in pilonidal sinus surgery,Sağlık Bakanlığı,Tıpta Uzmanlık,Anestezi ve Reanimasyon = Anesthesiology and Reanimation," onclick=tezDetay('wjAgPqj6F74BpGS4gpqBCw','OiMg_50tGRO3Ln68WKDfpw')"
610302,KEMAL ÖZÜLKEN,2009,Pterjium cerrahisi sonrası topikal siklosporin a kullanımının operasyon başarısı üzerine etkisi<br><span style='font-style: italic';>The effect of using topical cyclosporin a after pterygium surgery on operation success,Sağlık Bakanlığı,Tıpta Uzmanlık,Göz Hastalıkları = Eye Diseases," onclick=tezDetay('nQ-G69AwFL0Kb6IoTTiRcw','mASeVET85vWz8IcnHPzLXQ')"
558437,ALİ YURTSEVEN,2010,İzmir ili\'nde eğitimlerini sürdüren çocuk sağlığı ve hastalıkları uzmanlık öğrencilerinde tükenmişlik sendromu<br><span style='font-style: italic';>The evaluation of burnout and job satisfaction levels in residents of pediatrics in İzmir,Sağlık Bakanlığı,Tıpta Uzmanlık,Çocuk Sağlığı ve Hastalıkları = Child Health and Diseases," onclick=tezDetay('HM2Zr_sFBDSjuFOx12knOA','LLxeJjGtfRAnl3JRN-StWA')"
420774,TUĞBA KINAY,2009,"Long luteal GnRH agonist ve antagonist protokolü uygulanan olgularda seri serum progesteron, estradiol düzeyi ve endometrial kalınlık ölçümlerinin IVF sonuçları üzerine prediktif etkisinin araştırılması<br><span style='font-style: italic';>Evaluation of the predictive value of serial serum estradiol, progesterone and endometrial thickness measurements on IVF outcomes in cycles down-regulated with gonadotropin-releasing hormone agonist and antagonist",Sağlık Bakanlığı,Tıpta Uzmanlık,Kadın Hastalıkları ve Doğum = Obstetrics and Gynecology," onclick=tezDetay('hG6HCJ9r0ddsK1v9CZjRWw','9ufV9ug_c3D0hIAYB-UkLA')"
411908,ELİF KILIÇ,2009,Koroner arter hastalığında serum resistin düzeylerinin incelenmesi<br><span style='font-style: italic';>Evaluation of serum resistin levels in coronary artery disease,Sağlık Bakanlığı,Tıpta Uzmanlık,Biyokimya = Biochemistry," onclick=tezDetay('xIk61OYzMi3AvHDG52kA2Q','Fz77_FdzXZUGQ-iumBwW9g')"
691407,SEMRA KÜLEKÇİ,2011,"Kolesteatomlu kronik otit media olgularında preoperatif fizik muayene, difüzyon  ağırlıklı görüntüleme ve temporal  kemik tomografi bulgularının intraoperatif bulgularla karşılaştırılması<br><span style='font-style: italic';>Comparison of preoperative physical examination, diffusion-weighted imaging and temporal bone tomography findings with intraoperative findings in chronic otitis media with cholesteatoma",Sağlık Bakanlığı,Tıpta Uzmanlık,Kulak Burun ve Boğaz = Otorhinolaryngology (Ear-Nose-Throat)," onclick=tezDetay('Q1GDFgf-7WzR5hMSLZU3zA','ebnModD2dLf9J_Ru186-lw')"
615438,HANDE GÜRBÜZ AYTULUK,2011,Gastrointestinal sistem malignitesi olan hastalarda preoperatif nutrisyonel durumun postoperatif mortalite ve morbiditeye etkisi<br><span style='font-style: italic';>The impact of preoperative nutritional status on postoperative complications and mortality in patients with gastrointestinal system malignancy,Sağlık Bakanlığı,Tıpta Uzmanlık,Anestezi ve Reanimasyon = Anesthesiology and Reanimation," onclick=tezDetay('18kbRJ3xXbuTObDTBYTVkQ','1WlRbmQHqqSiorWycJyH7w')"
397167,CEYDA ANAR,2008,KOAH\'lı olgularda influenza ve pnömokok aşısı uygulanmasının hastanın antikor yanıtına ve kliniğine olan etkilerinin değerlendirilmesi<br><span style='font-style: italic';>Evaluation of clinical data and antibody response following influenza and pneumococ vaccination in patients with chronic obstructive pulmonary disease,Sağlık Bakanlığı,Tıpta Uzmanlık,Göğüs Hastalıkları = Chest Diseases," onclick=tezDetay('eh11Nh-TRHjCVmgDIcIfTg','t7CCsR0S9N6hru0zkFu99A')"
434377,MEHMET KALENDER,2011,Seksenli yaş grubunda koroner baypasta sol internal torasik arter grefti kullanımının mortalite ve morbiditeye etkisi<br><span style='font-style: italic';>Effects of left internal thoracic artery graft use on coronary artery bypass grafting mortality and morbidity in octogenarians,Sağlık Bakanlığı,Tıpta Uzmanlık,Göğüs Kalp ve Damar Cerrahisi = Thoracic and Cardiovascular Surgery," onclick=tezDetay('5smBiwh3GAkAswxroejKhQ','KTjoP-r4j5RUXwNG9DLe5A')"
510534,SEVİL KARAMAN,2010,Fakik regmatojen retina dekolmanlarında pars plana vitrektomi sonuçlarımız<br><span style='font-style: italic';>Our pars plana vi̇trectomy results in phaki̇c rhegmatogenous retinal detachments,Sağlık Bakanlığı,Tıpta Uzmanlık,Göz Hastalıkları = Eye Diseases," onclick=tezDetay('McvidonEORWdcc2GL2jEMg','VZFxxD34WF0EQSaLiWHlIg')"
554064,SAİT ÖZBİR,2011,Ürotelyal mesane kanseri nedeniyle radikal sistektomi uygulanan olgularda lokal ve sistemikrekürrensi etkileyen faktörler<br><span style='font-style: italic';>Local and systemic recurrence patterns of urothelial cancer after radical cystectomy,Sağlık Bakanlığı,Tıpta Uzmanlık,Üroloji = Urology," onclick=tezDetay('1GnTk5UCZGd0wlqkbik9IQ','cst6aCptAHEWyLAYp87xPA')"
649871,SİBEL YILMAZ,2011,Ortopedik cerrahide preoperatif nütrisyonel risk değerlendirmesi ve nütrisyonel durumun postoperatif hastanede kalış süresine etkisi<br><span style='font-style: italic';>The effect of nutritional status on length of hospital stay in adult patients undergoing elective orthopedic surgery: A prospective analysis,Sağlık Bakanlığı,Tıpta Uzmanlık,Anestezi ve Reanimasyon = Anesthesiology and Reanimation," onclick=tezDetay('gdNu7yH3jbpQq8OSoxV8cg','9ID4Ize38cnFqQOGAKiWwQ')"
568384,TAŞKIN ERKİNÜRESİN,2009,Yaygın insitu duktal karsinomlu invaziv duktal karsinomlar ile insitu duktal karsinomsuz invaziv duktal karsinomlarınnormal meme epitelinde östrojen reseptörekspresyonununkarşılaştırılması<br><span style='font-style: italic';>Comparison of estrogen receptor expression in normal breast epithelium of invasive ductal carcinoma with extensive in situ ductal carcinoma and invasive ductal carcinoma with in situ ductal carcinoma,Sağlık Bakanlığı,Tıpta Uzmanlık,Patoloji = Pathology," onclick=tezDetay('oDnUy0RiiV2chafrzy2ZhQ','pXxn_jDDvI6uWf2r2cHIuw')"
659515,SELEN IŞIK,2011,Bipolar bozukluk tanılı hastaların anne ve babalarında yüzde duygu dışavurumunu tanıma ve ayırt etme<br><span style='font-style: italic';>,Sağlık Bakanlığı,Tıpta Uzmanlık,Psikiyatri = Psychiatry," onclick=tezDetay('K1imbCz_Bfha8rezlciD4w','bQ7gnC_CCmNkAv8JJg0jqA')"
566108,LASER ŞANAL,2008,Gebelerde grup B streptokok kolonizasyonunun değişik besiyerleri kullanılarak gösterilmesi ve serotiplendirilmeleri<br><span style='font-style: italic';>Detecting group B streptococcus colonization in pregnants by using  different mediums and serotyping,Sağlık Bakanlığı,Tıpta Uzmanlık,Mikrobiyoloji = Microbiology," onclick=tezDetay('SLx0LTuTb09BEGRjJuCBLg','jTD8wv413kPu6q3Z0EZZ4A')"
481542,HÜSEYİN ÖZEVREN,2010,Deneysel kafa travma modelinde riluzol ve lamotrijin\'in nöroprotektif etkileri<br><span style='font-style: italic';>Neuroprotective effects of riluzole and lamotrigine in experimental head trauma model,Sağlık Bakanlığı,Tıpta Uzmanlık,Nöroşirürji = Neurosurgery," onclick=tezDetay('vPrueTClFUZOCz8LQ8xCig','vXbEfbnPMs5PIPkEYdB95g')"
411890,GÜNER MENEKŞE,2011,Deneysel spinal kord travma modelinde rituksimabın nöroprotektif etkisinin immünhistokimyasal ve elektron mikroskobik yöntemlerle incelenmesi<br><span style='font-style: italic';>The neuroprotective effects of rituximab in experimental spinal cord injury model: an immunohistochemical and electronmicroscopic study,Sağlık Bakanlığı,Tıpta Uzmanlık,Nöroşirürji = Neurosurgery," onclick=tezDetay('QQARShLVG0acImZblvBm2w','tFbOELk6J0d7PPGPSmW08g')"
420808,MUSTAFA SOLAK,2009,Diabetik erkek hastalarda homosistein ve dehidroepiandrosteron sülfat seviyelerinin koroner arter hastalığı açısından karşılaştırılması<br><span style='font-style: italic';>The relationship between level of homocysteine and dehydroepiandrosterone with coronary arter disease  i̇n diabetic male patients,Sağlık Bakanlığı,Tıpta Uzmanlık,Endokrinoloji ve Metabolizma Hastalıkları = Endocrinology and Metabolic Diseases," onclick=tezDetay('WX0GHD7i81lRdDEt2x3R0w','DA7lZU7ioYvmkgc9_5yLQw')"
451300,BETÜL BATTALOĞLU İNANÇ,2007,Kronik böbrek yetmezliği hastalarında etiyolojik değerlendirme<br><span style='font-style: italic';>Etiological evalution in chronic renal failure patients,Sağlık Bakanlığı,Tıpta Uzmanlık,Aile Hekimliği = Family Medicine," onclick=tezDetay('Oh0xDt9tlzNwuZqWhIq2wA','J2sXsiDk3bp4pCXS3gUfaQ')"
463806,BÜLENT ÇEKİÇ,2010,HBA1C değerinin ve diyabet süresinin oküler kan hemodinamiği üzerine etkisinin renkli doppler ultrasonografi ile incelenmesi<br><span style='font-style: italic';>Evaluation of the effect of HBA1C value and duration of Diabetes mellitus on ocular hemodynamics by color doppler ultrasonography,Sağlık Bakanlığı,Tıpta Uzmanlık,Radyoloji ve Nükleer Tıp = Radiology and Nuclear Medicine," onclick=tezDetay('MFlyfbXtV5AQa9wFmO_aPA','DjUPGGCR6OQEXSuGJL6cXg')"
480097,EMİNE ALYAMAÇ SUKGEN,2010,"Diabetik makular ödemi ve kataraktı olan hastalarda, fakoemülsifikasyon cerrahisiyle aynı ya da ayrı seanslarda yapılan intravitreal triamsinolon asetonid uygulamasının, grid lazer seçeneği ile birlikte etkilerinin karşılaştırılması<br><span style='font-style: italic';>",Sağlık Bakanlığı,Tıpta Uzmanlık,Göz Hastalıkları = Eye Diseases," onclick=tezDetay('erkP5fyi_Exx-W-aOaoXeA','G62O2qOkvusbTojFD3sXqw')"
513215,RAHİME RENDA,2006,680 febril konvülziyonlu hastanın retrospektif olarak değerlendirilmesi<br><span style='font-style: italic';>,Sağlık Bakanlığı,Tıpta Uzmanlık,Çocuk Sağlığı ve Hastalıkları = Child Health and Diseases," onclick=tezDetay('HxuowpJmyZdI4E2Y5doGrg','o5Podh8sg9ZAE23hb0dd1w')"
420907,GÖZDE DERVİŞ HAKİM,2009,Dispepsili hastalarda ve diabetik hastalarda giardia intestinalis prevalansı<br><span style='font-style: italic';>The prevalance of giardia intestinalis in di̇abetic and dispeptic patients,Sağlık Bakanlığı,Tıpta Uzmanlık,Gastroenteroloji = Gastroenterology," onclick=tezDetay('ZaO8MeQ9v30GK5Kx_bZZ5Q','XCZYLTBROS1t7-ykdMqQQQ')"
616825,BURCU VOLKAN,2008,Hafif persistan ve orta persistan astımlı çocuklarda montelukast ilezafirlukastın etkinliğinin karşılaştırılması<br><span style='font-style: italic';>,Sağlık Bakanlığı,Tıpta Uzmanlık,Çocuk Sağlığı ve Hastalıkları = Child Health and Diseases," onclick=tezDetay('F_ZPZufi5D-E1hEfTYbLUA','vuUigpX40IKyZ8Pzovdvgw')"
513326,AYŞEGÜL ÖZEL,2009,Laparotomı̇k ve laparoskopı̇k myomektomı̇lerı̇npostoperatı̇f komplı̇kasyonlar açısından değerlendı̇rı̇lmesı̇<br><span style='font-style: italic';>Evaluation of abdominal and laparoscopic myomectomies with respect topostoperative complications,Sağlık Bakanlığı,Tıpta Uzmanlık,Kadın Hastalıkları ve Doğum = Obstetrics and Gynecology," onclick=tezDetay('7r_88ewQBq2jbsD_krSr5Q','1rfzM04xGmqmA1tRxCxe2A')"
623820,ÖNDER ALTIN,2010,Sıçanlarda farklı batın kapama tekniklerinin yara iyileşmesi üzerine etkisi<br><span style='font-style: italic';>Effect of different abdominal closure techniques on wound healing in rats,Sağlık Bakanlığı,Tıpta Uzmanlık,Genel Cerrahi = General Surgery," onclick=tezDetay('vKJ2t3SgZk6zQZ5rhYLasA','aNCcEs8hI23fpWaCAI3lUQ')"
524822,VASFİYE İLBAY,2008,"Akut iskemik inmede, internal karotis arterin intima-media kalınlığı ile crp ilişkisi<br><span style='font-style: italic';>The relationship between crp and intima-media thickness of internal carotid artery in acute ischemic stroke",Sağlık Bakanlığı,Tıpta Uzmanlık,Nöroloji = Neurology," onclick=tezDetay('GnPPPgvYlR__DvJNzWcXNA','JtdotvwHOObDQtpzP5OVjw')"
419826,TOLGA DİNÇ,2011,Coşkun Herni onarımı ıle lıchtensteın hernı onarımının uzun dönem sonuçlarının karşılaştırılması<br><span style='font-style: italic';>,Sağlık Bakanlığı,Tıpta Uzmanlık,Genel Cerrahi = General Surgery," onclick=tezDetay('3Z2TcIpqGeVtYms_s-nWWA','L0PPXvrkqQxk7ARm9pQqmA')"
387095,PINAR ALTIAYLIK ÖZER,2009,Tamsulosin ve diğer sistemik ilaç kullanımlarında intraoperatif floppy iris sendromu insidansı<br><span style='font-style: italic';>Incidence of intraoperative floppy iris syndrome with use of tamsulosin and other systemic medications,Sağlık Bakanlığı,Tıpta Uzmanlık,Göz Hastalıkları = Eye Diseases," onclick=tezDetay('Dxraxyndp2mFxiupPdE1rA','CfCFCu-BUCOQFC9XtVaLVA')"
859425,FİLİZ ÇİFTÇİ,2011,"Şişli Etfal Eğitim ve Araştırma Hastanesinde, 1. Kadın Hastalıkları ve Doğum Kliniğinde doğum yapmış gebelerde anemi prevalansının araştırılması ve maternal anemi ile fetal büyüme kısıtlılığı arasındaki ilişkinin değerlendirilmesi<br><span style='font-style: italic';>An Investigation of the Prevalence of Anemia in the Obstetrics and Gynecology Clinic in Şişli Etfal Training and Research Hospital and Evaluation of the relationship between maternal anemia and fetal growth restriction",Sağlık Bakanlığı,Tıpta Uzmanlık,Kadın Hastalıkları ve Doğum = Obstetrics and Gynecology," onclick=tezDetay('5g9fqcXj7IqquWOjkNeKEQ','2pm67kBF12ATe8g0Bt8k0w')"
411996,DERYA AKDAĞ CIRIK,2008,Günaşımı olan hastalarda doğum indüksiyonu için kullanılan kontrollü salınımlı dinoproston (prostaglandin E2) vajinal ovülün feto-plasental kan akımı üzerine etkisi ve eşlik eden oligohidramniosu olan vakalarda kullanılmasının fetal ve uterin arter dopplerleri ile değerlendirilmesi<br><span style='font-style: italic';>The effect of sustained-release formulation of dinoprostone (prostaglandin E2) for vaginal insertion used for labor induction in postterm pregnancies on fetplasental blood flow and the evaluation of its use by fetal and uterin arterial doppler ultrasonography in postterm pregnancies with oligohydramnios,Sağlık Bakanlığı,Tıpta Uzmanlık,Kadın Hastalıkları ve Doğum = Obstetrics and Gynecology," onclick=tezDetay('5xq9nA9b5RygTwawrRQrKA','8g3PEyLNIhn2E4DVoPxEhQ')"
663443,ADİL UMUT ZÜBARİOĞLU,2010,Yaşamın ilk dakikalarında sağlıklı term bebeklerde oksijen saturasyon düzeyi<br><span style='font-style: italic';>Oxygen Saturation Levels in the First Minutes of Life in Healthy Term Neonates,Sağlık Bakanlığı,Tıpta Uzmanlık,Çocuk Sağlığı ve Hastalıkları = Child Health and Diseases," onclick=tezDetay('iHI47OutFg6cgwQOZIH-vA','IIYuerbEhDC7zThGdXuTKQ')"
536534,NECİP KARA,2010,Primer Açık Açılı Glokom Ve Psödoeksfoliatif Glokomda Selektif Lazer Trabeküloplasti Tedavisinin Etkinlik Ve Güvenilirliğinin Değerlendirilmesi<br><span style='font-style: italic';>Comparison of the efficacy and safety of selective laser trabeculoplasty in cases with primary open-angle glaucoma and pseudoexfoliative glaucoma,Sağlık Bakanlığı,Tıpta Uzmanlık,Göz Hastalıkları = Eye Diseases," onclick=tezDetay('-op9Ho1KPeFUJy17y_mIOQ','uMyDylllasKDCnbYFc1TTw')"
556608,SELMA AKTAŞ,2010,Prenatal ve yenidoğan döneminde atopi ve alerjik hastalıklara eğilim yaratan risk faktörleri<br><span style='font-style: italic';>Possible risk factors associated with allergic diseases among perinatal and infancy period,Sağlık Bakanlığı,Tıpta Uzmanlık,Allerji ve İmmünoloji = Allergy and Immunology," onclick=tezDetay('rWcqXLGZolWZdadEeghuqA','Lp-LGYCrF_wl__yUh6-a4w')"
501845,BİRGÜL LİVAOĞLU SAY,2008,Üriner sistem anotomisi normal olan çocuklarda   tekrarlayan idrar yolu enfeksiyonu nedenleri<br><span style='font-style: italic';>Reasons for recurrent urinary tract infections in the children who have a normal urinary system anatomy,Sağlık Bakanlığı,Tıpta Uzmanlık,Çocuk Sağlığı ve Hastalıkları = Child Health and Diseases," onclick=tezDetay('0-ZELagUEiTq0cl8G6dRLg','KCkmMDqqC-koNpb6urDGjQ')"
548893,İSMAİL OLTULU,2010,Kifoplasti ve vertebroplasti tekniği ile yerleştirilen pedikül vidalarının sıyırma kuvvetlerinin karşılaştırılması<br><span style='font-style: italic';>Comparison of shearing forces of pedicle screws that placed with kyphoplasty and vertebroplasty techniques,Sağlık Bakanlığı,Tıpta Uzmanlık,Ortopedi ve Travmatoloji = Orthopedics and Traumatology," onclick=tezDetay('jguduhoUGK2108woS1VoyA','ocvI_UkG-8gIbplzrp065w')"
476368,MUSTAFA KOÇ,2009,Pentacam scheimpflug kamera ile ön kamara açısının yaş gruplarına ve kadranlara göre incelenmesi<br><span style='font-style: italic';>Measurement of the anterior chamber angle according to quadrants and age groups using pentacam scheimpflug camera,Sağlık Bakanlığı,Tıpta Uzmanlık,Göz Hastalıkları = Eye Diseases," onclick=tezDetay('kyXvhO8k8MqEgTUtQPHa_w','Q_p57A_3HKcfcXL9HwQu4w')"
412002,EMRAH İPEK,2011,Koroner arter hastalığı ve metabolik sendromu olan hastalarda serum ürik asit düzeylerinin koroner tımı kare sayıları üzerindeki etkisi<br><span style='font-style: italic';>The effect of serum uric acid levels on timi frame counts in patients with coronary artery disease and metabolic syndrome,Sağlık Bakanlığı,Tıpta Uzmanlık,Kardiyoloji = Cardiology," onclick=tezDetay('ieZVbOQaPqbXy3w0IK9o-w','vRCoYw7rYTsBF1Mzgcjldg')"
625938,AYŞE SEÇİL KAYALI DİNÇ,2010,Tiroidektomi sonuçlarımızın retrospektif değerlendirilmesi<br><span style='font-style: italic';>Retrospective evaluation of thyroidectomy results,Sağlık Bakanlığı,Tıpta Uzmanlık,Kulak Burun ve Boğaz = Otorhinolaryngology (Ear-Nose-Throat)," onclick=tezDetay('bRaM-4MR51ImfWVOnHar_A','xlui-Sm6EogP9SXpfNu8sw')"
288885,BELİNDA MAŞALI,2011,Remisyondaki bipolar hastalarda valproatın beyin ossilasyonları üzerindeki etkileri<br><span style='font-style: italic';>Effect of valproate on brain oscillations in patients with bipolar disorder,Sağlık Bakanlığı,Tıpta Uzmanlık,Psikiyatri = Psychiatry," onclick=tezDetay('MxPLsGWCvUbS2MqBuKDNSQ','oURACi_jFbHuUu7x9Fy4hg')"
556486,AYŞE RENGİN TÜRKGÜLER,2011,Karaciğer kitlelerinde radyolojik görüntüleme ve patoloji sonuçlarının korelasyonu<br><span style='font-style: italic';>Radiologic imaging of liver masses and correlation with imaging findings,Sağlık Bakanlığı,Tıpta Uzmanlık,Radyoloji ve Nükleer Tıp = Radiology and Nuclear Medicine," onclick=tezDetay('LVvSG05sR6-Cdafhi4SDgg','PoS9VXYNspZ5zryjTUBwHA')"
