tez_no,yazar,yıl,title,üniversite,tez_türü,konu,tez_detay
411871,GÜLŞAH KARAÖREN,2006,"Kontrollü hipotansif anestezi uygulanan hastalarda deksmedetomidin ve esmolol\'ün hemodinami, ekstubasyona yanıt ve postoperatif etkilerinin karşılaştırılması<br><span style='font-style: italic';>A comparison of the effects of esmolol and dexmedetomidine on the hemodynamics, response to extubation and postoperative hemodynamics in controlled hypotensive anaesthesia",Sağlık Bakanlığı,Tıpta Uzmanlık,Anestezi ve Reanimasyon = Anesthesiology and Reanimation," onclick=tezDetay('c7vpvBT2IkHPvlsYWpg0eA','tP4q4JOU0RYzUMxQOEIFfg')"
171887,NURTEN BAYRAM,2006,Riskli pretermlerde transport edilen ve edilmeyen grupların morbidite ve mortalite yönünden karşılaştırılması<br><span style='font-style: italic';>,Sağlık Bakanlığı,Tıpta Uzmanlık,Çocuk Sağlığı ve Hastalıkları = Child Health and Diseases," onclick=tezDetay('gAf9Q8XIdVOwr-782GEI5g','LDX7Jo7uINwO71d5cnToRQ')"
171888,SERDAR YEŞİNEL,2006,Çok düşük doğum ağırlıklı riskli prematürelerin somatik gelişimlerine etki eden faktörler<br><span style='font-style: italic';> ,Sağlık Bakanlığı,Tıpta Uzmanlık,Kadın Hastalıkları ve Doğum = Obstetrics and Gynecology ; Çocuk Sağlığı ve Hastalıkları = Child Health and Diseases," onclick=tezDetay('_HUq5Ar1YcN1I7aPVTfwsw','JEhnj9UOs-yXe_MJguC1lw')"
653592,ENGİN ÖLÇÜCÜOĞLU,2010,Kasık fıtığı onarımında yama tespiti için kullanılan fibrin yapıştırıcıların ilioinguinal sinir üzerine etkileri \'Deneysel Çalışma\'<br><span style='font-style: italic';>The effects of fibrin sealants used for mesh fixation in inguinal hernia repair on the ilioinguinal nerve \'Experimental Study\',Sağlık Bakanlığı,Tıpta Uzmanlık,Genel Cerrahi = General Surgery," onclick=tezDetay('FjZErlN1cDhaa-7y2VJ-nw','hUb8Ur0QCxxbGG8-ux-OPg')"
491611,NUMAN KARAARSLAN,2011,"Meningiomlarda prognoza etki eden faktörler, matriks metalloproteinaz-3 enziminin biyolojik davranış ve prognoz üzerine etkisi<br><span style='font-style: italic';>Factors affecting prognosis in meningiomas, the effect of matrix metalloproteinase-3 enzyme on biological behaviour and prognosis",Sağlık Bakanlığı,Tıpta Uzmanlık,Nöroşirürji = Neurosurgery," onclick=tezDetay('fw8EQd6F7x5-XyrS-34psA','SNz5Ip2qQlAwY_XiiI8B_A')"
420775,BETÜL KOZANHAN,2008,Nöropatik ağrılı lumbal disk hastalarında preemptif pregabalinin anestezik madde tüketimine katkısı ve postoperatif analjeziye etkisi<br><span style='font-style: italic';>The contribution of preemptive pregabalin to anesthetic consumption and effect of postoperative analgesia in patients with neuropatic lumbal disc pain,Sağlık Bakanlığı,Tıpta Uzmanlık,Anestezi ve Reanimasyon = Anesthesiology and Reanimation," onclick=tezDetay('16VtzQJ8wtJ82znSuuiSUQ','TVVZ7RdVQAOQM7kYEg9cMQ')"
281815,GÜLDEN TURAN,2011,Servikovajinal smear sonuçları premalign olan olguların kolposkopik biopsi ve tedavi sonrası histopatolojik tanılarının karşılaştırılması<br><span style='font-style: italic';>To compare the colposcopic biopsy findings with the histopathologic diagnosis after the treatment in cases whose cervicovaginal smears showed premalign lesions,Sağlık Bakanlığı,Tıpta Uzmanlık,Kadın Hastalıkları ve Doğum = Obstetrics and Gynecology," onclick=tezDetay('fHW-tH8XQ99wuoDctnxefg','ysSVAvb4luq0iXrcw3IQuA')"
411854,OĞUZ KAYIRAN,2008,İskemi/reperfüzyon hasarının önlenmesinde tadalafilin etkisi (deneysel çalışma)<br><span style='font-style: italic';>İskemi̇/reperfüzyon hasarinin önlenmesi̇nde tadalafi̇li̇n etki̇si̇ (deneysel çalişma),Sağlık Bakanlığı,Tıpta Uzmanlık,Plastik ve Rekonstrüktif Cerrahi = Plastic and Reconstructive Surgery," onclick=tezDetay('tuPFUiF4OplngrQx8cK2jQ','L2qFRtHEZ08PvRjpLk5FNQ')"
193527,ABDULLAH ONUR GÖKSEL,2007,Endolarengeal mikrocerrahi uygulanan hastalarda ses kalitesinin akustik ve spektrografik analiz ile değerlendirilmesi<br><span style='font-style: italic';>Voice quality assessment of the patients after endolaryngeal microsurgery by acoustic and spectrographic analysis,Sağlık Bakanlığı,Tıpta Uzmanlık,Kulak Burun ve Boğaz = Otorhinolaryngology (Ear-Nose-Throat)," onclick=tezDetay('Bi5QFi_xfGk3WbiZXbauqA','5T2y2X1otZA2fXMGS1Axng')"
491719,MİTAT ARICIGİL,2009,Ağır osas\' lı hastalarda cpap cihazının alt üriner sistem semptomlarına etkisi<br><span style='font-style: italic';>,Sağlık Bakanlığı,Tıpta Uzmanlık,Kulak Burun ve Boğaz = Otorhinolaryngology (Ear-Nose-Throat)," onclick=tezDetay('uIaHUIoXMO9Tndxs9dFTNA','iCyWME10wS30HHnmFhy13w')"
224685,ERDEM TOPAL,2008,İstanbul ilinde 1-6 yaş grubunda hepatit A\'nın seroprevalansı ve hepatit B\' nin aşı sonrası serokonversiyonu<br><span style='font-style: italic';> ,Sağlık Bakanlığı,Tıpta Uzmanlık,Çocuk Sağlığı ve Hastalıkları = Child Health and Diseases," onclick=tezDetay('V6DtFCPMRxZ7OuX10FcRgA','VnSSlkBC8M5oPEF-n8OKhA')"
562694,SAİT ALİM,2011,Ocak 2007- Aralık 2009 yılları arasında kliniğimizde yapılan komplikasyonsuz Fakoemülsifikasyon ameliyatlarında refraksiyon sonuçlarımız<br><span style='font-style: italic';>To evaluate the refraction results of uncomplicated Phacoemulsification surgery performed between January 2007- December 2009 in our clinic,Sağlık Bakanlığı,Tıpta Uzmanlık,Göz Hastalıkları = Eye Diseases," onclick=tezDetay('SgeUgHEwRB1DiefpuNmQGw','5wVy8MEffCAybfZ-Jmzung')"
281785,FİLİZ YARŞILIKAL,2011,Endometrium kanserli hastalarda miyometrium invazyonunu değerlendirmede transvaginalsonorafinin duyarlılığı ve özgüllüğü<br><span style='font-style: italic';>The sensitivity and spesifity of tvusg at evaluation of myometrial invasion in endometrial cancer patients,Sağlık Bakanlığı,Tıpta Uzmanlık,Kadın Hastalıkları ve Doğum = Obstetrics and Gynecology," onclick=tezDetay('SPyWS_izJ4AIORQ6S9VYOQ','XHMq1O1yY806Hb3z8qDrXw')"
602877,FETHİ GÜL,2010,"Basınç  kontrollü hemorajik şok oluşturulmuş ratlarda   resüstasyonda  üç  farklı   sıvının hemodinami,  koagülasyon,   asid-baz  ve elektrolit  dengesi  üzerine olan  etkilerinin karşılaştırılması<br><span style='font-style: italic';>The comparative effects of three different types of resuscitation fluids on hemodynamics, coagulation, acid-base, and electrolite balance of rats in pressure-controlled hemorrhagic shock",Sağlık Bakanlığı,Tıpta Uzmanlık,Anestezi ve Reanimasyon = Anesthesiology and Reanimation," onclick=tezDetay('VvWkmkiLny3QaESdNdMWHA','_rYMztOZGqf66nAJRImmKA')"
704486,NESRİN GÜNDÜZ,2011,Pulmoner hipertansiyonda tahmini pulmoner arter sistolik basıncının hesaplanmasında bilgisayarlı tomografinin yeri<br><span style='font-style: italic';>The role of computed tomography in the calculation of pulmonary artery systolic pressure in patients with pulmonary hypertension,Sağlık Bakanlığı,Tıpta Uzmanlık,Radyoloji ve Nükleer Tıp = Radiology and Nuclear Medicine," onclick=tezDetay('AsnYxlaLSy4p9XOX8xLcXA','bGrAWvqtEW9U8sL9aldOUw')"
260218,AYŞEN COŞUT ÇAKMAK,2010,Vajinismus tanısı ile izlenen çiftlerde mizaç ve karakter özellikleri ile yakın ilişki stilleri<br><span style='font-style: italic';>Temperament and character traits and close relationship styles in couples with diagnosis of vaginismus,Sağlık Bakanlığı,Tıpta Uzmanlık,Psikiyatri = Psychiatry," onclick=tezDetay('SahwEAqavY2jfsaafLALcQ','P9s1dmdt-csojprKSKCgDg')"
664110,FATMA CEYDA AKIN ÖÇAL,2011,Alerjik rinit semptomlarının spesifik alerjenler  ve  alerjene maruziyet süresi ile ilişkisi<br><span style='font-style: italic';>Relationship between symptoms of allergic rhinitis and their severity with specific allergens and duration of allergic rhinitis,Sağlık Bakanlığı,Tıpta Uzmanlık,Kulak Burun ve Boğaz = Otorhinolaryngology (Ear-Nose-Throat)," onclick=tezDetay('TTtrVwyKqD1aUUfaQtCYPQ','XMS4S_A5bLawUlgHrXyBEA')"
524826,YALÇIN TURHAN,2011,Gelişimsel kalça displazisi tedavisi için uygulanan salter innominate osteotomisi sonrası asetabuler gelişme<br><span style='font-style: italic';>Acetabular development following salter innominate osteotomy for the treatment of developmental hip dysplasia,Sağlık Bakanlığı,Tıpta Uzmanlık,Ortopedi ve Travmatoloji = Orthopedics and Traumatology ; Ortopedi ve Travmatoloji = Orthopedics and Traumatology," onclick=tezDetay('9qbS_liQ9jtGgQYsyENw9Q','ff4vljdaejIP7prlGEa7Hg')"
491000,HALİL HARMAN,2010,Fibromiyalji sendromlu hastalarda el kavrama gücü ve duyusal muayenenin fonksiyonel değerlendirmeye ve yaşam kalitesine etkisi<br><span style='font-style: italic';>The Effects of Hand Grip Strength and sensory examination to Quality of Life and functional status in Fibromyalgia Syndrome.,Sağlık Bakanlığı,Tıpta Uzmanlık,Fiziksel Tıp ve Rehabilitasyon = Physical Medicine and Rehabilitation," onclick=tezDetay('jvUYgtm6-_-4TP6BL0467g','gwx5EmnNaP3ik3u0FrnCMg')"
633541,MUHAMMED KARADENİZ,2011,Akut inferior miyokard infarktüsünde p-dalga dispersiyonunun infarkttan sorumlu arteri göstermedeki tanısal değeri<br><span style='font-style: italic';>P wave dispersion can help to identify infarct related artery in acute inferior myocardial infarction,Sağlık Bakanlığı,Tıpta Uzmanlık,Kardiyoloji = Cardiology," onclick=tezDetay('ro4s4MLJaPg1VACOBHdkSw','opZCzQ2_laDdaiCUp6ygGA')"
412035,ALİ TARDU,2007,Pilonidal sinüsün cerrahi tedavisinde Limberg flep ile Dufourmentel flep yöntemlerinin karşılaştırılması<br><span style='font-style: italic';>Comparison of Limberg and Dufourmentel flap in surgical treatment of pilonidal sinus disease,Sağlık Bakanlığı,Tıpta Uzmanlık,Genel Cerrahi = General Surgery," onclick=tezDetay('phMREEco-jL9Xu6LtqgOlg','SuCQoXpUiJuxauB2n64sDw')"
555275,BURKAY YAKAR,2009,İlaç zehirlenmesi olan çocuk olgularda demografik özellikler veailesel etkenlerin değerlendirilmesi<br><span style='font-style: italic';>The evaluation of familial factors and demographic characteristics of children with drug poisoning,Sağlık Bakanlığı,Tıpta Uzmanlık,Aile Hekimliği = Family Medicine," onclick=tezDetay('-facFNeSoyPXwAOdNngqPg','nDCrkf-lVfNsgBV3-FEm8w')"
420780,RECAİ ERGÜN,2006,Kronik obstrüktif akciğer hastalığında ekshale karbonmonoksid ve arteriyal karboksihemoglobin  ölçümlerinin tanısal değeri.<br><span style='font-style: italic';>Kroni̇k obstrükti̇f akci̇ğer hastaliğinda ekshale karbonmonoksi̇d ve arteri̇yal karboksi̇hemoglobi̇n  ölçümleri̇ni̇n tanisal değeri̇.,Sağlık Bakanlığı,Tıpta Uzmanlık,Göğüs Hastalıkları = Chest Diseases," onclick=tezDetay('pmCw2LWfMbL-gmN9fYvFMQ','lsBr0GMqKyXyUuha2iNIHQ')"
625855,HASAN BÖREKCİ,2009,Koroziv madde içimi sonrası üst gastrointestinal sistemde oluşan hasara karşı oral olarak alınan a-c-e vitaminlerinin kombine etkinliğinin araştırılması<br><span style='font-style: italic';>Corrosive substance after drinking against damage in the gastrointestinal system a-c-e vitamins taken oralinvestigation of the effectiveness of the combined.,Sağlık Bakanlığı,Tıpta Uzmanlık,Genel Cerrahi = General Surgery," onclick=tezDetay('WCrTiuUO3jpe4PzUqN-3xg','znPX5mW57C3VMEG0NGmfWQ')"
681522,ÖZLEM ARMAN BİLİR,2009,Hastanemizde tip 1 diyabetes mellitus tanısıylaizlenen hastaların retrospektif olarakincelenmesi<br><span style='font-style: italic';>,Sağlık Bakanlığı,Tıpta Uzmanlık,Çocuk Sağlığı ve Hastalıkları = Child Health and Diseases," onclick=tezDetay('O3B-N3V2TZwfv9_7GX8gLw','wfsqu1qcpH3xHTxxGIcAgw')"
422616,IŞIL ADADAN,2006,Otoskleroz tanısıyla stapedotomi yapılan olgularda ven greft interpozisyonunun ve deneyimin postoperatif fonksiyonel başarı ve komplikasyonlar üzerine etkisi<br><span style='font-style: italic';>The effect of vein graft interposition and experience on the functional success and complications of stapedotomy in otosclerosis patients,Sağlık Bakanlığı,Tıpta Uzmanlık,Kulak Burun ve Boğaz = Otorhinolaryngology (Ear-Nose-Throat)," onclick=tezDetay('u_FF4_3lBs4Oy7JlEyz8Ow','UEfknRYiDCBq2Ip1DuLwYA')"
420801,BURAK KARADAĞ,2011,Ovulasyon indüksiyonu ve intrauterin inseminasyon sikluslarında luteal faz desteğinin gebelik oranlarına etkisi: prospektif randomize çalışma<br><span style='font-style: italic';>The effect of luteal phase support to  pregnancy rates in ovulation induction and intrauterine insemination cycles: prospective randomized study.,Sağlık Bakanlığı,Tıpta Uzmanlık,Kadın Hastalıkları ve Doğum = Obstetrics and Gynecology," onclick=tezDetay('NngSlrRGVGBIprttWrAdDQ','vkZoNLpFUf-Redlggr_8xQ')"
281457,NİHAL BAYSOY,2011,Düşük doğum ağırlıklı preterm bebeklerin taburculuk sonrasında izlemi ve rehospitalizasyon sıklığının ve nedenlerinin araştırılması<br><span style='font-style: italic';>Causes and rates of rehospitalization and follow up after discharge in premature infants in the first year of life,Sağlık Bakanlığı,Tıpta Uzmanlık,Çocuk Sağlığı ve Hastalıkları = Child Health and Diseases," onclick=tezDetay('19wjQ-9q4XBhR00F8FNT8g','fDzqStLIF_KnOi-b6l_8Xg')"
698190,AHMET BİLGİ,2011,Pubertal dişi sıçanlarda kronik Bisfenol-A maruziyetinin over üzerine apoptotik etkilerinin araştırılması<br><span style='font-style: italic';>,Sağlık Bakanlığı,Tıpta Uzmanlık,Kadın Hastalıkları ve Doğum = Obstetrics and Gynecology," onclick=tezDetay('NjflCr_bqvWSYsVNcrsYDQ','jewGN5taA7WyNcFwHY5ifw')"
659543,EVREN KARAALİ,2010,Gonartrozlu hastalarda uygulanan artroskopik debridmanın erken ve orta dönem sonuçlarının değerlendirilmesi ve yaşam kalitesi üzerindeki etkileri<br><span style='font-style: italic';>,Sağlık Bakanlığı,Tıpta Uzmanlık,Ortopedi ve Travmatoloji = Orthopedics and Traumatology," onclick=tezDetay('HH81sk6WdUyeaKHEVSLmjw','KGLYJxmk95PPXMFePIjVUA')"
387087,MUSTAFA DURGUN,2009,Yanık kontraktürlerine analitik yaklaşım<br><span style='font-style: italic';>,Sağlık Bakanlığı,Tıpta Uzmanlık,Plastik ve Rekonstrüktif Cerrahi = Plastic and Reconstructive Surgery," onclick=tezDetay('JZdObo3X99re8uBNU_3b4A','fG530QHefLWsTgEu2g1ynA')"
563967,EKİN İLKELİ,2011,Alfieri tipi  (edge-to-edge )  mitral kapak onarımın orta dönem klinik ve ekokardiyografik sonuçlarının değerlendirilmesi<br><span style='font-style: italic';>Evaluation of mid-term clinical and echocardiographic outcomes of Alfieri (edge-to-edge) mitral valve repair,Sağlık Bakanlığı,Tıpta Uzmanlık,Göğüs Kalp ve Damar Cerrahisi = Thoracic and Cardiovascular Surgery," onclick=tezDetay('5oKrLzeDMky71O0hmONDmA','Gc1cSHTSStH_gKda9pxdWQ')"
163539,EYÜP SABRİ KELEŞ,2005,Yenidoğan umblikal kord total IgE düzeyleri ve çevresel faktörlerle ilişkisi<br><span style='font-style: italic';>,Sağlık Bakanlığı,Tıpta Uzmanlık,Çocuk Sağlığı ve Hastalıkları = Child Health and Diseases," onclick=tezDetay('Bba2u7hNvOOEHNK5PZiQYQ','O9SySZEDVX7wIHUFIlu9Yg')"
163540,YASEMİN AĞRALI,2005,"Gerçek stres inkontinansın cerrahi tedavisinde Burch operasyonu, kolporafi anterior Kelly plikasyonu, TVT ve kolporafi anterior operasyonlarının karşılaştırılması<br><span style='font-style: italic';>",Sağlık Bakanlığı,Tıpta Uzmanlık,Kadın Hastalıkları ve Doğum = Obstetrics and Gynecology," onclick=tezDetay('-6hsuy9ksfkNTSStmPhUPg','LycfV4sW-xDbSZz5OIM2RA')"
419745,SELMA KENAR TİRYAKİOĞLU,2005,Tiroid hastalıklarında erken dönem ventrikül disfonksiyonlarının belirlenmesinde doku doppler görüntüleme yöntemlerinin yeri ve kullanımı<br><span style='font-style: italic';>The usage of tissue doppler imaging  studies  in determining early ventricular dysfunction in thyroid diseases,Sağlık Bakanlığı,Tıpta Uzmanlık,Kardiyoloji = Cardiology," onclick=tezDetay('Z-pIRPc9H1IWZfKHugqrFA','IwUAdEpXu7fthzowrHpxkw')"
698886,ABDURRAHMAN BUĞRA CENGİZ,2011,Sinonazal malign tümörlü hastalarda cerrahi sonuçlarımız<br><span style='font-style: italic';>Sinonasal tract malignancies: Surgery outcomes,Sağlık Bakanlığı,Tıpta Uzmanlık,Kulak Burun ve Boğaz = Otorhinolaryngology (Ear-Nose-Throat)," onclick=tezDetay('C8I2VB8OjzcIc174OQzM4g','4v8U2uIzuYlsu8y3okbEuw')"
568947,OSMAN BULUT OCAK,2009,İdiyopatik makula deliği tedavisinde 25 gauge pars plana vitrektomi sonuçlarımız<br><span style='font-style: italic';>İdiyopatik makula deliği tedavisinde 25 gauge pars plana vitrektomi sonuçlarımız,Sağlık Bakanlığı,Tıpta Uzmanlık,Göz Hastalıkları = Eye Diseases," onclick=tezDetay('8ecXId4Sa2JNBREyhe2OJQ','he2gqEO67lgb652BPx0y0g')"
693234,AHMET SERKAN İLGÜN,2011,"Kolorektal kanserde metastatik lenf nodu sayısının çıkarılan lenf nodu sayısına oranı (LNR), fascin ve standart faktörlerin sağkalım ile ilişkisi<br><span style='font-style: italic';>The Relationship of Lymph Node Ratio and Standard Factors with Survival in Colorectal Cancer",Sağlık Bakanlığı,Tıpta Uzmanlık,Genel Cerrahi = General Surgery," onclick=tezDetay('gugWSqWz2S9k0eLYNryL0g','6DOM3J6IUUzKX7OjbKSJgA')"
420762,OSMAN BİLGİN GÜLÇİÇEK,2008,Deneysel tıkanma ikterinde curcuminin oksidatif stres ve hepatik hasar ilişkisi<br><span style='font-style: italic';>,Sağlık Bakanlığı,Tıpta Uzmanlık,Genel Cerrahi = General Surgery," onclick=tezDetay('g7L74gmkx8olJQVdJrgCXA','QQjTWPxLheDmtKbXEXk4TA')"
564489,UMUT CANBEK,2009,Torakolomber vertebra kırıklarının posterior yaklaşım ile enstürümantasyonunda 2 üst – 2 alt ve 2 üst - 1 alt segment tespitlerinin karşılaştırılması<br><span style='font-style: italic';>Comparison of 2 upper - 2 lower and 2 upper - 1 lower segment fixations in the posterior approach of thoracolumbar vertebra fractures,Sağlık Bakanlığı,Tıpta Uzmanlık,Ortopedi ve Travmatoloji = Orthopedics and Traumatology," onclick=tezDetay('Cyh9_miUX1vGIlTzo-03Tg','_wejlfvgqmbuzEz9FCRAWg')"
164522,KADRİYE ERDEM,2005,Servikovaginal smear sonuçları premalign tanısı alan olgularda kolposkopik tanı ve tedavi sonuçlarının değerlendirilmesi<br><span style='font-style: italic';>,Sağlık Bakanlığı,Tıpta Uzmanlık,Kadın Hastalıkları ve Doğum = Obstetrics and Gynecology," onclick=tezDetay('zE3TSyh6zK6ygqgOxXiKDQ','yQE0RrrN7A0OUIOc5dnNPA')"
164523,ÖZCAN KARADEMİR,2005,Bishop skorunun başarılı doğum indüksiyonunun öngörülmesindeki değeri<br><span style='font-style: italic';>The role of the Bishop score in the succesfull birth induction,Sağlık Bakanlığı,Tıpta Uzmanlık,Kadın Hastalıkları ve Doğum = Obstetrics and Gynecology," onclick=tezDetay('pdf-ZN7L2yy5j0kjQGMbzA','m6TkvhQv6a5JSkTGbpmjAA')"
642536,SELİM KUL,2010,Olmesartan\'ın sol ventrikül hipertrofisi üzerine olan etkisinin atenolol ile karşılaştırılması<br><span style='font-style: italic';>The comparison of the effect of olmesartan on left ventricular hypertrophy with atenolol,Sağlık Bakanlığı,Tıpta Uzmanlık,Kardiyoloji = Cardiology," onclick=tezDetay('iPRrAUOyvsI-fT3aJtWUtg','wio6unE2y1PIxbM14e8MIA')"
163541,BARIŞ YOLCU,2005,Popülasyonumuza ait fetal biyometrik ölçümlerin nomogramlarının belirlenmesi<br><span style='font-style: italic';>,Sağlık Bakanlığı,Tıpta Uzmanlık,Kadın Hastalıkları ve Doğum = Obstetrics and Gynecology," onclick=tezDetay('eylXThXWMUQQ0brtOx5rUg','eifgtPH0YFbtayW2wmMwWQ')"
163542,SEMAVİ ULUSOY,2005,Adneksiyal kitlelerin malign-benign ayrımında malignansi riski endeksi (RMI)\'nin prospektif araştırılması<br><span style='font-style: italic';>,Sağlık Bakanlığı,Tıpta Uzmanlık,Kadın Hastalıkları ve Doğum = Obstetrics and Gynecology," onclick=tezDetay('cGhKppYHx7GOFlkjvJ-SVA','0oBLFc2BLFn_x702r9KJoQ')"
163543,GÜRKAN AĞRALI,2005,Materyal obezitenin perinatal ve neonatal sonuçlar üzerine etkisi<br><span style='font-style: italic';>,Sağlık Bakanlığı,Tıpta Uzmanlık,Kadın Hastalıkları ve Doğum = Obstetrics and Gynecology," onclick=tezDetay('6bYDBd0IjmtkhygGhO7q6g','LoM476auqW4a8hVHkA3Tdw')"
163544,VOLKAN TUNA,2005,"Cerrahi menopoz ve doğal menopoz olgularında kan lipid profili, trombotik sistem, arteriyel elastisite ve psikoseksüel parametrelerdeki değişiklikler<br><span style='font-style: italic';>",Sağlık Bakanlığı,Tıpta Uzmanlık,Kadın Hastalıkları ve Doğum = Obstetrics and Gynecology," onclick=tezDetay('l2Q8d-rjy6fwZ9W_XUkJ2w','4-YS0Rrdo0mI87HV_jRHCg')"
163612,FUNDA ÖZTÜRK,2005,Helicobacter pylori seropozitifliğinin hiperemezis gravidarum kliniği ile ilişkisi<br><span style='font-style: italic';>,Sağlık Bakanlığı,Tıpta Uzmanlık,Kadın Hastalıkları ve Doğum = Obstetrics and Gynecology," onclick=tezDetay('uAsyHgt1NmgCW4CV4GhfJQ','UB-t3XctPDQOhmifw-TXwg')"
163613,NEVİN UZUNOĞLU SAKALLI,2005,Hastanemize konvülziyonla başvuran olguların risk faktörleri ve sosyodemografik özellikleri açısından değerlendirildiği vaka kontrollü çalışma<br><span style='font-style: italic';>,Sağlık Bakanlığı,Tıpta Uzmanlık,Çocuk Sağlığı ve Hastalıkları = Child Health and Diseases," onclick=tezDetay('mx1Vcs924PXItgZshYn_2A','9ddByZdQYiAW3wq9_2UQTA')"
677319,İLKAY KOCA KALKAN,2006,Akciğer tüberkülozunda plazmada stromal hücre kökenli faktör 1 alfa ölçümünün değeri<br><span style='font-style: italic';>Plasma stromal derived factor 1 alpha levels in pulmonary tuberculosis,Sağlık Bakanlığı,Tıpta Uzmanlık,Göğüs Kalp ve Damar Cerrahisi = Thoracic and Cardiovascular Surgery," onclick=tezDetay('-63GaZhlUTejsyf9h_hGqw','0T1tcDKph2Eyr23KPy3Y2w')"
411945,ERHAN ŞÜKÜR,2010,Aseptik diz artroplastisi revizyon cerrahisi uygulanan hastalarda kısa ve orta  dönem sonuçlar<br><span style='font-style: italic';>The short and mid term results in patients who underwent aseptic revision knee arthroplasty surgery,Sağlık Bakanlığı,Tıpta Uzmanlık,Ortopedi ve Travmatoloji = Orthopedics and Traumatology," onclick=tezDetay('HrXeQxnp3SQFCipV8wfBoQ','1OKUsjrA_oWvZ3EGJOo7aQ')"
491723,YARAN KOBAN,2011,Fokal lazer fotokoagülasyon yapılmış olan diyabetik makula ödemi olgularında intravitreal bevacizumab tedavisinin etkinliği<br><span style='font-style: italic';>Efficacy of intravitreal bevacizumab in patients with diabetic macular edema previously treated with focal laser photocoagulation,Sağlık Bakanlığı,Tıpta Uzmanlık,Göz Hastalıkları = Eye Diseases," onclick=tezDetay('MAsS_UnAPsevVnJJX9--Rg','kjC0ana5q_cZvMBzJUtN-Q')"
428791,YUSUF HAYDAR ERTEKİN,2009,2006-2009 yılları arasında iç hastalıkları servisimizde yatan asitli hastalarda etyolojik inceleme<br><span style='font-style: italic';>Etiological research in patients with ascites hospitalized at internal medicine service for the years of 2006-2009.,Sağlık Bakanlığı,Tıpta Uzmanlık,Aile Hekimliği = Family Medicine ; Gastroenteroloji = Gastroenterology," onclick=tezDetay('iMBPerb8oUYT_IIjA-I9TA','9mAUoBcETa7_4ZtXJUSw0A')"
558730,ŞEYMA KAYALI,2010,Süt çocukluğunda demir profilaksisi gereksiniminin değerlendirilmesi<br><span style='font-style: italic';>Evaluation of the necessity for  iron prophylaxis  in infancy,Sağlık Bakanlığı,Tıpta Uzmanlık,Çocuk Sağlığı ve Hastalıkları = Child Health and Diseases," onclick=tezDetay('b5MgCFYgqCIp1ZqdgMPZ4Q','7HzVSi9H1PrhNpBLQ15HwA')"
662800,MEHMET TAŞ,2009,Proliferatif diabetik retinopatiye bağlı traksiyonel retina dekolman dışı komplikasyonlarda 23G mikroinsizyonel pars plana vitrektomi sonuçları<br><span style='font-style: italic';>Microincisional Pars Plana Vitrectomy in the Treatment of Diabetic RetinopathyComplications Without Retinal Detachment,Sağlık Bakanlığı,Tıpta Uzmanlık,Göz Hastalıkları = Eye Diseases," onclick=tezDetay('4Bw6MXrOKyx_E1_jfp_U6w','xfzyAb9T82xUd5aPn1zuxw')"
164524,AYSUN FIRAT,2005,Preterm eylem tedavisinde nifedipinin etkinliğinin araştırılması<br><span style='font-style: italic';>The efficacy of nifedipine in the treatment of preterm labor,Sağlık Bakanlığı,Tıpta Uzmanlık,Kadın Hastalıkları ve Doğum = Obstetrics and Gynecology," onclick=tezDetay('f-KuzWb8aelMNNBHWV6iNw','MAXDcXJDS9GAOgrsLWmJew')"
664744,GÖZDE TÜRKOĞLU,2009,"Serebral palsili çocuklarda motor düzey ile kognitif tutulumun karşılaştırılması ve kognitif fonksiyonlar ile ilişkili faktörlerin değerlendirilmesi<br><span style='font-style: italic';>The comparision of motor level and cognitive involvement, and the  evaluation of the factors related with cognitive functions in children with cerebral palsy.",Sağlık Bakanlığı,Tıpta Uzmanlık,Fiziksel Tıp ve Rehabilitasyon = Physical Medicine and Rehabilitation," onclick=tezDetay('_OL_h65cEDP4js2T-9JNzw','0wd-gc7H6YHtFuD7whD11Q')"
551341,EYLEM ACARTÜRK,2009,Koah hastalarındaki oksijen satürasyonunun pulse oksimetre iletesbitinin arter kan gazı tetkiki ile korelasyonu ve bu korelasyonu etkileyen faktörler<br><span style='font-style: italic';>Correlation of arterial oxygen saturation measured both by pulse oximeter and arterial blood gas analyzer in copd and affecting factors,Sağlık Bakanlığı,Tıpta Uzmanlık,Göğüs Hastalıkları = Chest Diseases," onclick=tezDetay('LHjSfJsmoVkl9JAvc-Bo2Q','e8sYVJGxak1tBL2-QzftrA')"
422592,İCLAL ERDEM,2005,Asemptomatik donanma dalgıçlarında hiperbarik ortamda oluşabilecek serebral patolojilerin mrg ile incelenmesi ve normal bireyler ile karşılaştırılması<br><span style='font-style: italic';>Evaluation of cerebral pathologies caused by hypbaric environment in asymptomatic military divers using magnetic resonance imaging and comparison of normal healthy individuals,Sağlık Bakanlığı,Tıpta Uzmanlık,Radyoloji ve Nükleer Tıp = Radiology and Nuclear Medicine," onclick=tezDetay('O6yyjXtusFmUslDTSiiERw','XgKB5fhWIHT4XMDFI7d9lQ')"
